Title,ID
"NKT Cells in Mice Originate from Cytoplasmic CD3-Positive, CD4<sup>-</sup>CD8<sup>-</sup> Double-Negative Thymocytes that Express CD44 and IL-7Rα.",30755654
Bone marrow laminins influence hematopoietic stem and progenitor cell cycling and homing to the bone marrow.,29360499
Non-steroidal anti-inflammatory drugs dampen the cytokine and antibody response to SARS-CoV-2 infection.,33441348
TRIM21 Dysfunction Enhances Aberrant B-Cell Differentiation in Autoimmune Pathogenesis.,32117252
Cancer-specific type-I interferon receptor signaling promotes cancer stemness and effector CD8+ T-cell exhaustion.,34858725
Trained Immunity-Promoting Nanobiologic Therapy Suppresses Tumor Growth and Potentiates Checkpoint Inhibition.,33125893
T cell infiltration in both human multiple system atrophy and a novel mouse model of the disease.,31993745
Restoration of antitumor immunity through anti-MICA antibodies elicited with a chimeric protein. ,32518090
In Vitro Recapitulation of Murine Thymopoiesis from Single Hematopoietic Stem Cells.,33113379
Monocytic myeloid-derived suppressor cells regulate T-cell responses against vaccinia virus.,28383204
<i>Irg1</i> expression in myeloid cells prevents immunopathology during <i>M. tuberculosis</i> infection.,29511063
Antigen delivery targeted to tumor-associated macrophages overcomes tumor immune resistance.,30628894
PIM-2 protein kinase negatively regulates T cell responses in transplantation and tumor immunity.,29781812
The microbiota regulate neuronal function and fear extinction learning.,31645720
Combined CD44- and CD25-Targeted Near-Infrared Photoimmunotherapy Selectively Kills Cancer and Regulatory T Cells in Syngeneic Mouse Cancer Models.,31953245
Deviant reporter expression and P2X4 passenger gene overexpression in the soluble EGFP BAC transgenic P2X7 reporter mouse model.,33199725
Th1 cells downregulate connexin 43 gap junctions in astrocytes via microglial activation.,27929069
Fecal MicroRNAs Show Promise as Noninvasive Crohn's Disease Biomarkers.,32551441
Microbiota-derived metabolite promotes HDAC3 activity in the gut.,32731255
PHF6 regulates phenotypic plasticity through chromatin organization within lineage-specific genes.,28607179
Graphene oxide polarizes iNKT cells for production of TGFβ and attenuates inflammation in an iNKT cell-mediated sepsis model.,29973666
IL-12/23p40 overproduction by dendritic cells leads to an increased Th1 and Th17 polarization in a model of Yersinia enterocolitica-induced reactive arthritis in TNFRp55-/- mice.,29494692
Programmed death ligand-1 expression on donor T cells drives graft-versus-host disease lethality.,27294527
Expression of the DNA-Binding Factor TOX Promotes the Encephalitogenic Potential of Microbe-Induced Autoreactive CD8+ T Cells.,29768177
Ablation of IL-17A abrogates progression of spontaneous intestinal tumorigenesis.,20212110
Gut microbiota modulates adoptive cell therapy via CD8α dendritic cells and IL-12.,29467322
mTOR-dependent translation drives tumor infiltrating CD8<sup>+</sup> effector and CD4<sup>+</sup> Treg cells expansion.,34787568
Trypanosoma brucei infection protects mice against malaria.,31703103
A local regulatory T cell feedback circuit maintains immune homeostasis by pruning self-activated T cells.,34157301
Tumor-derived ILT4 induces T cell senescence and suppresses tumor immunity.,33653799
"Sephin1, which prolongs the integrated stress response, is a promising therapeutic for multiple sclerosis.",30657878
A versatile platform for generating engineered extracellular vesicles with defined therapeutic properties.,33484965
Basophil-derived IL-6 regulates T<sub>H</sub>17 cell differentiation and CD4 T cell immunity.,28134325
Immune Responses to Broad-Spectrum Antibiotic Treatment and Fecal Microbiota Transplantation in Mice.,28469619
Cancer cell-expressed BTNL2 facilitates tumour immune escape via engagement with IL-17A-producing γδ T cells.,35017553
CD69 Targeting Enhances Anti-vaccinia Virus Immunity. ,31315995
Mycobacterium tuberculosis carrying a rifampicin drug resistance mutation reprograms macrophage metabolism through cell wall lipid changes.,30224802
NK cell heparanase controls tumor invasion and immune surveillance.,28581441
SOCS3 treatment prevents the development of alopecia areata by inhibiting CD8+ T cell-mediated autoimmune destruction.,28418931
An RORγt Oral Inhibitor Modulates IL-17 Responses in Peripheral Blood and Intestinal Mucosa of Crohn's Disease Patients.,30405600
iNKT Cells Suppress Pathogenic NK1.1<sup>+</sup>CD8<sup>+</sup> T Cells in DSS-Induced Colitis.,30333822
Bortezomib treatment induces a higher mortality rate in lupus model mice with a higher disease activity.,28800777
The Guanine-Nucleotide Exchange Factor Caldag Gefi Fine-Tunes Functional Properties of Regulatory T Cells.,28690878
Mechanisms of alloimmunization and subsequent bone marrow transplantation rejection induced by platelet transfusion in a murine model.,22300526
Early Detection of T cell Transfer-induced Autoimmune Colitis by In Vivo Imaging System.,27762297
AMPK-dependent and independent effects of AICAR and compound C on T-cell responses.,27177226
Active poly-GA vaccination prevents microglia activation and motor deficits in a C9orf72 mouse model.,31858749
Depletion of T regulatory cells promotes natural killer cell-mediated cardiac allograft vasculopathy.,25321164
Japanese Kampo medicine ninjin'yoeito synergistically enhances tumor vaccine effects mediated by CD8+ T cells.,28529575
"Fecal Microbiota Transplantation, Commensal Escherichia coli and Lactobacillus johnsonii Strains Differentially Restore Intestinal and Systemic Adaptive Immune Cell Populations Following Broad-spectrum Antibiotic Treatment.",29321764
BET Bromodomain Inhibitors Which Permit Treg Function Enable a Combinatorial Strategy to Suppress GVHD in Pre-clinical Allogeneic HSCT.,30733722
Beneficial effects of sunitinib on tumor microenvironment and immunotherapy targeting death receptor5.,30713805
IL-3 promotes the development of experimental autoimmune encephalitis.,27734026
"Function of CSF1 and IL34 in Macrophage Homeostasis, Inflammation, and Cancer.",31552020
Granulocyte-macrophage colony-stimulating factor neuroprotective activities in Alzheimer's disease mice.,29573847
Superior immune reconstitution using Treg-expanded donor cells versus PTCy treatment in preclinical HSCT models. ,30333311
Ly6C<sup>hi</sup> monocytes regulate T cell responses in viral hepatitis.,27777980
Inhibition of the JAK/STAT Signaling Pathway in Regulatory T Cells Reveals a Very Dynamic Regulation of Foxp3 Expression.,27077371
Vagotomy affects the development of oral tolerance and increases susceptibility to develop colitis independently of the alpha-7 nicotinic receptor.,27341335
Establishment of Chronic Typhoid Infection in a Mouse Carriage Model Involves a Type 2 Immune Shift and T and B Cell Recruitment to the Gallbladder. ,31575775
P2X7 receptor restrains pathogenic Tfh cell generation in systemic lupus erythematosus.,30655308
Tbet Deficiency Causes T Helper Cell Dependent Airways Eosinophilia and Mucus Hypersecretion in Response to Rhinovirus Infection.,27683080
Immune complexes stimulate CCR7-dependent dendritic cell migration to lymph nodes.,25384086
Low immunogenicity of mouse induced pluripotent stem cell-derived neural stem/progenitor cells.,29021610
Cordycepin and a preparation from <i>Cordyceps militaris</i> inhibit malignant transformation and proliferation by decreasing EGFR and IL-17RA signaling in a murine oral cancer model.,29212184
Blockade of MCAM/CD146 impedes CNS infiltration of T cells over the choroid plexus.,30134924
CD117<sup>+</sup>CD44<sup>+</sup> Stem T Cells Develop in the Thymus and Potently Suppress T-cell Proliferation by Modulating the CTLA-4 Pathway.,28279199
Subclinical Herpes Simplex Virus Type 1 Infections Provide Site-Specific Resistance to an Unrelated Pathogen.,28062697
HSPs drive dichotomous T-cell immune responses via DNA methylome remodelling in antigen presenting cells.,28561043
Loss of ABCG1 influences regulatory T cell differentiation and atherosclerosis.,27482882
Non-canonicaly recruited TCRαβCD8αα IELs recognize microbial antigens.,30022086
Neonatally imprinted stromal cell subsets induce tolerogenic dendritic cells in mesenteric lymph nodes.,30254319
Pneumococcal Surface Protein A Plays a Major Role in Streptococcus pneumoniae-Induced Immunosuppression.,27029587
Self-reactive CD4<sup>+</sup> IL-3<sup>+</sup> T cells amplify autoimmune inflammation in myocarditis by inciting monocyte chemotaxis.,30670465
Circumsporozoite protein-specific K(d)-restricted CD8+ T cells mediate protective antimalaria immunity in sporozoite-immunized MHC-I-K(d) transgenic mice.,25132735
Deoxyhypusine synthase promotes differentiation and proliferation of T helper type 1 (Th1) cells in autoimmune diabetes.,24196968
"The Probiotic Compound VSL#3 Modulates Mucosal, Peripheral, and Systemic Immunity Following Murine Broad-Spectrum Antibiotic Treatment.",28529928
Impaired resolution of DSS-induced colitis in mice lacking the glucocorticoid receptor in myeloid cells.,29324769
Compensation between CSF1R+ macrophages and Foxp3+ Treg cells drives resistance to tumor immunotherapy. ,29875321
Neutrophils regulate the lung inflammatory response via γδ T cell infiltration in an experimental mouse model of human metapneumovirus infection.,28336678
Targeted knock-in mice expressing the oxidase-fixed form of xanthine oxidoreductase favor tumor growth.,31659168
The Extracellular Domains of IgG1 and T Cell-Derived IL-4/IL-13 Are Critical for the Polyclonal Memory IgE Response In Vivo.,26523376
Natural killer T cell and TLR9 agonists as mucosal adjuvants for sublingual vaccination with clade C HIV-1 envelope protein.,25444819
The role of ADAM17 in the T-cell response against bacterial pathogens.,28877252
CXCR3 regulates CD4+ T cell cardiotropism in pressure overload-induced cardiac dysfunction. ,30779709
Beneficial role of rapamycin in experimental autoimmune myositis.,24265670
Proliferating Helper T Cells Require Rictor/mTORC2 Complex to Integrate Signals from Limiting Environmental Amino Acids.,27799302
Prior exposure to inhaled allergen enhances anti-viral immunity and T cell priming by dendritic cells.,29293541
Polycomb Repressive Complex 2 is essential for development and maintenance of a functional TEC compartment.,30254371
CXCL1 but not IL-6 is required for recurrent herpetic stromal keratitis.,24442436
Lack of MHC class II molecules favors CD8<sup>+</sup> T-cell infiltration into tumors associated with an increased control of tumor growth.,29399403
Erythropoietin Receptor-Mediated Molecular Crosstalk Promotes T Cell Immunoregulation and Transplant Survival.,28302753
Vitamin C Fosters the In Vivo Differentiation of Peripheral CD4+ Foxp3- T Cells into CD4+ Foxp3+ Regulatory T Cells but Impairs Their Ability to Prolong Skin Allograft Survival.,29479348
HPV16 drives cancer immune escape via NLRX1-mediated degradation of STING.,31874109
Renal Denervation Normalizes Arterial Pressure With No Effect on Glucose Metabolism or Renal Inflammation in Obese Hypertensive Mice.,27550916
Helminth Infection and Commensal Microbiota Drive Early IL-10 Production in the Skin by CD4+ T Cells That Are Functionally Suppressive.,25974019
Characterization of the Antigen-Specific CD4(+) T Cell Response Induced by Prime-Boost Strategies with CAF01 and CpG Adjuvants Administered by the Intranasal and Subcutaneous Routes.,26379666
IL-4-secreting eosinophils promote endometrial stromal cell proliferation and prevent <i>Chlamydia</i>-induced upper genital tract damage.,28765368
An integrin/MFG-E8 shuttle loads HIV-1 viral-like particles onto follicular dendritic cells in mouse lymph node. ,31793433
Chimeric antigen receptor-engineered T cells as oncolytic virus carriers.,27119109
Antigen-specific gene therapy after immunisation reduces the severity of collagen-induced arthritis.,24371448
IgG1 memory B cells keep the memory of IgE responses.,28935935
Vaccine Containing the Three Allelic Variants of the <i>Plasmodium vivax</i> Circumsporozoite Antigen Induces Protection in Mice after Challenge with a Transgenic Rodent Malaria Parasite.,29075260
Dynamics and genomic landscape of CD8<sup>+</sup> T cells undergoing hepatic priming.,31582858
Increased susceptibility of IgA-deficient mice to pulmonary Francisella tularensis live vaccine strain infection.,23836815
Lineage-affiliated transcription factors bind the Gata3 Tce1 enhancer to mediate lineage-specific programs.,26808502
Succinylated chitosan derivative has local protective effects on intestinal inflammation.,29450257
Myocarditis Elicits Dendritic Cell and Monocyte Infiltration in the Heart and Self-Antigen Presentation by Conventional Type 2 Dendritic Cells.,30524444
Impact of supplementation with a food-derived microbial community on obesity-associated inflammation and gut microbiota composition.,29043005
Marked in Vivo Donor Regulatory T Cell Expansion via Interleukin-2 and TL1A-Ig Stimulation Ameliorates Graft-versus-Host Disease but Preserves Graft-versus-Leukemia in Recipients after Hematopoietic Stem Cell Transplantation.,28219835
Paracrine effect of regulatory T cells promotes cardiomyocyte proliferation during pregnancy and after myocardial infarction.,29946151
Lack of autophagy induces steroid-resistant airway inflammation.,26589586
Baculovirus-based Vaccine Displaying Respiratory Syncytial Virus Glycoprotein Induces Protective Immunity against RSV Infection without Vaccine-Enhanced Disease.,22536165
Anti-IL-17 therapy restricts and reverses late-term corneal allorejection.,25754737
"A recombinant multi-antigen vaccine formulation containing Babesia bovis merozoite surface antigens MSA-2a<sub>1</sub>, MSA-2b and MSA-2c elicits invasion-inhibitory antibodies and IFN-γ producing cells.",27842609
CD69 Deficiency Enhances the Host Response to Vaccinia Virus Infection through Altered NK Cell Homeostasis.,27147744
"CD4<sup>+</sup> virtual memory: Antigen-inexperienced T cells reside in the naïve, regulatory, and memory T cell compartments at similar frequencies, implications for autoimmunity.",27894837
Pyrin Inflammasome Regulates Tight Junction Integrity to Restrict Colitis and Tumorigenesis.,29203393
Targeted activation of melanoma differentiation-associated protein 5 (MDA5) for immunotherapy of pancreatic carcinoma.,26504669
Cooperative therapeutic anti-tumor effect of IL-15 agonist ALT-803 and co-targeting soluble NKG2D ligand sMIC.,26625316
Stress Kinase GCN2 Controls the Proliferative Fitness and Trafficking of Cytotoxic T Cells Independent of Environmental Amino Acid Sensing.,27880901
De novo design of potent and selective mimics of IL-2 and IL-15.,30626941
Population snapshots predict early haematopoietic and erythroid hierarchies.,29466336
Heterologous Immunity and Persistent Murine Cytomegalovirus Infection. ,27807227
"S100A4-neutralizing antibody suppresses spontaneous tumor progression, pre-metastatic niche formation and alters T-cell polarization balance.",25884510
Bortezomib Plus Continuous B Cell Depletion Results in Sustained Plasma Cell Depletion and Amelioration of Lupus Nephritis in NZB/W F1 Mice.,26252021
Regulatory T cells resist virus infection-induced apoptosis.,25473049
"Type I IFN and not TNF, is Essential for Cyclic Di-nucleotide-elicited CTL by a Cytosolic Cross-presentation Pathway.",28754303
Highly Efficient and Versatile Plasmid-Based Gene Editing in Primary T Cells.,29445007
Mouse nidovirus LDV infection alleviates graft versus host disease and induces type I IFN-dependent inhibition of dendritic cells and allo-responsive T cells.,28474504
Identification of a Locus in Mice that Regulates the Collateral Damage and Lethality of Virus Infection.,31042467
Combination central tolerance and peripheral checkpoint blockade unleashes antimelanoma immunity. ,28931755
Programmed cell death-1 deficiency exacerbates T cell activation and atherogenesis despite expansion of regulatory T cells in atherosclerosis-prone mice.,24691202
Interferon Regulatory Factor 4 controls T<sub>H1</sub> cell effector function and metabolism.,27762344
Interferon gamma and T cells inhibit osteogenesis induced by allogeneic mesenchymal stromal cells.,22886855
The thymic medulla is required for Foxp3+ regulatory but not conventional CD4+ thymocyte development.,23530124
"Self-Transducible Bimodal PDX1-FOXP3 Protein Lifts Insulin Secretion and Curbs Autoimmunity, Boosting Tregs in Type 1 Diabetic Mice.",28988715
Oligodendrocyte death results in immune-mediated CNS demyelination.,26656646
Inhibition of tumor growth by a newly-identified activator for epidermal fatty acid binding protein.,25796556
Development of a diet-induced murine model of diabetes featuring cardinal metabolic and pathophysiological abnormalities of type 2 diabetes.,27402965
Deficiency of AMPK in CD8+ T cells suppresses their anti-tumor function by inducing protein phosphatase-mediated cell death.,25760243
Azithromycin treatment increases survival of high-risk corneal allotransplants.,23407315
Adaptive Immune Regulation of Mammary Postnatal Organogenesis.,26321127
CD4 T-cell hyporesponsiveness induced by schistosome larvae is not dependent upon eosinophils but may involve connective tissue mast cells.,26679416
Galectin-8 as an immunosuppressor in experimental autoimmune encephalomyelitis and a target of human early prognostic antibodies in multiple sclerosis.,28650992
Targeting epidermal fatty acid binding protein for treatment of experimental autoimmune encephalomyelitis.,25962726
Omega-1 knockdown in Schistosoma mansoni eggs by lentivirus transduction reduces granuloma size in vivo.,25400038
Therapeutic Use of Soluble Fas Ligand Ameliorates Acute and Recurrent Herpetic Stromal Keratitis in Mice.,26444718
Targeting Syk-activated B cells in murine and human chronic graft-versus-host disease.,25852057
Type I IFN signaling triggers immunopathology in tuberculosis-susceptible mice by modulating lung phagocyte dynamics.,24782112
IL-10 and NOS2 modulate antigen-specific reactivity and nerve infiltration by T cells in experimental leprosy.,25210773
Evaluation of non-reciprocal heterologous immunity between unrelated viruses.,25838115
Methoxychlor metabolite HPTE alters viability and differentiation of embryonic thymocytes from C57BL/6 mice.,29973080
TRPM7 kinase activity is essential for T cell colonization and alloreactivity in the gut.,29203869
Transforming growth factor-beta 1 delivery from microporous scaffolds decreases inflammation post-implant and enhances function of transplanted islets.,26701143
Role of chitosan co-formulation in enhancing interleukin-12 delivery and antitumor activity.,23453060
mTOR coordinates transcriptional programs and mitochondrial metabolism of activated T<sub>reg</sub> subsets to protect tissue homeostasis.,29844370
Intranasal administration of antibody-bound respiratory syncytial virus particles efficiently primes virus-specific immune responses in mice.,23637394
CD38 controls the innate immune response against Listeria monocytogenes.,23980105
Restrained Th17 response and myeloid cell infiltration into the central nervous system by human decidua-derived mesenchymal stem cells during experimental autoimmune encephalomyelitis.,26987803
Murine cytomegalovirus immediate-early 1 gene expression correlates with increased GVHD after allogeneic hematopoietic cell transplantation in recipients reactivating from latent infection.,23596528
Anti-CD20 antibody therapy and susceptibility to Pneumocystis pneumonia.,25733518
T-cell trafficking facilitated by high endothelial venules is required for tumor control after regulatory T-cell depletion.,22962270
Broadening the repertoire of functional herpes simplex virus type 1-specific CD8+ T cells reduces viral reactivation from latency in sensory ganglia.,23878317
C1q acts in the tumour microenvironment as a cancer-promoting factor independently of complement activation.,26831747
Role of gamma-delta T cells in host response against Staphylococcus aureus-induced pneumonia.,22776294
Factors associated with severe granulomatous pneumonia in Mycobacterium tuberculosis-infected mice vaccinated therapeutically with hsp65 DNA.,16041037
SYK-CARD9 Signaling Axis Promotes Gut Fungi-Mediated Inflammasome Activation to Restrict Colitis and Colon Cancer.,30231985
IL-4 receptor-alpha-dependent control of Cryptococcus neoformans in the early phase of pulmonary infection.,24475277
Trp2 peptide vaccine adjuvanted with (R)-DOTAP inhibits tumor growth in an advanced melanoma model.,22142394
Differential requirement for CCR4 and CCR7 during the development of innate and adaptive αβT cells in the adult thymus.,24990081
A role for IL-27p28 as an antagonist of gp130-mediated signaling.,21057510
Generation of a dual-functioning antitumor immune response in the peritoneal cavity.,23933065
"Immunosuppressive property within the Streptococcus pneumoniae cell wall that inhibits generation of T follicular helper, germinal center, and plasma cell response to a coimmunized heterologous protein.",23817619
Spontaneous Intestinal Tumorigenesis in Apc (/Min+) Mice Requires Altered T Cell Development with IL-17A.,26146642
Microbial Ligand Costimulation Drives Neutrophilic Steroid-Refractory Asthma.,26261989
An IL-27/NFIL3 signalling axis drives Tim-3 and IL-10 expression and T-cell dysfunction.,25614966
"Latent, Immunosuppressive Nature of Poly(lactic-<i>co</i>-glycolic acid) Microparticles.",30555893
IL-15 prolongs CD154 expression on human CD4 T cells via STAT5 binding to the CD154 transcriptional promoter.,24500400
Oncolytic virotherapy with an armed vaccinia virus in an orthotopic model of renal carcinoma is associated with modification of the tumor microenvironment.,27057460
Dendritic Cell-Like Cells Accumulate in Regenerating Murine Skeletal Muscle after Injury and Boost Adaptive Immune Responses Only upon a Microbial Challenge.,27196728
Maraba virus as a potent oncolytic vaccine vector.,24322333
The same self-peptide selects conventional and regulatory CD4⁺ T cells with identical antigen receptors.,25270305
Differential requirement for the CD45 splicing regulator hnRNPLL for accumulation of NKT and conventional T cells.,22073166
Genome Wide Identification of SARS-CoV Susceptibility Loci Using the Collaborative Cross.,26452100
Listeria monocytogenes-Induced Cell Death Inhibits the Generation of Cell-Mediated Immunity. ,27821585
Lymphoma-like T cell infiltration in liver is associated with increased copy number of dominant negative form of TGFβ receptor II.,23145171
Prevention of colitis-associated cancer by selective targeting of immunoproteasome subunit LMP7.,28881574
Differential antitumor immunity mediated by NKT cell subsets in vivo.,16275765
T-bet Regulates Natural Regulatory T Cell Afferent Lymphatic Migration and Suppressive Function.,26880765
Maintenance of peripheral T cell responses during Mycobacterium tuberculosis infection.,23028057
FoxP3+ regulatory T cells promote influenza-specific Tfh responses by controlling IL-2 availability.,24633065
Mechanisms of Acute Toxicity in NKG2D Chimeric Antigen Receptor T Cell-Treated Mice.,27849169
Chromatin Domain Organization of the TCRb Locus and Its Perturbation by Ectopic CTCF Binding. ,28137913
Antitumor adaptive immunity remains intact following inhibition of autophagy and antimalarial treatment.,27775547
Breaking the co-operation between bystander T-cells and natural killer cells prevents the development of immunosuppression after traumatic skeletal muscle injury in mice.,25609031
Autoantibody-mediated arthritis in the absence of C3 and activating Fcγ receptors: C5 is activated by the coagulation cascade.,23237573
MEK inhibitors selectively suppress alloreactivity and graft-versus-host disease in a memory stage-dependent manner.,23575444
Identification and characterization of H-2d restricted CD4+ T cell epitopes on Lpp20  of Helicobacter pylori.,23234363
Disease-dependent local IL-10 production ameliorates collagen induced arthritis in mice.,23166758
Caribbean and La Réunion Chikungunya Virus Isolates Differ in Their Capacity To Induce Proinflammatory Th1 and NK Cell Responses and Acute Joint Pathology.,25995257
Protective effects of polyamine depletion in mouse models of type 1 diabetes: implications for therapy.,23846959
Imaging of the cross-presenting dendritic cell subsets in the skin-draining lymph node.,26755602
Lung transplant acceptance is facilitated by early events in the graft and is associated with lymphoid neogenesis.,22549742
Cutting edge: MHC class II expression by pulmonary nonhematopoietic cells plays a critical role in controlling local inflammatory responses.,20810992
Natural Killer Dendritic Cells Enhance Immune Responses Elicited by α -Galactosylceramide-Stimulated Natural Killer T Cells.,23878807
"Indoleamine 2,3-dioxygenase controls fungal loads and immunity in Paracoccidioidomicosis but is more important to susceptible than resistant hosts.",25411790
Long-lived antigen-induced IgM plasma cells demonstrate somatic mutations and contribute to long-term protection.,27270306
Endothelial deficiency of L1 reduces tumor angiogenesis and promotes vessel normalization.,25157817
A locus on mouse chromosome 13 inversely regulates CD1d expression and the development of invariant natural killer T-cells.,25654212
Selective enhancement of donor hematopoietic cell engraftment by the CXCR4 antagonist AMD3100 in a mouse transplantation model.,20596257
Nitric oxide inhibits the accumulation of CD4+CD44hiTbet+CD69lo T cells in mycobacterial infection.,22890814
Runt-related transcription factor 3 is involved in the altered phenotype and function in ThPok-deficient invariant natural killer T cells.,24561456
Gene targeting in NOD mouse embryos using zinc-finger nucleases.,23974926
MHC class Ib-restricted CD8 T cells differ in dependence on CD4 T cell help and CD28 costimulation over the course of mouse polyomavirus infection.,22393155
