Title,ID
Cell-specific cargo delivery using synthetic bacterial spores.,36640333
Contribution of CD4+ cells in the emotional alterations induced by endometriosis in mice.,36311856
Comparison of therapeutic effects of mesenchymal stem cells from umbilical cord and bone marrow in the treatment of type 1 diabetes.,35941696
Vaccination with a Zika virus envelope domain III protein induces neutralizing antibodies and partial protection against Asian genotype in immunocompetent mice.,36471432
T-Cell Repertoire Analysis in the Conjunctiva of Murine Dry Eye Model.,36877515
"NRF2 Mediates Cellular Resistance to Transformation, Radiation, and Inflammation in Mice.",36139722
Short or Long Interval between Priming and Boosting: Does It Impact on the Vaccine Immunogenicity? ,33804604
Chemokines expressed by engineered bacteria recruit and orchestrate antitumor immunity.,36888717
Meibomian gland dysfunction is suppressed via selective inhibition of immune responses by topical LFA-1/ICAM antagonism with lifitegrast in the allergic eye disease (AED) model.,33812087
Emodin modulates gut microbial community and triggers intestinal immunity.,36088620
STING is an intrinsic checkpoint inhibitor that restrains the T<sub>H</sub>17 cell pathogenic program.,35613599
Naïve CD4<sup>+</sup> T Cell Activation in the Nasal-Associated Lymphoid Tissue following Intranasal Immunization with a Flagellin-Based Subunit Vaccine.,36555214
The gut microbiome contributes to splenomegaly and tissue inflammation in a murine model of primary biliary cholangitis.,35928756
Chronic CD27-CD70 costimulation promotes type 1-specific polarization of effector Tregs.,36993956
Versican promotes T helper 17 cytotoxic inflammation and impedes oligodendrocyte precursor cell remyelination.,35508608
An adjuvant-containing cDC1-targeted recombinant fusion vaccine conveys strong protection against murine melanoma growth and metastasis.,36046810
SIRT1 inactivation switches reactive astrocytes to an antiinflammatory phenotype in CNS autoimmunity.,36136587
COVID-19 vaccine mRNA-1273 elicits a protective immune profile in mice that is not associated with vaccine-enhanced disease upon SARS-CoV-2 challenge.,34270939
Post-endotoxin exposure-induced lung inflammation and resolution consequences beneficially impacted by lung-delivered IL-10 therapy.,36243830
Suppressor of Cytokine Signalling 5 (SOCS5) Modulates Inflammatory Responses during Alphavirus Infection.,36366574
Recruitment of monocytes primed to express heme oxygenase-1 ameliorates pathological lung inflammation in cystic fibrosis.,35581352
Control of intestinal inflammation by glycosylation-dependent lectin-driven immunoregulatory circuits. ,34144987
STAT3 signaling modulates the immune response induced after antigen targeting to conventional type 1 dendritic cells through the DEC205 receptor.,36330518
Bee Venom Phospholipase A2 Ameliorates Atherosclerosis by Modulating Regulatory T Cells. ,32977607
T cell kinetics reveal expansion of distinct lung T cell subsets in acute versus in resolved influenza virus infection.,36275685
MULT1-Encoding DNA Alleviates Schistosomiasis-Associated Hepatic Fibrosis via Modulating Cellular Immune Response.,35873385
Genetic and pharmacological modulation of DNA mismatch repair heterogeneous tumors promotes immune surveillance.,36584674
Pro-Resolving Factor Administration Limits Cancer Progression by Enhancing Immune Response Against Cancer Cells.,35116038
The HDAC inhibitor zabadinostat is a systemic regulator of adaptive immunity.,36702861
A diet enriched in omega-3 PUFA and inulin prevents type 1 diabetes by restoring gut barrier integrity and immune homeostasis in NOD mice.,36713378
Antigen presentation between T cells drives Th17 polarization under conditions of limiting antigen.,33730591
Adjuvants influence the maturation of VRC01-like antibodies during immunization.,36405776
GM-CSF<sup>+</sup> Tc17 cells are required to bolster vaccine immunity against lethal fungal pneumonia without causing overt pathology.,36288707
Systemic Injection of Oncolytic Vaccinia Virus Suppresses Primary Tumor Growth and Lung Metastasis in Metastatic Renal Cell Carcinoma by Remodeling Tumor Microenvironment. ,35052851
Pharmacological Wnt ligand inhibition overcomes key tumor-mediated resistance pathways to anti-PD-1 immunotherapy.,33951424
LRBA Deficiency Can Lead to Lethal Colitis That Is Diminished by SHIP1 Agonism.,35603158
A human STAT3 gain-of-function variant confers T cell dysregulation without predominant Treg dysfunction in mice.,36136607
CD69 expression on regulatory T cells protects from immune damage after myocardial infarction.,36066993
Immunomodulatory Properties of Umbilical Cord Blood-Derived Small Extracellular Vesicles and Their Therapeutic Potential for Inflammatory Skin Disorders. ,34575956
Cytokine elevation in the mouse small intestine at the early stage of infection with the gastrointestinal parasite Heligmosomoides polygyrus.,33597317
PRMT5 inhibition induces pro-inflammatory macrophage polarization and increased hepatic triglyceride levels without affecting atherosclerosis in mice.,36946061
Low-dose IL-2 shapes a tolerogenic gut microbiota that improves autoimmunity and gut inflammation.,35917175
Co-administration of Lactobacillus gasseri KBL697 and tumor necrosis factor-alpha inhibitor infliximab improves colitis in mice.,35688918
Beneficial role of rapamycin in experimental autoimmune myositis.,24265670
Immunomodulatory Effects by Photodynamic Treatment of Glioblastoma Cells In Vitro.,35684322
Immune checkpoint blockade impairs immunosuppressive mechanisms of regulatory T cells in B-cell lymphoma.,34229208
Immune response and protective efficacy of the SARS-CoV-2 recombinant spike protein vaccine S-268019-b in mice.,36460696
Adjuvant Screen Identifies Synthetic DNA-Encoding Flt3L and CD80 Immunotherapeutics as Candidates for Enhancing Anti-tumor T Cell Responses.,32161596
"Role for the metalloproteinase ADAM28 in the control of airway inflammation, remodelling and responsiveness in asthma.",36685493
Undernutrition and Hypoleptinemia Modulate Alloimmunity and CMV-specific Viral Immunity in Transplantation.,33724247
GRIM19 Impedes Obesity by Regulating Inflammatory White Fat Browning and Promoting Th17/Treg Balance. ,33467683
Isolevuglandins disrupt PU.1-mediated C1q expression and promote autoimmunity and hypertension in systemic lupus erythematosus.,35608913
The Voltage-Gated Hv1 H<sup>+</sup> Channel Is Expressed in Tumor-Infiltrating Myeloid-Derived Suppressor Cells.,37047188
Recombinant BCG expressing the LTAK63 adjuvant improves a short-term chemotherapy schedule in the control of tuberculosis in mice.,36119106
Specific targeting of inflammatory osteoclastogenesis by the probiotic yeast <i>S. boulardii</i> CNCM I-745 reduces bone loss in osteoporosis.,36848406
Rapamycin Eyedrops Increased CD4+Foxp3+ Cells and Prevented Goblet Cell Loss in the Aged Ocular Surface. ,33255287
Secreted gelsolin inhibits DNGR-1-dependent cross-presentation and cancer immunity.,34081922
Tolerance induction in memory CD4 T cells is partial and reversible.,32931017
STING signaling is a potential immunotherapeutic target in colorectal cancer.,31598165
Inhibition of myeloid-derived suppressive cell function with all-trans retinoic acid enhanced anti-PD-L1 efficacy in cervical cancer.,35688951
TIM-3 and TIM-1 Could Regulate Decidual <i>γδ</i>TCR Bright T Cells during Murine Pregnancy.,31236420
Resolvin D1 treatment on goblet cell mucin and immune responses in the chronic allergic eye disease (AED) model.,30279513
ADAR1 mutation causes ZBP1-dependent immunopathology.,35859177
Sex-Specific Effects of Microglia-Like Cell Engraftment during Experimental Autoimmune Encephalomyelitis. ,32957621
The G Protein-Coupled Receptor (GPR) 15 Counteracts Antibody-Mediated Skin Inflammation.,32922401
Tofacitinib Treatment in Primary Herpes Simplex Encephalitis Interferes With Antiviral Response.,35217873
Profiling of Tregs across tissues reveals plasticity in ST2 expression and hierarchies in tissue-specific phenotypes.,36093048
Glucan particles as a novel adjuvant for the induction of experimental autoimmune encephalomyelitis.,34111646
Skin and gut imprinted helper T cell subsets exhibit distinct functional phenotypes in central nervous system autoimmunity.,34099917
Soluble RAGE Prevents Type 1 Diabetes Expanding Functional Regulatory T Cells.,35713929
Immunizations with diverse sarbecovirus receptor-binding domains elicit SARS-CoV-2 neutralizing antibodies against a conserved site of vulnerability.,34788600
Small Molecule Enhancers of Endosome-to-Cytosol Import Augment Anti-tumor Immunity.,32668257
Knockdown of NEAT1 induces tolerogenic phenotype in dendritic cells by inhibiting activation of NLRP3 inflammasome.,31281488
Lysosomal Acid Lipase Is Required for Donor T Cells to Induce Graft-versus-Host Disease.,33113360
A single vaccination of nucleoside-modified Rabies mRNA vaccine induces prolonged highly protective immune responses in mice.,36761167
Soy-tomato enriched diet reduces inflammation and disease severity in a pre-clinical model of chronic pancreatitis.,33311549
Intercellular Adhesion Molecule-1 (ICAM-1) and ICAM-2 Differentially Contribute to Peripheral Activation and CNS Entry of Autoaggressive Th1 and Th17 Cells in Experimental Autoimmune Encephalomyelitis.,31993059
Niche-expressed Galectin-1 is involved in pre-B acute lymphoblastic leukemia relapse through pre-B cell receptor activation.,37009219
Decreased antiviral immune response within the central nervous system of aged mice is associated with increased lethality of West Nile virus encephalitis.,34327802
MicroRNA-155 contributes to host immunity against Toxoplasma gondii.,34907898
Treatment of glioblastoma with current oHSV variants reveals differences in efficacy and immune cell recruitment.,34553031
Cutting Edge: Early Attrition of Memory T Cells during Inflammation and Costimulation Blockade Is Regulated Concurrently by Proapoptotic Proteins Fas and Bim.,30610162
Heterologous Prime-Boost Combinations Highlight the Crucial Role of Adjuvant in Priming the Immune System.,29593710
Endocytic membrane repair by ESCRT-III controls antigen export to the cytosol during antigen cross-presentation.,35977488
Development of Tbet- and CD11c-expressing B cells in a viral infection requires T follicular helper cells outside of germinal centers.,35090581
IL-23 signaling regulation of pro-inflammatory T-cell migration uncovered by phosphoproteomics.,32203518
Rational design of innate defense regulator peptides as tumor vaccine adjuvants.,34016984
Correction: Female and male mouse lung group 2 innate lymphoid cells differ in gene expression profiles and cytokine production.,34015033
Inferior immunogenicity and efficacy of respiratory syncytial virus fusion protein-based subunit vaccine candidates in aged versus young mice.,29182682
Intestinal inflammation alters the antigen-specific immune response to a skin commensal.,35649365
Peripheral Inflammation Regulates CNS Immune Surveillance Through the Recruitment of Inflammatory Monocytes Upon Systemic α-Synuclein Administration.,30761145
FcRn-Targeted Mucosal Vaccination against Influenza Virus Infection.,34380652
IL-21 has a critical role in establishing germinal centers by amplifying early B cell proliferation.,35801309
Development of a Heat-Killed <i>fbp1</i> Mutant Strain as a Therapeutic Agent To Treat Invasive Cryptococcus Infection.,36719231
"Celiac Vagus Nerve Stimulation Recapitulates Angiotensin II-Induced Splenic Noradrenergic Activation, Driving Egress of CD8 Effector Cells.",33326772
Cutaneous Exposure to Clinically Relevant Lone Star Ticks Promotes IgE Production and Hypersensitivity through CD4<sup>+</sup> T Cell- and MyD88-Dependent Pathways in Mice.,31270149
Differential Recruitment of Dendritic Cells Subsets to Lymph Nodes Correlates with a Protective or Permissive T-Cell Response during Leishmania (Viannia) Braziliensis or Leishmania (Leishmania) Amazonensis Infection.,27073297
mRNA-encoded HIV-1 Env trimer ferritin nanoparticles induce monoclonal antibodies that neutralize heterologous HIV-1 isolates in mice.,35294883
Modulation of Primary Immune Response by Different Vaccine Adjuvants.,27781036
Matrix Metalloproteinase-12 Supports Pulmonary B Cell Follicle Formation and Local Antibody Responses During Asthma.,35944138
An efficient chronic unpredictable stress protocol to induce stress-related responses in C57BL/6 mice.,25698978
Sclerostin domain-containing protein 1 is dispensable for the differentiation of follicular helper and follicular regulatory T cells during acute viral infection.,31312383
Breakage-Fusion-Bridge Events Trigger Complex Genome Rearrangements and Amplifications in Developmentally Arrested T Cell Lymphomas.,31167132
Outer Membrane Protein of Gut Commensal Microorganism Induces Autoantibody Production and Extra-Intestinal Gland Inflammation in Mice. ,30347705
Robust Control of a Brain-Persisting Parasite through MHC I Presentation by Infected Neurons.,31189109
IL-9 Controls Central Nervous System Autoimmunity by Suppressing GM-CSF Production.,31852750
An Injectable Cytokine Trap for Local Treatment of Autoimmune Disease.,31753473
Tissue-restricted control of established central nervous system autoimmunity by TNF receptor 2-expressing Treg cells. ,33766913
Type I Interferon Therapy Limits CNS Autoimmunity by Inhibiting CXCR3-Mediated Trafficking of Pathogenic Effector T Cells.,31291583
MTH1 as a target to alleviate T cell driven diseases by selective suppression of activated T cells.,34453118
"Hypomorphic Brca2 and Rad51c double mutant mice display Fanconi anemia, cancer and polygenic replication stress.",36906610
PI3K Signaling in Dendritic Cells Aggravates DSS-Induced Colitis.,35514976
Addressing the role of PKD3 in the T cell compartment with knockout mice.,35440091
Intranasal Immunization with DnaK Protein Induces Protective Mucosal Immunity against Tuberculosis in CD4-Depleted Mice.,29473022
"Intranasal Nanoparticle Vaccination Elicits a Persistent, Polyfunctional CD4 T Cell Response in the Murine Lung Specific for a Highly Conserved Influenza Virus Antigen That Is Sufficient To Mediate Protection from Influenza Virus Challenge.",34076479
Dysregulation of NK and CD8<sup>+</sup>T Cells by the Microbiota Promotes the Progression of Lung Cancer.,36033391
Temporal dynamics of TNF-mediated changes in hematopoietic stem cell function and recovery.,36968066
A critical role for Th17 cell-derived TGF-β1 in regulating the stability and pathogenicity of autoimmune Th17 cells.,34050263
UVB modifies skin immune-stroma cross-talk and promotes effector T cell recruitment during cryptic<i>Leishmania donovani</i>infection,10.1101/2023.02.03.526940
Myeloid TLR4 signaling promotes post-injury withdrawal resolution of murine liver fibrosis.,36876136
Development of severe colitis is associated with lung inflammation and pathology.,37063825
pH and Proton Sensor GPR65 Determine Susceptibility to Atopic Dermatitis.,34135065
Interleukin-15 Complex Treatment Protects Mice from Cerebral Malaria by Inducing Interleukin-10-Producing Natural Killer Cells.,29625893
Garlic-Derived Organosulfur Compounds Regulate Metabolic and Immune Pathways in Macrophages and Attenuate Intestinal Inflammation in Mice.,35107883
CD4 T Cell Epitope Specificity and Cytokine Potential Are Preserved as Cells Transition from the Lung Vasculature to Lung Tissue following Influenza Virus Infection. ,29669836
Angiopoietin-2 blockade ameliorates autoimmune neuroinflammation by inhibiting leukocyte recruitment into the CNS.,32149735
"Polysaccharide extracted from Chinese white wax scale ameliorates 2,4-dinitrochlorobenzene-induced atopic dermatitis-like symptoms in BALB/c mice.",28579902
Immunomodulatory role of bitter melon extract in inhibition of head and neck squamous cell carcinoma growth.,27120805
Low-Dose rIL-15 Protects from Nephrotoxic Serum Nephritis via CD8<sup>+</sup> T Cells.,36429085
Recombinant cell-detecting RaDR-GFP in mice reveals an association between genomic instability and radiation-induced-thymic lymphoma.,35261787
TCR Retrogenic Mice as a Model To Map Self-Tolerance Mechanisms to the Cancer Mucosa Antigen GUCY2C.,30642983
"Attenuation and Stability of CHIKV-NoLS, a Live-Attenuated Chikungunya Virus Vaccine Candidate. ",30583514
Chronic follicular bronchiolitis requires antigen-specific regulatory T cell control to prevent fatal disease progression.,24163409
Matured Tolerogenic Dendritic Cells Effectively Inhibit Autoantigen Specific CD4+ T Cells in a Murine Arthritis Model.,31555285
DPP4 Inhibitor Sitagliptin Enhances Lymphocyte Recruitment and Prolongs Survival in a Syngeneic Ovarian Cancer Mouse Model. ,33513866
Isoflavone diet ameliorates experimental autoimmune encephalomyelitis through modulation of gut bacteria depleted in patients with multiple sclerosis. ,34244137
IL-21 has a critical role in establishing germinal centers by amplifying early B cell proliferation,10.1101/2022.01.21.476732
Bile salt hydrolase in non-enterotoxigenic Bacteroides potentiates colorectal cancer.,36765047
Lactoferrin-Functionalized Noble Metal Nanoparticles as New Antivirals for HSV-2 Infection. ,35056558
Expression and Function of Granzymes A and B in <i>Escherichia coli</i> Peritonitis and Sepsis.,28694562
RNA-Seq-Based TCR Profiling Reveals Persistently Increased Intratumoral Clonality in Responders to Anti-PD-1 Therapy.,32411589
Increased number of T cells and exacerbated inflammatory pathophysiology in a human IgG4 knock-in MRL/lpr mouse model.,36763580
Increased mortality in CD43-deficient mice during sepsis.,30226896
Burn injury influences the T cell homeostasis in a butyrate-acid sphingomyelinase dependent manner.,28063598
Unique Phenotypes of Heart Resident Type 2 Innate Lymphoid Cells.,32431711
Investigating immunoregulatory effects of myeloid cell autophagy in acute and chronic inflammation.,35652357
Increased susceptibility to organic dust exposure-induced inflammatory lung disease with enhanced rheumatoid arthritis-associated autoantigen expression in HLA-DR4 transgenic mice.,35717175
Invasive margin tissue-resident macrophages of high CD163 expression impede responses to T cell-based immunotherapy.,36914207
Paradoxical interaction between cancer and long-term postsepsis disorder: impairment of de novo carcinogenesis versus favoring the growth of established tumors. ,32376720
Co-existence of classical and alternative activation programs in macrophages responding to Toxoplasma gondii.,24083945
A Retinoid X Receptor Agonist Directed to the Large Intestine Ameliorates T-Cell-Mediated Colitis in Mice.,34475823
Effect of IL‑7 on Th17 cell responses in a mouse model of neutrophilic asthma.,32468040
Suppressor of cytokine signaling-1 mimetic peptides attenuate lymphocyte activation in the MRL/lpr mouse autoimmune model.,33737712
IL-33 Protects Mice against DSS-Induced Chronic Colitis by Increasing Both Regulatory B Cell and Regulatory T Cell Responses as Well as Decreasing Th17 Cell Response.,30539029
From pseudo to real-time dynamics of T cell thymic differentiation.,36624839
T cells expressing the lupus susceptibility allele Pbx1d enhance autoimmunity and atherosclerosis in dyslipidemic mice. ,32493841
Cadherin-11 Regulates Macrophage Development and Function.,35211116
Impaired airway mucociliary function reduces antigen-specific IgA immune response to immunization with a claudin-4-targeting nasal vaccine in mice.,29440671
Interleukin-19 Abrogates Experimental Autoimmune Encephalomyelitis by Attenuating Antigen-Presenting Cell Activation.,33776998
Murine foetal liver supports limited detectable expansion of life-long haematopoietic progenitors.,36202972
Peptidylprolyl isomerase C (Ppic) regulates invariant Natural Killer T cell (iNKT) differentiation in mice.,33864384
Interleukin-37 Ameliorates Influenza Pneumonia by Attenuating Macrophage Cytokine Production in a MAPK-Dependent Manner.,31736917
Dendritic Cell KLF2 Expression Regulates T Cell Activation and Proatherogenic Immune Responses.,27837103
RNPS1 inhibits excessive tumor necrosis factor/tumor necrosis factor receptor signaling to support hematopoiesis in mice.,35482923
Collagen epitope expression on B cells is sufficient to confer tolerance to collagen-induced arthritis.,27301320
Differences between immunodeficient mice generated by classical gene targeting and CRISPR/Cas9-mediated gene knockout.,29594927
Potent CD4+ T cell-associated antitumor memory responses induced by trifunctional bispecific antibodies in combination with immune checkpoint inhibition.,27966460
Complement C3a and C5a receptors promote GVHD by suppressing mitophagy in recipient dendritic cells. ,30568037
SPNS2 enables T cell egress from lymph nodes during an immune response.,34260944
Inhibition of G Protein βγ Subunit Signaling Abrogates Nephritis in Lupus-Prone Mice.,26990948
"TCR Affinity Biases Th Cell Differentiation by Regulating CD25, Eef1e1, and Gbp2.",30858199
Pulsed low-dose RANKL as a potential therapeutic for postmenopausal osteoporosis. ,27570837
Heritable vaginal bacteria influence immune tolerance and relate to early-life markers of allergic sensitization in infancy.,35932762
Helminth exposure protects against murine SARS-CoV-2 infection through macrophage dependent T cell activation,10.1101/2022.11.09.515832
Mycobacterium tuberculosis infection modulates adipose tissue biology.,29040326
Controlled administration of aerosolized SARS-CoV-2 to K18-hACE2 transgenic mice uncouples respiratory infection and anosmia from fatal neuroinvasion,10.1101/2021.08.06.455382
Differential Responses to Vitamin D2 and Vitamin D3 Are Associated With Variations in Free 25-Hydroxyvitamin D.,27399876
Environmental Factor-Mediated Transgenerational Inheritance of <i>Igf2r</i> Hypomethylation and Pulmonary Allergic Response <i>via</i> Targeting Dendritic Cells.,33424850
Inhibition of lysophosphatidic acid receptor 1-3 deteriorates experimental autoimmune encephalomyelitis by inducing oxidative stress.,34666785
Mycobacterium tuberculosis infection drives a type I IFN signature in lung lymphocytes.,35732116
Transcriptomics of the Vaccine Immune Response: Priming With Adjuvant Modulates Recall Innate Responses After Boosting.,29922291
TGF-β-mediated silencing of genomic organizer SATB1 promotes Tfh cell differentiation and formation of intra-tumoral tertiary lymphoid structures.,35021053
Redundant cytokine requirement for intestinal microbiota-induced Th17 cell differentiation in draining lymph nodes.,34433045
T-Cell Expression and Release of Kidney Injury Molecule-1 in Response to Glucose Variations Initiates Kidney Injury in Early Diabetes.,34285121
β1-Integrin- and KV1.3 channel-dependent signaling stimulates glutamate release from Th17 cells.,31661467
CpG 1018 Is an Effective Adjuvant for Influenza Nucleoprotein.,36992232
"COVID-<i>e</i>Vax, an electroporated plasmid DNA vaccine candidate encoding the SARS-CoV-2 Receptor Binding Domain, elicits protective immune responses in animal models of COVID-19",10.1101/2021.06.14.448343
Antigen-specific gene therapy after immunisation reduces the severity of collagen-induced arthritis.,24371448
Rate of Freeze Impacts the Survival and Immune Responses Post Cryoablation of Melanoma.,34149738
Multipotent progenitors and hematopoietic stem cells arise independently from hemogenic endothelium in the mouse embryo.,34525376
Androgen Receptors in Epithelial Cells Regulate Thymopoiesis and Recent Thymic Emigrants in Male Mice.,32714327
Maresin 1 ameliorates iron-deficient anemia in IL-10(-/-) mice with spontaneous colitis by the inhibition of hepcidin expression though the IL-6/STAT3 pathway.,27398158
In Situ Tumor Vaccination with Nanoparticle Co-Delivering CpG and STAT3 siRNA to Effectively Induce Whole-Body Antitumor Immune Response.,34118167
Early alveolar macrophage response and IL-1R-dependent T cell priming determine transmissibility of Mycobacterium tuberculosis strains.,35173157
CD6 deficiency impairs early immune response to bacterial sepsis.,36157587
The frequency of follicular T helper cells differs in acute and chronic neuroinflammation.,33235306
PHF6 regulates phenotypic plasticity through chromatin organization within lineage-specific genes.,28607179
Pathogenesis of Respiratory Syncytial Virus Infection in BALB/c Mice Differs Between Intratracheal and Intranasal Inoculation. ,31163619
A nonredundant role for T cell-derived interleukin 22 in antibacterial defense of colonic crypts.,35263568
mRNA-based SARS-CoV-2 vaccine candidate CVnCoV induces high levels of virus-neutralising antibodies and mediates protection in rodents.,33863911
Bystander activation of irrelevant CD4+ T cells following antigen-specific vaccination occurs in the presence and absence of adjuvant.,28489886
Targeted antibody and cytokine cancer immunotherapies through collagen affinity. ,30971453
Aggregation by peptide conjugation rescues poor immunogenicity of the HA stem.,33137148
Promotion of cholangiocarcinoma growth by diverse cancer-associated fibroblast subpopulations.,33930309
Single-cell transcriptomics of human gut T cells identifies cytotoxic CD4<sup>+</sup>CD8A<sup>+</sup> T cells related to mouse CD4 cytotoxic T cells.,36353619
C-type lectin receptor DCIR modulates immunity to tuberculosis by sustaining type I interferon signaling in dendritic cells.,28069953
mRNA based SARS-CoV-2 vaccine candidate CVnCoV induces high levels of virus neutralizing antibodies and mediates protection in rodents,10.1101/2020.10.23.351775
IFN-κ Is a Rheostat for Development of Psoriasiform Inflammation.,34364883
Interleukin-17 contributes to Ross River virus-induced arthritis and myositis.,35143591
"COVID-eVax, an electroporated DNA vaccine candidate encoding the SARS-CoV-2 RBD, elicits protective responses in animal models.",34547465
"Ovariectomy Activates Chronic Low-Grade Inflammation Mediated by Memory T Cells, Which Promotes Osteoporosis in Mice.",31995253
