Title,ID
Allospecific CD4(+) effector memory T cells do not induce graft-versus-host disease in mice.,22809867
CD4+ T lymphocyte ablation prevents pancreatic carcinogenesis in mice.,24795355
Deletion of interleukin-6 in mice with the dominant negative form of transforming growth factor beta receptor II improves colitis but exacerbates autoimmune cholangitis.,20578264
Distinct CD4 T-cell effects on primary versus recall CD8 T-cell responses during viral encephalomyelitis.,25187405
CD40 gene silencing reduces the progression of experimental lupus nephritis modulating local milieu and systemic mechanisms.,23799000
Genetic control of murine invariant natural killer T cells maps to multiple type 1 diabetes regions.,23719031
"Mesothelioma tumor cells modulate dendritic cell lipid content, phenotype and function.",25886502
Stat3 Signaling Promotes Survival And Maintenance Of Medullary Thymic Epithelial Cells.,26789196
Myeloid cell transmigration across the CNS vasculature triggers IL-1β-driven neuroinflammation during autoimmune encephalomyelitis in mice.,27139491
Topical imiquimod has therapeutic and immunomodulatory effects against intracranial tumors.,21389872
CCCTC-Binding Factor Translates Interleukin 2- and α-Ketoglutarate-Sensitive Metabolic Changes in T Cells into Context-Dependent Gene Programs.,28813658
Testing the role of P2X7 receptors in the development of type 1 diabetes in nonobese diabetic mice.,21357538
RIG-I-like helicases induce immunogenic cell death of pancreatic cancer cells and sensitize tumors toward killing by CD8(+) T cells.,25012502
Deficiency in regulatory T cells results in development of antimitochondrial antibodies and autoimmune cholangitis.,19065675
GITR intrinsically sustains early type 1 and late follicular helper CD4 T cell accumulation to control a chronic viral infection.,25590581
Renal intercalated cells sense and mediate inflammation via the P2Y14 receptor.,25799465
Nitric oxide synthase activity has limited influence on the control of Coccidioides infection in mice.,21513788
Analysis of the dynamics of infiltrating CD4(+) T cell subsets in the heart during experimental Trypanosoma cruzi infection.,23776551
Engineering DNA nanoparticles as immunomodulatory reagents that activate regulatory T cells.,22516958
Limited role of regulatory T cells during acute Theiler virus-induced encephalitis in resistant C57BL/6 mice.,25391297
Circulating herpes simplex type 1 (HSV-1)-specific CD8+ T cells do not access HSV-1 latently infected trigeminal ganglia.,21429183
"Different patterns of expansion, contraction and memory differentiation of HIV-1 Gag-specific CD8 T cells elicited by adenovirus type 5 and modified vaccinia Ankara vaccines.",21651938
Phenotypical and functional analysis of intraepithelial lymphocytes from small intestine of mice in oral tolerance.,22400033
LNK/SH2B3 regulates IL-7 receptor signaling in normal and malignant B-progenitors.,26974155
MyD88 signaling in B cells regulates the production of Th1-dependent antibodies to AAV.,22643865
Specific dietary oligosaccharides increase Th1 responses in a mouse respiratory syncytial virus infection model.,22896622
A mutant of Mycobacterium tuberculosis lacking the 19-kDa lipoprotein Rv3763 is highly attenuated in vivo but retains potent vaccinogenic properties.,17804126
CAML regulates Bim-dependent thymocyte death.,20300112
Absence of phagocyte NADPH oxidase 2 leads to severe inflammatory response in lungs of mice infected with Coccidioides.,21896326
"Quetiapine, an atypical antipsychotic, is protective against autoimmune-mediated demyelination by inhibiting effector T cell proliferation.",22912731
Sex steroid deficiency-associated bone loss is microbiota dependent and prevented by probiotics.,27111232
Prostaglandin E2 suppresses antifungal immunity by inhibiting interferon regulatory factor 4 function and interleukin-17 expression in T cells.,22464170
Impact of intravenous immunoglobulin on the dopaminergic system and immune response in the acute MPTP mouse model of Parkinson's disease.,23046563
ER Chaperone BiP/GRP78 Is Required for Myelinating Cell Survival and Provides Protection during Experimental Autoimmune Encephalomyelitis.,26631473
Activation of Invariant NKT cells with glycolipid ligand α-galactosylceramide ameliorates glucose-6-phosphate isomerase peptide-induced arthritis.,23251456
Distinct functions of antigen-specific CD4 T cells during murine Mycobacterium tuberculosis infection.,20962277
The ST2 pathway is involved in acute pancreatitis: a translational study in humans and mice.,22542450
ISCOMATRIX adjuvant combines immune activation with antigen delivery to dendritic cells in vivo leading to effective cross-priming of CD8+ T cells.,21613613
Epicutaneous model of community-acquired Staphylococcus aureus skin infections.,23381997
"Intradermal delivery of Shigella IpaB and IpaD type III secretion proteins: kinetics of cell recruitment and antigen uptake, mucosal and systemic immunity, and protection across serotypes.",24453241
Characterization of T cell phenotype and function in a double transgenic (collagen-specific TCR/HLA-DR1) humanized model of arthritis.,24405551
B7-H4Ig inhibits mouse and human T-cell function and treats EAE via IL-10/Treg-dependent mechanisms.,23683881
"Inhibition of indoleamine 2,3-dioxygenase enhances the T-cell response to influenza virus infection.",23580425
Contribution of NK cells to the innate phase of host protection against an intracellular bacterium targeting systemic endothelium.,22617213
Inoculation dose of Mycobacterium tuberculosis does not influence priming of T cell responses in lymph nodes.,23547119
Attenuated atherosclerotic lesions in apoE-Fcγ-chain-deficient hyperlipidemic mouse model is associated with inhibition of Th17 cells and promotion of regulatory T cells.,22043015
Myeloid dendritic cells (DCs) of mice susceptible to paracoccidioidomycosis suppress T cell responses whereas myeloid and plasmacytoid DCs from resistant mice induce effector and regulatory T cells.,23340311
Hock immunization: a humane alternative to mouse footpad injections.,17804011
Pathobiology of the 129:Stat1 <sup>-/-</sup> mouse model of human age-related ER-positive breast cancer with an immune infiltrate-excluded phenotype.,28865492
Fates of CD4+ T cells in a tolerant environment depend on timing and place of antigen exposure.,22176785
Myocardial aging as a T-cell-mediated phenomenon.,28255084
Differential contribution of dendritic cell CD1d to NKT cell-enhanced humoral immunity and CD8+ T cell activation.,22331103
Expansion of a restricted residual host T reg-cell repertoire is dependent on IL-2 following experimental autologous hematopoietic stem transplantation.,21928285
Disruption of CXCR2-mediated MDSC tumor trafficking enhances anti-PD1 efficacy.,24848257
Ectopic TBX1 suppresses thymic epithelial cell differentiation and proliferation during thymus organogenesis.,25053428
The actin regulator coronin 1A is mutant in a thymic egress-deficient mouse strain and in a patient with severe combined immunodeficiency.,18836449
Autoantibody-boosted T-cell reactivation in the target organ triggers manifestation of autoimmune CNS disease.,26957602
Induction of protective immunity by vaccination against Chlamydia trachomatis using the major outer membrane protein adjuvanted with CpG oligodeoxynucleotide coupled to the nontoxic B subunit of cholera toxin.,19686693
Constitutive expression of AID leads to tumorigenesis.,12732658
Targeting of the non-mutated tumor antigen HER2/neu to mature dendritic cells induces an integrated immune response that protects against breast cancer in mice.,22397502
CIITA promoter I CARD-deficient mice express functional MHC class II genes in myeloid and lymphoid compartments.,22218223
Single intranasal immunization with recombinant adenovirus-based vaccine induces protective immunity against respiratory syncytial virus infection.,18094185
"DNMT3A Haploinsufficiency Transforms FLT3ITD Myeloproliferative Disease into a Rapid, Spontaneous, and Fully Penetrant Acute Myeloid Leukemia.",27016502
Different tissue phagocytes sample apoptotic cells to direct distinct homeostasis programs.,27828940
Lack of IL-6 during coxsackievirus infection heightens the early immune response resulting in increased severity of chronic autoimmune myocarditis.,19587788
IL-12Rβ2 is critical for survival of primary Francisella tularensis LVS infection.,23440500
Mycobacterium ulcerans triggers T-cell immunity followed by local and regional but not systemic immunosuppression.,20974825
Differential T cell responses to residual viral antigen prolong CD4+ T cell contraction following the resolution of infection.,24146043
Proliferative expansion and acquisition of effector activity by memory CD4+ T cells in the lungs following pulmonary virus infection.,18292518
c-FLIP-Short reduces type I interferon production and increases viremia with coxsackievirus B3.,24816846
Kupffer cells hasten resolution of liver immunopathology in mouse models of viral hepatitis.,21655107
Dose-dependent lymphocyte apoptosis following respiratory infection with Vaccinia virus.,18692098
"Expansion of CD4(+) CD25(+) and CD25(-) T-Bet, GATA-3, Foxp3 and RORγt cells in allergic inflammation, local lung distribution and chemokine gene expression.",21625544
iNKT Cells Are Responsible for the Apoptotic Reduction of Basophils That Mediate Th2 Immune Responses Elicited by Papain in Mice Following γPGA Stimulation.,27049954
TLR3 and TLR9 agonists improve postexposure vaccination efficacy of live smallpox vaccines.,25350003
"T-bet regulates immunity to Francisella tularensis live vaccine strain infection, particularly in lungs.",24421047
"Vaccine immunity to coccidioidomycosis occurs by early activation of three signal pathways of T helper cell response (Th1, Th2, and Th17).",21859851
IgG2 antibodies against a clinical grade Plasmodium falciparum CSP vaccine antigen associate with protection against transgenic sporozoite challenge in mice.,25343487
ICAM-5 modulates cytokine/chemokine production in the CNS during the course of herpes simplex virus type 1 infection.,19589604
Immunogenicity of a prime-boost vaccine containing the circumsporozoite proteins of Plasmodium vivax in rodents.,24478093
Topical herpes simplex virus 2 (HSV-2) vaccination with human papillomavirus vectors expressing gB/gD ectodomains induces genital-tissue-resident memory CD8+ T cells and reduces genital disease and viral shedding after HSV-2 challenge.,25320297
The interaction between IL-18 and IL-18 receptor limits the magnitude of protective immunity and enhances pathogenic responses following infection with intracellular bacteria.,21715688
Aberrant overexpression of IL-15 initiates large granular lymphocyte leukemia through chromosomal instability and DNA hypermethylation.,23153537
T-bet deficiency reduces atherosclerosis and alters plaque antigen-specific immune responses.,15665085
Hypercholesterolemia impairs immunity to tuberculosis.,18505807
Effects of targeted deletion of cannabinoid receptors CB1 and CB2 on immune competence and sensitivity to immune modulation by Delta9-tetrahydrocannabinol.,18791168
Treatment of multiple myeloma with adoptively transferred chimeric NKG2D receptor-expressing T cells.,21209626
Role of regulatory T cells in a new mouse model of experimental autoimmune myositis.,19218348
Rapid acquisition of tissue-specific homing phenotypes by CD4(+) T cells activated in cutaneous or mucosal lymphoid tissues.,11781372
H2 control of natural T regulatory cell frequency in the lymph node correlates with susceptibility to day 3 thymectomy-induced autoimmune disease.,21135167
Expression of αvβ8 integrin on dendritic cells regulates Th17 cell development and experimental autoimmune encephalomyelitis in mice.,21099117
The death effector domain protein PEA-15 negatively regulates T-cell receptor signaling.,20354143
CD4+ T lymphocytes are not necessary for the acute rejection of vascularized mouse lung transplants.,18354199
Deleting TCR alpha beta+ or CD4+ T lymphocytes leads to opposite effects on site-specific atherosclerosis in female apolipoprotein E-deficient mice.,15579444
Human neutrophil Fcgamma receptors initiate and play specialized nonredundant roles in antibody-mediated inflammatory diseases.,18538590
"VCAM-1 blockade delays disease onset, reduces disease severity and inflammatory cells in an atopic dermatitis model.",20065994
Differential immunological phenotypes are exhibited after scald and flame burns.,18650781
Transgenic kallikrein 5 mice reproduce major cutaneous and systemic hallmarks of Netherton syndrome.,24534191
Digital cell quantification identifies global immune cell dynamics during influenza infection.,24586061
The interaction of LCK and the CD4 co-receptor alters the dose response of T-cells to interleukin-7.,20433867
Susceptibility of CCR5-deficient mice to genital herpes simplex virus type 2 is linked to NK cell mobilization.,17267483
OX40 induces CCL20 expression in the context of antigen stimulation: an expanding role of co-stimulatory molecules in chemotaxis.,20400327
"Respiratory Francisella tularensis live vaccine strain infection induces Th17 cells and prostaglandin E2, which inhibits generation of gamma interferon-positive T cells.",18391003
Identification of stage-specific gene modulation during early thymocyte development by whole-genome profiling analysis after aryl hydrocarbon receptor activation.,20159946
CD4+ CD25+ Foxp3- T-regulatory cells produce both gamma interferon and interleukin-10 during acute severe murine spotted fever rickettsiosis.,19564386
Abnormal immune response of CCR5-deficient mice to ocular infection with herpes simplex virus type 1.,16476970
Activation of OX40 augments Th17 cytokine expression and antigen-specific uveitis.,20952591
Identification of an IL-17-producing NK1.1(neg) iNKT cell population involved in airway neutrophilia.,17470641
Interleukin-6 is essential for primary resistance to Francisella tularensis live vaccine strain infection.,23230288
Interleukin-22 but not interleukin-17 provides protection to hepatocytes during acute liver inflammation.,17919941
Gfi1 integrates progenitor versus granulocytic transcriptional programming.,19346496
Lymphotoxin-alpha and TNF have essential but independent roles in the evolution of the granulomatous response in experimental leprosy.,19246648
Ubiquitous Over-Expression of Chromatin Remodeling Factor SRG3 Ameliorates the T Cell-Mediated Exacerbation of EAE by Modulating the Phenotypes of both Dendritic Cells and Macrophages.,26147219
Nedd4 augments the adaptive immune response by promoting ubiquitin-mediated degradation of Cbl-b in activated T cells.,18931680
Modulation of CD8+ CTL effector function by fibroblasts derived from the immunoprivileged cornea.,17460279
Bone marrow precursor cells from aged mice generate CD4 T cells that function well in primary and memory responses.,18802086
Expansion and function of Foxp3-expressing T regulatory cells during tuberculosis.,17709423
Epidermal barrier defects link atopic dermatitis with altered skin cancer susceptibility.,24843010
"Fan1 deficiency results in DNA interstrand cross-link repair defects, enhanced tissue karyomegaly, and organ dysfunction.",26980189
A critical role for the retinoic acid signaling pathway in the pathophysiology of gastrointestinal graft-versus-host disease.,23529927
Intestinal phenotype in mice overexpressing a heparin-binding EGF-like growth factor transgene in enterocytes.,19939201
JunD/AP-1-mediated gene expression promotes lymphocyte growth dependent on interleukin-7 signal transduction.,22384197
Newly generated CD4 T cells in aged animals do not exhibit age-related defects in response to antigen.,15781577
Thymus-specific serine protease controls autoreactive CD4 T cell development and autoimmune diabetes in mice.,21505262
Phenotypic complementation of genetic immunodeficiency by chronic herpesvirus infection. ,25599590
Dectin-1 is required for beta-glucan recognition and control of fungal infection.,17159984
Immune reconstitution during Pneumocystis lung infection: disruption of surfactant component expression and function by S-nitrosylation.,19201882
Intraspleen delivery of a DNA vaccine coding for superoxide dismutase (SOD) of Brucella abortus induces SOD-specific CD4+ and CD8+ T cells.,15039330
ESAT-6-specific CD4 T cell responses to aerosol Mycobacterium tuberculosis infection are initiated in the mediastinal lymph nodes.,18667699
"Development of functional and molecular correlates of vaccine-induced protection for a model intracellular pathogen, F. tularensis LVS.",22275868
Maintenance of immune tolerance to a neo-self acetylcholine receptor antigen with aging: implications for late-onset autoimmunity.,20435934
The neuropeptide alpha-melanocyte-stimulating hormone is critically involved in the development of cytotoxic CD8+ T cells in mice and humans.,20126537
T cell epitope specificity and pathogenesis of mouse hepatitis virus-1-induced disease in susceptible and resistant hosts.,20554960
Immune dysregulation accelerates atherosclerosis and modulates plaque composition in systemic lupus erythematosus.,16636270
Positive selection of MHC class Ib-restricted CD8(+) T cells on hematopoietic cells.,12089507
The Wnt signaling antagonist Kremen1 is required for development of thymic architecture.,17162372
Amelioration of coxsackievirus B3-mediated myocarditis by inhibition of tissue inhibitors of matrix metalloproteinase-1.,18055551
Activation of Th1 and Tc1 cell adenosine A2A receptors directly inhibits IL-2 secretion in vitro and IL-2-driven expansion in vivo.,15746085
"Tentative T cells: memory cells are quick to respond, but slow to divide.",18404208
Both spike and background genes contribute to murine coronavirus neurovirulence.,16809289
Mutation in fas ligand impairs maturation of thymocytes bearing moderate affinity T cell receptors.,12860933
Infected site-restricted Foxp3+ natural regulatory T cells are specific for microbial antigens.,16533885
Interleukin (IL)-15 and IL-7 jointly regulate homeostatic proliferation of memory phenotype CD8+ cells but are not required for memory phenotype CD4+ cells.,12070280
CEACAM1 regulates TIM-3-mediated tolerance and exhaustion.,25363763
Increased sensitivity to staphylococcal enterotoxin B following adenoviral infection.,15908364
Intranasal vaccination induces protective immunity against intranasal infection with virulent Francisella tularensis biovar A.,15845466
Loss of precursor B cell expansion but not allelic exclusion in VpreB1/VpreB2 double-deficient mice.,11181696
"T cells translate individual, quantal activation into collective, analog cytokine responses via time-integrated feedbacks.",24719192
Increased mortality and dysregulated cytokine production in tumor necrosis factor receptor 1-deficient mice following systemic Klebsiella pneumoniae infection.,12933830
