Title,ID
Transient Inhibition of the JAK/STAT Pathway Prevents B-ALL Development in Genetically Predisposed Mice.,35131871
Roles of T Follicular Helper Cells and T Follicular Regulatory Cells in Autoantibody Production in IL-2-Deficient Mice.,31356160
Neutral ceramidase-dependent regulation of macrophage metabolism directs intestinal immune homeostasis and controls enteric infection.,35354041
TLR9 Sensing of Self-DNA Controls Cell-Mediated Immunity to Listeria Infection via Rapid Conversion of Conventional CD4<sup>+</sup> T Cells to T<sub>reg</sub>.,32268093
Mucosal Immunity in the Female Murine Mammary Gland.,29884705
Monomethyl auristatin antibody and peptide drug conjugates for trimodal cancer chemo-radio-immunotherapy.,35790753
Galectin-1 functions as a Th2 cytokine that selectively induces Th1 apoptosis and promotes Th2 function.,18991278
Notch-Regulated Dendritic Cells Restrain Inflammation-Associated Colorectal Carcinogenesis.,33441309
Influenza Virus Neuraminidase Engages CD83 and Promotes Pulmonary Injury. ,33177200
Arkadia-SKI/SnoN signaling differentially regulates TGF-β-induced iTreg and Th17 cell differentiation. ,34473197
Group V secretory phospholipase A2 is involved in macrophage activation and is sufficient for macrophage effector functions in allergic pulmonary inflammation.,23650617
Enhancing adoptive T-cell therapy with fucoidan-based IL-2 delivery microcapsules.,36684086
Role of Insulin-Like Growth Factor Binding Protein-3 in the Pathogenesis of Herpes Stromal Keratitis.,32106295
Early infection with respiratory syncytial virus impairs regulatory T cell function and increases susceptibility to allergic asthma.,22961107
E-Protein Inhibition in ILC2 Development Shapes the Function of Mature ILC2s during Allergic Airway Inflammation.,35181641
Elucidating immunologic mechanisms of PROSTVAC cancer immunotherapy.,25328681
The Spontaneous Autoimmune Neuromyopathy in ICOSL<sup>-/-</sup> NOD Mice Is CD4<sup>+</sup> T-Cell and Interferon-γ Dependent.,28424681
Progesterone modulates the T-cell response via glucocorticoid receptor-dependent pathways.,30604567
Dynamic Imprinting of the Treg Cell-Specific Epigenetic Signature in Developing Thymic Regulatory T Cells.,31681278
Identification of an Essential Cytoplasmic Region of Interleukin-7 Receptor α Subunit in B-Cell Development. ,30149646
Tumor Cells Modified with Newcastle Disease Virus Expressing IL-24 as a Cancer Vaccine.,31338417
Abrogated AID Function Prolongs Survival and Diminishes Renal Pathology in the BXSB Mouse Model of Systemic Lupus Erythematosus.,31988182
Expression of Nutrient Transporters on NK Cells During Murine Cytomegalovirus Infection Is MyD88-Dependent.,34093543
CD25+CD4+ T cells contribute to the control of memory CD8+ T cells.,12084927
A Methodological Approach Using rAAV Vectors Encoding Nanobody-Based Biologics to Evaluate ARTC2.2 and P2X7 <i>In Vivo</i>.,34489954
The chemokines CXCL9 and CXCL10 promote a protective immune response but do not contribute to cardiac inflammation following infection with Trypanosoma cruzi.,16368965
Upregulation of Tolerogenic Pathways by the Hydrogen Sulfide Donor GYY4137 and Impaired Expression of H2S-Producing Enzymes in Multiple Sclerosis. ,32664399
Obesity Prolongs the Inflammatory Response in Mice After Severe Trauma and Attenuates the Splenic Response to the Inflammatory Reflex.,34867969
Priming of myelin-specific T cells in the absence of dendritic cells results in accelerated development of Experimental Autoimmune Encephalomyelitis.,33891644
Regulation of Th17 cells by P. UF1 against systemic Listeria monocytogenes infection.,29420115
Intestinal intraepithelial lymphocyte derived angiotensin converting enzyme modulates epithelial cell apoptosis.,16215678
The regulatory role of PGC1α-related coactivator in response to drug-induced liver injury.,32821877
A Fragrant Environment Containing α-Pinene Suppresses Tumor Growth in Mice by Modulating the Hypothalamus/Sympathetic Nerve/Leptin Axis and Immune System.,31018712
Local Delivery of Regulatory T Cells Promotes Corneal Allograft Survival.,30247445
Higher-order looping and nuclear organization of Tcra facilitate targeted rag cleavage and regulated rearrangement in recombination centers.,23416051
SLAMF7 and IL-6R define distinct cytotoxic versus helper memory CD8<sup>+</sup> T cells.,33311473
The cytolytic molecules Fas ligand and TRAIL are required for murine thymic graft-versus-host disease.,19955659
Divergent expression patterns of IL-4 and IL-13 define unique functions in allergic immunity.,22138715
"GILT in Thymic Epithelial Cells Facilitates Central CD4 T Cell Tolerance to a Tissue-Restricted, Melanoma-Associated Self-Antigen.",32269095
KLRG1<sup>+</sup> Memory CD8 T Cells Combine Properties of Short-Lived Effectors and Long-Lived Memory.,32611727
Role of Interferon-γ-Producing Th1 Cells in a Murine Model of Type I Interferon-Independent Autoinflammation Resulting From DNase II Deficiency.,31464028
T Cell-Intrinsic Interferon Regulatory Factor 1 Expression Suppresses Differentiation of CD4<sup>+</sup> T Cell Populations That Support Chronic Gammaherpesvirus Infection.,34346769
IL17A Regulates Tumor Latency and Metastasis in Lung Adeno and Squamous SQ.2b and AD.1 Cancer.,29653981
"Virus-Like Particle-Drug Conjugates Induce Protective, Long-lasting Adaptive Antitumor Immunity in the Absence of Specifically Targeted Tumor Antigens.",33853825
Lactobacillus pentosus Modulates Immune Response by Inducing IL-10 Producing Tr1 Cells.,31921469
Clonal Expansion of Allergen-specific CD4<sup>+</sup> T Cell in the Lung in the Absence of Lymph Nodes.,28680377
Long noncoding RNA lnc-sox5 modulates CRC tumorigenesis by unbalancing tumor microenvironment.,28632999
NFAT1 Regulates Ly6Chi Monocyte Recruitment to the CNS and Plays an Essential Role in Resistance to Toxoplasma gondii Infection.,31555297
Role of LFA-1 integrin in the control of a lymphocytic choriomeningitis virus (LCMV) infection.,33251934
No major role for insulin-degrading enzyme in antigen presentation by MHC molecules.,24516642
Design of T-cell receptor libraries with diverse binding properties to examine adoptive T-cell responses.,23052828
Inhibition of SOCS1-/- lethal autoinflammatory disease correlated to enhanced peripheral Foxp3+ regulatory T cell homeostasis.,21788442
Aedes aegypti sialokinin facilitates mosquito blood feeding and modulates host immunity and vascular biology.,35417706
Tim-3 is dispensable for allergic inflammation and respiratory tolerance in experimental asthma.,33822811
Endothelial cell-derived oxysterol ablation attenuates experimental autoimmune encephalomyelitis.,36715148
A single dose of self-transcribing and replicating RNA-based SARS-CoV-2 vaccine produces protective adaptive immunity in mice.,33823303
Axin1 Protects Colon Carcinogenesis by an Immune-Mediated Effect.,36356835
Effector memory Th1 CD4 T cells are maintained in a mouse model of chronic malaria.,21124875
Long noncoding RNA Malat1 is not essential for T cell development and response to LCMV infection.,30474472
Synergy of NUP98-HOXA10 Fusion Gene and NrasG12D Mutation Preserves the Stemness of Hematopoietic Stem Cells on Culture Condition. ,31443434
Oncogenic Vav1-Myo1f induces therapeutically targetable macrophage-rich tumor microenvironment in peripheral T cell lymphoma.,35443168
Intratumoral immune activation with TLR4 agonist synergizes with effector T cells to eradicate established murine tumors.,32579133
ML1419c peptide immunization induces Mycobacterium leprae-specific HLA-A*0201-restricted CTL in vivo with potential to kill live mycobacteria.,21705623
The Second Oncogenic Hit Determines the Cell Fate of <i>ETV6-RUNX1</i> Positive Leukemia.,34336858
Extracellular Vesicles from Apoptotic Cells Promote TGFβ Production in Macrophages and Suppress Experimental Colitis.,30971739
Intratumoral immunotherapy using platelet-cloaked nanoparticles enhances antitumor immunity in solid tumors.,33790276
B Cell-Intrinsic Expression of Interferon Regulatory Factor 1 Supports Chronic Murine Gammaherpesvirus 68 Infection. ,32321819
Transfer of in vitro-expanded naïve T cells after lymphodepletion enhances antitumor immunity through the induction of polyclonal antitumor effector T cells.,28854279
Ginger and its bioactive component 6-shogaol mitigate lung inflammation in a murine asthma model.,31800263
Brown Adipocyte and Splenocyte Co-Culture Maintains Regulatory T Cell Subset in Intermittent Hypobaric Conditions.,31624708
MiR-15a/16-1 deficiency induces IL-10-producing CD19<sup>+</sup> TIM-1<sup>+</sup> cells in tumor microenvironment.,30467955
B lymphocytes protect islet β cells in diabetes prone NOD mice treated with imatinib. ,30964447
Cutting Edge: Defective Aerobic Glycolysis Defines the Distinct Effector Function in Antigen-Activated CD8<sup>+</sup> Recent Thymic Emigrants.,28507025
CEACAM1 regulates CD8<sup>+</sup> T cell immunity and protects from severe pathology during <i>Citrobacter rodentium</i> induced colitis.,32521208
gB co-immunization with GP96 enhances pulmonary-resident CD8 T cells and exerts a long-term defence against MCMV pneumonitis.,33155438
Fucosyltransferase Induction during Influenza Virus Infection Is Required for the Generation of Functional Memory CD4<sup>+</sup> T Cells.,29491007
Therapeutic KRAS<sup>G12C</sup> inhibition drives effective interferon-mediated anti-tumour immunity in immunogenic lung cancers,10.1101/2021.10.18.464819
B cell-intrinsic requirement for WNK1 kinase in antibody responses in mice.,36662229
T-bet-dependent NKp46<sup>+</sup> innate lymphoid cells regulate the onset of T<sub>H</sub>17-induced neuroinflammation.,28805812
IL-10-producing Th1 cells and disease progression are regulated by distinct CD11c⁺ cell populations during visceral leishmaniasis.,22911108
Acquisition of High-Quality Spectral Flow Cytometry Data.,32421215
CD4 expression in effector T cells depends on DNA demethylation over a developmentally established stimulus-responsive element.,35304452
"Dynamic Transcriptome, DNA Methylome, and DNA Hydroxymethylome Networks During T-Cell Lineage Commitment.",30396239
Identification of T cell clones without the need for sequencing.,25960175
Impact of intravenous immunoglobulin on the dopaminergic system and immune response in the acute MPTP mouse model of Parkinson's disease.,23046563
Calcipotriol and betamethasone dipropionate synergistically enhances the balance between regulatory and proinflammatory T cells in a murine psoriasis model.,31705000
Phenotypic complementation of genetic immunodeficiency by chronic herpesvirus infection. ,25599590
<i>Aurka</i> loss in CD19<sup>+</sup> B cells promotes megakaryocytopoiesis via IL-6/STAT3 signaling-mediated thrombopoietin production.,33754019
Microbial short-chain fatty acids modulate CD8<sup>+</sup> T cell responses and improve adoptive immunotherapy for cancer.,34210970
Virtual memory CD8 T cells expanded by helminth infection confer broad protection against bacterial infection.,30361537
Infectious Sporozoites of Plasmodium berghei Effectively Activate Liver CD8α+ Dendritic Cells.,29472929
Preceding Viral Infections Do Not Imprint Long-Term Changes in Regulatory T Cell Function.,32433493
Stepwise chromatin and transcriptional acquisition of an intraepithelial lymphocyte program.,33686285
Antigen-Presenting B Cells Program the Efferent Lymph T Helper Cell Response.,35355990
ZBTB46 defines and regulates ILC3s that protect the intestine.,35831503
Dexamethasone premedication suppresses vaccine-induced immune responses against cancer.,32923115
Cutting Edge: β-Catenin-Interacting Tcf1 Isoforms Are Essential for Thymocyte Survival but Dispensable for Thymic Maturation Transitions.,28348272
Pioglitazone stabilizes atherosclerotic plaque by regulating the Th17/Treg balance in AMPK-dependent mechanisms.,29084546
Urinary detection of early responses to checkpoint blockade and of resistance to it via protease-cleaved antibody-conjugated sensors.,35241815
Transcriptional Upregulation of NLRC5 by Radiation Drives STING- and Interferon-Independent MHC-I Expression on Cancer Cells and T Cell Cytotoxicity.,32355214
GIPR Signaling in Immune Cells Maintains Metabolically Beneficial Type 2 Immune Responses in the White Fat From Obese Mice.,33717200
Polymorphic estrogen receptor binding site causes Cd2-dependent sex bias in the susceptibility to autoimmune diseases.,34552089
"Plasmacytoid Dendritic Cells Mediate Control of Ross River Virus Infection via a Type I Interferon-Dependent, MAVS-Independent Mechanism. ",33361425
"Ubiquitin E3 Ligase Pellino-1 Inhibits IL-10-mediated M2c Polarization of Macrophages, Thereby Suppressing Tumor Growth.",31720043
Modulation of TCR signalling components occurs prior to positive selection and lineage commitment in iNKT cells.,34880299
TCR Affinity for In Vivo Peptide-Induced Thymic Positive Selection Fine-Tunes TCR Responsiveness of Peripheral CD8<sup>+</sup> T Cells.,31235550
NKG2A Blockade Potentiates CD8 T Cell Immunity Induced by Cancer Vaccines.,30503208
Blockade of BAFF Reshapes the Hepatic B Cell Receptor Repertoire and Attenuates Autoantibody Production in Cholestatic Liver Disease.,32332110
FOLFOX Chemotherapy Ameliorates CD8 T Lymphocyte Exhaustion and Enhances Checkpoint Blockade Efficacy in Colorectal Cancer.,32391270
The AP-1 transcription factor JunB is required for Th17 cell differentiation.,29234109
CD40 Agonist Overcomes T Cell Exhaustion Induced by Chronic Myeloid Cell IL-27 Production in a Pancreatic Cancer Preclinical Model.,33558374
Tregs facilitate obesity and insulin resistance via a Blimp-1/IL-10 axis. ,33351782
Lack of NFATc1 SUMOylation prevents autoimmunity and alloreactivity. ,32986812
T Follicular Regulatory Cell Suppression of T Follicular Helper Cell Function Is Context-Dependent <i>in vitro</i>.,32362895
Macrophage and dendritic cell subset composition can distinguish endotypes in adjuvant-induced asthma mouse models.,34061861
Eosinophils Control Liver Damage by Modulating Immune Responses Against <i>Fasciola hepatica</i>.,33042162
TCR<sup>+</sup>CD4<sup>-</sup>CD8<sup>-</sup> (double negative) T cells protect from cisplatin-induced renal epithelial cell apoptosis and acute kidney injury.,32281417
TSLP drives acute T<sub>H</sub>2-cell differentiation in lungs.,32304753
The CD137 Ligand Is Important for Type 1 Diabetes Development but Dispensable for the Homeostasis of Disease-Suppressive CD137<sup>+</sup> FOXP3<sup>+</sup> Regulatory CD4 T Cells.,32295876
Type 17 immunity promotes the exhaustion of CD8+ T cells in cancer. ,34083422
<i>Rehmannia glutinosa</i> exhibits anti-aging effect through maintaining the quiescence and decreasing the senescence of hematopoietic stem cells.,30891565
"A Synthetic DNA, Multi-Neoantigen Vaccine Drives Predominately MHC Class I CD8<sup>+</sup> T-cell Responses, Impacting Tumor Challenge.",30679156
Transient IL-33 upregulation in neonatal mouse lung promotes acute but not chronic type 2 immune responses induced by allergen later in life.,34048460
Acute IL-4 Governs Pathogenic T Cell Responses during <i>Leishmania major</i> Infection.,32948646
The Effect of Antibody Fragments on CD25 Targeted Regulatory T Cell Near-Infrared Photoimmunotherapy.,31498995
Dendritic Cells and Myeloid Derived Suppressor Cells Fully Responsive to Stimulation via Toll-Like Receptor 4 Are Rapidly Induced from Bone-Marrow Cells by Granulocyte-Macrophage Colony-Stimulating Factor. ,32932705
Vaccinia Virus Vectors Targeting Peptides for MHC Class II Presentation to CD4<sup>+</sup> T Cells.,31896555
CD4<sup>+</sup> T Cell-Derived NGAL Modifies the Outcome of Ischemic Acute Kidney Injury.,31889023
Myeloid-derived suppressor cells control B cell accumulation in the central nervous system during autoimmunity.,30374128
"Safety, Immunogenicity, and Protective Efficacy of a Chimeric A/B Live Attenuated Influenza Vaccine in a Mouse Model. ",33513862
Hematopoietic progenitor cell regulation by CD4+CD25+ T cells.,20200356
CRISPR/Cas9-mediated knockout of <i>Rag-2</i> causes systemic lymphopenia with hypoplastic lymphoid organs in FVB mice.,30671102
"Single Cell Mass Cytometry Revealed the Immunomodulatory Effect of Cisplatin Via Downregulation of Splenic CD44+, IL-17A+ MDSCs and Promotion of Circulating IFN-γ+ Myeloid Cells in the 4T1 Metastatic Breast Cancer Model. ",31881770
CD4<sup>+</sup> TSCMs in the Bone Marrow Assist in Maturation of Antibodies against Influenza in Mice.,30733641
Th17 cytokines are critical for respiratory syncytial virus-associated airway hyperreponsiveness through regulation by complement C3a and tachykinins.,21918196
Molecular and cellular mechanisms of Mycobacterium avium-induced thymic atrophy.,22922815
Excessive Costimulation Leads to Dysfunction of Adoptively Transferred T Cells.,32213625
"Topoisomerase I inhibitor, irinotecan, depletes regulatory T cells and up-regulates MHC class I and PD-L1 expression, resulting in a supra-additive antitumor effect when combined with anti-PD-L1 antibodies.",30140379
T follicular helper and T follicular regulatory cells have different TCR specificity.,28429709
"High-affinity, neutralizing antibodies to SARS-CoV-2 can be made without T follicular helper cells.",34914544
Viral coinfection promotes tuberculosis immunopathogenesis by type I IFN signaling-dependent impediment of Th1 cell pulmonary influx.,35672321
Neuroinvasive Listeria monocytogenes infection triggers accumulation of brain CD8<sup>+</sup> tissue-resident memory T cells in a miR-155-dependent fashion.,32878636
Glioblastoma infiltration of both tumor- and virus-antigen specific cytotoxic T cells correlates with experimental virotherapy responses.,32198420
Cornea-infiltrating and lymph node dendritic cells contribute to CD4+ T cell expansion after herpes simplex virus-1 ocular infection.,25422507
Functional Characterization of Ly49<sup>+</sup>CD8 T-Cells in Both Normal Condition and During Anti-Viral Response.,33488602
PD-L1<sup>+</sup> and XCR1<sup>+</sup> dendritic cells are region-specific regulators of gut homeostasis.,34389726
The crystal structure of CD8 in complex with YTS156.7.7 Fab and interaction with other CD8 antibodies define the binding mode of CD8 alphabeta to MHC class I.,18929574
Early-life EV-A71 infection augments allergen-induced airway inflammation in asthma through trained macrophage immunity.,33441966
"1,25-Dihydroxyvitamin D3 inhibits the differentiation and migration of T(H)17 cells to protect against experimental autoimmune encephalomyelitis.",20886077
Prenatal cadmium exposure alters postnatal immune cell development and function.,22521604
Innate immune adaptor MyD88 deficiency prevents skin inflammation in SHARPIN-deficient mice.,30038386
Partitioning stable and unstable expression level variation in cell populations: A theoretical framework and its application to the T cell receptor.,32841238
Expansion and function of Foxp3-expressing T regulatory cells during tuberculosis.,17709423
Phenotyping and comparing the immune cell populations of free-ranging Atlantic bottlenose dolphins (Tursiops truncatus) and dolphins under human care.,28347312
"Effects of a herbal formulation, KGC3P, and its individual component, nepetin, on coal fly dust-induced airway inflammation.",32820197
Inhibition of Cdk8/Cdk19 Activity Promotes Treg Cell Differentiation and Suppresses Autoimmune Diseases.,31552016
"Cancer cell autophagy, reprogrammed macrophages, and remodeled vasculature in glioblastoma triggers tumor immunity.",36113478
Murine cytomegalovirus infection exacerbates complex IV deficiency in a model of mitochondrial disease.,32130224
Depletion of ID3 enhances mesenchymal stem cells therapy by targeting BMP4 in Sjögren's syndrome.,32139667
Dietary cellulose prevents gut inflammation by modulating lipid metabolism and gut microbiota.,32138587
Radiation Therapy Induces Macrophages to Suppress T-Cell Responses Against Pancreatic Tumors in Mice.,26946344
IL-18BP is a secreted immune checkpoint and barrier to IL-18 immunotherapy.,32581358
The synergistic immunoregulatory effects of culture-expanded mesenchymal stromal cells and CD4(+)25(+)Foxp3+ regulatory T cells on skin allograft rejection.,23940676
Serine protease activity contributes to control of Mycobacterium tuberculosis in hypoxic lung granulomas in mice.,20679732
Inflammation and neutrophil extracellular traps in cerebral cavernous malformation.,35333979
Cutaneous Infection with Leishmania major Mediates Heterologous Protection against Visceral Infection with Leishmania infantum.,26371247
Stimulation of Oncogene-Specific Tumor-Infiltrating T Cells through Combined Vaccine and αPD-1 Enable Sustained Antitumor Responses against Established HER2 Breast Cancer.,32732224
2B4 but not PD-1 blockade improves mortality in septic animals with preexisting malignancy. ,31723059
Donor Allospecific CD44<sup>high</sup> Central Memory T Cells Have Decreased Ability to Mediate Graft-vs.-Host Disease.,31001254
A RORγt<sup>+</sup> cell instructs gut microbiota-specific T<sub>reg</sub> cell differentiation.,36071167
PU.1 Expression in T Follicular Helper Cells Limits CD40L-Dependent Germinal Center B Cell Development.,26363052
Inducible Bronchus-Associated Lymphoid Tissues (iBALT) Serve as Sites of B Cell Selection and Maturation Following Influenza Infection in Mice.,30984186
Regulatory B Lymphocytes Colonize the Respiratory Tract of Neonatal Mice and Modulate Immune Responses of Alveolar Macrophages to RSV Infection in IL-10-Dependant Manner. ,32751234
"Orai, STIM, and PMCA contribute to reduced calcium signal generation in CD8<sup>+</sup> T cells of elderly mice.",32062611
A Critical Role for Fas-Mediated Off-Target Tumor Killing in T-cell Immunotherapy.,33334730
Tumor progression locus 2 differentially regulates IFNγ and IL-17 production by effector CD4+ T cells in a T cell transfer model of colitis.,25781948
"Neoadjuvant STING Activation, Extended Half-life IL2, and Checkpoint Blockade Promote Metastasis Clearance via Sustained NK-cell Activation.",34686488
The deubiquitinase CYLD controls protective immunity against helminth infection by regulation of Treg cell plasticity.,33309741
Mast cell-derived TNF can promote Th17 cell-dependent neutrophil recruitment in ovalbumin-challenged OTII mice.,17197430
PD-1 modulates regulatory T-cell homeostasis during low-dose interleukin-2 therapy.,28151427
N-Cadherin-Expressing Bone and Marrow Stromal Progenitor Cells Maintain Reserve Hematopoietic Stem Cells.,30650358
Monoclonal regulatory T cells provide insights into T cell suppression.,27210828
"Inhibition of T cell receptor signaling by cholesterol sulfate, a naturally occurring derivative of membrane cholesterol.",27213689
Tumor growth limited to subcutaneous site vs tumor growth in pulmonary site exhibit differential effects on systemic immunities.,28535011
Regulatory T Cells Support Breast Cancer Progression by Opposing IFN-γ-Dependent Functional Reprogramming of Myeloid Cells.,33296659
Helminth-induced Ly6C<sup>hi</sup> monocyte-derived alternatively activated macrophages suppress experimental autoimmune encephalomyelitis.,28094319
Antisense targeting of CD47 enhances human cytotoxic T-cell activity and increases survival of mice bearing B16 melanoma when combined with anti-CTLA4 and tumor irradiation.,31628526
Enhanced Cell Division Is Required for the Generation of Memory CD4 T Cells to Migrate Into Their Proper Location.,32010148
Hierarchical regulation of the resting and activated T cell epigenome by major transcription factor families.,34937932
Respiratory syncytial virus impairs T cell activation by preventing synapse assembly with dendritic cells.,18818306
PD-1 inhibits antiviral immunity at the effector phase in the liver.,12847136
Concurrent Dexamethasone Limits the Clinical Benefit of Immune Checkpoint Blockade in Glioblastoma.,33239433
Myc Cooperates with Ras by Programming Inflammation and Immune Suppression.,29195074
Freeze and Thaw of CD4+CD25+Foxp3+ Regulatory T Cells Results in Loss of CD62L Expression and a Reduced Capacity to Protect against Graft-versus-Host Disease.,26693907
Prostaglandin D2 signaling in dendritic cells is critical for the development of EAE.,32624353
Intermittent PI3Kδ inhibition sustains anti-tumour immunity and curbs irAEs.,35508656
Modified alkaloid pattern in developing tobacco callus.,11539700
The RAG2 C-terminus and ATM protect genome integrity by controlling antigen receptor gene cleavage.,23900513
Atypical chemokine receptor 4 shapes activated B cell fate.,29386231
Normalizing the environment recapitulates adult human immune traits in laboratory mice.,27096360
T-B Lymphocyte Interactions Promote Type 1 Diabetes Independently of SLAM-Associated Protein.,33199538
Group 2 innate lymphoid cells utilize the IRF4-IL-9 module to coordinate epithelial cell maintenance of lung homeostasis.,26129648
Blockade of the CD93 pathway normalizes tumor vasculature to facilitate drug delivery and immunotherapy. ,34321321
"Overlapping roles of CXCL13, interleukin 7 receptor alpha, and CCR7 ligands in lymph node development.",12732660
Type I interferon signaling exacerbates Chlamydia muridarum genital infection in a murine model.,18663004
Interleukin-38 protects against sepsis by augmenting immunosuppressive activity of CD4<sup>+</sup> CD25<sup>+</sup> regulatory T cells.,31880383
Follicular Regulatory T Cells Can Access the Germinal Center Independently of CXCR5.,31968240
Phenotype of NK-Like CD8(+) T Cells with Innate Features in Humans and Their Relevance in Cancer Diseases.,28396661
Interferon-γ Receptor Signaling in Dendritic Cells Restrains Spontaneous Proliferation of CD4<sup>+</sup> T Cells in Chronic Lymphopenic Mice.,30792713
New gorilla adenovirus vaccine vectors induce potent immune responses and protection in a mouse malaria model.,28673287
Sphingosine-1-Phosphate Lyase Inhibition Alters the S1P Gradient and Ameliorates Crohn's-Like Ileitis by Suppressing Thymocyte Maturation.,31807751
