Title,ID
TGF-beta-dependent suppressive function of Tregs requires wild-type levels of CD18 in a mouse model of psoriasis.,18521187
Interleukin-17 contributes to generation of Th1 immunity and neutrophil recruitment during Chlamydia muridarum genital tract infection but is not required for macrophage influx or normal resolution of infection.,21149587
Dendritic cells are preferentially targeted among hematolymphocytes by Modified Vaccinia Virus Ankara and play a key role in the induction of virus-specific T cell responses in vivo.,18412969
A STAT4-dependent Th1 response is required for resistance to the helminth parasite Taenia crassiceps.,15271915
PD-1 inhibits antiviral immunity at the effector phase in the liver.,12847136
Transfer of in vivo primed transgenic T cells supports allergic lung inflammation and FIZZ1 and Ym1 production in an IL-4Rα and STAT6 dependent manner.,22014099
Spontaneous atopic dermatitis in mice expressing an inducible thymic stromal lymphopoietin transgene specifically in the skin.,16103410
"Overlapping roles of CXCL13, interleukin 7 receptor alpha, and CCR7 ligands in lymph node development.",12732660
Type I interferons promote fatal immunopathology by regulating inflammatory monocytes and neutrophils during Candida infections.,22911155
"Expansion of CD4(+) CD25(+) and CD25(-) T-Bet, GATA-3, Foxp3 and RORγt cells in allergic inflammation, local lung distribution and chemokine gene expression.",21625544
Elongated TCR alpha chain CDR3 favors an altered CD4 cytokine profile.,24886643
Involvement of fractalkine/CX3CL1 expression by dendritic cells in the enhancement of host immunity against Legionella pneumophila.,16113250
Direct ex vivo analyses of HLA-DR1 transgenic mice reveal an exceptionally broad pattern of immunodominance in the primary HLA-DR1-restricted CD4 T-cell response to influenza virus hemagglutinin.,17507491
UNC93B1 mediates differential trafficking of endosomal TLRs.,23426999
Number of T reg cells that differentiate does not increase upon encounter of agonist ligand on thymic epithelial cells.,15534371
Continuous activation of autoreactive CD4+ CD25+ regulatory T cells in the steady state.,12939344
"Antitumor activity and mechanism of action of the cyclopenta[b]benzofuran, silvestrol.",19401772
CD25+CD4+ T cells contribute to the control of memory CD8+ T cells.,12084927
A helminth immunomodulator exploits host signaling events to regulate cytokine production in macrophages.,21253577
The cytolytic molecules Fas ligand and TRAIL are required for murine thymic graft-versus-host disease.,19955659
Expansion and function of Foxp3-expressing T regulatory cells during tuberculosis.,17709423
T-bet is required for protection against vaccinia virus infection.,16188982
CD1d-expressing dendritic cells but not thymic epithelial cells can mediate negative selection of NKT cells.,12682110
DKK1 mediated inhibition of Wnt signaling in postnatal mice leads to loss of TEC progenitors and thymic degeneration.,20161711
Modulation of Kv channel expression and function by TCR and costimulatory signals during peripheral CD4(+) lymphocyte differentiation.,12370252
Guidelines for the use of flow cytometry and cell sorting in immunological studies (second edition).,31633216
