Title,ID
Regulatory T cells control strain specific resistance to Experimental Autoimmune Prostatitis.,27624792
MAPK Phosphatase-1 Deficiency Exacerbates the Severity of Imiquimod-Induced Psoriasiform Skin Disease.,29619028
Paradoxical effects of obesity on T cell function during tumor progression and PD-1 checkpoint blockade.,30420753
IL-10 produced by induced regulatory T cells (iTregs) controls colitis and pathogenic ex-iTregs during immunotherapy.,23125413
Receptor Activator of NF-κB Orchestrates Activation of Antiviral Memory CD8 T Cells in the Spleen Marginal Zone.,29186688
α-Synuclein deficiency promotes neuroinflammation by increasing Th1 cell-mediated immune responses.,27565429
Targeting leukocidin-mediated immune evasion protects mice from Staphylococcus aureus bacteremia. ,32602902
Immunity to Lutzomyia whitmani Saliva Protects against Experimental Leishmania braziliensis Infection.,27812113
"KLRG1<sup>+</sup> Effector CD8<sup>+</sup> T Cells Lose KLRG1, Differentiate into All Memory T Cell Lineages, and Convey Enhanced Protective Immunity.",29625895
CD8<sup>+</sup> T Cell Priming in Established Chronic Viral Infection Preferentially Directs Differentiation of Memory-like Cells for Sustained Immunity.,30314757
Nitric Oxide Synthase 2 Improves Proliferation and Glycolysis of Peripheral γδ T Cells.,27812136
Lactation-Based Maternal Educational Immunity Crosses MHC Class I Barriers and Can Impart Th1 Immunity to Th2-Biased Recipients.,28747348
Organoid Modeling of the Tumor Immune Microenvironment.,30550791
The CXC Chemokine Receptor 3 Inhibits Autoimmune Cholangitis <i>via</i> CD8<sup>+</sup> T Cells but Promotes Colitis <i>via</i> CD4<sup>+</sup> T Cells.,29868034
PLG scaffold delivered antigen-specific regulatory T cells induce systemic tolerance in autoimmune diabetes.,23432371
Maternal Milk T Cells Drive Development of Transgenerational Th1 Immunity in Offspring Thymus.,27496970
Progesterone-Based Therapy Protects Against Influenza by Promoting Lung Repair and Recovery in Females.,27631986
Concurrent Dexamethasone Limits the Clinical Benefit of Immune Checkpoint Blockade in Glioblastoma.,33239433
ILC2s regulate adaptive Th2 cell functions via PD-L1 checkpoint control.,28747424
IL-33 Aggravates DSS-Induced Acute Colitis in Mouse Colon Lamina Propria by Enhancing Th2 Cell Responses.,26161006
Allergen-specific IgG antibody signaling through FcγRIIb promotes food tolerance.,28479335
Cathepsin E Deficiency Ameliorates Graft-versus-Host Disease and Modifies Dendritic Cell Motility.,28298913
Spatiotemporal Modeling of the Key Migratory Events During the Initiation of Adaptive Immunity.,31024523
Stromal protein βig-h3 reprogrammes tumour microenvironment in pancreatic cancer.,30415234
Mucin O-glycans facilitate symbiosynthesis to maintain gut immune homeostasis.,31521614
Prolonged Survival of Subcutaneous Allogeneic Islet Graft by Donor Chimerism without Immunosuppressive Treatment.,28713424
γδ T cells control humoral immune response by inducing T follicular helper cell differentiation.,30089795
Dysregulated invertebrate tropomyosin-dectin-1 interaction confers susceptibility to allergic diseases. ,29475849
Tcf1 and Lef1 provide constant supervision to mature CD8<sup>+</sup> T cell identity and function by organizing genomic architecture.,34615872
Increasing cell permeability of N-acetylglucosamine via 6-acetylation enhances capacity to suppress T-helper 1 (TH1)/TH17 responses and autoimmunity.,30913278
Blimp-1 Rather Than Hobit Drives the Formation of Tissue-Resident Memory CD8<sup>+</sup> T Cells in the Lungs.,30899267
Epithelial LTβR signaling controls the population size of the progenitors of medullary thymic epithelial cells in neonatal mice.,28290551
Increased Th9 cells and IL-9 levels accelerate disease progression in experimental atherosclerosis.,28386359
Dendritic Cell PD-L1 Limits Autoimmunity and Follicular T Cell Differentiation and Function.,29531164
Virus-specific CD4 and CD8 T cell responses in the absence of Th1-associated transcription factors.,24231259
Mutation of the Traj18 gene segment using TALENs to generate Natural Killer T cell deficient mice.,27256918
Eicosapentaenoic acid and 5-HEPE enhance macrophage-mediated Treg induction in mice.,28676689
Poly-specific neoantigen-targeted cancer vaccines delay patient derived tumor growth.,30764846
Ikaros cooperates with Notch activation and antagonizes TGFβ signaling to promote pDC development.,30001316
Yersinia pseudotuberculosis supports Th17 differentiation and limits de novo regulatory T cell induction by directly interfering with T cell receptor signaling.,28378044
"Interleukin-21 signaling in B cells, but not in T cells, is indispensable for the development of collagen-induced arthritis in mice.",27535236
IL-3 promotes the development of experimental autoimmune encephalitis.,27734026
Long-lived tissue resident HIV-1 specific memory CD8<sup>+</sup> T cells are generated by skin immunization with live virus vectored microneedle arrays.,29056444
T cells expressing chimeric antigen receptor promote immune tolerance. ,29046484
Bcl11a controls Flt3 expression in early hematopoietic progenitors and is required for pDC development in vivo.,23741395
Structural and functional changes to lymph nodes in ageing mice.,28207940
Activated β-catenin in Foxp3<sup>+</sup> regulatory T cells links inflammatory environments to autoimmunity.,30374130
Vγ4<sup>+</sup>γδT Cells Aggravate Severe H1N1 Influenza Virus Infection-Induced Acute Pulmonary Immunopathological Injury <i>via</i> Secreting Interleukin-17A.,28912779
Metabolic control of regulatory T cell (Treg) survival and function by Lkb1.,29109251
Intravaginal Chlamydia trachomatis Challenge Infection Elicits TH1 and TH17 Immune Responses in Mice That Promote Pathogen Clearance and Genital Tract Damage.,27606424
A role for BATF3 in T<sub>H</sub>9 differentiation and T-cell-driven mucosal pathologies.,30617301
A variant in human AIOLOS impairs adaptive immunity by interfering with IKAROS.,34155405
Nitric oxide synthase 2 is involved in the pro-tumorigenic potential of γδ17 T cells in melanoma.,27622078
Betaglycan (TβRIII) is expressed in the thymus and regulates T cell development by protecting thymocytes from apoptosis.,22952931
IL-23R-activated STAT3/STAT4 is essential for Th1/Th17-mediated CNS autoimmunity. ,28878115
CD39 is upregulated during activation of mouse and human T cells and attenuates the immune response to Listeria monocytogenes.,29742141
CD8 Follicular T Cells Promote B Cell Antibody Class Switch in Autoimmune Disease.,29743314
Regional Distribution of CNS Antigens Differentially Determines T-Cell Mediated Neuroinflammation in a CX3CR1-Dependent Manner.,29959236
Skin immunisation activates an innate lymphoid cell-monocyte axis regulating CD8<sup>+</sup> effector recruitment to mucosal tissues.,31101810
Early primed KLRG1- CMV-specific T cells determine the size of the inflationary T cell pool.,31083700
Logic-Gated ROR1 Chimeric Antigen Receptor Expression Rescues T Cell-Mediated Toxicity to Normal Tissues and Enables Selective Tumor Targeting.,30889382
LymphoAtlas: a dynamic and integrated phosphoproteomic resource of TCR signaling in primary T cells reveals ITSN2 as a regulator of effector functions.,32618424
Suppressive oligodeoxynucleotides promote the generation of regulatory T cells by inhibiting STAT1 phosphorylation.,25311665
"A purified, fermented, extract of Triticum aestivum has lymphomacidal activity mediated via natural killer cell activation.",29304125
Inflammation-induced Id2 promotes plasticity in regulatory T cells.,30413714
The lysophosphatidic acid receptor LPA4 regulates hematopoiesis-supporting activity of bone marrow stromal cells.,26090649
Differential control of immune cell homeostasis by Foxp3(+) regulatory T cells in murine peripheral lymph nodes and spleen.,25215190
The Rate of CD4 T Cell Entry into the Lungs during Mycobacterium tuberculosis Infection Is Determined by Partial and Opposing Effects of Multiple Chemokine Receptors. ,30962399
Critical Contribution of NK Group 2 Member D Expressed on Invariant Natural Killer T Cells in Concanavalin A-Induced Liver Hepatitis in Mice.,29868013
Identification of a CD4 T-cell epitope in the hemagglutinin stalk domain of pandemic H1N1 influenza virus and its antigen-driven TCR usage signature in BALB/c mice.,27157498
"M2SR, a novel live single replication influenza virus vaccine, provides effective heterosubtypic protection in mice.",27595896
Altered thymic differentiation and modulation of arthritis by invariant NKT cells expressing mutant ZAP70.,29980684
CXCR6<sup>+</sup>ST2<sup>+</sup> memory T helper 2 cells induced the expression of major basic protein in eosinophils to reduce the fecundity of helminth.,30275296
The Antitumor Activity of Combinations of Cytotoxic Chemotherapy and Immune Checkpoint Inhibitors Is Model-Dependent.,30356816
Fcγ receptor III and Fcγ receptor IV on macrophages drive autoimmune valvular carditis in mice.,24757138
Trickle infection and immunity to Trichuris muris.,31730667
MHC II+ resident peritoneal and pleural macrophages rely on IRF4 for development from circulating monocytes.,27551152
Syndromic immune disorder caused by a viable hypomorphic allele of spliceosome component Snrnp40.,31427773
CD4 T cell epitope specificity determines follicular versus non-follicular helper differentiation in the polyclonal response to influenza infection or vaccination.,27329272
PrtA immunization fails to protect against pulmonary and invasive infection by Streptococcus pneumoniae.,30253765
Combination of TLR1/2 and TLR3 ligands enhances CD4(+) T cell longevity and antibody responses by modulating type I IFN production.,27580796
"1,25 (OH)<sub>2</sub>D<sub>3</sub> treatment alters the granulomatous response in M. tuberculosis infected mice.",27698450
Divergent Roles of Kupffer Cell TLR2/3 Signaling in Alcoholic Liver Disease and the Protective Role of EGCG.,31562937
LKB1 orchestrates dendritic cell metabolic quiescence and anti-tumor immunity.,30911060
Tumor-associated neutrophils suppress pro-tumoral IL-17+ γδ T cells through induction of oxidative stress.,29750788
The Syk-NFAT-IL-2 Pathway in Dendritic Cells Is Required for Optimal Sterile Immunity Elicited by Alum Adjuvants.,27895176
Bhlhe40 controls cytokine production by T cells and is essential for pathogenicity in autoimmune neuroinflammation.,24699451
Lipid signalling enforces functional specialization of T<sub>reg</sub> cells in tumours.,33627871
Chromatin-Associated Protein SIN3B Prevents Prostate Cancer Progression by Inducing Senescence.,28807943
Coexpression of YY1 Is Required to Elaborate the Effector Functions Controlled by PLZF in NKT Cells.,31227579
An FBXW7-ZEB2 axis links EMT and tumour microenvironment to promote colorectal cancer stem cells and chemoresistance.,30783098
Response to BRAF inhibition in melanoma is enhanced when combined with immune checkpoint blockade.,24903021
Inhibition of protective immunity against <i>Staphylococcus aureus</i> infection by MHC-restricted immunodominance is overcome by vaccination.,32270029
Cholera Toxin Promotes Th17 Cell Differentiation by Modulating Expression of Polarizing Cytokines and the Antigen-Presenting Potential of Dendritic Cells.,27271559
HER2-LAMP vaccines effectively traffic to endolysosomal compartments and generate enhanced polyfunctional T cell responses that induce complete tumor regression.,32532838
MAIT cells are imprinted by the microbiota in early life and promote tissue repair. ,31649166
Co-inhibition of colony stimulating factor-1 receptor and BRAF oncogene in mouse models of BRAF<sup>V600E</sup> melanoma.,27141346
Allograft dendritic cell p40 homodimers activate donor-reactive memory CD8+ T cells. ,29467328
Dietary quercetin ameliorates experimental colitis in mouse by remodeling the function of colonic macrophages via a heme oxygenase-1-dependent pathway.,28976231
Interferon regulatory factor 3 controls interleukin-17 expression in CD8 T lymphocytes.,23918362
CD5 enhances Th17-cell differentiation by regulating IFN-γ response and RORγt localization.,24356888
Adenovirus serotype 5 vaccine vectors trigger IL-27-dependent inhibitory CD4+ T cell responses that impair CD8+ T cell function. ,28239679
Interleukin-27 Early Impacts <i>Leishmania infantum</i> Infection in Mice and Correlates with Active Visceral Disease in Humans.,27867384
Hepato-entrained B220+CD11c+NK1.1+ cells regulate pre-metastatic niche formation in the lung. ,29930175
CD6 modulates thymocyte selection and peripheral T cell homeostasis.,27377588
Targeting myeloid derived suppressor cells with all-trans retinoic acid is highly time-dependent in therapeutic tumor vaccination.,28920004
Dendritic cells pulsed with tumor cells killed by high hydrostatic pressure induce strong immune responses and display therapeutic effects both in murine TC-1 and TRAMP-C2 tumors when combined with docetaxel chemotherapy.,26718011
Oxygen Sensing by T Cells Establishes an Immunologically Tolerant Metastatic Niche.,27565342
Eosinophils support adipocyte maturation and promote glucose tolerance in obesity.,29967467
An integrin/MFG-E8 shuttle loads HIV-1 viral-like particles onto follicular dendritic cells in mouse lymph node. ,31793433
Light-entrained and brain-tuned circadian circuits regulate ILC3s and gut homeostasis.,31534216
IL-28B down-regulates regulatory T cells but does not improve the protective immunity following tuberculosis subunit vaccine immunization.,26521300
NLRP3 inflammasome: Pathogenic role and potential therapeutic target for IgA nephropathy.,28117341
Cutting edge: IFN-γR signaling in non-T cell targets regulates T cell-mediated intestinal inflammation through multiple mechanisms.,24523506
Integrated microbiota and metabolite profiles link Crohn's disease to sulfur metabolism.,32859898
Impaired Fas-Fas Ligand Interactions Result in Greater Recurrent Herpetic Stromal Keratitis in Mice.,26504854
A Novel Role for TL1A/DR3 in Protection against Intestinal Injury and Infection.,27233964
γδ T Cells Coexpressing Gut Homing α4β7 and αE Integrins Define a Novel Subset Promoting Intestinal Inflammation.,27927968
Requirement of Treg-intrinsic CTLA4/PKCη signaling pathway for suppressing tumor immunity. ,29212947
Universal vaccine against respiratory syncytial virus A and B subtypes.,28384263
Beneficial role of rapamycin in experimental autoimmune myositis.,24265670
A multi-antigen vaccine in combination with an immunotoxin targeting tumor-associated fibroblast for treating murine melanoma.,27119119
Small intestinal eosinophils regulate Th17 cells by producing IL-1 receptor antagonist.,26951334
Antigen Processing in the Endoplasmic Reticulum Is Monitored by Semi-Invariant αβ TCRs Specific for a Conserved Peptide-Qa-1<sup>b</sup> MHC Class Ib Ligand.,28108559
Trogocytosis of peptide-MHC class II complexes from dendritic cells confers antigen-presenting ability on basophils.,28096423
γδ-T cells promote IFN-γ-dependent <i>Plasmodium</i> pathogenesis upon liver-stage infection.,31028144
Gut microbiota from multiple sclerosis patients enables spontaneous autoimmune encephalomyelitis in mice.,28893994
Perinatal tolerance to proinsulin is sufficient to prevent autoimmune diabetes.,27699217
YY1<sup>lo</sup> NKT cells are dedicated IL-10 producers.,32127556
Sex-Based Differences in Susceptibility to Severe Acute Respiratory Syndrome Coronavirus Infection.,28373583
"Local Delivery of the Toll-Like Receptor 9 Ligand CpG Downregulates Host Immune and Inflammatory Responses, Ameliorating Established Leishmania (Viannia) panamensis Chronic Infection. ",28052994
Loss of Neurokinin-1 Receptor Alters Ocular Surface Homeostasis and Promotes an Early Development of Herpes Stromal Keratitis.,27798158
In vivo characterization of the physicochemical properties of polymer-linked TLR agonists that enhance vaccine immunogenicity.,26501954
Oxidative stress controls regulatory T cell apoptosis and suppressor activity and PD-L1-blockade resistance in tumor.,29083399
A protective role for periostin and TGF-β in IgE-mediated allergy and airway hyperresponsiveness.,22093101
Immune modulating effects of cyclophosphamide and treatment with tumor lysate/CpG synergize to eliminate murine neuroblastoma.,26082836
Distinct Kinase-Independent Role of RIPK3 in CD11c<sup>+</sup> Mononuclear Phagocytes in Cytokine-Induced Tissue Repair.,28273458
Deletion of the Mineralocorticoid Receptor in Myeloid Cells Attenuates Central Nervous System Autoimmunity.,29081780
Pirfenidone ameliorates murine chronic GVHD through inhibition of macrophage infiltration and TGF-β production.,28254742
Local effects of regulatory T cells in MUC1 transgenic mice potentiate growth of MUC1 expressing tumor cells in vivo.,23028615
IL-4/IL-13 Heteroreceptor Influences Th17 Cell Conversion and Sensitivity to Regulatory T Cell Suppression To Restrain Experimental Allergic Encephalomyelitis.,28801358
Endothelial Cells in the Decidual Bed Are Potential Therapeutic Targets for Preterm Birth Prevention.,31067461
Deficiency of host CD96 and PD-1 or TIGIT enhances tumor immunity without significantly compromising immune homeostasis.,29900061
In Vivo Expansion of Regulatory T Cells by Low-Dose Interleukin-2 Treatment Increases Allograft Survival in Corneal Transplantation.,26881788
Sphingosine-1-phosphate receptor 2 is critical for follicular helper T cell retention in germinal centers.,24913235
Targeting <i>Mycobacterium tuberculosis</i> Antigens to Dendritic Cells <i>via</i> the DC-Specific-ICAM3-Grabbing-Nonintegrin Receptor Induces Strong T-Helper 1 Immune Responses.,29662482
The SKI proto-oncogene restrains the resident CD103<sup>+</sup>CD8<sup>+</sup> T cell response in viral clearance.,32612153
Interleukin-17 Drives Interstitial Entrapment of Tissue Lipoproteins in Experimental Psoriasis.,30415924
The chromatin-associated Sin3B protein is required for hematopoietic stem cell functions in mice.,27806947
PLZF(+) Innate T Cells Support the TGF-β-Dependent Generation of Activated/Memory-Like Regulatory T Cells.,27101876
γδ T cells producing interleukin-17A regulate adipose regulatory T cell homeostasis and thermogenesis.,29670241
Eliciting unnatural immune responses by activating cryptic epitopes in viral antigens.,29570395
On the Role IL-4/IL-13 Heteroreceptor Plays in Regulation of Type 1 Diabetes.,28646042
Oral administration of bovine milk from cows hyperimmunized with intestinal bacterin stimulates lamina propria T lymphocytes to produce Th1-biased cytokines in mice.,24686517
Reversible nerve damage and corneal pathology in murine herpes simplex stromal keratitis.,24789786
ATP citrate lyase controls hematopoietic stem cell fate and supports bone marrow regeneration.,35229328
The vimentin intermediate filament network restrains regulatory T cell suppression of graft-versus-host disease.,30106752
Post-sepsis immunosuppression depends on NKT cell regulation of mTOR/IFN-γ in NK cells.,32154791
Suppressive oligodeoxynucleotides promote the development of Th17 cells.,23844143
The T cell CD6 receptor operates a multitask signalosome with opposite functions in T cell activation. ,33125054
"Anti-CD11b antibody treatment suppresses the osteoclast generation, inflammatory cell infiltration, and autoantibody production in arthritis-prone FcγRIIB-deficient mice.",29422084
RAG2 and XLF/Cernunnos interplay reveals a novel role for the RAG complex in DNA repair.,26833222
MicroRNA regulation of type 2 innate lymphoid cell homeostasis and function in allergic inflammation.,29122948
Trogocytosis-Mediated Intracellular Signaling in CD4<sup>+</sup> T Cells Drives T<sub>H</sub>2-Associated Effector Cytokine Production and Differentiation.,30962293
CD73 on cancer-associated fibroblasts enhanced by the A<sub>2B</sub>-mediated feedforward circuit enforces an immune checkpoint.,31980601
Preclinical investigation of combined gene-mediated cytotoxic immunotherapy and immune checkpoint blockade in glioblastoma.,29016938
Spirulina lipopolysaccharides inhibit tumor growth in a Toll-like receptor 4-dependent manner by altering the cytokine milieu from interleukin-17/interleukin-23 to interferon-γ.,28075473
Inducible down-regulation of MHC class I results in natural killer cell tolerance.,30559128
Lymphotoxin α fine-tunes T cell clonal deletion by regulating thymic entry of antigen-presenting cells.,29593265
Transcriptional determinants of tolerogenic and immunogenic states during dendritic cell maturation.,28130292
High Endothelial Venules Accelerate Naive T Cell Recruitment by Tumor Necrosis Factor-Mediated R-Ras Upregulation.,33159887
Eos Is Redundant for Regulatory T Cell Function but Plays an Important Role in IL-2 and Th17 Production by CD4+ Conventional T Cells.,26062998
Ulmus davidiana var. japonica Nakai upregulates eosinophils and suppresses Th1 and Th17 cells in the small intestine.,24116141
A crucial role of L-selectin in C protein-induced experimental polymyositis in mice.,24644046
Tissue-specific contributions of <i>Tmem79</i> to atopic dermatitis and mast cell-mediated histaminergic itch.,30463955
Regulatory T Cells Modulate DNA Vaccine Immunogenicity at Early Time via Functional CD4(+) T Cells and Antigen Duration.,26483796
VEGFC acts as a double-edged sword in renal cell carcinoma aggressiveness.,30809300
Impact of NKT Cells and LFA-1 on Liver Regeneration under Subseptic Conditions.,27977747
CD8 T cell-mediated killing of orexinergic neurons induces a narcolepsy-like phenotype in mice.,27621438
Dietary non-fermentable fiber prevents autoimmune neurological disease by changing gut metabolic and immune status.,29993025
Bob1 limits cellular frequency of T-follicular helper cells.,27080143
Inducible CD4+LAP+Foxp3- regulatory T cells suppress allergic inflammation.,22079987
CD4+ T helper cells use CD154-CD40 interactions to counteract T reg cell-mediated suppression of CD8+ T cell responses to influenza.,23835849
Transient CD4+ T Cell Depletion Results in Delayed Development of Functional Vaccine-Elicited Antibody Responses.,26865713
Pre-clinical antigenicity studies of an innovative multivalent vaccine for human visceral leishmaniasis.,29176865
Generation of induced pluripotent stem cell-derived mice by reprogramming of a mature NKT cell.,24854340
Tumor-immune profiling of murine syngeneic tumor models as a framework to guide mechanistic studies and predict therapy response in distinct tumor microenvironments.,30388137
CD8<sup>+</sup> T cells regulate tumour ferroptosis during cancer immunotherapy.,31043744
miR-150 Regulates Differentiation and Cytolytic Effector Function in CD8+ T cells.,26549197
"Inactivation of CREBBP expands the germinal center B cell compartment, down-regulates MHCII expression and promotes DLBCL growth.",28831000
Regulatory T cells expressing granzyme B play a critical role in controlling lung inflammation during acute viral infection.,22236998
TRIB2 regulates normal and stress-induced thymocyte proliferation.,27462446
DGCR8-mediated production of canonical microRNAs is critical for regulatory T cell function and stability.,23741528
Preventing Allograft Rejection by Targeting Immune Metabolism.,26489460
Restriction of Nonpermissive RUNX3 Protein Expression in T Lymphocytes by the Kozak Sequence.,26170388
"The ability to rearrange dual TCRs enhances positive selection, leading to increased Allo- and Autoreactive T cell repertoires.",25015825
Ageing adversely affects the migration and function of marginal zone B cells.,28369800
Cutaneous Infection with Leishmania major Mediates Heterologous Protection against Visceral Infection with Leishmania infantum.,26371247
Intranasal vaccination promotes detrimental Th17-mediated immunity against influenza infection.,24465206
Mesenteric lymph node stromal cell-derived extracellular vesicles contribute to peripheral de novo induction of Foxp3<sup>+</sup> regulatory T cells.,28833065
An Anti-Inflammatory Role for NLRP10 in Murine Cutaneous Leishmaniasis.,28931602
TGF-<b>β</b> and VEGF cooperatively control the immunotolerant tumor environment and the efficacy of cancer immunotherapies.,27699271
Intestinal microbiota link lymphopenia to murine autoimmunity via PD-1<sup>+</sup>CXCR5<sup>-/dim</sup> B-helper T cell induction.,28443628
Myeloid cell expressed proprotein convertase FURIN attenuates inflammation.,27527873
Oral administration of taheebo (Tabebuia avellanedae Lorentz ex Griseb.) water extract prevents DSS-induced colitis in mice by up-regulating type II T helper immune responses.,28877696
Selective accumulation of pro-inflammatory T cells in the intestine contributes to the resistance to autoimmune demyelinating disease.,24504092
Mycobacterial and mouse HSP70 have immuno-modulatory effects on dendritic cells.,23269491
B cell depletion reduces the development of atherosclerosis in mice.,20603314
B cell-intrinsic CD84 and Ly108 maintain germinal center B cell tolerance.,25801429
IFT20 controls LAT recruitment to the immune synapse and T-cell activation in vivo.,26715756
Complexity of transcriptional regulation within the Rag locus: identification of a second Nwc promoter region within the Rag2 intron.,21243488
TCR signal strength controls thymic differentiation of iNKT cell subsets.,29985393
Osteoprotegerin-Mediated Homeostasis of Rank+ Thymic Epithelial Cells Does Not Limit Foxp3+ Regulatory T Cell Development.,26254339
Heterogeneity among viral antigen-specific CD4+ T cells and their de novo recruitment during persistent polyomavirus infection.,20622115
Concomitant analysis of Helios and Neuropilin-1 as a marker to detect thymic derived regulatory T cells in naïve mice.,25586548
"The G protein-coupled receptor P2RY8 and follicular dendritic cells promote germinal center confinement of B cells, whereas S1PR3 can contribute to their dissemination.",26573295
