Title,ID
STING is an intrinsic checkpoint inhibitor that restrains the T<sub>H</sub>17 cell pathogenic program.,35613599
Naïve CD4<sup>+</sup> T Cell Activation in the Nasal-Associated Lymphoid Tissue following Intranasal Immunization with a Flagellin-Based Subunit Vaccine.,36555214
Chronic CD27-CD70 costimulation promotes type 1-specific polarization of effector Tregs.,36993956
Cell-specific cargo delivery using synthetic bacterial spores.,36640333
Suppressor of Cytokine Signalling 5 (SOCS5) Modulates Inflammatory Responses during Alphavirus Infection.,36366574
STAT3 signaling modulates the immune response induced after antigen targeting to conventional type 1 dendritic cells through the DEC205 receptor.,36330518
Contribution of CD4+ cells in the emotional alterations induced by endometriosis in mice.,36311856
Meibomian gland dysfunction is suppressed via selective inhibition of immune responses by topical LFA-1/ICAM antagonism with lifitegrast in the allergic eye disease (AED) model.,33812087
Antigen presentation between T cells drives Th17 polarization under conditions of limiting antigen.,33730591
Comparison of therapeutic effects of mesenchymal stem cells from umbilical cord and bone marrow in the treatment of type 1 diabetes.,35941696
Vaccination with a Zika virus envelope domain III protein induces neutralizing antibodies and partial protection against Asian genotype in immunocompetent mice.,36471432
The gut microbiome contributes to splenomegaly and tissue inflammation in a murine model of primary biliary cholangitis.,35928756
PRMT5 inhibition induces pro-inflammatory macrophage polarization and increased hepatic triglyceride levels without affecting atherosclerosis in mice.,36946061
Co-administration of Lactobacillus gasseri KBL697 and tumor necrosis factor-alpha inhibitor infliximab improves colitis in mice.,35688918
T-Cell Repertoire Analysis in the Conjunctiva of Murine Dry Eye Model.,36877515
Short or Long Interval between Priming and Boosting: Does It Impact on the Vaccine Immunogenicity? ,33804604
Chemokines expressed by engineered bacteria recruit and orchestrate antitumor immunity.,36888717
"Role for the metalloproteinase ADAM28 in the control of airway inflammation, remodelling and responsiveness in asthma.",36685493
Emodin modulates gut microbial community and triggers intestinal immunity.,36088620
Inhibition of myeloid-derived suppressive cell function with all-trans retinoic acid enhanced anti-PD-L1 efficacy in cervical cancer.,35688951
Tofacitinib Treatment in Primary Herpes Simplex Encephalitis Interferes With Antiviral Response.,35217873
T cell kinetics reveal expansion of distinct lung T cell subsets in acute versus in resolved influenza virus infection.,36275685
Immunizations with diverse sarbecovirus receptor-binding domains elicit SARS-CoV-2 neutralizing antibodies against a conserved site of vulnerability.,34788600
A single vaccination of nucleoside-modified Rabies mRNA vaccine induces prolonged highly protective immune responses in mice.,36761167
A diet enriched in omega-3 PUFA and inulin prevents type 1 diabetes by restoring gut barrier integrity and immune homeostasis in NOD mice.,36713378
Niche-expressed Galectin-1 is involved in pre-B acute lymphoblastic leukemia relapse through pre-B cell receptor activation.,37009219
GM-CSF<sup>+</sup> Tc17 cells are required to bolster vaccine immunity against lethal fungal pneumonia without causing overt pathology.,36288707
MicroRNA-155 contributes to host immunity against Toxoplasma gondii.,34907898
SIRT1 inactivation switches reactive astrocytes to an antiinflammatory phenotype in CNS autoimmunity.,36136587
LRBA Deficiency Can Lead to Lethal Colitis That Is Diminished by SHIP1 Agonism.,35603158
FcRn-Targeted Mucosal Vaccination against Influenza Virus Infection.,34380652
IL-21 has a critical role in establishing germinal centers by amplifying early B cell proliferation.,35801309
Immunomodulatory Properties of Umbilical Cord Blood-Derived Small Extracellular Vesicles and Their Therapeutic Potential for Inflammatory Skin Disorders. ,34575956
Post-endotoxin exposure-induced lung inflammation and resolution consequences beneficially impacted by lung-delivered IL-10 therapy.,36243830
Secreted gelsolin inhibits DNGR-1-dependent cross-presentation and cancer immunity.,34081922
An Injectable Cytokine Trap for Local Treatment of Autoimmune Disease.,31753473
PI3K Signaling in Dendritic Cells Aggravates DSS-Induced Colitis.,35514976
Addressing the role of PKD3 in the T cell compartment with knockout mice.,35440091
Adjuvant Screen Identifies Synthetic DNA-Encoding Flt3L and CD80 Immunotherapeutics as Candidates for Enhancing Anti-tumor T Cell Responses.,32161596
MULT1-Encoding DNA Alleviates Schistosomiasis-Associated Hepatic Fibrosis via Modulating Cellular Immune Response.,35873385
Bee Venom Phospholipase A2 Ameliorates Atherosclerosis by Modulating Regulatory T Cells. ,32977607
UVB modifies skin immune-stroma cross-talk and promotes effector T cell recruitment during cryptic<i>Leishmania donovani</i>infection,10.1101/2023.02.03.526940
Pro-Resolving Factor Administration Limits Cancer Progression by Enhancing Immune Response Against Cancer Cells.,35116038
The HDAC inhibitor zabadinostat is a systemic regulator of adaptive immunity.,36702861
Garlic-Derived Organosulfur Compounds Regulate Metabolic and Immune Pathways in Macrophages and Attenuate Intestinal Inflammation in Mice.,35107883
Adjuvants influence the maturation of VRC01-like antibodies during immunization.,36405776
TCR Retrogenic Mice as a Model To Map Self-Tolerance Mechanisms to the Cancer Mucosa Antigen GUCY2C.,30642983
IL-21 has a critical role in establishing germinal centers by amplifying early B cell proliferation,10.1101/2022.01.21.476732
Bile salt hydrolase in non-enterotoxigenic Bacteroides potentiates colorectal cancer.,36765047
Lactoferrin-Functionalized Noble Metal Nanoparticles as New Antivirals for HSV-2 Infection. ,35056558
RNA-Seq-Based TCR Profiling Reveals Persistently Increased Intratumoral Clonality in Responders to Anti-PD-1 Therapy.,32411589
The G Protein-Coupled Receptor (GPR) 15 Counteracts Antibody-Mediated Skin Inflammation.,32922401
Glucan particles as a novel adjuvant for the induction of experimental autoimmune encephalomyelitis.,34111646
Cytokine elevation in the mouse small intestine at the early stage of infection with the gastrointestinal parasite Heligmosomoides polygyrus.,33597317
Increased susceptibility to organic dust exposure-induced inflammatory lung disease with enhanced rheumatoid arthritis-associated autoantigen expression in HLA-DR4 transgenic mice.,35717175
Invasive margin tissue-resident macrophages of high CD163 expression impede responses to T cell-based immunotherapy.,36914207
Investigating immunoregulatory effects of myeloid cell autophagy in acute and chronic inflammation.,35652357
Cutaneous Exposure to Clinically Relevant Lone Star Ticks Promotes IgE Production and Hypersensitivity through CD4<sup>+</sup> T Cell- and MyD88-Dependent Pathways in Mice.,31270149
Soluble RAGE Prevents Type 1 Diabetes Expanding Functional Regulatory T Cells.,35713929
A human STAT3 gain-of-function variant confers T cell dysregulation without predominant Treg dysfunction in mice.,36136607
Genetic and pharmacological modulation of DNA mismatch repair heterogeneous tumors promotes immune surveillance.,36584674
CD69 expression on regulatory T cells protects from immune damage after myocardial infarction.,36066993
Effect of IL‑7 on Th17 cell responses in a mouse model of neutrophilic asthma.,32468040
COVID-19 vaccine mRNA-1273 elicits a protective immune profile in mice that is not associated with vaccine-enhanced disease upon SARS-CoV-2 challenge.,34270939
Cadherin-11 Regulates Macrophage Development and Function.,35211116
Interleukin-19 Abrogates Experimental Autoimmune Encephalomyelitis by Attenuating Antigen-Presenting Cell Activation.,33776998
Murine foetal liver supports limited detectable expansion of life-long haematopoietic progenitors.,36202972
Treatment of glioblastoma with current oHSV variants reveals differences in efficacy and immune cell recruitment.,34553031
Collagen epitope expression on B cells is sufficient to confer tolerance to collagen-induced arthritis.,27301320
SPNS2 enables T cell egress from lymph nodes during an immune response.,34260944
GRIM19 Impedes Obesity by Regulating Inflammatory White Fat Browning and Promoting Th17/Treg Balance. ,33467683
Mycobacterium tuberculosis infection drives a type I IFN signature in lung lymphocytes.,35732116
Skin and gut imprinted helper T cell subsets exhibit distinct functional phenotypes in central nervous system autoimmunity.,34099917
Immune response and protective efficacy of the SARS-CoV-2 recombinant spike protein vaccine S-268019-b in mice.,36460696
β1-Integrin- and KV1.3 channel-dependent signaling stimulates glutamate release from Th17 cells.,31661467
Beneficial role of rapamycin in experimental autoimmune myositis.,24265670
Isolevuglandins disrupt PU.1-mediated C1q expression and promote autoimmunity and hypertension in systemic lupus erythematosus.,35608913
Rate of Freeze Impacts the Survival and Immune Responses Post Cryoablation of Melanoma.,34149738
Androgen Receptors in Epithelial Cells Regulate Thymopoiesis and Recent Thymic Emigrants in Male Mice.,32714327
The frequency of follicular T helper cells differs in acute and chronic neuroinflammation.,33235306
Rapamycin Eyedrops Increased CD4+Foxp3+ Cells and Prevented Goblet Cell Loss in the Aged Ocular Surface. ,33255287
mRNA-based SARS-CoV-2 vaccine candidate CVnCoV induces high levels of virus-neutralising antibodies and mediates protection in rodents.,33863911
Aggregation by peptide conjugation rescues poor immunogenicity of the HA stem.,33137148
IL-9 Controls Central Nervous System Autoimmunity by Suppressing GM-CSF Production.,31852750
mRNA based SARS-CoV-2 vaccine candidate CVnCoV induces high levels of virus neutralizing antibodies and mediates protection in rodents,10.1101/2020.10.23.351775
"<i>Saccharomyces cerevisiae</i> Fermentation Product Did Not Attenuate Clinical Signs, but Psyllium Husk Has Protective Effects in a Murine Dextran Sulfate Sodium-Induced Colitis Model.",33215055
Probiotics Prevent Hypertension in a Murine Model of Systemic Lupus Erythematosus Induced by Toll-Like Receptor 7 Activation.,34444829
ADAR1 mutation causes ZBP1-dependent immunopathology.,35859177
Maturation of circulating Ly6C<sup>hi</sup>CCR2<sup>+</sup> monocytes by mannan-MOG induces antigen-specific tolerance and reverses autoimmune encephalomyelitis.,36159850
Sex-Specific Effects of Microglia-Like Cell Engraftment during Experimental Autoimmune Encephalomyelitis. ,32957621
Profiling of Tregs across tissues reveals plasticity in ST2 expression and hierarchies in tissue-specific phenotypes.,36093048
Bacterial Strain-Dependent Dissociation of Cell Recruitment and Cell-to-Cell Spread in Early M. tuberculosis Infection.,35695454
A critical role for Th17 cell-derived TGF-β1 in regulating the stability and pathogenicity of autoimmune Th17 cells.,34050263
Salmonella Vaccine Vector System for Foot-and-Mouth Disease Virus and Evaluation of Its Efficacy with Virus-Like Particles. ,33466461
High-dimensional analysis of intestinal immune cells during helminth infection. ,32041687
IL-6 is not Absolutely Essential for the Development of a TH17 Immune Response after an Aerosol Infection with Mycobacterium Tuberculosis H37rv. ,33375150
Lysosomal Acid Lipase Is Required for Donor T Cells to Induce Graft-versus-Host Disease.,33113360
Knockdown of NEAT1 induces tolerogenic phenotype in dendritic cells by inhibiting activation of NLRP3 inflammasome.,31281488
Soy-tomato enriched diet reduces inflammation and disease severity in a pre-clinical model of chronic pancreatitis.,33311549
CD4 T Cell Epitope Specificity and Cytokine Potential Are Preserved as Cells Transition from the Lung Vasculature to Lung Tissue following Influenza Virus Infection. ,29669836
Regulatory T Cells Induce Metastasis by Increasing Tgf-β and Enhancing the Epithelial–Mesenchymal Transition. ,31690033
Development of Tbet- and CD11c-expressing B cells in a viral infection requires T follicular helper cells outside of germinal centers.,35090581
Decreased antiviral immune response within the central nervous system of aged mice is associated with increased lethality of West Nile virus encephalitis.,34327802
High Fat Diet Inhibits Dendritic Cell and T Cell Response to Allergens but Does Not Impair Inhalational Respiratory Tolerance.,27483441
Temporary Reduction of Membrane CD4 with the Antioxidant MnTBAP Is Sufficient to Prevent Immune Responses Induced by Gene Transfer.,31497619
"Attenuation and Stability of CHIKV-NoLS, a Live-Attenuated Chikungunya Virus Vaccine Candidate. ",30583514
Isoflavone diet ameliorates experimental autoimmune encephalomyelitis through modulation of gut bacteria depleted in patients with multiple sclerosis. ,34244137
Heterologous Prime-Boost Combinations Highlight the Crucial Role of Adjuvant in Priming the Immune System.,29593710
A single strain of Bacteroides fragilis protects gut integrity and reduces GVHD.,33554953
Rational design of innate defense regulator peptides as tumor vaccine adjuvants.,34016984
Regulatory T Cells Play a Role in a Subset of Idiopathic Preterm Labor/Birth and Adverse Neonatal Outcomes.,32640239
Intestinal inflammation alters the antigen-specific immune response to a skin commensal.,35649365
Fas/FasL Contributes to HSV-1 Brain Infection and Neuroinflammation.,34526992
Inferior immunogenicity and efficacy of respiratory syncytial virus fusion protein-based subunit vaccine candidates in aged versus young mice.,29182682
Sclerostin domain-containing protein 1 is dispensable for the differentiation of follicular helper and follicular regulatory T cells during acute viral infection.,31312383
Unique Phenotypes of Heart Resident Type 2 Innate Lymphoid Cells.,32431711
Paradoxical interaction between cancer and long-term postsepsis disorder: impairment of de novo carcinogenesis versus favoring the growth of established tumors. ,32376720
"Restriction of Viral Replication, Rather than T Cell Immunopathology, Drives Lethality in Murine Norovirus CR6-Infected STAT1-Deficient Mice.",35107369
Primary germinal center-resident T follicular helper cells are a physiologically distinct subset of CXCR5<sup>hi</sup>PD-1<sup>hi</sup> T follicular helper cells.,35081372
Microenvironmental IL-6 inhibits anti-cancer immune responses generated by cytotoxic chemotherapy.,34711820
"Celiac Vagus Nerve Stimulation Recapitulates Angiotensin II-Induced Splenic Noradrenergic Activation, Driving Egress of CD8 Effector Cells.",33326772
Co-existence of classical and alternative activation programs in macrophages responding to Toxoplasma gondii.,24083945
Monocyte-Derived Macrophages Are Necessary for Beta-Adrenergic Receptor-Driven Choroidal Neovascularization Inhibition.,31800964
CD4 T cell-intrinsic STING signaling controls the differentiation and effector functions of TH1 and TH9 cells. ,35091453
T cells expressing the lupus susceptibility allele Pbx1d enhance autoimmunity and atherosclerosis in dyslipidemic mice. ,32493841
IL-33 Protects Mice against DSS-Induced Chronic Colitis by Increasing Both Regulatory B Cell and Regulatory T Cell Responses as Well as Decreasing Th17 Cell Response.,30539029
Differential Recruitment of Dendritic Cells Subsets to Lymph Nodes Correlates with a Protective or Permissive T-Cell Response during Leishmania (Viannia) Braziliensis or Leishmania (Leishmania) Amazonensis Infection.,27073297
Measuring Intratumoral Heterogeneity of Immune Repertoires.,32457825
Tissue-restricted control of established central nervous system autoimmunity by TNF receptor 2-expressing Treg cells. ,33766913
Interleukin-37 Ameliorates Influenza Pneumonia by Attenuating Macrophage Cytokine Production in a MAPK-Dependent Manner.,31736917
mRNA-encoded HIV-1 Env trimer ferritin nanoparticles induce monoclonal antibodies that neutralize heterologous HIV-1 isolates in mice.,35294883
Modulation of Primary Immune Response by Different Vaccine Adjuvants.,27781036
The concerted change in the distribution of cell cycle phases and zone composition in germinal centers is regulated by IL-21.,34887406
Differences between immunodeficient mice generated by classical gene targeting and CRISPR/Cas9-mediated gene knockout.,29594927
Administration of Lactobacillus fermentum KBL375 Causes Taxonomic and Functional Changes in Gut Microbiota Leading to Improvement of Atopic Dermatitis.,31612141
Specific targeting of inflammatory osteoclastogenesis by the probiotic yeast <i>S. boulardii</i> CNCM I-745 reduces bone loss in osteoporosis.,36848406
Glycan-Modified Virus-like Particles Evoke T Helper Type 1-like Immune Responses.,32790346
Interleukin-15 Complex Treatment Protects Mice from Cerebral Malaria by Inducing Interleukin-10-Producing Natural Killer Cells.,29625893
Mycobacterium tuberculosis infection modulates adipose tissue biology.,29040326
Controlled administration of aerosolized SARS-CoV-2 to K18-hACE2 transgenic mice uncouples respiratory infection and anosmia from fatal neuroinvasion,10.1101/2021.08.06.455382
Environmental Factor-Mediated Transgenerational Inheritance of <i>Igf2r</i> Hypomethylation and Pulmonary Allergic Response <i>via</i> Targeting Dendritic Cells.,33424850
"Preventive Administration of Non-Allergenic Bet v 1 Peptides Reduces Allergic Sensitization to Major Birch Pollen Allergen, Bet v 1.",34795666
Engineered immunological niches to monitor disease activity and treatment efficacy in relapsing multiple sclerosis.,32747712
Inhibition of lysophosphatidic acid receptor 1-3 deteriorates experimental autoimmune encephalomyelitis by inducing oxidative stress.,34666785
Differential Responses to Vitamin D2 and Vitamin D3 Are Associated With Variations in Free 25-Hydroxyvitamin D.,27399876
"Intranasal Nanoparticle Vaccination Elicits a Persistent, Polyfunctional CD4 T Cell Response in the Murine Lung Specific for a Highly Conserved Influenza Virus Antigen That Is Sufficient To Mediate Protection from Influenza Virus Challenge.",34076479
MTH1 as a target to alleviate T cell driven diseases by selective suppression of activated T cells.,34453118
TGF-β-mediated silencing of genomic organizer SATB1 promotes Tfh cell differentiation and formation of intra-tumoral tertiary lymphoid structures.,35021053
Lactate Limits T Cell Proliferation via the NAD(H) Redox State.,33326785
Graft protective effect and induction of CD4<sup>+</sup>Foxp3<sup>+</sup> cell by Thrombomodulin on allograft arteriosclerosis in mice.,29783997
T-Cell Expression and Release of Kidney Injury Molecule-1 in Response to Glucose Variations Initiates Kidney Injury in Early Diabetes.,34285121
Themis regulates metabolic signaling and effector functions in CD4<sup>+</sup> T cells by controlling NFAT nuclear translocation.,33177694
Therapeutic Effects of Probiotic Minas Frescal Cheese on the Attenuation of Ulcerative Colitis in a Murine Model.,33737918
"COVID-<i>e</i>Vax, an electroporated plasmid DNA vaccine candidate encoding the SARS-CoV-2 Receptor Binding Domain, elicits protective immune responses in animal models of COVID-19",10.1101/2021.06.14.448343
Introduction of Zinc-salt Fixation for Effective Detection of Immune Cell-related Markers by Immunohistochemistry.,26157038
Matured Tolerogenic Dendritic Cells Effectively Inhibit Autoantigen Specific CD4+ T Cells in a Murine Arthritis Model.,31555285
The CD153 vaccine is a senotherapeutic option for preventing the accumulation of senescent T cells in mice.,32424156
Maresin 1 ameliorates iron-deficient anemia in IL-10(-/-) mice with spontaneous colitis by the inhibition of hepcidin expression though the IL-6/STAT3 pathway.,27398158
Osterix-Cre marks distinct subsets of CD45- and CD45+ stromal populations in extra-skeletal tumors with pro-tumorigenic characteristics.,32755539
Induction of Broad-Spectrum Protective Immunity against Disparate <i>Cryptococcus</i> Serotypes.,29163469
"Murine model of colonization with fungal pathogen Candida auris to explore skin tropism, host risk factors and therapeutic strategies.",33385336
Immunomodulatory role of bitter melon extract in inhibition of head and neck squamous cell carcinoma growth.,27120805
Antigen Acquisition Enables Newly Arriving B Cells To Enter Ongoing Immunization-Induced Germinal Centers.,28687657
Circulating Exosomes Control CD4<sup>+</sup> T Cell Immunometabolic Functions via the Transfer of miR-142 as a Novel Mediator in Myocarditis.,32882180
A nonredundant role for T cell-derived interleukin 22 in antibacterial defense of colonic crypts.,35263568
Targeted antibody and cytokine cancer immunotherapies through collagen affinity. ,30971453
Antigen-specific gene therapy after immunisation reduces the severity of collagen-induced arthritis.,24371448
"COVID-eVax, an electroporated DNA vaccine candidate encoding the SARS-CoV-2 RBD, elicits protective responses in animal models.",34547465
Interleukin-17 contributes to Ross River virus-induced arthritis and myositis.,35143591
C-type lectin receptor DCIR modulates immunity to tuberculosis by sustaining type I interferon signaling in dendritic cells.,28069953
Microenvironmental Th9 and Th17 lymphocytes induce metastatic spreading in lung cancer.,32229721
In situ vaccination with defined factors overcomes T cell exhaustion in distant tumors.,31329159
Exposure to diesel exhaust particles increases susceptibility to invasive pneumococcal disease.,31983527
IL-4-BATF signaling directly modulates IL-9 producing mucosal mast cell (MMC9) function in experimental food allergy.,33069715
Biased Generation and In Situ Activation of Lung Tissue-Resident Memory CD4 T Cells in the Pathogenesis of Allergic Asthma.,29343554
Regulatory T cells use arginase 2 to enhance their metabolic fitness in tissues. ,31852848
CTLA-4 Protects against Angiotensin II-Induced Abdominal Aortic Aneurysm Formation in Mice.,31147569
Inhibition of the BTK-IDO-mTOR axis promotes differentiation of monocyte-lineage dendritic cells and enhances anti-tumor T cell immunity.,34614413
Burn injury influences the T cell homeostasis in a butyrate-acid sphingomyelinase dependent manner.,28063598
Antiviral Activity of Tannic Acid Modified Silver Nanoparticles: Potential to Activate Immune Response in Herpes Genitalis. ,30261662
Peripheral adaptive immunity of the triple transgenic mouse model of Alzheimer's disease.,30611289
The onset of circulation triggers a metabolic switch required for endothelial to hematopoietic transition.,34910918
"TCR Affinity Biases Th Cell Differentiation by Regulating CD25, Eef1e1, and Gbp2.",30858199
Myeloid Folliculin balances mTOR activation to maintain innate immunity homeostasis. ,30843872
Targeting B cells in the pre-phase of systemic autoimmunity globally interferes with autoimmune pathology.,34585117
Impaired airway mucociliary function reduces antigen-specific IgA immune response to immunization with a claudin-4-targeting nasal vaccine in mice.,29440671
Gβγ is a direct regulator of endogenous p101/p110γ and p84/p110γ PI3Kγ complexes in mouse neutrophils. ,33144519
PTPN2 elicits cell autonomous and non-cell autonomous effects on antitumor immunity in triple-negative breast cancer.,35196085
miR-146a deficiency does not aggravate muscular dystrophy in mdx mice.,31412923
Th17 cells differentiated with mycelial membranes of Candida albicans prevent oral candidiasis. ,29462298
A Synthetic Micro-Consensus DNA Vaccine Generates Comprehensive Influenza A H3N2 Immunity and Protects Mice Against Lethal Challenge by Multiple H3N2 Viruses.,30062926
Concurrent OX40 and CD30 Ligand Blockade Abrogates the CD4-Driven Autoimmunity Associated with CTLA4 and PD1 Blockade while Preserving Excellent Anti-CD8 Tumor Immunity.,28646041
Potent CD4+ T cell-associated antitumor memory responses induced by trifunctional bispecific antibodies in combination with immune checkpoint inhibition.,27966460
Complement C3a and C5a receptors promote GVHD by suppressing mitophagy in recipient dendritic cells. ,30568037
Interleukin-4 Supports the Suppressive Immune Responses Elicited by Regulatory T Cells.,29184551
Type I Interferon Therapy Limits CNS Autoimmunity by Inhibiting CXCR3-Mediated Trafficking of Pathogenic Effector T Cells.,31291583
β-Glucan Induces Protective Trained Immunity against Mycobacterium tuberculosis Infection: A Key Role for IL-1.,32433977
Combined Prebiotic and Microbial Intervention Improves Oral Cholera Vaccination Responses in a Mouse Model of Childhood Undernutrition.,32348782
<i>Staphylococcus succinus</i> 14BME20 Prevents Allergic Airway Inflammation by Induction of Regulatory T Cells via Interleukin-10.,31231389
Lack of IFNγ signaling attenuates spread of influenza A virus in vivo and leads to reduced pathogenesis.,30390564
Targeted deletion of NFAT-Interacting-Protein-(NIP) 45 resolves experimental asthma by inhibiting Innate Lymphoid Cells group 2 (ILC2).,31666531
PLG scaffold delivered antigen-specific regulatory T cells induce systemic tolerance in autoimmune diabetes.,23432371
Transcriptomics of the Vaccine Immune Response: Priming With Adjuvant Modulates Recall Innate Responses After Boosting.,29922291
Depletion of microglia augments the dopaminergic neurotoxicity of MPTP.,29401614
LIMIT is an immunogenic lncRNA in cancer immunity and immunotherapy.,33958760
Modulation of Roquin Function in Myeloid Cells Reduces <i>Mycobacterium tuberculosis</i>-Induced Inflammation.,28747346
Microbiota Sensing by Mincle-Syk Axis in Dendritic Cells Regulates Interleukin-17 and -22 Production and Promotes Intestinal Barrier Integrity.,30709742
Nod2 Deficiency Augments Th17 Responses and Exacerbates Autoimmune Arthritis.,30150283
Development of a SFTSV DNA vaccine that confers complete protection against lethal infection in ferrets.,31444366
