Title,ID
Immunogenic Chemotherapy Enhances Recruitment of CAR-T Cells to Lung Tumors and Improves Antitumor Efficacy when Combined with Checkpoint Blockade.,33357452
Fibroblastic reticular cell lineage convergence in Peyer's patches governs intestinal immunity.,33707780
Tolerogenic Immunomodulation by PEGylated Antigenic Peptides.,33162973
High glucose macrophage exosomes enhance atherosclerosis by driving cellular proliferation & hematopoiesis.,34381972
CD4<sup>+</sup> TSCMs in the Bone Marrow Assist in Maturation of Antibodies against Influenza in Mice.,30733641
Multifaceted effects of soluble human CD6 in experimental cancer models. ,32217757
Early T cell infiltration is modulated by programed cell death-1 protein and its ligand (PD-1/PD-L1) interactions in murine kidney transplants.,32763116
Serine/threonine phosphatase PP2A is essential for optimal B cell function. ,32161189
Foxp3+ CD4+ regulatory T cells control dendritic cells in inducing antigen-specific immunity to emerging SARS-CoV-2 antigens.,34882757
Long-term ex vivo haematopoietic-stem-cell expansion allows nonconditioned transplantation.,31142833
Microbial Colonization at Early Life Promotes the Development of Diet-Induced CD8αβ Intraepithelial T Cells.,30841027
Protective CD4+ Th1 cell-mediated immunity is reliant upon execution of effector function prior to the establishment of the pathogen niche.,34543348
Type I IFN signaling in T regulatory cells modulates chemokine production and myeloid derived suppressor cells trafficking during EAE.,32709481
Pro- and Antitumorigenic Capacity of Immunoproteasomes in Shaping the Tumor Microenvironment.,33707310
Calcium signals regulate the functional differentiation of thymic iNKT cells.,34169542
Adventitial Stromal Cells Define Group 2 Innate Lymphoid Cell Tissue Niches.,30824323
A Fragrant Environment Containing α-Pinene Suppresses Tumor Growth in Mice by Modulating the Hypothalamus/Sympathetic Nerve/Leptin Axis and Immune System.,31018712
Induction of IL-22-Producing CD4+ T Cells by Segmented Filamentous Bacteria Independent of Classical Th17 Cells.,34566952
The deubiquitinase CYLD controls protective immunity against helminth infection by regulation of Treg cell plasticity.,33309741
Interconnected subsets of memory follicular helper T cells have different effector functions.,29018187
"Cholesterol-Independent Suppression of Lymphocyte Activation, Autoimmunity, and Glomerulonephritis by Apolipoprotein A-I in Normocholesterolemic Lupus-Prone Mice.",26466956
"Plasmacytoid Dendritic Cells Mediate Control of Ross River Virus Infection via a Type I Interferon-Dependent, MAVS-Independent Mechanism. ",33361425
Calcium-mediated shaping of naive CD4 T-cell phenotype and function. ,29239722
Loss of MBNL1 induces RNA misprocessing in the thymus and peripheral blood.,32332745
Direct Tumor Killing and Immunotherapy through Anti-SerpinB9 Therapy.,33242418
IL-27 targets Foxp3+ Tregs to mediate antiinflammatory functions during experimental allergic airway inflammation.,30674714
Differences between immunodeficient mice generated by classical gene targeting and CRISPR/Cas9-mediated gene knockout.,29594927
The evolution of zebrafish RAG2 protein is required for adapting to the elevated body temperature of the higher endothermic vertebrates.,32139788
Mouse Model of SARS-CoV-2 Reveals Inflammatory Role of Type I Interferon Signaling,10.2139/ssrn.3628297
CD147 regulates antitumor CD8<sup>+</sup> T-cell responses to facilitate tumor-immune escape.,33177695
Regulation of Pulmonary Bacterial Immunity by Follistatin-Like Protein 1. ,33077624
Preferential Homing of Tumor-specific and Functional CD8+ Stem Cell-like Memory T Cells to the Bone Marrow.,31145231
CRISPR/Cas9-mediated knockout of <i>CD47</i> causes hemolytic anemia with splenomegaly in C57BL/6 mice.,30671119
Autophagy is dispensable for the maintenance of hematopoietic stem cells in neonates.,33710340
Annexin A5 as an immune checkpoint inhibitor and tumor-homing molecule for cancer treatment.,32111835
Histone deacetylase 3 represses cholesterol efflux during CD4<sup>+</sup> T-cell activation.,34854376
Identification of an Essential Cytoplasmic Region of Interleukin-7 Receptor α Subunit in B-Cell Development. ,30149646
Endogenous retroviruses promote homeostatic and inflammatory responses to the microbiota.,34166614
"Ovariectomy Activates Chronic Low-Grade Inflammation Mediated by Memory T Cells, Which Promotes Osteoporosis in Mice.",31995253
Transient antibody targeting of CD45RC inhibits the development of graft-versus-host disease.,32511714
A distinct dendritic cell population arises in the thymus of IL-13Rα1-sufficient but not IL-13Rα1-deficient mice.,29929727
IL-21/IL-21R signaling suppresses intestinal inflammation induced by DSS through regulation of Th responses in lamina propria in mice.,27545302
Yersinia Pseudotuberculosis Modulates Regulatory T Cell Stability via Injection of Yersinia Outer Proteins in a Type III Secretion System-Dependent Manner.,30719325
Blocking IL-10 receptor signaling ameliorates Mycobacterium tuberculosis infection during influenza-induced exacerbation. ,30998505
Recognition of Class II MHC Peptide Ligands That Contain β-Amino Acids.,31391235
Mouse model of SARS-CoV-2 reveals inflammatory role of type I interferon signaling. ,32750141
Tumor necrosis factor receptor family costimulation increases regulatory T-cell activation and function via NF-κB.,32012260
Human Beta Defensin 2 Ameliorated Alcohol-Associated Liver Disease in Mice.,35153819
Microbial short-chain fatty acids modulate CD8<sup>+</sup> T cell responses and improve adoptive immunotherapy for cancer.,34210970
Microwave ablation combined with OK-432 induces Th1-type response and specific antitumor immunity in a murine model of breast cancer.,28137271
Pioglitazone stabilizes atherosclerotic plaque by regulating the Th17/Treg balance in AMPK-dependent mechanisms.,29084546
Akt2 Regulates the Differentiation and Function of NKT17 Cells via FoxO-1-ICOS Axis.,30258434
A bacterial bile acid metabolite modulates T<sub>reg</sub> activity through the nuclear hormone receptor NR4A1.,34416161
Large-Scale Clonal Analysis Resolves Aging of the Mouse Hematopoietic Stem Cell Compartment.,29625072
NOX2 inhibition reduces oxidative stress and prolongs survival in murine KRAS-induced myeloproliferative disease.,30323311
Regulatory T cells in skin are uniquely poised to suppress profibrotic immune responses. ,31492709
The ubiquitin ligase MDM2 sustains STAT5 stability to control T cell-mediated antitumor immunity.,33767425
Suppression of local type I interferon by gut microbiota-derived butyrate impairs antitumor effects of ionizing radiation. ,33496784
T Follicular Regulatory Cell-Derived Fibrinogen-like Protein 2 Regulates Production of Autoantibodies and Induction of Systemic Autoimmunity.,33168576
Inflammation and neutrophil extracellular traps in cerebral cavernous malformation.,35333979
Terminally Differentiated CD4<sup>+</sup> T Cells Promote Myocardial Inflammaging.,33679735
A Novel Animal Model of Emphysema Induced by Anti-Elastin Autoimmunity.,31182478
Type 2 innate lymphoid cells control eosinophil homeostasis.,24037376
The role of NK cells and CD39 in the immunological control of tumor metastases.,31069159
Anxiolytic Drug FGIN-1-27 Ameliorates Autoimmunity by Metabolic Reprogramming of Pathogenic Th17 Cells.,32111885
Hippo Kinases Mst1 and Mst2 Sense and Amplify IL-2R-STAT5 Signaling in Regulatory T Cells to Establish Stable Regulatory Activity.,30413360
Targeted deletion of NFAT-Interacting-Protein-(NIP) 45 resolves experimental asthma by inhibiting Innate Lymphoid Cells group 2 (ILC2).,31666531
PRMT5 Is Required for T Cell Survival and Proliferation by Maintaining Cytokine Signaling.,32328070
Interleukin-2/antibody complex expanding Foxp3<sup>＋</sup> regulatory T cells exacerbates Th2-mediated allergic airway inflammation.,30885291
Treg cells mediate recovery from EAE by controlling effector T cell proliferation and motility in the CNS.,25476447
Regulation of invariant NKT cell development and function by a 0.14 Mbp locus on chromosome 1: a possible role for Fcgr3.,29880961
Adenosine monophosphate deaminase 3 null mutation causes reduction of naive T cells in mouse peripheral blood.,32761233
Robust Iterative Stimulation with Self-Antigens Overcomes CD8<sup>+</sup> T Cell Tolerance to Self- and Tumor Antigens.,31533033
The NF-κB RelA Transcription Factor Is Critical for Regulatory T Cell Activation and Stability.,31749798
Long noncoding RNA lnc-sox5 modulates CRC tumorigenesis by unbalancing tumor microenvironment.,28632999
Helios Controls a Limited Subset of Regulatory T Cell Functions.,26582951
Parabiosis reveals leukocyte dynamics in the kidney.,29251733
Expression of Nutrient Transporters on NK Cells During Murine Cytomegalovirus Infection Is MyD88-Dependent.,34093543
Conditional Deletion of the V-ATPase a2-Subunit Disrupts Intrathymic T Cell Development.,31456807
Suppression of Th17 Cell Response in the Alleviation of Dextran Sulfate Sodium-Induced Colitis by <i>Ganoderma lucidum</i> Polysaccharides.,29888292
Homeostasis and transitional activation of regulatory T cells require c-Myc.,31911938
Negative regulation of TCR signaling by ubiquitination of Zap-70 Lys-217.,27032069
The molecular signature of murine T cell homeostatic proliferation reveals both inflammatory and immune inhibition patterns.,28551033
Local Depletion of Immune Checkpoint Ligand CTLA4 Expressing Cells in Tumor Beds Enhances Antitumor Host Immunity. ,33997271
Subclinical Herpes Simplex Virus Type 1 Infections Provide Site-Specific Resistance to an Unrelated Pathogen.,28062697
Anti-CD45RB Antibody Therapy Attenuates Renal Ischemia-Reperfusion Injury by Inducing Regulatory B Cells.,31296607
Superior immune responses induced by intranasal immunization with recombinant adenovirus-based vaccine expressing full-length Spike protein of Middle East respiratory syndrome coronavirus.,31329652
CRISPR/Cas9-mediated knockout of <i>Rag-2</i> causes systemic lymphopenia with hypoplastic lymphoid organs in FVB mice.,30671102
Dietary DHA amplifies LXA<sub>4</sub> circuits in tissues and lymph node PMN and is protective in immune-driven dry eye disease.,30104626
Monoclonal regulatory T cells provide insights into T cell suppression.,27210828
IFN-γ and CD25 drive distinct pathologic features during hemophagocytic lymphohistiocytosis.,30578871
The AP-1 transcription factor JunB is required for Th17 cell differentiation.,29234109
Theoretical modeling reveals that regulatory T cells increase T-cell interaction with antigen-presenting cells for stable immune tolerance.,31131864
Murine roseolovirus does not accelerate amyloid-β pathology and human roseoloviruses are not over-represented in Alzheimer disease brains.,35033173
Sex Differences in the Immune System Become Evident in the Perinatal Period in the Four Core Genotypes Mouse.,34122327
Liver-resident NK cells suppress autoimmune cholangitis and limit the proliferation of CD4<sup>+</sup> T cells.,30874628
Inflammation drives nitric oxide synthase 2 expression by γδ T cells and affects the balance between melanoma and vitiligo associated melanoma.,30228955
Role of endocytosis and trans-endocytosis in ICOS costimulator-induced downmodulation of the ICOS Ligand.,33527556
Genome-wide transcriptional analyses of islet-specific CD4+ T cells identify Idd9 genes controlling diabetogenic T cell function.,25672752
Tissue signals imprint ILC2 identity with anticipatory function.,30201992
Immune regulation by fungal strain diversity in inflammatory bowel disease.,35296857
gB co-immunization with GP96 enhances pulmonary-resident CD8 T cells and exerts a long-term defence against MCMV pneumonitis.,33155438
Mice Deficient in Nucleoporin Nup210 Develop Peripheral T Cell Alterations.,30323813
A Hepatitis B Virus-Derived Peptide Exerts an Anticancer Effect via TNF/iNOS-producing Dendritic Cells in Tumor-Bearing Mouse Model. ,33499256
Local Delivery of Regulatory T Cells Promotes Corneal Allograft Survival.,30247445
Intestinal development and homeostasis require activation and apoptosis of diet-reactive T cells.,30939122
Blood leukocytes recapitulate diabetogenic peptide-MHC-II complexes displayed in the pancreatic islets. ,33822842
NFAT-dependent and -independent exhaustion circuits program maternal CD8 T cell hypofunction in pregnancy.,34882194
Macrophage Exosomes Resolve Atherosclerosis by Regulating Hematopoiesis and Inflammation via MicroRNA Cargo.,32668250
Extracellular Vesicles from Apoptotic Cells Promote TGFβ Production in Macrophages and Suppress Experimental Colitis.,30971739
Metformin Promotes the Protection of Mice Infected With <i>Plasmodium yoelii</i> Independently of γδ T Cell Expansion.,30619302
Medullary stromal cells synergize their production and capture of CCL21 for T-cell emigration from neonatal mouse thymus.,33570638
PD-1 modulates regulatory T-cell homeostasis during low-dose interleukin-2 therapy.,28151427
Interferon-γ Receptor Signaling in Dendritic Cells Restrains Spontaneous Proliferation of CD4<sup>+</sup> T Cells in Chronic Lymphopenic Mice.,30792713
Stabilization of Foxp3 by Targeting JAK2 Enhances Efficacy of CD8 Induced Regulatory T Cells in the Prevention of Graft-versus-Host Disease.,30242073
A FLCN-TFE3 Feedback Loop Prevents Excessive Glycogenesis and Phagocyte Activation by Regulating Lysosome Activity.,32049013
Impaired Expression of Rearranged Immunoglobulin Genes and Premature p53 Activation Block B Cell Development in BMI1 Null Mice.,30605667
Dynamic metrics-based biomarkers to predict responders to anti-PD-1 immunotherapy.,30587849
Fucosyltransferase Induction during Influenza Virus Infection Is Required for the Generation of Functional Memory CD4<sup>+</sup> T Cells.,29491007
Pathogenic function of bystander-activated memory-like CD4<sup>+</sup> T cells in autoimmune encephalomyelitis.,30755603
Interleukin-17-Producing γδ T Cells Originate from SOX13<sup>+</sup> Progenitors that Are Independent of γδTCR Signaling.,30413363
Neutrophils Which Migrate to Lymph Nodes Modulate CD4<sup>+</sup> T Cell Response by a PD-L1 Dependent Mechanism.,30761151
Segmented Filamentous Bacteria Induce Divergent Populations of Antigen-Specific CD4 T Cells in the Small Intestine.,30759969
Targeting a Pre-existing Anti-transgene T Cell Response for Effective Gene Therapy of MPS-I in the Mouse Model of the Disease.,31060789
Maresin 1 ameliorates iron-deficient anemia in IL-10(-/-) mice with spontaneous colitis by the inhibition of hepcidin expression though the IL-6/STAT3 pathway.,27398158
Selenium supplementation suppresses immunological and serological features of lupus in B6.Sle1b mice.,31006265
Microbiota-induced tissue signals regulate ILC3-mediated antigen presentation.,32286285
A clinically applicable adjuvant for an atherosclerosis vaccine in mice.,29932463
DAPK1 (death associated protein kinase 1) mediates mTORC1 activation and antiviral activities in CD8<sup>+</sup> T cells.,31541182
Targeting Mutated Plus Germline Epitopes Confers Pre-clinical Efficacy of an Instantly Formulated Cancer Nano-Vaccine.,31156619
Cutting Edge: β-Catenin-Interacting Tcf1 Isoforms Are Essential for Thymocyte Survival but Dispensable for Thymic Maturation Transitions.,28348272
RAS P21 Protein Activator 3 (RASA3) Specifically Promotes Pathogenic T Helper 17 Cell Generation by Repressing T-Helper-2-Cell-Biased Programs.,30446383
Lack of NFATc1 SUMOylation prevents autoimmunity and alloreactivity. ,32986812
IFNAR1 Controls Autocrine Type I IFN Regulation of PD-L1 Expression in Myeloid-Derived Suppressor Cells.,29752314
Distinct metabolic programs established in the thymus control effector functions of γδ T cell subsets in tumor microenvironments.,33462452
Evaluation of Anti-Tumor Effects of Whole-Body Low-Dose Irradiation in Metastatic Mouse Models. ,32365904
Single-cell analysis reveals immune modulation and metabolic switch in tumor-draining lymph nodes.,33117603
T Cell-Derived Lymphotoxin Is Essential for the Anti-Herpes Simplex Virus 1 Humoral Immune Response. ,29743364
Treatment of donor corneal tissue with immunomodulatory cytokines: a novel strategy to promote graft survival in high-risk corneal transplantation.,28428556
Cutting Edge: Resident Memory CD8 T Cells Express High-Affinity TCRs.,26371252
"Characterization of kidney CD45intCD11bintF4/80+MHCII+CX3CR1+Ly6C- ""intermediate mononuclear phagocytic cells"".",29856833
Compromised counterselection by FAS creates an aggressive subtype of germinal center lymphoma. ,33237303
Immunization with a recombinant antigen composed of conserved blocks from TSA56 provides broad genotype protection against scrub typhus.,31237478
"Efficient IL-2R signaling differentially affects the stability, function, and composition of the regulatory T-cell pool.",33408345
OX40 triggering concomitant to IL12-engineered cell vaccine hampers the immunoprevention of HER2/neu-driven mammary carcinogenesis.,30221061
Follicular regulatory T cells inhibit the development of granzyme B-expressing follicular helper T cells. ,31434804
Facilitated Peptide Transport <i>via</i> the Mucosal Epithelium: Impact on Tolerance Induction.,28321216
Chronic follicular bronchiolitis requires antigen-specific regulatory T cell control to prevent fatal disease progression.,24163409
Cross-Presentation of Skin-Targeted Recombinant Adeno-associated Virus 2/1 Transgene Induces Potent Resident Memory CD8+ T Cell Responses. ,30541847
Protective effect of cigarette smoke on the course of dextran sulfate sodium-induced colitis is accompanied by lymphocyte subpopulation changes in the blood and colon.,28812128
Streamlined Protocol for Deep Proteomic Profiling of FAC-sorted Cells and Its Application to Freshly Isolated Murine Immune Cells.,30792265
Robust adaptive immune response against <i>Babesia microti</i> infection marked by low parasitemia in a murine model of sickle cell disease.,30518538
Toll-Like Receptor 7 Agonist-Induced Dermatitis Causes Severe Dextran Sulfate Sodium Colitis by Altering the Gut Microbiome and Immune Cells.,30510995
Donor myeloid derived suppressor cells (MDSCs) prolong allogeneic cardiac graft survival through programming of recipient myeloid cells in vivo.,32859934
Electronic cigarettes disrupt lung lipid homeostasis and innate immunity independent of nicotine.,31483291
IL-32γ potentiates tumor immunity in melanoma. ,32841222
Targeting age-specific changes in CD4<sup>+</sup> T cell metabolism ameliorates alloimmune responses and prolongs graft survival.,33497523
Interleukin-18 up-regulates amino acid transporters and facilitates amino acid-induced mTORC1 activation in natural killer cells.,30696773
Neutral ceramidase-dependent regulation of macrophage metabolism directs intestinal immune homeostasis and controls enteric infection.,35354041
Roles of T Follicular Helper Cells and T Follicular Regulatory Cells in Autoantibody Production in IL-2-Deficient Mice.,31356160
B-1a cells acquire their unique characteristics by bypassing the pre-BCR selection stage.,31628339
Fibroblastic reticular cells enhance T cell metabolism and survival via epigenetic remodeling.,31636464
Regulatory T cells suppress virus-specific antibody responses to Friend retrovirus infection.,29614127
Targeting CD39 in Cancer Reveals an Extracellular ATP- and Inflammasome-Driven Tumor Immunity.,31699796
Enhancing adoptive T-cell therapy with fucoidan-based IL-2 delivery microcapsules.,36684086
Murine myeloproliferative disorder as a consequence of impaired collaboration between dendritic cells and CD4 T cells.,30333120
Non-specific Effect of Vaccines: Immediate Protection against Respiratory Syncytial Virus Infection by a Live Attenuated Influenza Vaccine.,29445364
"Unique pulmonary immunotoxicological effects of urban PM are not recapitulated solely by carbon black, diesel exhaust or coal fly ash.",29178979
CD8<sup>+</sup> T Cells Prevent Lethality from Neonatal Murine Roseolovirus Infection.,28972091
TLR3 Activation of Intratumoral CD103<sup>+</sup> Dendritic Cells Modifies the Tumor Infiltrate Conferring Anti-tumor Immunity.,30949170
PD-1 restraint of regulatory T cell suppressive activity is critical for immune tolerance. ,33045061
Identification of a T follicular helper cell subset that drives anaphylactic IgE. ,31371561
CD4(+) CD44(v.low) cells are unique peripheral precursors that are distinct from recent thymic emigrants and stem cell-like memory cells.,25910642
Disruption of thymic central tolerance by infection with murine roseolovirus induces autoimmune gastritis.,35226043
KLRG1<sup>+</sup> Memory CD8 T Cells Combine Properties of Short-Lived Effectors and Long-Lived Memory.,32611727
"A disconnect between precursor frequency, expansion potential, and site-specific CD4+ T cell responses in aged mice.",29864157
Immunomodulatory effects of soluble CD5 on experimental tumor models.,29296231
Keratinocyte-intrinsic MHCII expression controls microbiota-induced Th1 cell responses.,31672911
TGF-β signaling controls <i>Foxp3</i> methylation and T reg cell differentiation by modulating Uhrf1 activity.,31515281
Interleukin-15 Complex Treatment Protects Mice from Cerebral Malaria by Inducing Interleukin-10-Producing Natural Killer Cells.,29625893
Induction of liver-specific intrahepatic myeloid cells aggregation expands CD8 T cell and inhibits growth of murine hepatoma.,30524897
MicroRNA-directed pathway discovery elucidates an miR-221/222-mediated regulatory circuit in class switch recombination. ,34586363
Cornea-infiltrating and lymph node dendritic cells contribute to CD4+ T cell expansion after herpes simplex virus-1 ocular infection.,25422507
N-Cadherin-Expressing Bone and Marrow Stromal Progenitor Cells Maintain Reserve Hematopoietic Stem Cells.,30650358
The corepressor NCOR1 regulates the survival of single-positive thymocytes.,29162920
Mevalonate metabolism-dependent protein geranylgeranylation regulates thymocyte egress. ,31722972
Delayed control of herpes simplex virus infection and impaired CD4(+) T-cell migration to the skin in mouse models of DOCK8 deficiency.,25776845
"An orally-active adiponectin receptor agonist mitigates cutaneous fibrosis, inflammation and microvascular pathology in a murine model of systemic sclerosis.",30087356
CTLA4-CD28 chimera gene modification of T cells enhances the therapeutic efficacy of donor lymphocyte infusion for hematological malignancy.,28751785
Stepwise chromatin and transcriptional acquisition of an intraepithelial lymphocyte program.,33686285
Infectious Sporozoites of Plasmodium berghei Effectively Activate Liver CD8α+ Dendritic Cells.,29472929
Lung-Infiltrating Foxp3<sup>+</sup> Regulatory T Cells Are Quantitatively and Qualitatively Different during Eosinophilic and Neutrophilic Allergic Airway Inflammation but Essential To Control the Inflammation.,29093062
Female-Specific Downregulation of Tissue Polymorphonuclear Neutrophils Drives Impaired Regulatory T Cell and Amplified Effector T Cell Responses in Autoimmune Dry Eye Disease.,26324767
Characterization of the early inflammatory infiltrate at the feeding site of infected sand flies in mice protected from vector-transmitted Leishmania major by exposure to uninfected bites.,24762408
Molecular and cellular mechanisms of Mycobacterium avium-induced thymic atrophy.,22922815
Obesity-Linked PPARγ S273 Phosphorylation Promotes Insulin Resistance through Growth Differentiation Factor 3.,32941798
Self-Renewal and Toll-like Receptor Signaling Sustain Exhausted Plasmacytoid Dendritic Cells during Chronic Viral Infection.,29669251
IRF9 Prevents CD8+ T Cell Exhaustion in an Extrinsic Manner during Acute Lymphocytic Choriomeningitis Virus Infection. ,28878077
Modulation of autoimmune pathogenesis by T cell-triggered inflammatory cell death.,31462647
Heme Oxygenase-1-Expressing Dendritic Cells Promote Foxp3+ Regulatory T Cell Differentiation and Induce Less Severe Airway Inflammation in Murine Models.,28033400
Elucidating the Immune-Related Mechanisms by Which Probiotic Strain Lactobacillus casei BL23 Displays Anti-tumoral Properties.,30687269
Group 2 innate lymphoid cells utilize the IRF4-IL-9 module to coordinate epithelial cell maintenance of lung homeostasis.,26129648
Differential Requirement of <i>Cd8</i> Enhancers E8<sub>I</sub> and E8<sub>VI</sub> in Cytotoxic Lineage T Cells and in Intestinal Intraepithelial Lymphocytes.,30915074
Moderate static magnetic fields enhance antitumor CD8<sup>+</sup> T cell function by promoting mitochondrial respiration.,32884074
Essential and non-overlapping IL-2Rα-dependent processes for thymic development and peripheral homeostasis of regulatory T cells.,30833563
Tcf1-CTCF cooperativity shapes genomic architecture to promote CD8<sup>+</sup> T cell homeostasis.,35882936
IL-15 Generates IFN-γ-producing Cells Reciprocally Expressing Lymphoid-Myeloid Markers during Dendritic Cell Differentiation.,30745835
Aging promotes reorganization of the CD4 T cell landscape toward extreme regulatory and effector phenotypes.,31457092
"Safety, Immunogenicity, and Protective Efficacy of a Chimeric A/B Live Attenuated Influenza Vaccine in a Mouse Model. ",33513862
Novel Modified Vaccinia Virus Ankara Vector Expressing Anti-apoptotic Gene B13R Delays Apoptosis and Enhances Humoral Responses. ,30541829
Dendritic cells pulsed with tumor cells killed by high hydrostatic pressure inhibit prostate tumor growth in TRAMP mice.,29209567
Enhancing T Cell Immune Responses by B Cell-based Therapeutic Vaccine Against Chronic Virus Infection.,25177253
Combining anti-IL-7Rα antibodies with autoantigen-specific immunotherapy enhances non-specific cytokine production but fails to prevent Type 1 Diabetes.,30908554
Commensal-specific T cell plasticity promotes rapid tissue adaptation to injury. ,30523076
Foxp1 Negatively Regulates T Follicular Helper Cell Differentiation and Germinal Center Responses by Controlling Cell Migration and CTLA-4.,29212910
