Title,ID
Platelet PD-L1 suppresses anti-cancer immune cell activity in PD-L1 negative tumors.,33168847
The PD-1 Pathway Regulates Development and Function of Memory CD8<sup>+</sup> T Cells following Respiratory Viral Infection.,32610128
Obesity-Linked PPARγ S273 Phosphorylation Promotes Insulin Resistance through Growth Differentiation Factor 3.,32941798
Limited Cross-Variant Immunity after Infection with the SARS-CoV-2 Omicron Variant Without Vaccination,10.1101/2022.01.13.22269243
ZBTB7B (ThPOK) Is Required for Pathogenesis of Cerebral Malaria and Protection against Pulmonary Tuberculosis. ,31792077
TCF1 and LEF1 Control Treg Competitive Survival and Tfr Development to Prevent Autoimmune Diseases.,31216480
Blockade of ErbB2 and PD-L1 using a bispecific antibody to improve targeted anti-ErbB2 therapy.,31646095
Docosahexaenoic acid supplementation represses the early immune response against murine cytomegalovirus but enhances NK cell effector function.,35439922
The kinase PDK1 regulates regulatory T cell survival via controlling redox homeostasis.,34646383
Type I IFN signaling in T regulatory cells modulates chemokine production and myeloid derived suppressor cells trafficking during EAE.,32709481
B Cells Drive MHC Class I–Restricted CD4 T Cells to Induce Spontaneous Central Nervous System Autoimmunity,PMC9665903
Tetherin/BST-2 promotes dendritic cell activation and function during acute retrovirus infection.,26846717
Generation of an immunodeficient mouse model of tcirg1-deficient autosomal recessive osteopetrosis.,31938717
The Gut Microbiota Affects Corticosterone Production in the Murine Small Intestine. ,33921780
Hobit and Blimp-1 regulate T<sub>RM</sub> abundance after LCMV infection by suppressing tissue exit pathways of T<sub>RM</sub> precursors.,35389518
"Integrative taxonomy of Nearctic and Palaearctic Aleocharinae: new species, synonymies, and records (Coleoptera, Staphylinidae).",34140825
Targeting TIGIT Inhibits Bladder Cancer Metastasis Through Suppressing IL-32.,35069212
An <i>In Vitro</i> Co-culture Mouse Model Demonstrates Efficient Vaccine-Mediated Control of <i>Francisella tularensis</i> SCHU S4 and Identifies Nitric Oxide as a Predictor of Efficacy.,27933275
Regulation of tissue-dependent differences in CD8+ T cell apoptosis during viral infection.,24942579
TNFAIP3 Reduction-of-Function Drives Female Infertility and CNS Inflammation.,35464428
Ferritin triggers neutrophil extracellular trap-mediated cytokine storm through Msr1 contributing to adult-onset Still's disease pathogenesis.,36357401
"Antibody, but not B-cell-dependent antigen presentation, plays an essential role in preventing Chlamydia systemic dissemination in mice.",32026472
Suppression of CD4+ Effector Responses by Naturally Occurring CD4+ CD25+ Foxp3+ Regulatory T Cells Contributes to Experimental Cerebral Malaria.,26553468
A Heat-Killed Cryptococcus Mutant Strain Induces Host Protection against Multiple Invasive Mycoses in a Murine Vaccine Model. ,31772051
<i>Fat-1</i> Transgenic Mice With Augmented n3-Polyunsaturated Fatty Acids Are Protected From Liver Injury Caused by Acute-On-Chronic Ethanol Administration.,34531743
IL-10 blockade facilitates DNA vaccine-induced T cell responses and enhances clearance of persistent virus infection.,18332180
Temporal tracking of microglial and monocyte single-cell transcriptomics in lethal flavivirus infection.,37016414
A Natural Variant of the Signaling Molecule Vav1 Enhances Susceptibility to Myasthenia Gravis and Influences the T Cell Receptor Repertoire.,30410484
Formation of pancreatic β-cells from precursor cells contributes to the reversal of established type 1 diabetes.,33866285
Recombinant Fc-fusion vaccine of RBD induced protection against SARS-CoV-2 in non-human primate and mice,10.21203/rs.3.rs-147112/v1
IL-1β-activated mTORC2 promotes accumulation of IFN-γ<sup>+</sup> γδ T cells by upregulating CXCR3 to restrict hepatic fibrosis.,35361750
Microbiota-derived butyrate limits the autoimmune response by promoting the differentiation of follicular regulatory T cells.,32711255
Cutting Edge: Resident Memory CD8 T Cells Express High-Affinity TCRs.,26371252
Differentiation of IL-17-Producing Invariant Natural Killer T Cells Requires Expression of the Transcription Factor c-Maf.,29163480
Mice Lacking the Purinergic Receptor P2X5 Exhibit Defective Inflammasome Activation and Early Susceptibility to <i>Listeria monocytogenes</i>.,32540996
Combination of Cisplatin and Irradiation Induces Immunogenic Cell Death and Potentiates Postirradiation Anti-PD-1 Treatment Efficacy in Urothelial Carcinoma. ,33430352
Carbohydrate fatty acid monosulphate: oil-in-water adjuvant enhances SARS-CoV-2 RBD nanoparticle-induced immunogenicity and protection in mice.,36788219
Liquiritigenin enhances cyclic adenosine monophosphate production to mitigate inflammation in dendritic cells.,34939873
Notch signaling represents an important checkpoint between follicular T-helper and canonical T-helper 2 cell fate.,29467447
Murine hematopoietic stem cell activity is derived from pre-circulation embryos but not yolk sacs.,30573729
NCF4 dependent intracellular reactive oxygen species regulate plasma cell formation.,36095971
"Therapy of lymphoma by immune checkpoint inhibitors: the role of T cells, NK cells and cytokine-induced tumor senescence. ",33441389
Tolerance to Proinsulin-1 Reduces Autoimmune Diabetes in NOD Mice.,33841427
Th17 cells confer long-term adaptive immunity to oral mucosal Candida albicans infections.,23250275
Prevention of EAE by tolerogenic vaccination with PEGylated antigenic peptides.,34408824
Ubiquitin Specific Protease 1 Expression and Function in T Cell Immunity.,34380645
Chimeric Fusion (F) and Attachment (G) Glycoprotein Antigen Delivery by mRNA as a Candidate Nipah Vaccine.,34956199
Cyclic di-AMP as endogenous adjuvant enhanced BCG-induced trained immunity and protection against <i>Mycobacterium tuberculosis</i> in mice.,36081510
EBV/HHV-6A dUTPases contribute to myalgic encephalomyelitis/chronic fatigue syndrome pathophysiology by enhancing TFH cell differentiation and extrafollicular activities.,35482424
CXCR4 blockade reduces the severity of murine heart allograft rejection by plasmacytoid dendritic cell-mediated immune regulation.,34893663
Innate Sensing through Mesenchymal TLR4/MyD88 Signals Promotes Spontaneous Intestinal Tumorigenesis.,30650348
Progression of relapsing-remitting demyelinating disease does not require increased TCR affinity or epitope spread.,25267971
Metabolic reprogramming of alloantigen-activated T cells after hematopoietic cell transplantation.,26950421
Protein Immunization Induces Memory CD4<sup>+</sup> T Cells That Lack Th Lineage Commitment.,34380649
Glucocorticoids Oppose Thymocyte Negative Selection by Inhibiting Helios and Nur77.,31527196
Angiopoietin-like 4 deficiency upregulates macrophage function through the dysregulation of cell-intrinsic fatty acid metabolism.,32195030
Probiotic and Functional Properties of <i>Limosilactobacillus reuteri</i> INIA P572.,34072532
The CTRP3-AdipoR2 Axis Regulates the Development of Experimental Autoimmune Encephalomyelitis by Suppressing Th17 Cell Differentiation.,34925309
Restricted Clonality and Limited Germinal Center Reentry Characterize Memory B Cell Reactivation by Boosting.,31866068
Maturation-dependent licensing of naive T cells for rapid TNF production.,21124839
Protective immunity to H7N9 influenza viruses elicited by synthetic DNA vaccine.,24631084
The mediatory role of Majie cataplasm on inflammation of allergic asthma through transcription factors related to Th1 and Th2.,32489402
Regulation of Pulmonary Bacterial Immunity by Follistatin-Like Protein 1. ,33077624
mTOR signaling mediates ILC3-driven immunopathology.,34341503
Exploring the immunomodulatory role of virtual memory CD8<sup>+</sup> T cells: Role of IFN gamma in tumor growth control.,36330506
CLEC-2 is required for development and maintenance of lymph nodes.,24532804
Characterization of Immune Cells from Adipose Tissue.,31483101
Differential sensitivity of inflammatory macrophages and alternatively activated macrophages to ferroptosis.,34272880
Proinflammatory signaling in islet β cells propagates invasion of pathogenic immune cells in autoimmune diabetes.,35767947
"BCG hydrogel promotes CTSS-mediated antigen processing and presentation, thereby suppressing metastasis and prolonging survival in melanoma.",35732347
TH17 cells require ongoing classic IL-6 receptor signaling to retain transcriptional and functional identity. ,32680955
Adverse effects following anti-COVID-19 vaccination with mRNA-based BNT162b2 are alleviated by altering the route of administration and correlate with baseline enrichment of T and NK cell genes.,35639676
Oxaliplatin-Resistant Hepatocellular Carcinoma Drives Immune Evasion Through PD-L1 Up-Regulation and PMN-Singular Recruitment.,36513250
Autophagy is dispensable for the maintenance of hematopoietic stem cells in neonates.,33710340
<i>Bifidobacterium longum</i> Ameliorates Ovariectomy-Induced Bone Loss <i>via</i> Enhancing Anti-Osteoclastogenic and Immunomodulatory Potential of Regulatory B Cells (Bregs).,35693779
Systemic Listeria monocytogenes infection in aged mice induces long-term neuroinflammation: the role of miR-155.,35614490
Systematic Study of the Immune Components after Ischemic Stroke Using CyTOF Techniques.,32908941
Recombinant Fc-fusion vaccine of RBD induced protection against SARS-CoV-2 in non-human primate and mice,10.1101/2020.11.29.402339
The IL-10GFP (VeRT-X) mouse strain is not suitable for the detection of IL-10 production by granulocytes during lung inflammation.,33979348
Cutting Edge: Dynamic Expression of Id3 Defines the Stepwise Differentiation of Tissue-Resident Regulatory T Cells.,30518568
Follicular Helper T Cells Remodel the Immune Microenvironment of Pancreatic Cancer via Secreting CXCL13 and IL-21. ,34359579
Targeting miR-148b-5p Inhibits Immunity Microenvironment and Gastric Cancer Progression.,33717068
SKI Expression Suppresses Pathogenic Th17 Cell Response and Mitigates Experimental Autoimmune Encephalomyelitis.,34335622
Immunogenicity and pre-clinical efficacy of an OMV-based SARS-CoV-2 vaccine,10.1101/2021.07.12.452027
Antibiotics-Induced Dysbiosis of Intestinal Microbiota Aggravates Atopic Dermatitis in Mice by Altered Short-Chain Fatty Acids.,31743970
CD8 follicular T cells localize throughout the follicle during germinal center reactions and maintain cytolytic and helper properties.,34274825
NK cells interfere with the generation of resistance against mycoplasma respiratory infection following nasal-pulmonary immunization.,19625649
Parabiosis reveals leukocyte dynamics in the kidney.,29251733
PSGL-1 Is a T Cell Intrinsic Inhibitor That Regulates Effector and Memory Differentiation and Responses During Viral Infection.,34326837
The thymic microenvironment gradually modulates the phenotype of thymus-homing peripheral conventional dendritic cells.,34748687
Th1 cells are dispensable for primary clearance of Chlamydia from the female reproductive tract of mice.,35196366
In Vivo Rescue Assay of RhoA-Deficient Hematopoietic Stem and Progenitor Cells.,30062417
"On-target and direct modulation of alloreactive T cells by a nanoparticle carrying MHC alloantigen, regulatory molecules and CD47 in a murine model of alloskin transplantation.",29508634
Correlation of Regulatory T Cell Numbers with Disease Tolerance upon Virus Infection.,33893179
Potent induction of tumor immunity by combining tumor cryoablation with anti-CTLA-4 therapy.,22108823
VLM catecholaminergic neurons control tumor growth by regulating CD8+ T cells. ,34260392
Redirecting host preexisting influenza A virus immunity for cancer immunotherapy.,34731283
Both T cell priming in lymph node and CXCR3-dependent migration are the key events for predicting the response of atezolizumab.,34230534
Early Neutrophilia Marked by Aerobic Glycolysis Sustains Host Metabolism and Delays Cancer Cachexia.,35205709
Immune responses in a mouse model of vitiligo with spontaneous epidermal de- and repigmentation.,24935676
Mice deficient of Myc super-enhancer region reveal differential control mechanism between normal and pathological growth. ,28583252
A T-Cell Surface Marker Panel Predicts Murine Acute Graft-Versus-Host Disease.,33584657
The Transcriptional Repressor Gfi1 Plays a Critical Role in the Development of NKT1- and NKT2-Type iNKT Cells.,27284976
Blocking IL-10 receptor signaling ameliorates Mycobacterium tuberculosis infection during influenza-induced exacerbation. ,30998505
Activation of Aryl Hydrocarbon Receptor by ITE Improves Cardiac Function in Mice After Myocardial Infarction.,34157850
Single-cell genomics identifies distinct B1 cell developmental pathways and reveals aging-related changes in the B-cell receptor repertoire.,35526067
"A synDNA vaccine delivering neoAg collections controls heterogenous, multifocal murine lung and ovarian tumors via robust T cell generation.",34141866
NUP98-HOXA10hd fusion protein sustains multi-lineage haematopoiesis of lineage-committed progenitors in transplant setting.,32725842
Suppression of IL-23-mediated psoriasis-like inflammation by regulatory B cells.,33483537
Active and Inactive Enhancers Cooperate to Exert Localized and Long-Range Control of Gene Regulation.,27239026
Dulaglutide Modulates the Development of Tissue-Infiltrating Th1/Th17 Cells and the Pathogenicity of Encephalitogenic Th1 Cells in the Central Nervous System. ,30934882
Immune dysregulation accelerates atherosclerosis and modulates plaque composition in systemic lupus erythematosus.,16636270
"Discovery of DRP-104, a tumor-targeted metabolic inhibitor prodrug.",36383674
Optimal CD8<sup>+</sup> T-cell memory formation following subcutaneous cytomegalovirus infection requires virus replication but not early dendritic cell responses.,34003499
Human Beta Defensin 2 Ameliorated Alcohol-Associated Liver Disease in Mice.,35153819
Akt2 Regulates the Differentiation and Function of NKT17 Cells via FoxO-1-ICOS Axis.,30258434
Transient T-bet expression functionally specifies a distinct T follicular helper subset.,30232200
Bcl6 controls the Th2 inflammatory activity of regulatory T cells by repressing Gata3 function.,23053511
"<i>Tremella fuciformis</i> Polysaccharides Inhibited Colonic Inflammation in Dextran Sulfate Sodium-Treated Mice <i>via</i> Foxp3+ T Cells, Gut Microbiota, and Bacterial Metabolites.",33868283
Vaccinia Virus Infection Inhibits Skin Dendritic Cell Migration to the Draining Lymph Node.,33419767
Maternal gut microbiome regulates immunity to RSV infection in offspring.,34613328
Overexpression of hepatic serum amyloid A1 in mice increases IL-17-producing innate immune cells and decreases bone density.,33781747
A novel mouse AAV6 hACE2 transduction model of wild-type SARS-CoV-2 infection studied using synDNA immunogens.,34124612
Effect of the Lactococcus Lactis 11/19-B1 Strain on Atopic Dermatitis in a Clinical Test and Mouse Model. ,32183266
Metabolic preconditioning in CD4+ T cells restores inducible immune tolerance in lupus-prone mice.,34403367
D-mannose ameliorates autoimmune phenotypes in mouse models of lupus.,33402096
Immunotherapy of prostate cancer using novel synthetic DNA vaccines targeting multiple tumor antigens.,33884106
"IL-4Rα signaling by CD8α<sup>+</sup> dendritic cells contributes to cerebral malaria by enhancing inflammatory, Th1, and cytotoxic CD8<sup>+</sup> T cell responses.",33798555
Direct infection of dendritic cells during chronic viral infection suppresses antiviral T cell proliferation and induces IL-10 expression in CD4 T cells.,24613988
IKKβ-mediated inflammatory myeloid cell activation exacerbates experimental autoimmune encephalomyelitis by potentiating Th1/Th17 cell activation and compromising blood brain barrier.,27450563
GPR43 regulates marginal zone B-cell responses to foreign and endogenous antigens.,32888232
Properties and Roles of γδT Cells in <i>Plasmodium yoelii nigeriensis</i> NSM Infected C57BL/6 Mice.,35127555
Duration of antigen receptor signaling determines T-cell tolerance or activation.,20921406
Combined Treatment with Methylprednisolone and Human Bone Marrow-Derived Mesenchymal Stem Cells Ameliorate Experimental Autoimmune Encephalomyelitis.,30603546
Metabolic determinants of the immune modulatory function of neural stem cells.,27590826
Understanding Resistance vs. Susceptibility in Visceral Leishmaniasis Using Mouse Models of Leishmania infantum Infection.,30881923
Antitumor efficacy of combined CTLA4/PD-1 blockade without intestinal inflammation is achieved by elimination of FcγR interactions. ,33127658
Persistence of <i>Brucella abortus</i> in the Bone Marrow of Infected Mice.,30622977
Activation status dictates the function of unlicensed natural killer cells in mice and humans.,34496010
Programmed Cell Death Protein 1-PDL1 Interaction Prevents Heart Damage in Chronic <i>Trypanosoma cruzi</i> Infection.,29867974
d-enantiomers of CATH-2 enhance the response of macrophages against <i>Streptococcus suis</i> serotype 2.,35127168
Effective Treatment of Established Bone Metastases Can Be Achieved by Combinatorial Osteoclast Blockade and Depletion of Granulocytic Subsets.,34551967
Small intestinal immune-environmental changes induced by oral tolerance inhibit experimental atopic dermatitis.,33664229
CD29 targeted near-infrared photoimmunotherapy (NIR-PIT) in the treatment of a pigmented melanoma model.,35003897
Integrated hepatic single-cell RNA sequencing and untargeted metabolomics reveals the immune and metabolic modulation of Qing-Fei-Pai-Du decoction in mice with coronavirus-induced pneumonia.,35032732
Hybrid resistance to parental bone marrow grafts in nonlethally irradiated mice.,30346652
Purinergic P2X4 receptors and mitochondrial ATP production regulate T cell migration.,29894310
A role for leukocyte-derived IL-1RA in DC homeostasis revealed by increased susceptibility of IL-1RA-deficient mice to cutaneous leishmaniasis.,21525884
Counter-regulation of T cell effector function by differentially activated p38.,24863062
Hedgehog interacting protein-expressing lung fibroblasts suppress lymphocytic inflammation in mice. ,34375314
Diacylglycerol kinase ζ (DGKζ) and Casitas b-lineage proto-oncogene b-deficient mice have similar functional outcomes in T cells but DGKζ-deficient mice have increased T cell activation and tumor clearance.,30027154
Blood flow guides sequential support of neutrophil arrest and diapedesis by PILR-β1 and PILR-α. ,31385804
SIRT5 Contributes to Colorectal Cancer Growth by Regulating T Cell Activity.,32953892
Intestinal helminth infection transforms the CD4<sup>+</sup> T cell composition of the skin.,34931000
Cutting Edge: CCR2 Is Not Required for Ly6C<sup>hi</sup> Monocyte Egress from the Bone Marrow but Is Necessary for Migration within the Brain in La Crosse Virus Encephalitis.,29246952
Ketogenesis acts as an endogenous protective programme to restrain inflammatory macrophage activation during acute pancreatitis.,35339899
Inhibiting Glucose Metabolism Results in Herpes Simplex Encephalitis.,34470854
Suppressor of cytokine signalling 3 (SOCS3) expressed in podocytes attenuates glomerulonephritis and suppresses autoantibody production in an imiquimod-induced lupus model. ,34016718
Gut Microbiome in Progressive Multiple Sclerosis.,33876477
Blimp-1 molds the epigenetic architecture of IL-21-mediated autoimmune diseases through an autoregulatory circuit.,35503415
Lactococcus lactis Delivery of Surface Layer Protein A Protects Mice from Colitis by Re-Setting Host Immune Repertoire. ,34572293
Transcription factor RORα enforces stability of the Th17 cell effector program by binding to a Rorc cis-regulatory element.,36243007
Autoreactive CD8 T cells in NOD mice exhibit phenotypic heterogeneity but restricted TCR gene usage.,35667687
Opposing functions of circadian protein DBP and atypical E2F family E2F8 in anti-tumor Th9 cell differentiation.,36241625
MHC-class I-restricted CD4 T cells: a nanomolar affinity TCR has improved anti-tumor efficacy in vivo compared to the micromolar wild-type TCR.,22926060
Alleviation of Ulcerative Colitis Potentially through th1/th2 Cytokine Balance by a Mixture of Rg3-enriched Korean Red Ginseng Extract and Persicaria tinctoria. ,33182623
Exhausted PD-1<sup>+</sup> TOX<sup>+</sup> CD8<sup>+</sup> T Cells Arise Only in Long-Term Experimental <i>Trypanosoma cruzi</i> Infection.,35720419
Cigarette Smoke Increases CD8α<sup>+</sup> Dendritic Cells in an Ovalbumin-Induced Airway Inflammation.,28670318
Microbial Colonization at Early Life Promotes the Development of Diet-Induced CD8αβ Intraepithelial T Cells.,30841027
Do cytomegalovirus-specific memory T cells interfere with new immune responses in lymphoid tissues?,31069636
"Redefining the Foreign Antigen and Self-Driven Memory CD4<sup>+</sup> T-Cell Compartments <i>via</i> Transcriptomic, Phenotypic, and Functional Analyses.",35707543
An innate IL-25-ILC2-MDSC axis creates a cancer-permissive microenvironment for <i>Apc</i> mutation-driven intestinal tumorigenesis.,35658010
A lentiviral vector expressing a dendritic cell-targeting multimer induces mucosal anti-mycobacterial CD4<sup>+</sup> T-cell immunity.,36104497
Interleukin-2/antibody complex expanding Foxp3<sup>＋</sup> regulatory T cells exacerbates Th2-mediated allergic airway inflammation.,30885291
Rapid In Vivo Assessment of Adjuvant's Cytotoxic T Lymphocytes Generation Capabilities for Vaccine Development. ,29985310
miR-155 promotes T reg cell development by safeguarding medullary thymic epithelial cell maturation. ,33125052
Foxp3+ Regulatory and Conventional CD4+ T Cells Display Similarly High Frequencies of Alloantigen-Reactive Cells.,30941146
Chronic oral exposure to glycated whey proteins increases survival of aged male NOD mice with autoimmune prostatitis by regulating the gut microbiome and anti-inflammatory responses.,31829366
Lung Inflammatory Response to Environmental Dust Exposure in Mice Suggests a Link to Regional Respiratory Disease Risk.,34456580
The absence of CCR7 results in dysregulated monocyte migration and immunosuppression facilitating chronic cutaneous leishmaniasis.,24205367
Early T cell infiltration is modulated by programed cell death-1 protein and its ligand (PD-1/PD-L1) interactions in murine kidney transplants.,32763116
The transcription factor FoxP3 can fold into two dimerization states with divergent implications for regulatory T cell function and immune homeostasis.,35926508
mTOR Complex 1 Signaling Regulates the Generation and Function of Central and Effector Foxp3<sup>+</sup> Regulatory T Cells.,29884702
Identification and Regulation of TCRαβ<sup>+</sup>CD8αα<sup>+</sup> Intraepithelial Lymphocytes in Murine Oral Mucosa.,32849598
Multimodal Molecular Imaging Detects Early Responses to Immune Checkpoint Blockade.,33837042
Cardiomyocyte Transplantation after Myocardial Infarction Alters the Immune Response in the Heart. ,32756334
"DNA vaccines targeting heavy chain C-terminal fragments of Clostridium botulinum neurotoxin serotypes A, B, and E induce potent humoral and cellular immunity and provide protection from lethal toxin challenge.",26158319
Adenosine monophosphate deaminase 3 null mutation causes reduction of naive T cells in mouse peripheral blood.,32761233
Novel synthetic plasmid and Doggybone DNA vaccines induce neutralizing antibodies and provide protection from lethal influenza challenge in mice.,26091432
"Dynamically linking influenza virus infection kinetics, lung injury, inflammation, and disease severity. ",34282728
MicroRNA-155 Regulates MAIT1 and MAIT17 Cell Differentiation.,33898469
The sphingosine-1-phosphate transporter Spns2 expressed on endothelial cells regulates lymphocyte trafficking in mice.,22406534
Hookworm excretory/secretory products induce interleukin-4 (IL-4)+ IL-10+ CD4+ T cell responses and suppress pathology in a mouse model of colitis.,23545299
PARP-inhibition reprograms macrophages toward an anti-tumor phenotype.,36223740
Definitive activation of endogenous antitumor immunity by repetitive cycles of cyclophosphamide with interspersed Toll-like receptor agonists.,27341020
Plasmacytoid Dendritic Cells and Type I Interferon Promote Extrafollicular B Cell Responses to Extracellular Self-DNA.,32454024
Enhanced susceptibility to chemically induced colitis caused by excessive endosomal TLR signaling in LRBA-deficient mice.,31097594
Characterization of Resident Corneal Plasmacytoid Dendritic Cells and Their Pivotal Role in Herpes Simplex Keratitis.,32877681
Transient Depletion of Foxp3<sup>+</sup> Regulatory T Cells Selectively Promotes Aggressive β Cell Autoimmunity in Genetically Susceptible DEREG Mice.,34447385
Integrating CD4<sup>+</sup> T cell help for therapeutic cancer vaccination in a preclinical head and neck cancer model.,34408919
Canonical PI3Kγ signaling in myeloid cells restricts Trypanosoma cruzi infection and dampens chagasic myocarditis.,29666415
Inhibition of the multiplication of Mycobacterium leprae by vaccination with a recombinant M. bovis BCG strain that secretes major membrane protein II in mice.,19675226
"Cholesterol-Independent Suppression of Lymphocyte Activation, Autoimmunity, and Glomerulonephritis by Apolipoprotein A-I in Normocholesterolemic Lupus-Prone Mice.",26466956
CD8<sup>+</sup> T cells and fatty acids orchestrate tumor ferroptosis and immunity via ACSL4.,35216678
Lymph nodes as barriers to T-cell rejuvenation in aging mice and nonhuman primates.,30430748
Distinct difference in tumor-infiltrating immune cells between Wilms' tumor gene 1 peptide vaccine and anti-programmed cell death-1 antibody therapies.,34355173
Antitumor Responses in the Absence of Toxicity in Solid Tumors by Targeting B7-H3 via Chimeric Antigen Receptor T Cells.,30753824
Intestinal microbiota modulates gluten-induced immunopathology in humanized mice.,26456581
