Title,ID
"Isolation, characterization and transcriptome analysis of a novel Antarctic Aspergillus sydowii strain MS-19 as a potential lignocellulosic enzyme source.",PMC5450402
Reinforcement of bonded crown fractured incisors with porcelain veneers.,1782899
Zika virus pathogenesis and current therapeutic advances.,PMC7850325
Silica-Gentamicin Nanohybrids: Synthesis and Antimicrobial Action.,PMC5456682
Effect of cervical coating of ethyl cellulose polymer and metacrylic acid copolymer on the radicular penetration of hydrogen peroxide during bleaching.,1302680
Rigidity of various fixation methods used as dental splints.,1289069
Reasons for and incidence of tooth mortality in a Swedish population.,1302686
"Mosaic penicillin-binding protein 2 in Neisseria gonorrhoeae isolates collected in 2008 in San Francisco, California.",PMC2737862
Effects of systemic and topical nicotine on pulpal blood flow in dogs.,8404699
Education and process change to improve skin health in a residential aged care facility.,PMC7949546
Adhesion of light-cured composite resin to bleached and unbleached bovine dentin.,2079018
Effect of probe design on the suitability of laser Doppler flowmetry in vitality testing of human teeth.,8404698
Genome-wide characterization of non-reference transposons in crops suggests non-random insertion.,PMC4971691
RAS Synthetic Lethal Screens Revisited: Still Seeking the Elusive Prize?,PMC4413026
Genome-wide characterization of long intergenic non-coding RNAs (lincRNAs) provides new insight into viral diseases in honey bees Apis cerana and Apis mellifera.,PMC4559890
"Discovery of novel, orally bioavailable, antileishmanial compounds using phenotypic screening.",PMC5764437
Unified Compact ECC-AES Co-Processor with Group-Key Support for IoT Devices in Wireless Sensor Networks. ,PMC5795697
Dental trauma in children: a survey.,1687388
Is age a prognostic biomarker for survival among women with locally advanced cervical cancer treated with chemoradiation? An NRG Oncology/Gynecologic Oncology Group ancillary data analysis.,PMC5693242
Cytotoxicity of eugenol in sealer containing zinc-oxide.,1915132
"Root resorption--etiology, terminology and clinical manifestations.",3078294
Clinical evaluation of pulp and dentine sensitivity after supragingival and subgingival scaling.,1820859
"Resistance to vertical fracture of roots, previously fractured and bonded with glass ionomer cement, composite resin and cyanoacrylate cement.",8243340
Candida dubliniensis screening using the germ tube test in clinical yeast isolates and prevalence of C. dubliniensis in Korea.,PMC6647691
High expression of ezrin predicts poor prognosis in uterine cervical cancer.,PMC4228363
Pertussigen in vivo enhances antigen-specific production in vitro of lymphokine that stimulates macrophage procoagulant activity and plasminogen activator.,3782790
"Muscle contraction and force: the importance of an ancillary network, nutrient supply and waste removal.",PMC2635739
"Indica rice genome assembly, annotation and mining of blast disease resistance genes.",PMC4793524
Effect of root canal infection and treatment of traumatized primary incisors on their permanent successors.,1396355
A functional role of LEFTY during progesterone therapy for endometrial carcinoma.,PMC5740891
Critical factors influencing the in vivo performance of long-acting lipophilic solutions--impact on in vitro release method design.,PMC2782087
Zonation of Ribosomal DNA Transcription Defines a Stem Cell Hierarchy in Colorectal Cancer.,PMC9006079
Neurotoxic effect of two root canal sealers with calcium hydroxide on rat phrenic nerve in vitro.,1820855
Secular trends in regional differences in nutritional biomarkers and self-reported dietary intakes among American adults: National Health and Nutrition Examination Survey (NHANES) 1988-1994 to 2009-2010.,PMC6204125
Unusual case of general pulp calcification (pulp stones) in a young Greek girl.,2094604
Some observations on the mechanics of oscillation of ultrasonic files.,2202589
Complete discrimination of docosahexaenoate from arachidonate by 85 kDa cytosolic phospholipase A2 during the hydrolysis of diacyl- and alkenylacylglycerophosphoethanolamine.,8180247
Observations of acoustic streaming fields around an oscillating ultrasonic file.,1302678
Digital subtraction radiography for assessment of simulated root resorption cavities. Performance of conventional and reverse contrast modes.,1291302
"Evolutionary Agroecology: the potential for cooperative, high density, weed-suppressing cereals.",PMC3352502
Dentine hypersensitivity: a review.,1915127
Exposure of dental personnel to chloroform in root-filling procedures.,1291303
Enhancement of oxygen mass transfer and gas holdup using palm oil in stirred tank bioreactors with xanthan solutions as simulated viscous fermentation broths.,PMC3847969
Polyunsaturated fatty acids and prostate cancer risk: a Mendelian randomisation analysis from the PRACTICAL consortium.,PMC4997551
Natural underlying mtDNA heteroplasmy as a potential source of intra-person hiPSC variability.,PMC5282833
Sex differences in the effects of microsomal enzyme inducers on hepatic phase I drug metabolism in the rat.,4052097
Budding yeast CENP-A<sup>Cse4</sup> interacts with the N-terminus of Sgo1 and regulates its association with centromeric chromatin.,PMC5815428
Pulp capping with calcium hydroxide: diagnostic value of radiographic findings.,3271679
Effect of intracanal dressings on repair and apical bridging of teeth with incomplete root formation.,8491125
Levels of PEDF in pleural effusions from lung adenocarcinoma and benign disease patients.,PMC3809976
Replacing resorbed maxillary central incisors with mandibular premolars.,2390967
Investigating the spatial risk distribution of West Nile virus disease in birds and humans in southern Ontario from 2002 to 2005.,PMC1871569
Surface-induced Dissociation Mass Spectrometry as a Structural Biology Tool.,PMC9282826
Monoinfection of root canal with Pseudomonas aeruginosa.,3152165
Practical application of opt-out recruitment methods in two health services research studies.,PMC5391553
"Incidence of Metabolic Syndrome and Its Risk Factors among Type 2 Diabetes Clinic Attenders in Isfahan, Iran.",PMC3313686
Distract yourself: prediction of salient distractors by own actions and external cues.,PMC6373372
Lay and professional knowledge of methods for emergency management of avulsed teeth.,1291304
Prognosis of luxated non-vital maxillary incisors treated with calcium hydroxide and filled with gutta-percha. A retrospective clinical study.,1521505
The radicular palatal groove--a therapeutic modality.,3271682
Profiling of Propionibacterium acnes recovered from root canal and blood during and after endodontic treatment.,1302689
Mortality associated with medical therapy versus elective colectomy in ulcerative colitis: a cohort study.,PMC4925099
Effects of the penetration of a root canal filling material into the mandibular canal. 1. Tissue reaction to the material.,1915124
Morphology of the mineralizing front and observations of reparative dentine following induction and inhibition of dentinogenesis in the rat incisor.,1302679
Effects of the penetration of a root canal filling material into the mandibular canal. 2. Changes in the alveolar nerve tissue.,1915125
Privacy Act of 1974; systems of records--PHS.,10264553
Clinical examination of patients with orofacial pain.,3267523
Development of a 63K SNP Array for Cotton and High-Density Mapping of Intraspecific and Interspecific Populations of Gossypium spp.,PMC4478548
Factors associated with genital chlamydial and gonococcal infection in females.,PMC1194876
Continuing root formation following apexification treatment.,2133316
Early ficolin-1 is a sensitive prognostic marker for functional outcome in ischemic stroke.,PMC4721111
In vitro cutaneous application of ISCOMs on human skin enhances delivery of hydrophobic model compounds through the stratum corneum.,PMC2782083
Histometric study of the effect of occlusal alteration on periodontal tissue healing after surgical injury.,1915129
Proteome profiling of cadmium-induced apoptosis by antibody array analyses in human bronchial epithelial cells.,PMC4868746
"A Comprehensive Review of Internet of Things: Technology Stack, Middlewares, and Fog/Edge Computing Interface. ",PMC8840251
Apical periodontitis and resorption of the root canal wall.,3271680
Experimental basis for the management of dental resorption.,2701095
"Inflammatory resorption: untreated, arrested, prevented.",2640197
Epinephrine permeation across dentin in vitro.,1915126
Tooth splinting: a review of the literature and consideration of the versatility of a wire-composite splint.,2094598
A study of endodontically apexified teeth.,1685990
Comparison between two ultrasonic units in shaping curved canals in teeth using macroradiography.,1782894
Iatrogenic vertical root fractures in endodontically treated teeth.,3073952
Computer identification of snoRNA genes using a Mammalian Orthologous Intron Database.,PMC1184218
Requirement of long progression time for the expression of neoplastic phenotypes following direct perturbation to specific region(s) of DNA of Syrian hamster embryo cells.,3708584
Entrapped air and its effects on dye penetration of voids.,1782904
Bleaching of discoloured root-filled teeth.,3248577
Rapid orthodontic extrusion of crown root and cervical root fractured teeth.,1782893
Dental trauma in contact team sports.,2908308
Developmental anomaly of permanent teeth related to traumatic injury.,2133308
Follow-up study of endodontic status in an adult Swedish population.,1810716
Histological and bacteriological study of pulps extirpated after luxation injuries.,3267527
"Elicited ROS Scavenging Activity, Photoprotective, and Wound-Healing Properties of Collagen-Derived Peptides from the Marine Sponge Chondrosia reniformis. ",PMC6316299
Evidence for an inhibitor of osteoclast attachment in dentinal matrix.,2094599
Case of mistaken identity: periapical cemental dysplasia in an endodontically treated tooth.,2640198
Efficacy of different irrigation methods and concentrations of root canal irrigation solutions on bacteria in the root canal.,1396362
Influence of endodontic materials on the bonding of composite resin to dentin.,1396358
Status of zinc nutrition in Bangladesh: the underlying associations.,PMC4976114
Effect of luxation injuries on permanent teeth.,1810713
Concurrent unilateral chromatid damage and DNA strand breakage in response to 6-thioguanine treatment.,3533081
"Increased risks of polycythemia vera, essential thrombocythemia, and myelofibrosis among 24,577 first-degree relatives of 11,039 patients with myeloproliferative neoplasms in Sweden.",PMC2532797
Selection of Meat Inspection Data for an Animal Welfare Index in Cattle and Pigs in Denmark. ,PMC5742788
Similarities in the microfloras of root canals and deep periodontal pockets.,2202588
Efficient shoot formation on internodal segments and alkaloid formation in the regenerates of Cephaelis ipecacuanha A. Richard.,24220713
Sealing ability of sectional injection thermoplasticized gutta-percha technique with varying distance between needle tip and apical foramen.,1521507
Vertical root fracture and dentin deformation in curved roots: the influence of spreader design.,2094602
Root canal anatomy of mandibular first premolars in a southern Chinese population.,3248581
Restored vitality in luxated teeth assessed by laser Doppler flowmeter.,3078296
Social and environmental determinants of child health in Mongolia across years of rapid economic growth: 2000-2010.,PMC5663099
A systematic approach to preventing intracanal breakage of endodontic files.,2132211
"The yeast plasma membrane ATP binding cassette (ABC) transporter Aus1: purification, characterization, and the effect of lipids on its activity.",PMC3122238
Metastatic carcinoma of the mandible mimicking periapical lesion of endodontic origin.,3248584
Outcomes of Extremely Preterm Infants With Birth Weight Less Than 400 g.,PMC6503635
Covid-19 and some contours of India’s ongoing agrarian crisis Covid-19 y algunos contornos de la actual crisis agraria de la India,PMC7862918
"Epipodial Tentacle Gene Expression and Predetermined Resilience to Summer Mortality in the Commercially Important Greenlip Abalone, Haliotis laevigata.",PMC5405107
Preliminary evaluation of the apical seal of root canals filled with a Teflon-base material.,3271681
"Prevalence of apical periodontitis, crowned teeth and teeth with posts in a Swedish population.",1810715
Multivariate evaluation of pharmacological responses in early clinical trials - a study of rIL-21 in the treatment of patients with metastatic melanoma.,PMC2848411
Long-term paresthesia following inadvertent forcing of sodium hypochlorite through perforation in maxillary incisor.,2637861
Validation of biomarkers of food intake-critical assessment of candidate biomarkers.,PMC5975465
Endodontic treatment of a canine with a talon cusp.,3248583
In vitro efficacy of sodium perborate preparations used for intracoronal bleaching of discolored non-vital teeth.,1915131
Subtraction radiography for the diagnosis of periapical bone lesions.,3078295
Long-term splinting of maxillary incisor with intra-alveolar root fracture.,3248576
Demonstration of Bacteroides intermedius in periapical tissue using indirect immunofluorescence microscopy.,2133307
Subtractive proteomics to identify novel drug targets and reverse vaccinology for the development of chimeric vaccine against Acinetobacter baumannii.,PMC5997985
"Thermal decomposition of [Co(en)3][Fe(CN)6]∙ 2H2O: Topotactic dehydration process, valence and spin exchange mechanism elucidation.",PMC3637566
Permeability of normal versus carious dentin.,1810714
Periodontally derived pulpal lesions.,3251755
Xeroradiography and its application to dentistry.,2700958
Carotenoid intake and adipose tissue carotenoid levels in relation to prostate cancer aggressiveness among African-American and European-American men in the North Carolina-Louisiana prostate cancer project (PCaP).,PMC5080909
Subcellular localization of glutaraldehyde.,2128827
Quantitative chemical study of root canal preparations with calcium hydroxide.,3248572
Periodontal fiber attachment and apical root resorption.,3248580
Applicability of X-ray computerized tomography in endodontics.,2390962
"The cloning of plant E2F, a retinoblastoma-binding protein, reveals unique and conserved features with animal G(1)/S regulators.",PMC148597
The root and root canal anatomy of maxillary molars in a Chinese population.,3248579
Ciprofloxacin treatment of periapical Pseudomonas aeruginosa infection.,3150353
Prevalence and quality of endodontic treatment in an urban adult population in Norway.,3248574
Comparative debridement study between hand and sonic instrumentation of the root canal.,3248582
Prognosis of permanent teeth in the line of mandibular fractures.,1983466
Orofacial pain--troll and control: five topics on clinical problems.,3248575
Root fractures: a case of dental non-intervention.,3267529
Incidence and predictors of bowel obstruction in elderly patients with stage IV colon cancer: a population-based cohort study.,PMC4507521
Pulpal reactions following experimental acute trauma of concussion type on immature dog teeth.,2908326
Resorption and mineralization processes following root fracture of permanent incisors.,3248578
"CO<sub>2</sub> flux emissions from the Earth's most actively degassing volcanoes, 2005-2015.",PMC6443792
The changing antibiotic susceptibility of bloodstream infections in the first month of life: informing antibiotic policies for early- and late-onset neonatal sepsis.,PMC9151171
Unusual DNA conformation at low pH revealed by NMR: parallel-stranded DNA duplex with homo base pairs.,1420168
Vertical crown-root fracture of the mandibular first primary molar in a one-year-old child.,2637860
Optimising risk-based surveillance for early detection of invasive plant pathogens.,PMC7581011
"Role of Physiology, Immunity, Microbiota, and Infectious Diseases in the Gut Health of Poultry. ",PMC8875638
Dens evaginatus in the Hong Kong Chinese population.,3248571
Vps11 and Vps18 of Vps-C membrane traffic complexes are E3 ubiquitin ligases and fine-tune signalling.,PMC6478910
Solubility and biocompatibility of calcium hydroxide-containing root canal sealers.,3267525
Treatment of crown fractured incisors with laminate veneer restorations. An experimental study.,1396359
In vivo efficacy of various retrofills and of CO2 laser in apical surgery.,1915122
"Autophagy in cancer associated fibroblasts promotes tumor cell survival: Role of hypoxia, HIF1 induction and NFκB activation in the tumor stromal microenvironment.",PMC3047617
Relationship of intracanal medicaments to endodontic flare-ups.,2133314
Clinical Implementation of Pharmacogenetic Decision Support Tools for Antidepressant Drug Prescribing.,PMC6774046
Avulsed human teeth replanted within 15 minutes--a long-term clinical follow-up study.,2390966
Local injection of Benadryl for the prevention of iatrogenic endodontic flare-ups.,3251761
Pro- and antiapoptotic markers in upper tract urothelial carcinoma associated with Balkan endemic nephropathy.,PMC3201692
Pest categorisation of <i>Maconellicoccus hirsutus</i>.,PMC8749475
ACE Inhibitory and Antioxidant Activities of Collagen Hydrolysates from the Ribbon Jellyfish (<i>Chrysaora</i> sp.).,PMC5079151
Effect of ultrasonic instrumentation on Bacteroides intermedius.,2598890
Retrograde approaches in endodontic therapy.,1782906
Adolescent and adult perceptions of traditional and novel smokeless tobacco products and packaging in rural Ohio.,PMC4491921
An enigmatic sinus tract origin.,2635107
Parental age and risk of childhood cancer: a pooled analysis.,PMC2738598
An analysis of breakage of ultrasonic files during root canal instrumentation.,2598889
Surgical extrusion of root-fractured teeth--a follow-up study of two surgical methods.,3251760
Damage of the Hertwig's epithelial root sheath: effect upon root growth after autotransplantation of teeth in monkeys.,3267524
Wireless Sensor Networks for Big Data Systems. ,PMC6480280
Neurotoxic and analgesic effects of root canal cements and pulp-protecting dental materials.,3077354
Childhood Maltreatment and PTSD: Spiritual Well-Being and Intimate Partner Violence as Mediators.,PMC4792129
"Vitality of human lip fibroblasts in milk, Hanks balanced salt solution and Viaspan storage media.",1782897
Trends in fracture incidence: a population-based study over 20 years.,PMC3929546
Enamel hypoplasia of a maxillary central incisor.,2637862
Formant measurement in children's speech based on spectral filtering.,PMC4743040
Genetic dissection of seed-iron and zinc concentrations in chickpea.,PMC4827059
"Association of pulmonary, cardiovascular, and hematologic metrics with carbon nanotube and nanofiber exposure among U.S. workers: a cross-sectional study.",PMC5956815
Frequency of dental and traumatic events in the etiology of temporomandibular disorders.,3267528
Toxic effects of various retrograde root filling materials on gingival fibroblasts and rat sarcoma cells.,1289070
Infant High-Grade Gliomas Comprise Multiple Subgroups Characterized by Novel Targetable Gene Fusions and Favorable Outcomes.,PMC8313225
Free-ranging farm cats: home range size and predation on a livestock unit in Northwest Georgia.,PMC4403806
In vivo fractures of endodontically treated posterior teeth restored with enamel-bonded resin.,2133313
Tissue response to dental caries.,3326722
Healing of apical periodontitis after endodontic treatment using three different root canal sealers.,3248573
Canal markings produced by endosonic instruments.,1782900
A comparison of the effects of cresol and eugenol on bovine pulp.,3251756
"Traumatic dental injuries in 3- to 13-year-old boys in Monterrey, Mexico.",1983426
"New data on two remarkable Antarctic species Amblydorylaimusisokaryon (Loof, 1975) Andrássy, 1998 and Pararhyssocolpusparadoxus (Loof, 1975), gen. n., comb. n. (Nematoda, Dorylaimida).",PMC4523744
Etched metal prostheses to retain severely traumatized teeth in function.,2574666
Decision strategies in endodontics: on the design of a recall program.,3119321
Claudin 11 regulates bone homeostasis via bidirectional EphB4-EphrinB2 signaling.,PMC5938033
Occurrence of traumatic injuries in the oromaxillary region of children in a Japanese prefecture.,2908032
Enamel-dentin crown fractures bonded with various bonding agents.,1782898
Diabetes registers in general practice. College reports higher prevalence.,PMC2539217
Functional fixation for traumatically luxated teeth.,3479321
A histobacteriological assessment of nonvital teeth after ultrasonic root canal instrumentation.,2637859
Angiogenesis in upper tract urothelial carcinoma associated with Balkan endemic nephropathy.,PMC3438770
Exploring the links between peptoid antibacterial activity and toxicity.,PMC6072100
Non-invasive molecular imaging of fibrosis using a collagen-targeted peptidomimetic of the platelet collagen receptor glycoprotein VI.,PMC2680759
Incidence of external root resorption and esthetic results in 58 bleached pulpless teeth.,3268415
A six-year follow-up study of sports-related dental injuries in children and adolescents.,1983467
Endodontic treatment and immunopathology of periapical granuloma in an AIDS patient.,2977755
"Sleeping problems and suicide in 75,000 Norwegian adults: a 20 year follow-up of the HUNT I study.",PMC3157656
Toxicity of root canal sealers on rat bone cells in primary culture.,2133311
Regulating Divergent Transcriptomes through mRNA Splicing and Its Modulation Using Various Small Compounds. ,PMC7139312
Aspects of genetic interaction in hybrids of Aspergillus nidulans and Aspergillus rugulosus obtained by protoplast fusion.,6363618
C-shaped root canals in mandibular second molars in a Chinese population.,3267526
Estimated radiation risks associated with endodontic radiography.,2390963
Dentin induction by implants of autolyzed antigen-extracted allogeneic dentin on amputated pulps of dogs.,2640195
The WAVE complex associates with sites of saddle membrane curvature. ,PMC8185649
Effect of brief storage in ATP solution on periodontal healing after replantation of teeth in rats.,2133310
Root form and canal anatomy of mandibular first molars in a southern Chinese population.,3268414
Male and female adult population health status in China: a cross-sectional national survey.,PMC2529296
Image analysis of endodontic radiographs: digital subtraction and quantitative densitometry.,2202590
Pathogenesis and mechanism of traumatic injuries to teeth.,2890518
"Association of resistin polymorphism, its serum levels and prevalence of stroke in Japanese type 2 diabetic patients.",PMC4008008
A technique to reinforce weakened roots with post canals.,3326726
Experimental dental traumatology: development of a model for external root resorption.,2894300
"Prevalence of previous endodontic treatment, technical standard and occurrence of periapical lesions in a randomly selected adult, general population.",2094601
Pulpal response to topical application of citric acid to root dentin.,3268412
Clinical efficacy of an endodontic antiseptic in a controlled release delivery system.,3251758
An in vitro comparison of root canal content extrusion using ultrasonic and hand instrumentation.,1782896
"Toxicological assessment of Xanthigen<sup>®</sup> nutraceutical extract combination: Mutagenicity, genotoxicity and oral toxicity.",PMC6205089
Retrograde root filling with composite and a dentin-bonding agent. 2.,1838330
An atypical tooth fracture due to an indirect trauma mechanism.,3476303
Cloning and characterization of the CarbcL gene related to chlorophyll in pepper (Capsicum annuum L.) under fruit shade stress.,PMC4602107
An enzyme histochemical study of the influence of formocresol and calcium hydroxide on the dental pulp.,3268417
Serum biomarkers for neurofibromatosis type 1 and early detection of malignant peripheral nerve-sheath tumors.,PMC3648455
Inter-laboratory assessment of different digital PCR platforms for quantification of human cytomegalovirus DNA.,PMC5359388
Provider-delivered tobacco dependence treatment to Medicaid smokers.,PMC4015092
Penetration of dentin by different conditioners in vitro: a quantitative study.,3073951
Pulpal response to an anhydrous glass ionomer luting cement.,2639790
Polyamine analysis of infected root canal contents related to clinical symptoms.,2133312
"State and socio-demographic group variation in out-of-pocket expenditure, borrowings and Janani Suraksha Yojana (JSY) programme use for birth deliveries in India.",PMC3570391
The making of an antibiotic.,3304987
Maass cusp forms.,PMC397818
In vitro study of the sealing ability of four retrograde filling materials.,3251759
Evaluation of alternatives to chloroform in endodontic practice.,2639788
Effect of a desensitizing dentifrice on dentinal hypersensitivity.,2639785
Use of an electronic apex locator in the treatment of teeth with incomplete root formation.,2639789
Tissue response to a quaternary ammonium compound in a controlled release delivery system.,3251757
Tissue reactions after experimental luxation injuries in immature rat teeth.,1915123
1H NMR spectroscopy of Paracoccus denitrificans cytochrome c-550.,6087896
Antibiotics in exudate from periapical lesions in dogs.,2640196
Extraradicular endodontic infections.,3472884
Direct pulp capping: a review.,3315643
Late complications of luxation injuries to teeth.,3481570
Painful dysesthesia of the inferior alveolar nerve following use of a paraformaldehyde-containing root canal sealer.,3268418
Evidence for direct inhibition of dentinoclasts by a corticosteroid/antibiotic endodontic paste.,3151884
Retrograde root filling with composite and a dentin-bonding agent. 1.,1838329
Neighborhood socioeconomic and racial disparities in angiography and coronary revascularization: the ARIC surveillance study.,PMC3418426
