Title,ID
Consolidated criteria for strengthening reporting of health research involving indigenous peoples: the CONSIDER statement.,PMC6688310
Vaccination programmes in the Italian military.,12922079
[Bipolar head injury with global amnesia].,14691492
Extracellular Vesicles-Based Biomarkers Represent a Promising Liquid Biopsy in Endometrial Cancer. ,PMC6966595
"Distinct properties of Ca<sup>2+</sup> efflux from brain, heart and liver mitochondria: The effects of Na<sup>+</sup>, Li<sup>+</sup> and the mitochondrial Na<sup>+</sup>/Ca<sup>2+</sup> exchange inhibitor CGP37157.",PMC8187304
"The Impact of Type VI Secretion System, Bacteriocins and Antibiotics on Bacterial Competition of Pectobacterium carotovorum subsp. brasiliense and the Regulation of Carbapenem Biosynthesis by Iron and the Ferric-Uptake Regulator.",PMC6813493
Agranulocytosis Associated With Spironolactone Therapy: A Case Report.,PMC5649688
Directed differentiation and long-term maintenance of epicardial cells derived from human pluripotent stem cells under fully defined conditions.,PMC5630264
Non-invasive neural stem cells become invasive in vitro by combined FGF2 and BMP4 signaling.,PMC3744023
Improved Machine Learning Approach for Wavefront Sensing. ,PMC6720461
Gentamicin-resistant Enterococcus faecalis sequence type 6 with reduced penicillin susceptibility: diagnostic and therapeutic implications.,PMC2953138
Development of Wastewater Pooled Surveillance of Severe Acute Respiratory Syndrome Coronavirus 2 (SARS-CoV-2) from Congregate Living Settings.,PMC8316081
Crystal Structures of Potent Dimeric Positive Allosteric Modulators at the Ligand-Binding Domain of the GluA2 Receptor.,PMC6421545
The function of GORASPs in Golgi apparatus organization in vivo. ,PMC7480117
acNASH index to diagnose nonalcoholic steatohepatitis: a prospective derivation and global validation study.,PMC8495106
CellBIC: bimodality-based top-down clustering of single-cell RNA sequencing data reveals hierarchical structure of the cell type.,PMC6265269
Prevalence of coronary artery calcification in patients undergoing assessment for orthotopic liver transplantation.,19025916
Nanosized [Pd69(CO)36(PEt3)18]: metal-core geometry containing a linear assembly of three face-sharing centered Pd33 icosahedra inside of a hexagonal-shaped Pd30 tube.,12900974
A Bioluminescent 3CLPro Activity Assay to Monitor SARS-CoV-2 Replication and Identify Inhibitors. ,PMC8473059
Diabetic kidney disease in the elderly: prevalence and clinical correlates.,PMC5797340
Black and Hispanic women are less likely than white women to receive guideline-concordant endometrial cancer treatment.,PMC7483220
Machine learning utilising spectral derivative data improves cellular health classification through hyperspectral infra-red spectroscopy.,PMC7491715
"ADAM15 expression is increased in lung CD8<sup>+</sup> T cells, macrophages, and bronchial epithelial cells in patients with COPD and is inversely related to airflow obstruction.",PMC7364636
Effects of potassium alkali and calcium supplementation on bone turnover in postmenopausal women.,15755853
Orbital Angular Momentum (OAM) of Rotating Modes Driven by Electrons in Electron Cyclotron Masers.,PMC5469808
Targeting glioma stem cells in vivo by a G-quadruplex-stabilizing synthetic macrocyclic hexaoxazole.,PMC5472576
"Functional domains of Runx1 are differentially required for CD4 repression, TCRbeta expression, and CD4/8 double-negative to CD4/8 double-positive transition in thymocyte development.",15749889
Brain and testis: more alike than previously thought?,PMC8169208
"Epidemiology and determinants of non-diabetic hyperglycaemia and its conversion to type 2 diabetes mellitus, 2000-2015: cohort population study using UK electronic health records.",PMC7484863
Diversity of Useful Plants in Cabo Verde Islands: A Biogeographic and Conservation Perspective.,PMC9144021
Exploring the economic impact of breast cancers during the 18 months following diagnosis.,17345557
Modeling the Control of COVID-19: Impact of Policy Interventions and Meteorological Factors,
Critical Assessment of Myelography Practices: A Call for Rational Guideline Revision.,PMC7655379
Effects of sports drinks on the maintenance of physical performance during 3 tennis matches: a randomized controlled study.,PMC4190931
Computational design of a PAK1 binding protein.,PMC2903434
Process Mining-Driven Analysis of the COVID19 Impact on the Vaccinations of Victorian Patients,
Resource competition explains rare cannibalism in the wild in livebearing fishes.,PMC9109233
Announcements May 2007,PMC2200730
Complications of open radical retropubic prostatectomy in potential candidates for active monitoring.,18329080
A Hybrid {Silk@Zirconium MOF} Material as Highly Efficient As<sup>III</sup>-sponge.,PMC7283345
Flour and starch characteristics of soft wheat cultivars and their effect on cookie quality.,PMC6801258
Core-modified hexaphyrins; characterization of two- and four-ring inverted 26 pi aromatic macrocycles.,12967317
Recent progress in work on PGD2 antagonists for drugs targeting allergic diseases.,15579050
ETS-related gene (ERG) undermines genome stability in mouse prostate progenitors via Gsk3β dependent Nkx3.1 degradation.,PMC8968219
2-Year research fellowship,PMC2200782
Job stress among GPs: associations with practice organisation in 11 high-income countries.,PMC7363272
A prospective pilotstudy comparing the anesthetic effects of an alpha-2 agonist during holmium laser resection of the prostate and transurethral resection for prostate surgery for benign prostatic hyperplasia patients using selective alpha-1 blockers.,PMC6161351
Oxidative Stress and Endometriosis: A Systematic Review of the Literature.,PMC5625949
"Cardiovascular Pathophysiology, Epidemiology, and Treatment Considerations of Coronavirus Disease 2019 (COVID-19): A Review.",PMC7801216
Structural and functional comparison of 15S- and 15R-specific cyclooxygenases from the coral Plexaura homomalla.,15317588
Announcements May 2007,PMC2219659
Exposure to secondhand smoke in Iranian pregnant women at home and the related factors.,PMC7205101
Natural Cyclopeptides as Anticancer Agents in the Last 20 Years. ,PMC8068844
Combinational blockade of MET and PD-L1 improves pancreatic cancer immunotherapeutic efficacy.,PMC8414725
Possible relationship between general and pregnancy-related anxiety during the first half of pregnancy and the birth process: a prospective cohort study.,PMC5623367
Synthesis of medium ring nitrogen heterocycles via a tandem copper-catalyzed C-N bond formation-ring-expansion process.,15025480
Specific biomarkers of myocardial inflammation and remodeling processes as predictors of mortality in high-risk patients undergoing percutaneous mitral valve repair (MitraClip).,PMC6490071
Ion yield improvement for static secondary ion mass spectrometry by use of polyatomic primary ions.,18401858
Association between prenatal exposure to perfluoroalkyl substances and asthma in 5-year-old children in the Odense Child Cohort.,PMC6858758
The case for not masking away repetitive DNA.,PMC5930866
Reported Māori consumer experiences of health systems and programs in qualitative research: a systematic review with meta-synthesis.,PMC6816189
Identification of small molecule drugs and development of a novel autophagy-related prognostic signature for kidney renal clear cell carcinoma.,PMC7541166
Ubiquitination is essential for recovery of cellular activities after heat shock.,PMC8574219
"Detection of EGFR gene mutations in non-small cell lung cancer: lessons from a single-institution routine analysis of 1,403 tumor samples.",PMC3829780
Effect of statins on cardiovascular events in patients with mild to moderate chronic kidney disease: a systematic review and meta-analysis of randomized clinical trials.,PMC4015624
E-cigarette and waterpipe use in two adolescent cohorts: cross-sectional and longitudinal associations with conventional cigarette smoking.,PMC5889768
Dissecting Breast Cancer Circulating Tumor Cells Competence via Modelling Metastasis in Zebrafish. ,PMC8431683
Generation of Vascularized Neural Organoids by Co-culturing with Mesodermal Progenitor Cells.,PMC7580204
Carcass characteristics and meat quality of purebred Pakchong 5 and crossbred pigs sired by Pakchong 5 or Duroc boar.,PMC6409453
Objectively assessed recess physical activity in girls and boys from high and low socioeconomic backgrounds.,PMC3938069
Mutations in Superoxide Dismutase 1 (Sod1) Linked to Familial Amyotrophic Lateral Sclerosis Can Disrupt High-Affinity Zinc-Binding Promoted by the Copper Chaperone for Sod1 (Ccs). ,PMC7179120
Sperm DNA integrity and male infertility: a narrative review and guide for the reproductive physicians.,PMC9360512
Could the extent of lymphadenectomy be modified by neoadjuvant chemotherapy in cervical cancer? A large-scale retrospective study.,PMC4393094
A novel β-catenin/BCL9 complex inhibitor blocks oncogenic Wnt signaling and disrupts cholesterol homeostasis in colorectal cancer.,PMC9054024
Genome Organization of Sphingobium indicum B90A: An Archetypal Hexachlorocyclohexane (HCH) Degrading Genotype.,PMC5737386
Chromatographic fingerprints analysis and determination of seven components in Danmu preparations by HPLC-DAD/QTOF-MS.,PMC7027017
Type 2 diabetes and its correlates among adults in Bangladesh: a population based study.,PMC4610042
Association of Developmental Venous Anomalies with Demyelinating Lesions in Patients with Multiple Sclerosis.,PMC7410692
Occurrence of antimicrobials in the final effluents of wastewater treatment plants in Canada.,15296302
Global trends on Covid-19 and food security research: A scientometric study,PMC8426152
Coronary blood flow assessment after successful angioplasty for acute myocardial infarction predicts the risk of long-term cardiac events.,15557378
Association of Tumor HER3 Messenger RNA Expression With Panitumumab Efficacy in Advanced Colorectal Cancer.,PMC5933356
"Drugs That Changed Society: Microtubule-Targeting Agents Belonging to Taxanoids, Macrolides and Non-Ribosomal Peptides.",PMC9457747
"Echinococcus multilocularis Infection, Southern Ontario, Canada.",PMC6346450
Waste Coffee Ground Biochar: A Material for Humidity Sensors. ,PMC6412531
The magnitude and impact of tobacco marketing exposure in adolescents' day-to-day lives: An ecological momentary assessment (EMA) study.,PMC6957907
Conditional QTL mapping for waterlogging tolerance in two RILs populations of wheat.,PMC3671099
Comparison of Cell and Organoid-Level Analysis of Patient-Derived 3D Organoids to Evaluate Tumor Cell Growth Dynamics and Drug Response.,PMC7372585
Evaluation of the Phenolic Profile of Castanea sativa Mill. By-Products and Their Antioxidant and Antimicrobial Activity against Multiresistant Bacteria. ,PMC7022504
How growers make decisions impacts plant disease control.,PMC9394827
Ecological correlates of species' roles in highly invaded seed dispersal networks.,PMC7848469
"International epidemiology databases to evaluate AIDS (IeDEA) in sub-Saharan Africa, 2012-2019.",PMC7232622
"Correlations among body condition scores from various sources, dairy form, and cow health from the United States and Denmark.",15377632
Can Intrapartum Cardiotocography Predict Uterine Rupture among Women with Prior Caesarean Delivery?: A Population Based Case-Control Study.,PMC4752316
Thalamic shape: a possible endophenotype.,PMC6671083
Versatile Construction of Single-Tailed Giant Surfactants with Hydrophobic Poly(ε-caprolactone) Tail and Hydrophilic POSS Head. ,PMC6419185
"A Real-Life, International, Observational Study Demonstrating The Efficacy Of A Cosmetic Emulsion In The Supportive Care Of Mild-To-Moderate Facial Acne.",PMC6791409
The status of emergency obstetric and newborn care in post-conflict eastern DRC: a facility-level cross-sectional study.,PMC8356431
Body mass index trajectories from 2 to 18 years - exploring differences between European cohorts.,PMC5347959
Nutritional and Pharmaceutical Applications of Under-Explored Knottin Peptide-Rich Phytomedicines.,PMC9737898
Identification of molecular markers for the Pc39 gene conferring resistance to crown rust in oat.,PMC7064627
Correlation of Incident Potentially Inappropriate Medication Prescriptions and Hospitalization: An Analysis Based on the PRISCUS List.,PMC4883217
Non-invasive assessment of liver alterations in Senning and Mustard patients.,PMC6837929
"The Prevalence, Risk Factors, and Outcomes of Sepsis in Critically Ill Patients in China: A Multicenter Prospective Cohort Study.",PMC7774866
"Early Success With Retention in Care Among People Living With HIV at Decentralized ART Satellite Sites in Yangon, Myanmar, 2015-2016.",PMC6538688
International Disease Epidemics and the Shadow Economy,10.2139/ssrn.3653950
Microfluidic systems in proteomics.,14613180
"[Majority of county councils support ""automatic"" sick listing via telephone].",12362753
Prospective BMI changes in preschool children are associated with parental characteristics and body weight perceptions: the ToyBox-study.,PMC9991669
Three-dimensional curvature mismatch of the acetabular radius to the femoral head radius is increased in borderline dysplastic hips.,PMC7135075
Anti-Lymphangiogenesis Components from Zoanthid Palythoa tuberculosa. ,PMC5852475
Evaluation of Alignment between the Health Claims Nutrient Profiling Scoring Criterion (NPSC) and the Health Star Rating (HSR) Nutrient Profiling Models. ,PMC6115993
Cloning and sequence analysis of the gene encoding LipL32 of Leptospira interrogans serovar Sejroe.,17221365
Incidence and prognosis of liver metastasis at diagnosis: a pan-cancer population-based study.,PMC7269791
Variable Bax antigenicity is linked to keratinocyte position within epidermal strata and UV-induced apoptosis.,18177350
Clofilium inhibits Slick and Slack potassium channels.,PMC3526865
Evaluating CRISPR-based prime editing for cancer modeling and CFTR repair in organoids. ,PMC8356249
Designing and validating a low-cost real time locating system to continuously assess patient wait times.,PMC7324007
Patient-proxy agreement on health-related quality of life in juvenile fibromyalgia syndrome.,PMC6507148
Endogenous CCN family member WISP1 inhibits trauma-induced heterotopic ossification. ,PMC7406255
Probing the Nature of Noncovalent Interactions in Dimers of Linear Tyrosine-Based Dipeptides.,PMC6648619
The year in molecular imaging.,PMC4802868
Human coronavirus spike protein-host receptor recognition.,PMC7604128
A new in vivo cross-linking mass spectrometry platform to define protein-protein interactions in living cells.,PMC4256503
"Late initiation of antenatal care and associated factors among pregnant women in Addis Zemen primary hospital, South Gondar, Ethiopia.",PMC6544982
Nano-nutrition of chicken embryos. The effect of in ovo administration of diamond nanoparticles and L-glutamine on molecular responses in chicken embryo pectoral muscles.,PMC3856104
The association between histological subtype of a first primary endometrial cancer and second cancer risk.,PMC6504982
Ultrasmall CuS@BSA nanoparticles with mild photothermal conversion synergistically induce MSCs-differentiated fibroblast and improve skin regeneration.,PMC6993219
Expression of pigment epithelium-derived factor decreases liver metastasis and correlates with favorable prognosis for patients with ductal pancreatic adenocarcinoma.,15150108
Accurate detection of aneuploidies in array CGH and gene expression microarray data.,15284100
IL-13 is a driver of COVID-19 severity. ,PMC8410056
The Korean Version of the Cognitive Assessment Scale for Stroke Patients (K-CASP): A Reliability and Validity Study.,PMC5532341
"Edwardsiella tarda Ivy, a lysozyme inhibitor that blocks the lytic effect of lysozyme and facilitates host infection in a manner that is dependent on the conserved cysteine residue.",PMC3811778
The Impact of Pretrained Language Models on Negation and Speculation Detection in Cross-Lingual Medical Text: Comparative Study.,PMC7746498
A Systematic Review of the Impact of the First Year of COVID-19 on Obesity Risk Factors: A Pandemic Fueling a Pandemic?,PMC8989548
Intermittent theta-burst stimulation improves motor function by inhibiting neuronal pyroptosis and regulating microglial polarization via TLR4/NFκB/NLRP3 signaling pathway in cerebral ischemic mice.,PMC9188077
Usefulness of comprehensive targeted multigene panel sequencing for neuromuscular disorders in Korean patients.,PMC6785438
"Ethyl 2,7,7-trimethyl-4-(1-methyl-1H-indol-3-yl)-5-oxo-1,4,5,6,7,8-hexa-hydro-quinoline-3-carboxyl-ate.",PMC3588325
Effects of Pimobendan on Prolonging Time to Rehospitalization or Frequency of Rehospitalization in Patients with Heart Failure: A Retrospective Cohort Study Using a Medical Administrative Database (PREFER Study).,PMC7343344
Implementation of an interprofessional medication adherence program for chronic patients in community pharmacies: how much does it cost for the provider?,PMC6323833
Opportunities and Challenges in the Delivery of mRNA-based Vaccines. ,PMC7076378
Advances in the prevention of Alzheimer's Disease.,PMC4447057
Enhancing Crop Yield Prediction Utilizing Machine Learning on Satellite-Based Vegetation Health Indices. ,PMC8840272
The Epigenetic Basis of Individuality.,PMC6294334
Protocol for the Generation of Human Pluripotent Reporter Cell Lines Using CRISPR/Cas9. ,PMC7566848
Impact of Balloon Pulmonary Angioplasty on Hemodynamics and Clinical Outcomes in Patients with Chronic Thromboembolic Pulmonary Hypertension: the Initial Korean Experience.,PMC5760809
Highly diastereoselective multicomponent synthesis of unsymmetrical imidazolines.,12323062
Valine may be the first limiting branched-chain amino acid in egg protein in men.,14608070
Sample storage conditions induce post-collection biases in microbiome profiles.,PMC6307155
Linkage-based genome assembly improvement of oil palm (Elaeis guineensis).,PMC6488618
Many cytokines are very useful therapeutic targets in disease.,PMC2575703
Home-based subcutaneous immunoglobulin for chronic inflammatory demyelinating polyneuropathy patients: A Swiss cost-minimization analysis.,PMC7688145
Comparing Two Neurodevelopmental Disorders Linked to CK2: Okur-Chung Neurodevelopmental Syndrome and Poirier-Bienvenu Neurodevelopmental Syndrome-Two Sides of the Same Coin?,PMC9182197
An Analytical Temperature-Dependent Design Model for Contour-Mode MEMS Resonators and Oscillators Verified by Measurements. ,PMC6068624
Treatment outcomes of intradiscal steroid injection/selective nerve root block for 161 patients with cervical radiculopathy.,PMC4361523
Clinical management of inflammatory bowel disease in the organ recipient.,PMC3974519
Biomimetic device and foreign body reaction cooperate for efficient tumour cell capture in murine advanced ovarian cancer. ,PMC7328160
"Population prevalence of sexually transmitted infections in a high HIV burden district in KwaZulu-Natal, South Africa: Implications for HIV epidemic control.",PMC7484252
Druggable Growth Dependencies and Tumor Evolution Analysis in Patient-Derived Organoids of Neuroendocrine Cancer,10.1101/2022.10.31.514549
Standardized GMP-compliant scalable production of human pancreas organoids.,PMC7055108
Active smoking and risk of breast cancer in a Danish nurse cohort study.,PMC5568272
High-Throughput Glycomic Methods.,PMC9614987
Diagnostic yield and safety of colonoscopy in Israeli patients in an open access referral system.,17413609
Nutrient removal from human fecal sludge digestate in full-scale biological filters.,PMC7397500
"Maternal Exposure to Ambient Air Pollution and Risk of Preeclampsia: A Population-Based Cohort Study in Scania, Sweden. ",PMC7084298
Organizational structures and early mobilization practices in South African public sector intensive care units-A cross-sectional study.,PMC7483254
Effects of Oral Glutamine Supplementation on Early Postnatal Muscle Morphology in Low and Normal Birth Weight Piglets. ,PMC7692811
A method for differentiating human induced pluripotent stem cells toward functional cardiomyocytes in 96-well microplates.,PMC7595118
Investigating the mycobiome of the Holcomb Creosote Superfund Site.,PMC7242165
Compositional variation in early-life parenting structures alters oxytocin and vasopressin 1a receptor development in prairie voles (Microtus ochrogaster).,PMC8486352
"Comparative Study of SPA Mud from ""Bacino Idrominerario Omogeneo dei Colli Euganei (B.I.O.C.E.)-Italy"" and Industrially Optimized Mud for Skin Applications. ",PMC7345495
"Total Synthesis of the Ortho-Hydroxylated Protoberberines ( S)-Govaniadine, ( S)-Caseamine, and ( S)-Clarkeanidine via a Solvent-Directed Pictet-Spengler Reaction.",PMC6328280
The Human Induced Pluripotent Stem Cell Test as an Alternative Method for Embryotoxicity Testing. ,PMC8950674
Multiplex amplified product-length polymorphism analysis for rapid detection of human mitochondrial DNA variations.,11669538
2-(4-Morpholine-carbothio-ylsulfan-yl)-acetic acid.,PMC2979280
"Synthesis of a water-soluble 1,3-bis(diphenylene)-2-phenylallyl radical.",PMC2882179
COVID-19: a crisis of the female self-employed.,PMC8192686
A single-cell view on alga-virus interactions reveals sequential transcriptional programs and infection states.,PMC7239649
Software system to predict the infection in COVID-19 patients using deep learning and web of things.,PMC8441673
Developmental pattern of the cortical topology in high-functioning individuals with autism spectrum disorder.,PMC7814766
Can CO<sub>2</sub> emissions and energy consumption determine the economic performance of South Korea? A time series analysis.,PMC7980802
Painting Materials and Technique for the Expression of Chinese Inheritance in Liu Kang's Huangshan and Guilin Landscapes (1977-1996).,PMC9658206
Visceral fat mass determination in rodent: validation of dual-energy X-ray absorptiometry and anthropometric techniques in fat and lean rats.,PMC3014952
The Transcriptional Profile of Trichophyton rubrum Co-Cultured with Human Keratinocytes Shows New Insights about Gene Modulation by Terbinafine. ,PMC6963840
"Live-cell imaging of rice cytological changes reveals the importance of host vacuole maintenance for biotrophic invasion by blast fungus, Magnaporthe oryzae.",PMC4694143
Heterologous Production of Microbial Ribosomally Synthesized and Post-translationally Modified Peptides.,PMC6092494
The prevalence of HIV among MSM in China: a large-scale systematic analysis.,PMC6880607
First highly regio- and diastereoselective [3+2] cycloaddition of chiral nonracemic Fischer carbene complexes with azomethine ylides: an enantioselective synthesis of (+)-rolipram.,11560324
In Vitro Bioaccessibility and Functional Properties of Phenolic Compounds from Enriched Beverages Based on Cocoa Bean Shell. ,PMC7353536
Silicon-Vacancy Centers in Ultra-Thin Nanocrystalline Diamond Films. ,PMC6187497
"Association of Socioeconomic Position With e-Cigarette Use Among Individuals Who Quit Smoking in England, 2014 to 2019.",PMC7275246
Epicardial and Endocardial Ablation Based on Channel Mapping in Patients With Ventricular Tachycardia and Chronic Chagasic Cardiomyopathy: Importance of Late Potential Mapping During Sinus Rhythm to Recognize the Critical Substrate.,PMC9075208
"Design and efficient synthesis of new stable 1alpha,25-dihydroxy-19-norvitamin D3 analogues containing amide bond.",12443770
Cathepsin L promotes angiogenesis by regulating the CDP/Cux/VEGF-D pathway in human gastric cancer.,PMC7567730
QRS duration predicts 30 day mortality following ST elevation myocardial infarction.,PMC5497163
Achieving High Ortho Selectivity in Aniline C-H Borylations by Modifying Boron Substituents.,PMC6105271
Nutritional Adaptations in Elite Soccer Referees: First Evidence and Perspectives.,PMC4519224
Skin Penetration and Permeation Properties of Transcutol®-Neat or Diluted Mixtures.,PMC6848246
Using Group-Based Trajectory Temperature Modeling to Predict Postoperative Infections after Total Knee Arthroplasty,PMC5631458
WO<sub>3</sub> Nanowires Enhance Molecular Alignment and Optical Anisotropy in Electrospun Nanocomposite Fibers: Implications for Hybrid Light-Emitting Systems.,PMC8961744
BsRADseq: screening DNA methylation in natural populations of non-model species.,PMC4949719
Opioid Prescribing and Polypharmacy in Children with Chronic Musculoskeletal Pain.,PMC6387982
Post-diagnosis weight loss as a prognostic factor in non-small cell lung cancer.,PMC5803614
Urine Neutrophil Gelatinase-associated Lipocalin (NGAL) for Prediction of Persistent AKI and Major Adverse Kidney Events.,PMC7250906
A Serious Game Approach to Improve Food Behavior in Families-A Pilot Study. ,PMC7284603
Is different better?: models of teaching and their influence on the net financial outcome for general practice teaching posts.,PMC3146948
Fibrosis imaging: Current concepts and future directions.,PMC6130769
Yolk sac tumor of the ovary in a young girl with tuberous sclerosis: A case report and review of the literature.,PMC4434146
Transient rapamycin treatment during developmental stage extends lifespan in Mus musculus and Drosophila melanogaster.,PMC9442325
Body mass index development from birth to early adolescence; effect of perinatal characteristics and maternal migration background in a Swedish cohort.,PMC4193784
The Central Vein: FLAIR Signal Abnormalities Associated with Developmental Venous Anomalies in Patients with Multiple Sclerosis.,PMC7655358
TNFAIP3 genetic polymorphisms reduce ankylosing spondylitis risk in Eastern Chinese Han population.,PMC6629655
Vitamin D Supplementation and Cognition in People with Type 2 Diabetes: A Randomized Control Trial.,PMC6875298
Copper-zinc superoxide dismutase (Sod1) activation terminates interaction between its copper chaperone (Ccs) and the cytosolic metal-binding domain of the copper importer Ctr1.,PMC6647829
"Healthcare expenditures for privately insured US patients with cystic fibrosis, 2010-2016.",PMC6688469
