Title,ID
The Optimal Treatment Plan to Avoid Axillary Lymph Node Dissection in Early-Stage Breast Cancer Patients Differs by Surgical Strategy and Tumor Subtype.,PMC5697709
Targeting the Extracellular Matrix in Abdominal Aortic Aneurysms Using Molecular Imaging Insights. ,PMC7962044
Determinants of maternal healthcare utilisation among pregnant women in Southern Ethiopia: a multi-level analysis.,PMC9898958
[The cutting-edge of medicine; Towards adult stem cell-based therapy for intestinal diseases].,23356176
Opto-E-cadherin: Optogenetic control over cell-cell adhesions,10.21203/rs.3.rs-2512247/v1
Surgical site infections caused by multi-drug resistant organisms: a case-control study in general surgery.,PMC9481497
Optimization of a Microwave Assisted Extraction Method for Maximum Flavonols and Antioxidant Activity of Onion Extracts.,PMC9774159
Insights into the Mechanisms of Neuromuscular Fatigue in Boys and Men.,25970661
"Virus Diversity, Abundance, and Evolution in Three Different Bat Colonies in Switzerland.",PMC9505930
Deep Learning Analysis of Polish Electronic Health Records for Diagnosis Prediction in Patients with Cardiovascular Diseases.,PMC9225281
Pediatric Obesity and Perceived Exertion: Difference Between Weight-Bearing and Non-Weight-Bearing Exercises Performed at Different Intensities.,26090822
Preoperative serum CA19-9 should be routinely measured in the colorectal patients with preoperative normal serum CEA: a multicenter retrospective cohort study.,PMC9454113
VDR Gene variation and insulin resistance related diseases.,PMC5563043
Pregnancy and fetal outcomes of chronic hepatitis C mothers with viremia in China.,PMC9494928
Determination of glucosamine and its derivatives released from photocrosslinked gelatin hydrogels using HPLC.,26053464
Optimization of Cyclodextrin-Assisted Extraction of Phenolics from <i>Helichrysum italicum</i> for Preparation of Extracts with Anti-Elastase and Anti-Collagenase Properties.,PMC9959134
CENIT (Impact of Cardiac Exercise Training on Lipid Content in Coronary Atheromatous Plaques Evaluated by Near-Infrared Spectroscopy): A Randomized Trial.,PMC9238565
[Dermatologic surgery on the scalp].,25394521
Estimating the impact of the COVID-19 pandemic on diagnosis and survival of five cancers in Chile from 2020 to 2030: a simulation-based analysis.,PMC8415898
Modified silaffin R5 peptides enable encapsulation and release of cargo molecules from biomimetic silica particles.,23643899
Evaluation of the efficacy and tolerance of a short 7 day third-generation cephalosporin treatment in the management of acute pyelonephritis in young women in the emergency department.,26903277
Hydropersulfides (RSSH) Outperform Post-Conditioning and Other Reactive Sulfur Species in Limiting Ischemia-Reperfusion Injury in the Isolated Mouse Heart.,PMC9137952
Development of a Prediction Model to Estimate the Glycemic Load of Ready-to-Eat Meals. ,PMC8625555
Regional disparities in postnatal care among mothers aged 15-49 years old: An analysis of the Indonesian Demographic and Health Survey 2017.,PMC8323067
Conductivity Behaviour under Pressure of Copper Micro-Additive/Polyurethane Composites (Experiment and Modelling).,PMC9002542
Moderate-to-vigorous group aerobic exercise versus group leisure activities for mild-to-moderate depression in adolescents: study protocol for a multicentre randomised controlled trial.,PMC9274524
cAMP signaling regulates platelet myosin light chain (MLC) phosphorylation and shape change through targeting the RhoA-Rho kinase-MLC phosphatase signaling pathway.,24100445
The Influence of Environmental Conditions on Intake Behavior and Activity by Feedlot Steers Fed Corn or Barley-Based Diets. ,PMC8145294
Multisystem Inflammatory Syndrome in Children Admitted to a Tertiary Pediatric Intensive Care Unit.,PMC9894696
Seminal Vesicle Involvement by Carcinoma In Situ of the Bladder: Clonal Analysis Using Next-Generation Sequencing to Elucidate the Mechanism of Tumor Spread.,PMC7577816
Effects of lung and airway epithelial maturation cocktail on the structure of lung bud organoids.,PMC6042463
Focus on renal blood flow in mechanically ventilated patients with SARS-CoV-2: a prospective pilot study.,PMC7775615
Application of Omaha system-based continuing care in patients with retained double J tube after urinary calculus surgery.,PMC8129280
Bioinformatics analyses of the pathogenesis and new biomarkers of chronic obstructive pulmonary disease.,PMC8601278
Translation of immunomodulatory therapy to treat chronic heart failure: Preclinical studies to first in human.,PMC10079025
"Draft genome assemblies and predicted microRNA complements of the intertidal lophotrochozoans Patella vulgata (Mollusca, Patellogastropoda) and Spirobranchus (Pomatoceros) lamarcki (Annelida, Serpulida).",26319627
Differentiated mouse kidney tubuloids as a novel <i>in vitro</i> model to study collecting duct physiology.,PMC9905633
Systematic review of biochemical biomarkers for neck and upper-extremity musculoskeletal disorders.,26599377
Children with flat feet have weaker toe grip strength than those having a normal arch.,PMC4681939
Understanding Depression from Psycholinguistic Patterns in Social Media Texts,PMC7148066
Importance of Foot and Leg Structure for Beef Cattle in Forage-Based Production Systems.,PMC9913362
Effect of Work-Related Sedentary Time on Overall Health Profile in Active vs. Inactive Office Workers.,PMC6174317
Next-Generation Grade and Survival Expression Biomarkers of Human Gliomas Based on Algorithmically Reconstructed Molecular Pathways.,PMC9266372
Systemic approaches using single cell transcriptome reveal that C/EBPγ regulates autophagy under amino acid starved condition.,PMC9303372
Eating habits and lifestyle Changes during COVID-19 lockdown: an Italian survey,10.21203/rs.3.rs-30403/v1
Single-Cell Analysis Identifies LY6D as a Marker Linking Castration-Resistant Prostate Luminal Cells to Prostate Progenitors and Cancer.,PMC6315111
Increased Carrier Peptide Stability through pH Adjustment Improves Insulin and PTH(1-34) Delivery In Vitro and In Vivo Rather than by Enforced Carrier Peptide-Cargo Complexation. ,PMC7589992
Selection and identification of a DNA aptamer that mimics saxitoxin in antibody binding.,23480547
Stochastic Virtual Population of Subjects With Type 1 Diabetes for the Assessment of Closed-Loop Glucose Controllers.,23864149
PHGDH Inhibits Ferroptosis and Promotes Malignant Progression by Upregulating SLC7A11 in Bladder Cancer.,PMC9461664
An augmented food strategy leads to complete energy compensation during a 15-day military training expedition in the cold.,PMC8165736
Senescence-Induced Vascular Remodeling Creates Therapeutic Vulnerabilities in Pancreas Cancer.,PMC7278897
Impact of fasting on stress systems and depressive symptoms in patients with major depressive disorder: a cross-sectional study.,PMC9091273
Reported sources of health inequities in Indigenous Peoples with chronic kidney disease: a systematic review of quantitative studies.,PMC8299576
Association between Inflammatory Bowel Disease and Pancreatitis: A PRISMA-Compliant Systematic Review.,PMC7422476
DNA damage triggers squamous metaplasia in human lung and mammary cells via mitotic checkpoints.,PMC9867756
Case report: Novel phenotype in central 22q11.2 deletion syndrome.,PMC7752388
Revisiting the Nordic long-term care model for older people-still equal?,PMC9062627
Vitamin D Supplementation for the Treatment of Depressive Symptoms in Women with Type 2 Diabetes: A Randomized Clinical Trial.,PMC8913152
Platelet lysate outperforms FCS and human serum for co-culture of primary human macrophages and hMSCs.,PMC6401182
Antisense Oligonucleotide Therapy for Spinocerebellar Ataxias: Good News for Terrible Diseases.,PMC6336412
"Examination of Medication Use Patterns by Age Group, Comorbidity, and Month in COVID-19 Positive Patients in a Large State-wide Health System During the Pandemic in 2020",10.1101/2021.07.15.21259539
Sphingosine-1-Phosphate (S1P) Lyase Inhibition Aggravates Atherosclerosis and Induces Plaque Rupture in <i>ApoE<sup>-/-</sup></i>Mice.,PMC9455951
Costs Associated with the Treatment of Clostridioides Difficile Infections. ,PMC8307892
"Lysophosphatidic acid stimulates activation of focal adhesion kinase and paxillin and promotes cell motility, via LPA1-3, in human pancreatic cancer.",24061591
Metabolite Profiling of Alangium salviifolium Bark Using Advanced LC/MS and GC/Q-TOFTechnology. ,PMC7821929
Self-poisoning in the acute care medicine 2005-2012.,25951922
Real-World Three-Year Clinical Outcomes of Biolimus-Eluting Stents versus Other Contemporary Drug-Eluting Stents in Patients with Acute Myocardial Infarction Patients: Data from the Korea Acute Myocardial Infarction Registry (KAMIR).,PMC8315886
"The bigger, the stronger? Insights from muscle architecture and nervous characteristics in obese adolescent girls.",26285605
Plutonium transport in the environment.,23458827
Corn versus Barley in Finishing Diets: Effect on Steer Performance and Feeding Behavior. ,PMC8064474
Reduced neural responses to food cues might contribute to the anorexigenic effect of acute exercise observed in obese but not lean adolescents.,PMC5842668
Correspondence: Reply to 'Phantom phonon localization in relaxors'.,PMC5717196
Breastfeeding and motor development in term and preterm infants in a longitudinal US cohort.,PMC5698835
Can prognostic nutritional index and systemic immune-inflammatory index predict disease severity in COVID-19?,PMC8420107
Health-Related Quality of Life and Mental Well-Being during the COVID-19 Pandemic in Five Countries: A One-Year Longitudinal Study.,PMC9654255
`Risk of cardiovascular disease associated with febuxostat versus allopurinol use in patients with gout: a retrospective cohort study in Korea.,PMC9898368
Fear of recurrence or progression as a link between somatic symptoms and perceived stress among cancer survivors.,PMC5500975
Clinical outcome and indications for palliative gastrojejunostomy in unresectable advanced gastric cancer: multi-institutional retrospective analysis.,23715966
Impact of a hydrophobic ion on the early stage of atmospheric aerosol formation.,PMC6842599
Role of Dietary Methyl Sulfonyl Methane in Poultry.,PMC9913537
Children have a reduced maximal voluntary activation level of the adductor pollicis muscle compared to adults.,25694208
"Impact of bacterial aerosol, particulate matter, and microclimatic parameters on animal welfare in Chorzów (Poland) zoological garden.",PMC7788024
Sequences Encoding a Novel Toursvirus Identified from Southern and Northern Corn Rootworms (Coleoptera: Chrysomelidae). ,PMC8879594
Establishment and Culture of Human Intestinal Organoids Derived from Adult Stem Cells.,PMC9285512
The Rise of IGFBP4 in People with Obstructive Sleep Apnea and Multilevel Sleep Surgery Recovers Its Basal Levels.,PMC8505101
Catalytic amine-borane dehydrogenation by a PCP-pincer palladium complex: a combined experimental and DFT analysis of the reaction mechanism.,23282977
Physical activity initiated by employer induces improvements in a novel set of biomarkers of inflammation: an 8-week follow-up study.,PMC5346428
Clinical thresholds in pain-related facial activity linked to differences in cortical network activation in neonates.,PMC10108588
Long-term risk of ischemic heart disease after adjuvant radiotherapy in breast cancer: results from a large population-based cohort.,PMC6977272
Messenger RNA and MicroRNA transcriptomic signatures of cardiometabolic risk factors.,PMC5299677
Neglect: failure to thrive and obesity.,25242707
Polymer film-based microwell array platform for long-term culture and research of human bronchial organoids.,PMC10060184
Recurrence and survival among breast cancer patients achieving a pathological complete response to neoadjuvant chemotherapy.,26272743
Concurrent use of statins decreases major bleeding and intracerebral hemorrhage in non-valvular atrial fibrillation patients taking direct oral anticoagulants-A nationwide cohort study.,PMC9393418
Estimating the cause-specific relative risks of non-optimal temperature on daily mortality: a two-part modelling approach applied to the Global Burden of Disease Study.,PMC8387975
Multimodality Advanced Cardiovascular and Molecular Imaging for Early Detection and Monitoring of Cancer Therapy-Associated Cardiotoxicity and the Role of Artificial Intelligence and Big Data.,PMC8964995
Cross-modal binding in developmental dyslexia.,23773185
Fasting Hormones Synergistically Induce Amino Acid Catabolism Genes to Promote Gluconeogenesis.,PMC8346669
The Progress of Smart Elderly Care Research: A Scientometric Analysis Based on CNKI and WOS.,PMC9859223
"Campylobacter portucalensis sp. nov., a new species of Campylobacter isolated from the preputial mucosa of bulls.",PMC6953823
Update on the Brassicaceae species checklist.,PMC7952366
Dexamethasone as an Analgesic Adjunct for Postcesarean Delivery Pain: A Randomized Controlled Trial.,PMC8486547
The Road from Pathological Narcissism to Suicidality in Adolescence: An Empirical Study. ,PMC8469779
The Association between Trajectories of Anthropometric Variables and Risk of Diabetes among Prediabetic Chinese.,PMC8706558
Drug repositioning in non-small cell lung cancer (NSCLC) using gene co-expression and drug-gene interaction networks analysis.,PMC9177601
"Marital status and survival in patients with soft tissue sarcoma: A population-based, propensity-matched study.",PMC6382714
A juvenile locomotor program promotes vocal learning in zebra finches.,PMC9187677
A family carer decision support intervention for people with advanced dementia residing in a nursing home: a study protocol for an international advance care planning intervention (mySupport study).,PMC9607827
Cerebral Venous Sinus Thrombosis following COVID-19 Vaccination: Analysis of 552 Worldwide Cases. ,PMC8874972
Pien Tze Huang induces apoptosis and inhibits proliferation of 5-fluorouracil-resistant colorectal carcinoma cells via increasing miR-22 expression.,PMC5639424
Comprehensive Analysis of Endoplasmic Reticulum Stress in Intracranial Aneurysm.,PMC9022475
Impact of Varicocele Repair on Semen Parameters in Infertile Men: A Systematic Review and Meta-Analysis.,PMC10042659
Epidemiologic Trends of Viral Skin Infections in Egypt: A Cross-Sectional Hospital-Based Study.,PMC6457287
"Whole-exome sequencing identifies ADAM10 mutations as a cause of reticulate acropigmentation of Kitamura, a clinical entity distinct from Dowling-Degos disease.",23666529
Follow-Up of Advanced Parkinson's Disease Patients after Clinical or Surgical Emergencies: A Practical Approach.,PMC7647779
"High diagnostic yield in skeletal ciliopathies using massively parallel genome sequencing, structural variant screening and RNA analyses.",PMC8472897
Quantification and identification of particle-associated bacteria in unchlorinated drinking water from three treatment plants by cultivation-independent methods.,23618316
[Sonographic imaging of the prostate].,25023241
Intestinal Region-Specific and Layer-Dependent Induction of TNFα in Rats with Streptozotocin-Induced Diabetes and after Insulin Replacement. ,PMC8466257
Cohort study of the characteristics and outcomes in patients with COVID-19 and in-hospital cardiac arrest.,PMC8635887
"Enhanced chemical stability, chromatic properties and regeneration of betalains in Rivina humilis L. berry juice",10.1016/j.lwt.2014.03.027
Synthesis of functionalized acenaphthenes and a new class of homooxacalixarenes.,22724527
A meta-analysis of the local application of vancomycin powder to prevent surgical site infection after spinal surgeries.,PMC7391445
How can multimodality be used to design usable interfaces in IPS2 for older employees?,22317257
"Synthesis, Photophysical and Electronic Properties of Mono-, Di-, and Tri-Amino-Substituted Ortho-Perylenes, and Comparison to the Tetra-Substituted Derivative.",PMC7540539
Impossible Movement Illusions.,PMC6305988
Internal Polymerization of Epoxy Group of Epoxidized Natural Rubber by Ferric Chloride and Formation of Strong Network Structure. ,PMC8659828
An Enhanced Tree Routing Based on Reinforcement Learning in Wireless Sensor Networks.,PMC9824047
Change in the Use of Fractionation in Radiotherapy Used for Early Breast Cancer at the Start of the COVID-19 Pandemic: A Population-Based Cohort Study of Older Women in England and Wales.,PMC9151525
"Digital Economy, Agricultural Technological Progress, and Agricultural Carbon Intensity: Evidence from China.",PMC9180528
iRGD-coupled responsive fluorescent nanogel for targeted drug delivery.,23410678
SARS-CoV-2 Amino Acid Mutations Detection in Greek Patients Infected in the First Wave of the Pandemic.,PMC9322066
Age-Related Effects of COVID-19 Pandemic on Mechanical Reperfusion and 30-Day Mortality for STEMI: Results of the ISACS-STEMI COVID-19 Registry.,PMC10059932
Intraoperative care of elderly patients with COVID-19 undergoing double lung transplantation: Two case reports.,PMC7716330
Preoperative platelet/lymphocyte ratio is a superior prognostic factor compared to other systemic inflammatory response markers in ovarian cancer patients.,26063409
Length-dependent motions of SARS-CoV-2 frameshifting RNA pseudoknot and alternative conformations suggest avenues for frameshifting suppression.,PMC9310368
The EWAS Catalog: a database of epigenome-wide association studies.,PMC9096146
"Trends and Inequalities in the Incidence of Acute Myocardial Infarction among Beijing Townships, 2007-2018.",PMC8656834
Novel Neplanocin A Derivatives as Selective Inhibitors of Hepatitis B Virus with a Unique Mechanism of Action.,PMC9211404
Reduced neural response to food cues following exercise is accompanied by decreased energy intake in obese adolescents.,26449418
Improvement of asymmetric thyroid eye disease with teprotumumab.,PMC9132868
A STING-based biosensor affords broad cyclic dinucleotide detection within single living eukaryotic cells.,PMC7363834
Is ultrasound-guided procedure entirely reliable?,PMC5645578
"BAR, SOFT AND DRI POST-HEPATIC TRANSPLANTATION: WHAT IS THE BEST FOR SURVIVAL ANALYSIS?",PMC8195467
Modal share changes due to COVID-19: The case of Budapest.,PMC7290209
Efficacy of recruitment maneuver for improving the brain dead marginal lungs to ideal.,24314951
Imaging the Gouy phase shift in photonic jets with a wavefront sensor.,22940939
Diabetes mellitus in dialysis and renal transplantation.,PMC8495524
The status and analysis of common mutations found in the SARS-CoV-2 whole genome sequences from Bangladesh.,PMC8977224
β-cyclodextrin-poly(β-amino ester) nanoparticles for sustained drug delivery across the blood-brain barrier.,23066958
Ligand-Constraint-Induced Peroxide Activation for Electrophilic Reactivity.,PMC8252416
Dielectric Tunability Properties in (110)-Oriented Epitaxial 0.5Ba(Ti0.8Zr0.2)O3-0.5(Ba0.7Ca0.3)TiO3 Thin Films Prepared by PLD Method. ,PMC7662516
Association of Vascular Properties With the Brain White Matter Hyperintensity in Middle-Aged Population.,PMC9238713
"Genomic Features of High-Priority Salmonella enterica Serovars Circulating in the Food Production Chain, Brazil, 2000-2016.",PMC6667439
Simultaneous determination of refractive index and thickness of moderately thick plane-parallel transparent glass plates using cyclic path optical configuration setup and a lateral shearing interferometer.,22695591
Elevation of preoperative recipient aqueous cytokine levels in eyes with primary graft failure after corneal transplantation.,PMC6139874
Analysis on the Social Environment of College Students' Rural Employment and Entrepreneurship.,PMC9296296
CMR for myocardial characterization in ischemic heart disease: state-of-the-art and future developments.,PMC7990980
CORR Insights®: fractures in geriatric mice show decreased callus expansion and bone volume.,PMC4182377
Variation in Cause-Specific Mortality Rates in Italy during the First Wave of the COVID-19 Pandemic: A Study Based on Nationwide Data. ,PMC8776013
Triclustering-based classification of longitudinal data for prognostic prediction: targeting relevant clinical endpoints in amyotrophic lateral sclerosis.,PMC10105751
"Immunomodulatory Activity of Extracellular Vesicles of Kimchi-Derived Lactic Acid Bacteria (Leuconostoc mesenteroides, Latilactobacillus curvatus, and Lactiplantibacillus plantarum). ",PMC8834128
Influences of assisted breathing and mechanical ventilator settings on tidal volume and alveolar pressures in acute respiratory distress syndrome: a bench study.,PMC8889593
Integrated omics approach to unveil antifungal bacterial polyynes as acetyl-CoA acetyltransferase inhibitors.,PMC9098870
Use of platelet-rich plasma and modified nanofat grafting in infected ulcers: Technical refinements to improve regenerative and antimicrobial potential.,PMC7264902
Prognostic Value of Enolase Gene Family in Colon Cancer.,PMC7401828
Sequence Capture of Mitochondrial Genome with PCR-Generated Baits Provides New Insights into the Biogeography of the Genus Abies Mill. ,PMC8954396
A novel risk-scoring system conducing to chemotherapy decision for patients with pancreatic ductal adenocarcinoma after pancreatectomy.,PMC8176415
Lack of catch-up in weight gain may intermediate between pregnancies with hyperemesis gravidarum and reduced fetal growth: the Japan Environment and Children's Study.,PMC8917715
Genome-Wide Investigation of Maximum Habitual Alcohol Intake in US Veterans in Relation to Alcohol Consumption Traits and Alcohol Use Disorder.,PMC9614582
The Effect of Vitamin D Supplementation on Insulin Resistance among Women with Polycystic Ovary Syndrome.,PMC6724384
"Generation, Maintenance and HBV Infection of Human Liver Organoids.",PMC8983161
Stereotactic body radiotherapy plus transcatheter arterial chemoembolization for inoperable hepatocellular carcinoma patients with portal vein tumour thrombus: A meta-analysis.,PMC9122181
Introduction to the Special Issue Teacher Educators for Children with Behavioral Disorders (TECBD) Conference.,PMC7389157
IgG antibodies in food allergy influence allergen-antibody complex formation and binding to B cells: a role for complement receptors.,23997216
Propensity-Matched Analysis of Sigmoidectomies for Diverticular Disease. ,PMC6328361
p53 Promotes Differentiation of Cardiomyocytes from hiPSC through Wnt Signaling-Mediated Mesendodermal Differentiation.,PMC8611312
Energy intake adaptations to acute isoenergetic active video games and exercise are similar in obese adolescents.,25804270
Circulating monocytes are reduced by sphingosine-1-phosphate receptor modulators independently of S1P3.,23436932
Dyslexia and fluency: parafoveal and foveal influences on rapid automatized naming.,22924951
"The Expression and Role Analysis of Methylation-Regulated Differentially Expressed Gene UBE2C in Pan-Cancer, Especially for HGSOC.",PMC9264902
MicroRNA-29 in the adaptive immune system: setting the threshold.,22971773
Effect of muscle length on voluntary activation level in children and adults.,25083726
Growth patterns and nutritional status of small for gestational age infants in Malaysia during the first year of life.,PMC8650951
Targeting collagen for diagnostic imaging and therapeutic delivery.,PMC4936964
"Impacts of Rumen Degradable or Undegradable Protein Supplementation with or without Salt on Nutrient Digestion, and VFA Concentrations. ",PMC8614571
Impact and effect mechanisms of mass campaigns in resource-constrained health systems: quasi-experimental evidence from polio eradication in Nigeria. ,PMC7942242
"Tobacco Advertising and ID Checks in Columbus, Ohio, in Advance of Tobacco 21.",PMC7808558
An International Consensus on Actions to Improve Lung Cancer Survival: A Modified Delphi Method Among Clinical Experts in the International Cancer Benchmarking Partnership.,PMC9596933
Impact of Weather on Pedestrians' Slip Risk. ,PMC8910018
Distribution Pattern Analysis of Cortical Brain Infarcts on Diffusion-Weighted Magnetic Resonance Imaging: A Hypothesis-Generating Approach to the Burden of Silent Embolic Stroke.,PMC9673729
"Effects of Dietary Organic and Inorganic Sulfur on Laying Performance, Egg Quality, Ileal Morphology, and Antioxidant Capacity in Laying Hens. ",PMC8749785
Lower-normal TSH is associated with better metabolic risk factors: A cross-sectional study on Spanish men.,26552743
Colloidal crystallization of surfactant-free ZnO quantum dots.,22069245
Patient-Sharing Networks of Physicians and Health Care Utilization and Spending Among Medicare Beneficiaries.,PMC5833496
Revisiting Solution-Based Processing of van der Waals Layered Materials for Electronics.,PMC9928402
Genetic  diversity of Lagerstroemia (Lythraceae) species assessed by simple  sequence repeat markers.,23079847
Effects of CsSn<sub>x</sub>Pb<sub>1-x</sub>I<sub>3</sub> Quantum Dots as Interfacial Layer on Photovoltaic Performance of Carbon-Based Perovskite Solar Cells.,PMC8085196
"Sleep, Diet, Physical Activity, and Stress during the COVID-19 Pandemic: A Qualitative Analysis. ",PMC8945701
8-azaadenosine and 8-chloroadenosine are not selective inhibitors of ADAR.,PMC9113518
"Repellency Mechanism of Natural Guar Gum-Based Film Incorporated with Citral against Brown Planthopper, Nilaparvata lugens (Stål) (Hemiptera: Delphacidae). ",PMC8776237
How do cohabitation and marital status affect mortality risk? Results from a cohort study in Thailand.,PMC9486337
Coupling machine learning and epidemiological modelling to characterise optimal fungicide doses when fungicide resistance is partial or quantitative,10.1101/2022.09.17.508365
Critical Role of Maternal Selenium Nutrition in Neurodevelopment: Effects on Offspring Behavior and Neuroinflammatory Profile.,PMC9104078
Impact of Water Temperature on Heart Rate Variability during Bathing. ,PMC8145520
Hyperbranched polymeric N-oxide: a novel kind of metal-free photocatalyst.,22377679
