Title,ID
Ablation of Transcription Factor IRF4 Promotes Transplant Acceptance by Driving Allogenic CD4+ T Cell Dysfunction.,29221730
Human Commensal <i>Prevotella histicola</i> Ameliorates Disease as Effectively as Interferon-Beta in the Experimental Autoimmune Encephalomyelitis.,33362764
Memory CD4+ T cells enhance B-cell responses to drifting influenza immunization.,30548475
IFN-γ Critically Enables the Intratumoural Infiltration of CXCR3+ CD8+ T Cells to Drive Squamous Cell Carcinoma Regression. ,33925140
Abrogation of IFN-γ Signaling May not Worsen Sensitivity to PD-1/PD-L1 Blockade. ,32155707
RAMP1 in Kupffer cells is a critical regulator in immune-mediated hepatitis.,30462657
Targeting the MAPK and PI3K pathways in combination with PD1 blockade in melanoma.,28123875
Anti-CTLA-4 synergizes with dendritic cell-targeted vaccine to promote IL-3-dependent CD4<sup>+</sup> effector T cell infiltration into murine pancreatic tumors.,30945313
Commensal Candida albicans Positively Calibrates Systemic Th17 Immunological Responses.,30870622
Recombinant Mycobacterium smegmatis with a pMyong2 vector expressing Human Immunodeficiency Virus Type I Gag can induce enhanced virus-specific immune responses.,28300196
ADAM10 and Notch1 on murine dendritic cells control the development of type 2 immunity and IgE production.,28745029
Prostaglandin D2 signaling in dendritic cells is critical for the development of EAE.,32624353
The metabolic hormone leptin promotes the function of T<sub>FH</sub> cells and supports vaccine responses.,34031386
IL-10 Deficiency Accelerates Type 1 Diabetes Development <i>via</i> Modulation of Innate and Adaptive Immune Cells and Gut Microbiota in <i>BDC2.5</i> NOD Mice.,34394099
Combination therapy with L-arginine and α-PD-L1 antibody boosts immune response against osteosarcoma in immunocompetent mice.,28045576
IL22 Promotes <i>Kras</i>-Mutant Lung Cancer by Induction of a Protumor Immune Response and Protection of Stemness Properties.,29764837
OX40L-JAG1-Induced Expansion of Lineage-Stable Regulatory T Cells Involves Noncanonical NF-κB Signaling.,31704879
Enrichment of intestinal Lactobacillus by enhanced secretory IgA coating alters glucose homeostasis in P2rx7<sup>-/-</sup> mice.,31249344
Generation and Characterization of Universal Live-Attenuated Influenza Vaccine Candidates Containing Multiple M2e Epitopes. ,33153089
SLAM family receptors control pro-survival effectors in germinal center B cells to promote humoral immunity. ,33237304
Interferon regulatory factor 1 (IRF-1) downregulates Checkpoint kinase 1 (CHK1) through miR-195 to upregulate apoptosis and PD-L1 expression in Hepatocellular carcinoma (HCC) cells.,33772151
Oncolytic Herpes Simplex Virus Encoding IL12 Controls Triple-Negative Breast Cancer Growth and Metastasis.,32266155
Intratumoral co-injection of the poly I:C-derivative BO-112 and a STING agonist synergize to achieve local and distant anti-tumor efficacy. ,34824158
Sepsis induces long-lasting impairments in CD4+ T-cell responses despite rapid numerical recovery of T-lymphocyte populations.,30730978
Nlrp12 Mediates Adverse Neutrophil Recruitment during Influenza Virus Infection.,29282312
Prostaglandin E2 promotes intestinal inflammation via inhibiting microbiota-dependent regulatory T cells. ,33579710
LincRNA-immunity landscape analysis identifies EPIC1 as a regulator of tumor immune evasion and immunotherapy resistance.,33568470
The sialyltransferase ST3Gal-IV guides murine T-cell progenitors to the thymus.,32380539
Pre-existing neutralizing antibodies prevent CD8 T cell-mediated immunopathology following respiratory syncytial virus infection.,31844172
Molecular Imaging of Chimeric Antigen Receptor T Cells by ICOS-ImmunoPET.,33087332
Valproic acid inhibits interferon-γ production by NK cells and increases susceptibility to Listeria monocytogenes infection.,33082490
Alterations in antigen-specific naive CD4 T cell precursors after sepsis impairs their responsiveness to pathogen challenge.,25595784
CD8+ T cell-independent tumor regression induced by Fc-OX40L and therapeutic vaccination in a mouse model of glioma.,24293627
The Firre locus produces a trans-acting RNA molecule that functions in hematopoiesis.,31723143
"Local Irradiation Sensitized Tumors to Adoptive T Cell Therapy via Enhancing the Cross-Priming, Homing, and Cytotoxicity of Antigen-Specific CD8 T Cells.",31921127
Structural Analyses of a Dominant Cryptosporidium parvum Epitope Presented by H-2K<sup>b</sup> Offer New Options To Combat Cryptosporidiosis.,36602309
Immunological dynamics after subcutaneous immunization with a squalene-based oil-in-water adjuvant.,33411367
"Discovery and characterization of high-affinity, potent SARS-CoV-2 neutralizing antibodies via single B cell screening.",34671080
LAG3 limits regulatory T cell proliferation and function in autoimmune diabetes.,28783703
Localized cocktail chemoimmunotherapy after in situ gelation to trigger robust systemic antitumor immune responses.,32181368
Enhanced tumor immune surveillance through neutrophil reprogramming due to Tollip deficiency.,30674719
Cellular Virotherapy Increases Tumor-Infiltrating Lymphocytes (TIL) and Decreases their PD-1+ Subsets in Mouse Immunocompetent Models. ,32708639
The Heteromeric Complex Formed by Dopamine Receptor D<sub>5</sub> and CCR9 Leads the Gut Homing of CD4<sup>+</sup> T Cells Upon Inflammation.,33864900
PERK is a critical metabolic hub for immunosuppressive function in macrophages.,35228694
A Genetic Screen to Identify Gain- and Loss-of-Function Modifications that Enhance T-cell Infiltration into Tumors.,32611665
Inhibition of EZH2 Ameliorates Lupus-Like Disease in MRL/lpr Mice.,31106974
Potency-matched Dual Cytokine-Antibody Fusion Proteins for Cancer Therapy.,28716814
CD8+ T Cells Contribute to the Development of Coronary Arteritis in the Lactobacillus casei Cell Wall Extract-Induced Murine Model of Kawasaki Disease.,27696768
"TCR Transgenic Mice Reveal Stepwise, Multi-site Acquisition of the Distinctive Fat-Treg Phenotype.",29887374
"Fluctuations of Spleen Cytokine and Blood Lactate, Importance of Cellular Immunity in Host Defense Against Blood Stage Malaria <i>Plasmodium yoelii</i>.",31608052
Tumor-Derived IL33 Promotes Tissue-Resident CD8<sup>+</sup> T Cells and Is Required for Checkpoint Blockade Tumor Immunotherapy.,32917659
Experimental Combined Immunotherapy of Tumours with Major Histocompatibility Complex Class I Downregulation. ,30469401
The PD-1 Pathway Regulates Development and Function of Memory CD8<sup>+</sup> T Cells following Respiratory Viral Infection.,32610128
"Immunomodulation By Subchronic Low Dose 2,3,7,8-Tetrachlorodibenzo-p-Dioxin in Experimental Autoimmune Encephalomyelitis in the Absence of Pertussis Toxin.",26822306
Cricket paralysis virus internal ribosome entry site-derived RNA promotes conventional vaccine efficacy by enhancing a balanced Th1/Th2 response.,31371226
Deletion of 5-Lipoxygenase in the Tumor Microenvironment Promotes Lung Cancer Progression and Metastasis through Regulating T Cell Recruitment.,26663781
Zinc finger protein Zfp335 controls early T-cell development and survival through β-selection-dependent and -independent mechanisms. ,35113015
Differential Control of iNKT Cell Effector Lineage Differentiation by the Forkhead Box Protein O1 (Foxo1) Transcription Factor.,31824499
Macrophage Migration Inhibitory Factor protects cancer cells from immunogenic cell death and impairs anti-tumor immune responses.,29864117
Transfer of Cell-Surface Antigens by Scavenger Receptor CD36 Promotes Thymic Regulatory T Cell Receptor Repertoire Development and Allo-tolerance.,29752065
Th1-like Plasmodium-Specific Memory CD4<sup>+</sup> T Cells Support Humoral Immunity.,29694898
Regulatory T cell transfer ameliorates lymphedema and promotes lymphatic vessel function.,27734032
"Eliminating mesothelioma by AAV-vectored, PD1-based vaccination in the tumor microenvironment.",33614918
Soluble CD83 Regulates Dendritic Cell-T Cell Immunological Synapse Formation by Disrupting Rab1a-Mediated F-Actin Rearrangement.,33585445
Systemic but not MDSC-specific IRF4 deficiency promotes an immunosuppressed tumor microenvironment in a murine pancreatic cancer model.,32448983
Radiation Therapy Combined with Cowpea Mosaic Virus Nanoparticle in Situ Vaccination Initiates Immune-Mediated Tumor Regression.,29732445
Blocking Short-Form Ron Eliminates Breast Cancer Metastases through Accumulation of Stem-Like CD4+ T Cells That Subvert Immunosuppression.,34330779
Anti-PD-L1 Efficacy Can Be Enhanced by Inhibition of Myeloid-Derived Suppressor Cells with a Selective Inhibitor of PI3Kδ/γ.,28364000
CD4<sup>+</sup>c-Met<sup>+</sup>Itgα4<sup>+</sup> T cell subset promotes murine neuroinflammation.,35488271
Hyaluronic Acid Synthesis Contributes to Tissue Damage in Systemic Lupus Erythematosus.,31572382
ER-to-Golgi transport and SEC23-dependent COPII vesicles regulate T cell alloimmunity. ,33463537
Salmonella Persistence and Host Immunity Are Dictated by the Anatomical Microenvironment. ,32393507
Comprehensive Analysis of the Safety Profile of a Single-Stranded RNA Nano-Structure Adjuvant. ,31500241
Intratumoral administration of IL2- and TNF-based fusion proteins cures cancer without establishing protective immunity.,29370721
β2 adrenergic receptor-mediated signaling regulates the immunosuppressive potential of myeloid-derived suppressor cells.,31566578
"Caveolin-1 Controls Vesicular TLR2 Expression, p38 Signaling and T Cell Suppression in BCG Infected Murine Monocytic Myeloid-Derived Suppressor Cells.",31849990
JAML promotes CD8 and γδ T cell antitumor immunity and is a novel target for cancer immunotherapy. ,34427588
"Prostate Cancer Cells Express More Androgen Receptor (AR) Following Androgen Deprivation, Improving Recognition by AR-Specific T Cells.",29051161
High-dimensional single cell mass cytometry analysis of the murine hematopoietic system reveals signatures induced by ageing and physiological pathogen challenges.,33879187
IDO1 Expression in Ovarian Cancer Induces PD-1 in T Cells <i>via</i> Aryl Hydrocarbon Receptor Activation.,34025677
HMGB1 promotes myeloid-derived suppressor cells and renal cell carcinoma immune escape.,28968989
CXCR3 blockade protects against Listeria monocytogenes infection-induced fetal wastage.,25751061
"Interleukin 33 exacerbates antigen driven airway hyperresponsiveness, inflammation and remodeling in a mouse model of asthma.",28652606
Synergistic Activation of Antitumor Immunity by a Particulate Therapeutic Vaccine.,34194942
Cancer therapy with major histocompatibility complex-deficient and interferon β-producing myeloid cells derived from allogeneic embryonic stem cells.,31348591
"LYG1 exerts antitumor function through promoting the activation, proliferation, and function of CD4<sup>+</sup> T cells.",28507796
Probiotics <i>Lactobacillus reuteri</i> Abrogates Immune Checkpoint Blockade-Associated Colitis by Inhibiting Group 3 Innate Lymphoid Cells.,31214189
Antigen Specificity Enhances Disease Control by Tregs in Vitiligo.,33335528
Increase of α-dicarbonyls in liver and receptor for advanced glycation end products on immune cells are linked to nonalcoholic fatty liver disease and liver cancer.,33628620
Novel Toll-Like Receptor 9 Agonist Derived from Cryptococcus neoformans Attenuates Allergic Inflammation Leading to Asthma Onset in Mice.,32585675
CTLA-4 expression by B-1a B cells is essential for immune tolerance.,33483505
Impaired estrogen signaling underlies regulatory T cell loss-of-function in the chronically inflamed intestine.,32632016
Avoiding phagocytosis-related artifact in myeloid derived suppressor cell T-lymphocyte suppression assays.,27856191
IL6 Fuels Durable Memory for Th17 Cell-Mediated Responses to Tumors.,32561531
"A Single-Cycle Glycoprotein D Deletion Viral Vaccine Candidate, ΔgD-2, Elicits Polyfunctional Antibodies That Protect against Ocular Herpes Simplex Virus. ",32295919
Systemic inhibition of PTPN22 augments anticancer immunity.,34283806
Murine Models of Steroid Refractory Graft-versus-Host Disease.,30127532
"Overexpression of Murine Rnaset2 in a Colon Syngeneic Mouse Carcinoma Model Leads to Rebalance of Intra-Tumor M1/M2 Macrophage Ratio, Activation of T Cells, Delayed Tumor Growth, and Rejection. ",32197460
Intrinsic TGF-β signaling promotes age-dependent CD8+ T cell polyfunctionality attrition.,24762437
CD4 T Helper Cells Instruct Lymphopenia-Induced Memory-Like CD8 T Cells for Control of Acute LCMV Infection.,28066432
Neuronal Ablation of Alpha/Beta Interferon (IFN-α/β) Signaling Exacerbates Central Nervous System Viral Dissemination and Impairs IFN-γ Responsiveness in Microglia/Macrophages. ,32796063
Blocking IFNAR1 inhibits multiple myeloma-driven Treg expansion and immunosuppression.,29558366
Th1-like Plasmodium-Specific Memory CD4<sup>+</sup> T Cells Support Humoral Immunity.,29141217
Targeted Delivery of Antigen to Activated CD169<sup>+</sup> Macrophages Induces Bias for Expansion of CD8<sup>+</sup> T Cells.,30393066
"Proteasome inhibition by bortezomib parallels a reduction in head and neck cancer cells growth, and an increase in tumor-infiltrating immune cells.",34561494
Autophagy promotes growth of tumors with high mutational burden by inhibiting a T-cell immune response.,34476408
Toll like receptor 7 expressed by malignant cells promotes tumor progression and metastasis through the recruitment of myeloid derived suppressor cells.,30546943
Functional characterization of T cell populations in a mouse model of chronic obstructive pulmonary disease.,23264660
TLR2-mediated activation of innate responses in the upper airways confers antiviral protection of the lungs. ,33561017
Injectable polypeptide hydrogel-based co-delivery of vaccine and immune checkpoint inhibitors improves tumor immunotherapy.,31149045
Maternal Antibiotic Treatment Protects Offspring from Diabetes Development in Nonobese Diabetic Mice by Generation of Tolerogenic APCs.,26401004
OX40 expression in neutrophils promotes hepatic ischemia/reperfusion injury. ,31672934
Kidney-infiltrating T cells in murine lupus nephritis are metabolically and functionally exhausted.,30130253
SRC family kinase (SFK) inhibitor dasatinib improves the antitumor activity of anti-PD-1 in NSCLC models by inhibiting Treg cell conversion and proliferation. ,33658304
Expansion of CD10<sup>neg</sup> neutrophils and CD14<sup>+</sup>HLA-DR<sup>neg/low</sup> monocytes driving proinflammatory responses in patients with acute myocardial infarction.,34289931
Activated T Lymphocytes are Essential Drivers of Pathological Remodeling in Ischemic Heart Failure.,28242779
STING agonist inflames the pancreatic cancer immune microenvironment and reduces tumor burden in mouse models.,31036082
NLRC4 suppresses melanoma tumor progression independently of inflammasome activation.,27617861
Layilin augments integrin activation to promote antitumor immunity. ,32539073
A major role for ferroptosis in <i>Mycobacterium tuberculosis</i>-induced cell death and tissue necrosis.,30787033
The Impact of Gut Microbiota on Gender-Specific Differences in Immunity.,28713378
Broad cross protection by recombinant live attenuated influenza H3N2 seasonal virus expressing conserved M2 extracellular domain in a chimeric hemagglutinin.,33603072
Batf3 selectively determines acquisition of CD8<sup>+</sup> dendritic cell phenotype and function.,27897162
c-Myc-Induced Survivin Is Essential for Promoting  the Notch-Dependent T Cell Differentiation from  Hematopoietic Stem Cells. ,28272325
Proinsulin peptide promotes autoimmune diabetes in a novel HLA-DR3-DQ2-transgenic murine model of spontaneous disease.,31612266
Intratumoral depletion of regulatory T cells using CD25-targeted photodynamic therapy in a mouse melanoma model induces antitumoral immune responses.,28537894
"Peroxisomal β-oxidation regulates whole body metabolism, inflammatory vigor, and pathogenesis of nonalcoholic fatty liver disease. ",29563328
Mitochondria-targeted hydroxyurea inhibits OXPHOS and induces antiproliferative and immunomodulatory effects.,34189437
Therapeutic administration of IL-15 superagonist complex ALT-803 leads to long-term survival and durable antitumor immune response in a murine glioblastoma model.,26174883
The plant hormone zeatin riboside inhibits T lymphocyte activity via adenosine A2A receptor activation.,24813229
Prevention of Influenza Virus-Induced Immunopathology by TGF-β Produced during Allergic Asthma.,26407325
Treatment of peanut allergy and colitis in mice via the intestinal release of butyrate from polymeric micelles.,36550307
Establishment of fetomaternal tolerance through glycan-mediated B cell suppression.,35236989
Small Molecule Cyclotriazadisulfonamide Abrogates the Upregulation of the Human Receptors CD4 and 4-1BB and Suppresses In Vitro Activation and Proliferation of T Lymphocytes.,33968048
Combining BRAF inhibition with oncolytic herpes simplex virus enhances the immune-mediated antitumor therapy of BRAF-mutant thyroid cancer. ,32759235
Chemotherapeutic tumor microparticles combining low-dose irradiation reprogram tumor-promoting macrophages through a tumor-repopulating cell-curtailing pathway.,28680743
Multilayer omics analysis reveals a non-classical retinoic acid signaling axis that regulates hematopoietic stem cell identity.,34706256
miR-143/145 differentially regulate hematopoietic stem and progenitor activity through suppression of canonical TGFβ signaling.,29925839
Defining the Mechanistic Correlates of Protection Conferred by Whole-Cell Vaccination against Pseudomonas aeruginosa Acute Murine Pneumonia. ,33199354
IFNγ is Required for Optimal Antibody-Mediated Immunity against Genital Chlamydia Infection.,27600502
Eradication of spontaneous malignancy by local immunotherapy. ,29386357
Toll-like receptor 7 deficiency suppresses type 1 diabetes development by modulating B-cell differentiation and function.,33432061
Optimized Timing of Post-Transplantation Cyclophosphamide in MHC-Haploidentical Murine Hematopoietic Cell Transplantation.,31586477
Schistosoma mansoni Tegument (Smteg) Induces IL-10 and Modulates Experimental Airway Inflammation.,27454771
Dermal IRF4+ dendritic cells and monocytes license CD4+ T helper cells to distinct cytokine profiles.,33159073
Restriction of memory B cell differentiation at the germinal center B cell positive selection stage.,32407433
Protection against Staphylococcus aureus bacteremia-induced mortality depends on ILC2s and eosinophils. ,30721149
Stroma-derived Fibrinogen-like Protein 2 Activates Cancer-associated Fibroblasts to Promote Tumor Growth in Lung Cancer.,28656005
Synergy between <i>Toxoplasma gondii</i> type I Δ<i>GRA17</i> immunotherapy and PD-L1 checkpoint inhibition triggers the regression of targeted and distal tumors.,34725213
Enhanced immunotherapy by combining a vaccine with a novel murine GITR ligand fusion protein.,29088720
CD4+ T cells promote humoral immunity and viral control during Zika virus infection.,30677097
Tumour sensitization via the extended intratumoural release of a STING agonist and camptothecin from a self-assembled hydrogel.,32778697
GCNT1-Mediated <i>O</i>-Glycosylation of the Sialomucin CD43 Is a Sensitive Indicator of Notch Signaling in Activated T Cells.,32060138
Enteric pathogens induce tissue tolerance and prevent neuronal loss from subsequent infections.,34717799
Intravaginal Chlamydia trachomatis Challenge Infection Elicits TH1 and TH17 Immune Responses in Mice That Promote Pathogen Clearance and Genital Tract Damage.,27606424
GPR182 limits antitumor immunity via chemokine scavenging in mouse melanoma models.,35013216
The trophic life cycle stage of Pneumocystis species induces protective adaptive responses without inflammation-mediated progression to pneumonia.,29267980
β2→1-Fructans Modulate the Immune System <i>In Vivo</i> in a Microbiota-Dependent and -Independent Fashion.,28261212
Vaccine delivery alerts innate immune systems for more immunogenic vaccination. ,33690222
Discovery of surrogate agonists for visceral fat Treg cells that modulate metabolic indices in vivo.,32773038
Murine Norovirus Infection Induces T<sub>H</sub>1 Inflammatory Responses to Dietary Antigens.,30392830
B7-H3×4-1BB bispecific antibody augments antitumor immunity by enhancing terminally differentiated CD8<sup>+</sup> tumor-infiltrating lymphocytes.,33523913
Toll-Like Receptor 7 Enhances Rabies Virus-Induced Humoral Immunity by Facilitating the Formation of Germinal Centers.,30906301
"LV305, a dendritic cell-targeting integration-deficient ZVex(TM)-based lentiviral vector encoding NY-ESO-1, induces potent anti-tumor immune response.",27626061
Leucine-rich repeat containing 8A (LRRC8A)-dependent volume-regulated anion channel activity is dispensable for T-cell development and function.,28192143
A Recombinant Rabies Virus Expressing Fms-like Tyrosine Kinase 3 Ligand (Flt3L) Induces Enhanced Immunogenicity in Mice.,31254272
"l-Citrulline Metabolism in Mice Augments CD4<sup>+</sup> T Cell Proliferation and Cytokine Production <i>In Vitro</i>, and Accumulation in the Mycobacteria-Infected Lung.",29201027
Flow cytometric analysis of inflammatory and resident myeloid populations in mouse ocular inflammatory models.,27544307
A micropeptide encoded by lncRNA MIR155HG suppresses autoimmune inflammation via modulating antigen presentation.,32671205
Rutin-Enriched Extract from Coriandrum sativum L. Ameliorates Ionizing Radiation-Induced Hematopoietic Injury. ,28468251
Surveillance on the status of immune cells after Echinnococcus granulosus protoscoleces infection in Balb/c mice.,23555767
"Viral Replicative Capacity, Antigen Availability via Hematogenous Spread, and High TFH:TFR Ratios Drive Induction of Potent Neutralizing Antibody Responses. ",30626686
"Zeb1 represses TCR signaling, promotes the proliferation of T cell progenitors and is essential for NK1.1<sup>+</sup> T cell development.",32398809
Combined Trabectedin and anti-PD1 antibody produces a synergistic antitumor effect in a murine model of ovarian cancer.,26219551
Tumor Regression and Cure Depends on Sustained Th1 Responses.,29912725
Immune activation caused by vascular oxidation promotes fibrosis and hypertension.,26595812
Helminth-induced IL-4 expands bystander memory CD8<sup>+</sup> T cells for early control of viral infection.,30375396
Combined PD-1 blockade and GITR triggering induce a potent antitumor immunity in murine cancer models and synergizes with chemotherapeutic drugs.,24502656
<i>Ubc9</i> Is Required for Positive Selection and Late-Stage Maturation of Thymocytes.,28314856
Polymicrobial Sepsis Diminishes Dendritic Cell Numbers and Function Directly Contributing to Impaired Primary CD8 T Cell Responses In Vivo.,27798171
The thymic medulla is required for Foxp3+ regulatory but not conventional CD4+ thymocyte development.,23530124
"IL-15 superagonist/IL-15RαSushi-Fc fusion complex (IL-15SA/IL-15RαSu-Fc; ALT-803) markedly enhances specific subpopulations of NK and memory CD8+ T cells, and mediates potent anti-tumor activity against murine breast and colon carcinomas.",26910920
B cells expressing the transcription factor T-bet drive lupus-like autoimmunity.,28240602
Targeting the myeloid checkpoint receptor SIRPα potentiates innate and adaptive immune responses to promote anti-tumor activity.,33256806
IgE-mediated enhancement of CD4(+) T cell responses requires antigen presentation by CD8α(-) conventional dendritic cells.,27306570
"A single-amino acid substitution in the adaptor LAT accelerates TCR proofreading kinetics and alters T-cell selection, maintenance and function.",36914891
PD-1 blockade reverses adaptive immune resistance induced by high-dose hypofractionated but not low-dose daily fractionated radiation.,29399393
Syngeneic red blood cell-induced extracellular vesicles suppress delayed-type hypersensitivity to self-antigens in mice.,31365154
Endogenous T cells prevent tumor immune escape following adoptive T cell therapy.,31682239
Malt1 self-cleavage is critical for regulatory T cell homeostasis and anti-tumor immunity in mice.,30025160
Analysis of the T Cell Response to Zika Virus and Identification of a Novel CD8+ T Cell Epitope in Immunocompetent Mice.,28231312
Elimination of IL-10-inducing T-helper epitopes from an IGFBP-2 vaccine ensures potent antitumor activity.,24778415
Host genetics play a critical role in controlling CD8 T cell function and lethal immunopathology during chronic viral infection.,28715493
Ebola Virus Glycoprotein Induces an Innate Immune Response <i>In vivo</i> via TLR4.,28861075
PD-1<sup>+</sup> melanocortin receptor dependent-Treg cells prevent autoimmune disease.,31729418
Eosinophil recruitment is dynamically regulated by interplay among lung dendritic cell subsets after allergen challenge.,30250029
Differential requirement for CCR4 and CCR7 during the development of innate and adaptive αβT cells in the adult thymus.,24990081
The same self-peptide selects conventional and regulatory CD4⁺ T cells with identical antigen receptors.,25270305
Variations in Cellular Responses of Mouse T Cells to Adenosine-5'-Triphosphate Stimulation Do Not Depend on P2X7 Receptor Expression Levels but on Their Activation and Differentiation Stage.,29535730
Lattice Light-Sheet Microscopy Multi-dimensional Analyses (LaMDA) of T-Cell Receptor Dynamics Predict T-Cell Signaling States.,32437685
IL35 Hinders Endogenous Antitumor T-cell Immunity and Responsiveness to Immunotherapy in Pancreatic Cancer.,29980536
Role of PKCtheta in macrophage-mediated immune response to Salmonella typhimurium infection in mice.,27465248
Hepatic Natural Killer T-cell and CD8+ T-cell Signatures in Mice with Nonalcoholic Steatohepatitis.,29152605
Regulatory T cells promote myelin regeneration in the central nervous system.,28288125
Integration of Oncogenes via Sleeping Beauty as a Mouse Model of HPV16+ Oral Tumors and Immunologic Control.,29362220
