Title,ID
NKG2D-Fc fusion protein promotes antitumor immunity through the depletion of immunosuppressive cells.,32468232
MRP14 enhances the ability of macrophage to recruit T cells and promotes obesity-induced insulin resistance.,31040394
Identification of a Locus in Mice that Regulates the Collateral Damage and Lethality of Virus Infection.,31042467
Inflammation triggers ILC3 patrolling of the intestinal barrier.,35999393
A novel format for recombinant antibody-interleukin-2 fusion proteins exhibits superior tumor-targeting properties <i>in vivo</i>.,33110477
Bruton's tyrosine kinase regulates gut immune homeostasis through attenuating Th1 response.,33931590
Multilayer omics analysis reveals a non-classical retinoic acid signaling axis that regulates hematopoietic stem cell identity.,34706256
Replicating RNA vaccination elicits an unexpected immune response that efficiently protects mice against lethal Crimean-Congo hemorrhagic fever virus challenge.,35907368
Multimodal Intralesional Therapy for Reshaping the Myeloid Compartment of Tumors Resistant to Anti-PD-L1 Therapy via IRF8 Expression.,34362833
Coordinated Viral Control by Cytotoxic Lymphocytes Ensures Optimal Adaptive NK Cell Responses.,32966792
Tumor-Derived IL33 Promotes Tissue-Resident CD8<sup>+</sup> T Cells and Is Required for Checkpoint Blockade Tumor Immunotherapy.,32917659
Human IRF1 governs macrophagic IFN-γ immunity to mycobacteria.,36736301
Luteolin as a potential host-directed immunotherapy adjunct to isoniazid treatment of tuberculosis.,34415976
Optimizing therapeutic outcomes of immune checkpoint blockade by a microbial tryptophan metabolite.,35236743
Combination Adjuvants Enhance Recombinant Protein Vaccine Protection against Fungal Infection.,34399628
GABAergic neuronal IL-4R mediates T cell effect on memory.,34793707
Intratumoral administration of STING-activating nanovaccine enhances T cell immunotherapy.,35623658
5-Azacytidine depletes HSCs and synergizes with an anti-CD117 antibody to augment donor engraftment in immunocompetent mice.,34448832
A Chlamydia trachomatis Strain Expressing Ovalbumin Stimulates an Antigen-Specific CD4+ T Cell Response in Mice. ,30988057
Neutrophil Caspase-11 Is Essential to Defend against a Cytosol-Invasive Bacterium.,32726630
Soluble CD137 Ameliorates Acute Type 1 Diabetes by Inducing T Cell Anergy.,31787971
NFAM1 Promotes Pro-Inflammatory Cytokine Production in Mouse and Human Monocytes.,35095847
"A live attenuated influenza virus-vectored intranasal COVID-19 vaccine provides rapid, prolonged, and broad protection against SARS-CoV-2 infection",10.1101/2021.11.13.468472
Attenuation of immune-mediated bone marrow damage in conventionally housed mice.,31898340
Interferon regulatory factor 1 (IRF-1) downregulates Checkpoint kinase 1 (CHK1) through miR-195 to upregulate apoptosis and PD-L1 expression in Hepatocellular carcinoma (HCC) cells.,33772151
<i>Prevotella</i> Induces the Production of Th17 Cells in the Colon of Mice.,33204736
Engineering tumor-specific gene nanomedicine to recruit and activate T cells for enhanced immunotherapy.,37031188
Cryptotanshinone has curative dual anti-proliferative and immunotherapeutic effects on mouse Lewis lung carcinoma.,30972427
The Firre locus produces a trans-acting RNA molecule that functions in hematopoiesis.,31723143
Generation and Characterization of Universal Live-Attenuated Influenza Vaccine Candidates Containing Multiple M2e Epitopes. ,33153089
"Identification of Two Subsets of Murine DC1 Dendritic Cells That Differ by Surface Phenotype, Gene Expression, and Function.",34777358
Chemerin Suppresses Breast Cancer Growth by Recruiting Immune Effector Cells Into the Tumor Microenvironment.,31139180
CD27 expression on Treg cells limits immune responses against tumors.,34423375
Distinct Cell Adhesion Signature Defines Glioblastoma Myeloid-Derived Suppressor Cell Subsets.,36126163
GPX4 regulates cellular necrosis and host resistance in Mycobacterium tuberculosis infection.,36069923
Staphylococcus aureus Protection-Related Type 3 Cell-Mediated Immune Response Elicited by Recombinant Proteins and GM-CSF DNA Vaccine. ,34452024
Combination of CHEK1/2 inhibition and ionizing radiation results in abscopal tumor response through increased micronuclei formation.,32335582
A novel oral rabies vaccine enhances the immunogenicity through increasing dendritic cells activation and germinal center formation by expressing U-OMP19 in a mouse model.,33905300
Cold exposure protects from neuroinflammation through immunologic reprogramming.,34687652
Mesenchymal Stem Cells Alleviate DHEA-Induced Polycystic Ovary Syndrome (PCOS) by Inhibiting Inflammation in Mice.,31611920
Mitochondria-targeted hydroxyurea inhibits OXPHOS and induces antiproliferative and immunomodulatory effects.,34189437
Targeting resistance to radiation-immunotherapy in cold HNSCCs by modulating the Treg-dendritic cell axis. ,33883256
Potential of recombinant Mycobacterium paragordonae expressing HIV-1 Gag as a prime vaccine for HIV-1 infection.,31664100
SZB120 Exhibits Immunomodulatory Effects by Targeting eIF2α to Suppress Th17 Cell Differentiation.,33483349
An In Vivo Screen to Identify Short Peptide Mimotopes with Enhanced Antitumor Immunogenicity.,34992135
"A live attenuated virus-based intranasal COVID-19 vaccine provides rapid, prolonged, and broad protection against SARS-CoV-2.",35637645
PERK is a critical metabolic hub for immunosuppressive function in macrophages.,35228694
Recombinant Mycobacterium smegmatis with a pMyong2 vector expressing Human Immunodeficiency Virus Type I Gag can induce enhanced virus-specific immune responses.,28300196
Chronic mild hypoxia accelerates recovery from preexisting EAE by enhancing vascular integrity and apoptosis of infiltrated monocytes.,32371484
Tumor-derived exosomes promote carcinogenesis of murine oral squamous cell carcinoma.,31245809
Luteolin-mediated Kv1.3 K+ channel inhibition augments BCG vaccine efficacy against tuberculosis by promoting central memory T cell responses in mice.,32956412
Clonally expanded CD8 T cells characterize amyotrophic lateral sclerosis-4.,35732742
Eosinophil-Mediated Immune Control of Adult Filarial Nematode Infection Can Proceed in the Absence of IL-4 Receptor Signaling.,32571840
Treatment of peanut allergy and colitis in mice via the intestinal release of butyrate from polymeric micelles.,36550307
Selective targeting of histone modification fails to prevent graft versus host disease after hematopoietic cell transplantation.,30452487
Immunogenicity and Protective Efficacy of an Intranasal Live-attenuated Vaccine Against SARS-CoV-2 in Preclinical Animal Models,10.1101/2021.01.08.425974
Cervicovaginal Tissue Residence Confers a Distinct Differentiation Program upon Memory CD8 T Cells.,34088770
Anti-tumor efficacy of plasmid encoding emm55 in a murine melanoma model.,32556443
CXCR3 regulates CD4+ T cell cardiotropism in pressure overload-induced cardiac dysfunction. ,30779709
γδ T Cells Support Antigen-Specific αβ T cell-Mediated Antitumor Responses during BCG Treatment for Bladder Cancer.,34607803
Visualization of Activated T Cells by OX40-ImmunoPET as a Strategy for Diagnosis of Acute Graft-versus-Host Disease.,32900772
Tumour sensitization via the extended intratumoural release of a STING agonist and camptothecin from a self-assembled hydrogel.,32778697
Bioinorganic hybrid bacteriophage for modulation of intestinal microbiota to remodel tumor-immune microenvironment against colorectal cancer.,32440552
T cells protect against hepatitis A virus infection and limit infection-induced liver injury.,34331968
Zika Virus Mucosal Infection Provides Protective Immunity. ,32051274
IL-2/JES6-1 mAb complexes dramatically increase sensitivity to LPS through IFN-γ production by CD25+Foxp3- T cells. ,34932467
<i>Plasmodium</i> Preerythrocytic Vaccine Antigens Enhance Sterile Protection in Mice Induced by Circumsporozoite Protein.,34310889
Myxoma Virus Expressing LIGHT (TNFSF14) Pre-Loaded into Adipose-Derived Mesenchymal Stem Cells Is Effective Treatment for Murine Pancreatic Adenocarcinoma. ,33808692
An epitope-optimized human H3N2 influenza vaccine induces broadly protective immunity in mice and ferrets.,35739199
Enteric Glia Play a Critical Role in Promoting the Development of Colorectal Cancer.,33282743
"A Single-Cycle Glycoprotein D Deletion Viral Vaccine Candidate, ΔgD-2, Elicits Polyfunctional Antibodies That Protect against Ocular Herpes Simplex Virus. ",32295919
TLR2-mediated activation of innate responses in the upper airways confers antiviral protection of the lungs. ,33561017
Toxin-Triggered Interleukin-1 Receptor Signaling Enables Early-Life Discrimination of Pathogenic versus Commensal Skin Bacteria.,31784259
Hypoxia Supports Differentiation of Terminally Exhausted CD8 T Cells.,34025660
p53 Hinders CRISPR/Cas9-Mediated Targeted Gene Disruption in Memory CD8 T Cells In Vivo.,32887747
Binary outcomes of enhancer activity underlie stable random monoallelic expression.,35617021
Frequent mutations of FBXO11 highlight BCL6 as a therapeutic target in Burkitt lymphoma.,34625792
Intratumoral combination therapy with poly(I:C) and resiquimod synergistically triggers tumor-associated macrophages for effective systemic antitumoral immunity.,34531246
Lactococcus lactis Delivery of Surface Layer Protein A Protects Mice from Colitis by Re-Setting Host Immune Repertoire. ,34572293
Combination of ultrasound-based mechanical disruption of tumor with immune checkpoint blockade modifies tumor microenvironment and augments systemic antitumor immunity.,35039461
Unconventional Therapy with IgY in a Psoriatic Mouse Model Targeting Gut Microbiome. ,34575618
STEAP4 expression in CNS resident cells promotes Th17 cell-induced autoimmune encephalomyelitis.,33879167
Temporary Reduction of Membrane CD4 with the Antioxidant MnTBAP Is Sufficient to Prevent Immune Responses Induced by Gene Transfer.,31497619
Immunogenicity and protective efficacy of an intranasal live-attenuated vaccine against SARS-CoV-2.,34368648
Oncolytic Reovirus-Mediated Recruitment of Early Innate Immune Responses Reverses Immunotherapy Resistance in Prostate Tumors.,33665363
STING activation in alveolar macrophages and group 2 innate lymphoid cells suppresses IL-33-driven type 2 immunopathology. ,33400692
Metabolic reprogramming of the myeloid lineage by Schistosoma mansoni infection persists independently of antigen exposure.,33417618
Genetic manipulation of the human gut bacterium Eggerthella lenta reveals a widespread family of transcriptional regulators.,36494336
Immunotherapy Combined with Metronomic Dosing: An Effective Approach for the Treatment of NSCLC. ,33920884
Expansion of CD10<sup>neg</sup> neutrophils and CD14<sup>+</sup>HLA-DR<sup>neg/low</sup> monocytes driving proinflammatory responses in patients with acute myocardial infarction.,34289931
<i>Listeria</i> delivers tetanus toxoid protein to pancreatic tumors and induces cancer cell death in mice.,35320003
Zinc finger protein Zfp335 controls early T-cell development and survival through β-selection-dependent and -independent mechanisms. ,35113015
Chemokine receptor expression by inflammatory T cells in EAE.,25071447
"Hypoxia induces adrenomedullin from lung epithelia, stimulating ILC2 inflammation and immunity.",35532553
Tumor Cell-Intrinsic USP22 Suppresses Antitumor Immunity in Pancreatic Cancer.,31871120
Checkpoint molecules coordinately restrain hyperactivated effector T cells in the tumor microenvironment.,32076578
Inhibition of murine hepatoma tumor growth by cryptotanshinone involves TLR7-dependent activation of macrophages and induction of adaptive antitumor immune defenses.,31161238
CD4 T cells mediate brain inflammation and neurodegeneration in a mouse model of Parkinson's disease.,33704423
ZEB1 promotes pathogenic Th1 and Th17 cell differentiation in multiple sclerosis.,34433042
LincRNA-immunity landscape analysis identifies EPIC1 as a regulator of tumor immune evasion and immunotherapy resistance.,33568470
Liver X receptor β is required for the survival of single-positive thymocytes by regulating IL-7Rα expression.,32963358
Antibody-mediated delivery of LIGHT to the tumor boosts natural killer cells and delays tumor progression.,33404287
Post-Transplantation Cyclophosphamide Uniquely Restrains Alloreactive CD4<sup>+</sup> T-Cell Proliferation and Differentiation After Murine MHC-Haploidentical Hematopoietic Cell Transplantation.,35242129
Dermal IRF4+ dendritic cells and monocytes license CD4+ T helper cells to distinct cytokine profiles.,33159073
Interferon-Gamma Impairs Maintenance and Alters Hematopoietic Support of Bone Marrow Mesenchymal Stromal Cells.,29649408
Tim-3 mediates T cell trogocytosis to limit antitumor immunity.,35316223
CXCR7 Antagonism Reduces Acute Lung Injury Pathogenesis.,34803691
Degradation of tumour stromal hyaluronan by small extracellular vesicle-PH20 stimulates CD103+ dendritic cells and in combination with PD-L1 blockade boosts anti-tumour immunity.,31632619
Combination immunotherapy using G-CSF and oncolytic virotherapy reduces tumor growth in osteosarcoma. ,33737338
ER-to-Golgi transport and SEC23-dependent COPII vesicles regulate T cell alloimmunity. ,33463537
Dietary conjugated linoleic acid links reduced intestinal inflammation to amelioration of CNS autoimmunity.,33899089
HER2-LAMP vaccines effectively traffic to endolysosomal compartments and generate enhanced polyfunctional T cell responses that induce complete tumor regression.,32532838
Tumor-treating fields (TTFields) induce immunogenic cell death resulting in enhanced antitumor efficacy when combined with anti-PD-1 therapy.,32144446
Targeting <i>HER2</i> Exon 20 Insertion-Mutant Lung Adenocarcinoma with a Novel Tyrosine Kinase Inhibitor Mobocertinib.,34380634
Wnt-β-catenin activation epigenetically reprograms T<sub>reg</sub> cells in inflammatory bowel disease and dysplastic progression.,33664518
TREM-2 is a sensor and activator of T cell response in SARS-CoV-2 infection.,34878838
Tissue-specific activation of Myd88-dependent pathways governs disease severity in primary Sjögren's syndrome.,33596533
Resistance Against <i>Leishmania major</i> Infection Depends on Microbiota-Guided Macrophage Activation.,34745100
Disrupted fibroblastic reticular cells and interleukin-7 expression in tumor draining lymph nodes.,28928833
Blocking Short-Form Ron Eliminates Breast Cancer Metastases through Accumulation of Stem-Like CD4+ T Cells That Subvert Immunosuppression.,34330779
JAML promotes CD8 and γδ T cell antitumor immunity and is a novel target for cancer immunotherapy. ,34427588
Potency-matched Dual Cytokine-Antibody Fusion Proteins for Cancer Therapy.,28716814
Re-purposing the pro-senescence properties of doxorubicin to introduce immunotherapy in breast cancer brain metastasis.,36384097
Single-cell transcriptomics reveals immune dysregulation mediated by IL-17A in initiation of chronic lung injuries upon real-ambient particulate matter exposure.,35739565
Ifit2 deficiency restricts microglial activation and leukocyte migration following murine coronavirus (m-CoV) CNS infection.,33253295
A listeriolysin O subunit vaccine is protective against Listeria monocytogenes.,32684498
Anti-tumor immunity influences cancer cell reliance upon ATG7.,32923161
"FATC Domain Deletion Compromises ATM Protein Stability, Blocks Lymphocyte Development, and Promotes Lymphomagenesis.",33536256
Commensal Candida albicans Positively Calibrates Systemic Th17 Immunological Responses.,30870622
Salmonella Persistence and Host Immunity Are Dictated by the Anatomical Microenvironment. ,32393507
Prostaglandin D2 signaling in dendritic cells is critical for the development of EAE.,32624353
Mechanisms of innate and adaptive immunity to the Pfizer-BioNTech BNT162b2 vaccine.,35288714
IL6 Fuels Durable Memory for Th17 Cell-Mediated Responses to Tumors.,32561531
Intratumoral administration of IL2- and TNF-based fusion proteins cures cancer without establishing protective immunity.,29370721
Intratumoral immune activation with TLR4 agonist synergizes with effector T cells to eradicate established murine tumors.,32579133
Dectin-1 limits autoimmune neuroinflammation and promotes myeloid cell-astrocyte crosstalk via Card9-independent expression of Oncostatin M.,33581044
Potent inhibition of tumour cell proliferation and immunoregulatory function by mitochondria-targeted atovaquone.,33087770
Partial Protection From Lupus-Like Disease by B-Cell Specific Type I Interferon Receptor Deficiency.,33488628
Epigenetic and Transcriptional Control of the Epidermal Growth Factor Receptor Regulates the Tumor Immune Microenvironment in Pancreatic Cancer.,33158848
Prevention of Tumor Growth and Dissemination by In Situ Vaccination with Mitochondria-Targeted Atovaquone.,35243806
Irradiated tumor cell-derived microparticles mediate tumor eradication via cell killing and immune reprogramming.,32232155
"Therapeutic Myeloperoxidase Inhibition Attenuates Neutrophil Activation, ANCA-Mediated Endothelial Damage, and Crescentic GN.",31879336
Stromal Expression of the Core Clock Gene <i>Period 2</i> Is Essential for Tumor Initiation and Metastatic Colonization.,33123539
Non-random lymphocyte distribution among virus-infected cells of the respiratory tract.,24328934
Therapeutic efficacy of PD-L1 blockade in a breast cancer model is enhanced by cellular vaccines expressing B7-1 and glycolipid-anchored IL-12.,26308597
Synergy of a STING agonist and an IL-2 superkine in cancer immunotherapy against MHC I-deficient and MHC I<sup>+</sup> tumors.,35588144
A Highly Conserved Peptide Vaccine Candidate Activates Both Humoral and Cellular Immunity Against SARS-CoV-2 Variant Strains.,34950151
Identification of CD4 and H-2K<sup>d</sup>-restricted cytotoxic T lymphocyte epitopes on the human herpesvirus 6B glycoprotein Q1 protein.,30846739
Oncogenic KRAS-Driven Metabolic Reprogramming in Pancreatic Cancer Cells Utilizes Cytokines from the Tumor Microenvironment.,32046984
DSTYK inhibition increases the sensitivity of lung cancer cells to T cell-mediated cytotoxicity.,36169652
Soy-tomato enriched diet reduces inflammation and disease severity in a pre-clinical model of chronic pancreatitis.,33311549
Neuronal Ablation of Alpha/Beta Interferon (IFN-α/β) Signaling Exacerbates Central Nervous System Viral Dissemination and Impairs IFN-γ Responsiveness in Microglia/Macrophages. ,32796063
Matrix metalloproteinases and tissue inhibitors of metalloproteinases in murine β-coronavirus-induced neuroinflammation.,34906793
Abrogation of IFN-γ Signaling May not Worsen Sensitivity to PD-1/PD-L1 Blockade. ,32155707
Aberrant type 1 immunity drives susceptibility to mucosal fungal infections. ,33446526
Autophagy promotes growth of tumors with high mutational burden by inhibiting a T-cell immune response.,34476408
The Cancer-Associated ATM R3008H Mutation Reveals the Link between ATM Activation and Its Exchange.,33239428
Virus-derived immunostimulatory RNA induces type I IFN-dependent antibodies and T-cell responses during vaccination.,29861183
Interleukin-27 Is Essential for Type 1 Diabetes Development and Sjögren Syndrome-like Inflammation.,31801074
Macrophage inducible nitric oxide synthase circulates inflammation and promotes lung carcinogenesis.,29844930
Tonic LAT-HDAC7 Signals Sustain Nur77 and Irf4 Expression to Tune Naive CD4 T Cells.,28538176
Gamma Interferon Is Required for Chlamydia Clearance but Is Dispensable for T Cell Homing to the Genital Tract. ,32184237
IL-10 Deficiency Accelerates Type 1 Diabetes Development <i>via</i> Modulation of Innate and Adaptive Immune Cells and Gut Microbiota in <i>BDC2.5</i> NOD Mice.,34394099
Selective expansion of regulatory T cells using an orthogonal IL-2/IL-2 receptor system facilitates transplantation tolerance.,33855972
LAG3 associates with TCR-CD3 complexes and suppresses signaling by driving co-receptor-Lck dissociation.,35437325
Blockade of LAG-3 in PD-L1-Deficient Mice Enhances Clearance of Blood Stage Malaria Independent of Humoral Responses.,33519801
Loss of 15-lipoxygenase disrupts T<sub>reg</sub> differentiation altering their pro-resolving functions.,34040168
Bcl10-controlled Malt1 paracaspase activity is key for the immune suppressive function of regulatory T cells.,31138793
Enteric pathogens induce tissue tolerance and prevent neuronal loss from subsequent infections.,34717799
Expression of the mono-ADP-ribosyltransferase ART1 by tumor cells mediates immune resistance in non-small cell lung cancer.,35294260
Immunological dynamics after subcutaneous immunization with a squalene-based oil-in-water adjuvant.,33411367
Cellular Virotherapy Increases Tumor-Infiltrating Lymphocytes (TIL) and Decreases their PD-1+ Subsets in Mouse Immunocompetent Models. ,32708639
A chimeric yellow fever-Zika virus vaccine candidate fully protects against yellow fever virus infection in mice.,32116148
Tumor-draining lymph node is important for a robust abscopal effect stimulated by radiotherapy. ,33028691
Elimination of acquired resistance to PD-1 blockade via the concurrent depletion of tumour cells and immunosuppressive cells.,34725506
Macrophages and CD8<sup>+</sup> T Cells Mediate the Antitumor Efficacy of Combined CD40 Ligation and Imatinib Therapy in Gastrointestinal Stromal Tumors.,29467128
A conserved dendritic-cell regulatory program limits antitumour immunity.,32269339
Dynamics of the Coreceptor-LCK Interactions during T Cell Development Shape the Self-Reactivity of Peripheral CD4 and CD8 T Cells.,32023465
Comprehensive Analysis of the Safety Profile of a Single-Stranded RNA Nano-Structure Adjuvant. ,31500241
A Genetic Screen to Identify Gain- and Loss-of-Function Modifications that Enhance T-cell Infiltration into Tumors.,32611665
Brucella abortus and Pregnancy in Mice: Impact of Chronic Infection on Fertility and the Role of Regulatory T Cells in Tissue Colonization. ,32690635
Myocardial B cells are a subset of circulating lymphocytes with delayed transit through the heart. ,31945014
Airway Microbiota-Host Interactions Regulate Secretory Leukocyte Protease Inhibitor Levels and Influence Allergic Airway Inflammation.,33147448
Immunization against Anaplasma phagocytophilum Adhesin Binding Domains Confers Protection against Infection in the Mouse Model.,32661123
Cooperative Enhancer Activation by TLX1 and STAT5 Drives Development of NUP214-ABL1/TLX1-Positive T Cell Acute Lymphoblastic Leukemia.,30107177
A Genetic Mouse Model Recapitulates Immune Checkpoint Inhibitor-Associated Myocarditis and Supports a Mechanism-Based Therapeutic Intervention.,33257470
Specific ablation of CD4<sup>+</sup> T-cells promotes heart regeneration in juvenile mice.,32724455
Anti-CTLA-4 synergizes with dendritic cell-targeted vaccine to promote IL-3-dependent CD4<sup>+</sup> effector T cell infiltration into murine pancreatic tumors.,30945313
Functional characterization of T cell populations in a mouse model of chronic obstructive pulmonary disease.,23264660
Tumor-Targeted Immunotherapy by Using Primary Adipose-Derived Stem Cells and an Antigen-Specific Protein Vaccine. ,30445793
A cyclodextrin-based nanoformulation achieves co-delivery of ginsenoside Rg3 and quercetin for chemo-immunotherapy in colorectal cancer.,35127393
Conventional Co-Housing Modulates Murine Gut Microbiota and Hematopoietic Gene Expression. ,32858886
Helminthic dehydrogenase drives PGE<sub>2</sub> and IL-10 production in monocytes to potentiate Treg induction.,35357743
Modulation of Tumor-Associated Macrophages (TAM) Phenotype by Platelet-Activating Factor (PAF) Receptor.,29445756
Intestinal Microbiota Disruption Reduces Regulatory T Cells and Increases Respiratory Viral Infection Mortality Through Increased IFNγ Production.,30042764
Plant Virus-Like Particle In Situ Vaccine for Intracranial Glioma Immunotherapy. ,30974896
Overcoming Genetically Based Resistance Mechanisms to PD-1 Blockade.,32467343
RIG-I activating immunostimulatory RNA boosts the efficacy of anticancer vaccines and synergizes with immune checkpoint blockade.,30852164
Dynamic Regulation of the Molecular Mechanisms of Regulatory T Cell Migration in Inflamed Skin.,34040606
Promising xenograft animal model recapitulating the features of human pancreatic cancer.,32921958
"ERα Signaling Increased IL-17A Production in Th17 Cells by Upregulating IL-23R Expression, Mitochondrial Respiration, and Proliferation.",31849948
"Restriction of Viral Replication, Rather than T Cell Immunopathology, Drives Lethality in Murine Norovirus CR6-Infected STAT1-Deficient Mice.",35107369
Small Molecule Cyclotriazadisulfonamide Abrogates the Upregulation of the Human Receptors CD4 and 4-1BB and Suppresses In Vitro Activation and Proliferation of T Lymphocytes.,33968048
High-dimensional single cell mass cytometry analysis of the murine hematopoietic system reveals signatures induced by ageing and physiological pathogen challenges.,33879187
Lipid nanoparticles enhance the efficacy of mRNA and protein subunit vaccines by inducing robust T follicular helper cell and humoral responses.,34852217
IDO1 Expression in Ovarian Cancer Induces PD-1 in T Cells <i>via</i> Aryl Hydrocarbon Receptor Activation.,34025677
Viral infection engenders bona fide and bystander subsets of lung-resident memory B cells through a permissive mechanism.,35768001
An organoid-based screen for epigenetic inhibitors that stimulate antigen presentation and potentiate T-cell-mediated cytotoxicity.,34725507
Synergistic Activation of Antitumor Immunity by a Particulate Therapeutic Vaccine.,34194942
Targeted Delivery of IL2 to the Tumor Stroma Potentiates the Action of Immune Checkpoint Inhibitors by Preferential Activation of NK and CD8<sup>+</sup> T Cells.,30782667
Eosinophil recruitment is dynamically regulated by interplay among lung dendritic cell subsets after allergen challenge.,30250029
Antigen Specificity Enhances Disease Control by Tregs in Vitiligo.,33335528
