Title,ID
Nanoparticle-based modulation of CD4<sup>+</sup> T cell effector and helper functions enhances adoptive immunotherapy.,36241639
Envelope virus-mimetic nanovaccines by hybridizing bioengineered cell membranes with bacterial vesicles.,35712077
FOXP3 exon 2 controls T<sub>reg</sub> stability and autoimmunity.,35749515
LAMP2 regulates autophagy in the thymic epithelium and thymic stroma-dependent CD4 T cell development.,35535798
Radiotherapy combined with anti-CEACAM1 immunotherapy to induce survival advantage in glioma.,36928507
Clonal dynamics underlying the skewed CD4/CD8 ratio of mouse thymocytes revealed by TCR-independent barcoding.,36064961
IL-18BP mediates the balance between protective and pathological immune responses to Toxoplasma gondii.,36827187
SZT2 maintains hematopoietic stem cell homeostasis via nutrient-mediated mTORC1 regulation.,36250465
Biometabolites of <i>Citrus unshiu</i> Peel Enhance Intestinal Permeability and Alter Gut Commensal Bacteria.,36678190
Japanese Kampo Medicine Juzentaihoto Improves Antiviral Cellular Immunity in Tumour-Bearing Hosts.,35996405
The gut microbiota of people with asthma influences lung inflammation in gnotobiotic mice.,36824270
Adjuvant effect of IRES-based single-stranded RNA on melanoma immunotherapy.,36199130
"Cancer cell autophagy, reprogrammed macrophages, and remodeled vasculature in glioblastoma triggers tumor immunity.",36113478
High-Efficiency Retroviral Transduction for Type 1 Regulatory T Cell Differentiation.,36245799
IL-10-producing Th1 cells possess a distinct molecular signature in malaria,36594463
Mesenchymal Stromal Cells-Derived Extracellular Vesicles Regulate Dendritic Cell Functions in Dry Eye Disease.,36611828
FGF15 Protects Septic Mice by Inhibiting Inflammation and Modulating Treg Responses.,36386580
A TLR7-nanoparticle adjuvant promotes a broad immune response against heterologous strains of influenza and SARS-CoV-2.,36717665
Contribution of circulatory cells to asthma exacerbations and lung tissue-resident CD4 T cell memory.,35936001
Adaptive immune responses mediated age-related Plasmodium yoelii 17XL and 17XNL infections in 4 and 8-week-old BALB/c mice.,33430765
An Epidemic Zika Virus Isolate Drives Enhanced T Follicular Helper Cell and B Cell-Mediated Immunity.,35346966
Transplantation of Unirradiated Bone Marrow Cells after Total-Body Irradiation Prevents the Development of Thymic Lymphoma in Mice through Niche Competition.,33347573
Candida albicans oscillating UME6 expression during intestinal colonization primes systemic Th17 protective immunity.,35584674
CaCO<sub>3</sub> powder-mediated biomineralization of antigen nanosponges synergize with PD-1 blockade to potentiate anti-tumor immunity.,37024939
STAT1 signaling protects self-reactive T cells from control by innate cells during neuroinflammation.,35587373
Effective inactivated influenza vaccine for the elderly using a single-stranded RNA-based adjuvant.,34099809
UVB modifies skin immune-stroma cross-talk and promotes effector T cell recruitment during cryptic<i>Leishmania donovani</i>infection,10.1101/2023.02.03.526940
Fate mapping of hematopoietic stem cells reveals two pathways of native thrombopoiesis.,35922411
Host-versus-commensal immune responses participate in the rejection of colonized solid organ transplants.,35834335
Peptides Derived From S and N Proteins of Severe Acute Respiratory Syndrome Coronavirus 2 Induce T Cell Responses: A Proof of Concept for T Cell Vaccines.,34630356
Distinct myeloid antigen-presenting cells dictate differential fates of tumor-specific CD8+ T cells in pancreatic cancer.,35393950
Bcl-2 supports survival and metabolic fitness of quiescent tissue-resident ILC3,10.1101/2023.02.27.528945
"The subunits of IL-12, originating from two distinct cells, can functionally synergize to protect against pathogen dissemination in vivo.",34644571
Memory CD8<sup>+</sup> T cells upregulate glycolysis and effector functions under limiting oxygen conditions.,36482267
Bone Marrow Harbors a Unique Population of Dendritic Cells with the Potential to Boost Neutrophil Formation upon Exposure to Fungal Antigen.,35011617
A microarray patch SARS-CoV-2 vaccine induces sustained antibody responses and polyfunctional cellular immunity.,36062075
Mice transgenic for human <i>CTLA4-CD28</i> fusion gene show proliferation and transformation of ATLL-like and AITL-like T cells.,35003894
Monocytes Contribute to IFN-β Production via the MyD88-Dependent Pathway and Cytotoxic T-Cell Responses against Mucosal Respiratory Syncytial Virus Infection.,34522440
"Targeting Ubiquitin-like Protein, ISG15, as a Novel Tumor Associated Antigen in Colorectal Cancer.",36831577
Role of FK506-sensitive signals in asthmatic lung inflammation.,36439133
Combination TIGIT/PD-1 blockade enhances the efficacy of neoantigen vaccines in a model of pancreatic cancer.,36569934
RNA binding protein DDX5 restricts RORγt<sup>+</sup> T<sub>reg</sub> suppressor function to promote intestine inflammation.,36724232
CRISPR-Cas9 mediated generation of a conditional poly(A) binding protein nuclear 1 (Pabpn1) mouse model reveals an essential role for hematopoietic stem cells.,35504940
PKHB1 peptide induces antiviral effects through induction of immunogenic cell death in herpes simplex keratitis.,36532743
Comparison of murine retroorbital plexus and facial vein blood collection to mitigate animal ethics issues.,33958002
Cure of syngeneic carcinomas with targeted IL-12 through obligate reprogramming of lymphoid and myeloid immunity.,35260537
Alpha-Lipoic Acid Inhibits Spontaneous Diabetes and Autoimmune Recurrence in Non-Obese Diabetic Mice by Enhancing Differentiation of Regulatory T Cells and Showed Potential for Use in Cell Therapies for the Treatment of Type 1 Diabetes. ,35163121
Intratumoral immunotherapy relies on B and T cell collaboration.,35622903
Adjuvant Effects of a New Saponin Analog VSA-1 on Enhancing Homologous and Heterosubtypic Protection by Influenza Virus Vaccination.,36146461
Inducible costimulator ligand (ICOSL) on CD19<sup>+</sup> B cells is involved in immunopathological damage of rheumatoid arthritis (RA).,36405702
Mice with diverse microbial exposure histories as a model for preclinical vaccine testing.,34731647
Btn2a2 Regulates ILC2-T Cell Cross Talk in Type 2 Immune Responses.,35145516
Vascular Normalization Was Associated with Colorectal Tumor Regression upon Anti-PD-L1 Combinational Therapy.,36969495
T cell self-reactivity during thymic development dictates the timing of positive selection. ,33884954
CNS Pericytes Modulate Local T Cell Infiltration in EAE.,36361868
High-yield enrichment of mouse small intestine intraepithelial lymphocytes by immunomagnetic depletion of EpCAM<sup>+</sup> cells.,35243383
Pbrm1 intrinsically controls the development and effector differentiation of iNKT cells.,35770325
Superantigens promote <i>Staphylococcus aureus</i> bloodstream infection by eliciting pathogenic interferon-gamma production.,35165181
OX40 agonism enhances PD-L1 checkpoint blockade by shifting the cytotoxic T cell differentiation spectrum.,36796366
Incidence and severity of G6PI-induced arthritis are not increased in genetically distinct mouse strains upon aging.,34429153
IL-6/STAT3 signaling in tumor cells restricts the expression of frameshift-derived neoantigens by SMG1 induction.,36443756
"Osteopontin contributes to virus resistance associated with type I IFN expression, activation of downstream ifn-inducible effector genes, and CCR2<sup>+</sup>CD115<sup>+</sup>CD206<sup>+</sup> macrophage infiltration following ocular HSV-1 infection of mice.",36685562
Early innate and adaptive immune perturbations determine long-term severity of chronic virus and Mycobacterium tuberculosis coinfection.,33515487
Fecal IgA Levels Are Determined by Strain-Level Differences in Bacteroides ovatus and Are Modifiable by Gut Microbiota Manipulation.,32075742
Immunotherapy with IL12 and PD1/CTLA4 inhibition is effective in advanced ovarian cancer and associates with reversal of myeloid cell-induced immunosuppression.,37066116
Fully murine CD105-targeted CAR-T cells provide an immunocompetent model for CAR-T cell biology.,36275862
Th17/1-Biased Inflammatory Environment Involved in the Response of Epithelial Cells to Antigen Stimuli in Nasal Polyps.,34222494
Spatial transcriptomics demonstrates the role of CD4 T cells in effector CD8 T cell differentiation during chronic viral infection.,36450262
P2Y<sub>12</sub>-dependent activation of hematopoietic stem and progenitor cells promotes emergency hematopoiesis after myocardial infarction.,35353230
Distinct Cell Adhesion Signature Defines Glioblastoma Myeloid-Derived Suppressor Cell Subsets.,36126163
Subunit microparticulate vaccine delivery using microneedles trigger significant SARS-spike-specific humoral and cellular responses in a preclinical murine model.,36610521
The RNA-binding protein IMP2 drives a stromal-Th17 cell circuit in autoimmune neuroinflammation. ,34914635
Intratumoral BO-112 in combination with radiotherapy synergizes to achieve CD8 T-cell-mediated local tumor control.,36631161
Erythropoietin Reduces Auto- and Alloantibodies by Inhibiting T Follicular Helper Cell Differentiation.,34261755
SRA inhibition improves antitumor potency of antigen-targeted chaperone vaccine.,36793731
Combination of apoptotic T cell induction and self-peptide administration for therapy of experimental autoimmune encephalomyelitis.,31097410
The neuropeptide PACAP alleviates T. gondii infection-induced neuroinflammation and neuronal impairment.,36403002
Hypercholesterolemia Negatively Regulates P2X7-Induced Cellular Function in CD4<sup>+</sup> and CD8<sup>+</sup> T-Cell Subsets from B6 Mice Fed a High-Fat Diet.,35743168
"Human CD22-Transgenic, Primary Murine Lymphoma Challenges Immunotherapies in Organ-Specific Tumor Microenvironments. ",34638774
Choroid Plexus-Infiltrating T Cells as Drivers of Murine Neuropsychiatric Lupus.,35637551
Low-dose self-amplifying mRNA COVID-19 vaccine drives strong protective immunity in non-human primates against SARS-CoV-2 infection.,35672369
P2X7 purinergic receptor plays a critical role in maintaining T-cell homeostasis and preventing lupus pathogenesis.,36248812
Immunological conversion of solid tumours using a bispecific nanobioconjugate for cancer immunotherapy.,36357792
Physiological and Functional Effects of Dominant Active TCRα Expression in Transgenic Mice.,37047500
IL-2/JES6-1 mAb complexes dramatically increase sensitivity to LPS through IFN-γ production by CD25+Foxp3- T cells. ,34932467
Development of follicular dendritic cells in lymph nodes depends on retinoic acid-mediated signaling.,34528674
Comprehensive Testing of Chemotherapy and Immune Checkpoint Blockade in Preclinical Cancer Models Identifies Additive Combinations.,35634282
PARP14 inhibition restores PD-1 immune checkpoint inhibitor response following IFNγ-driven adaptive resistance,10.1101/2022.11.18.517143
Linking erythropoietin to Treg-dependent allograft survival through myeloid cells.,35389892
Involvement of autophagy in exacerbation of eosinophilic airway inflammation in a murine model of obese asthma.,35098856
Context-Dependent Role for T-bet in T Follicular Helper Differentiation and Germinal Center Function following Viral Infection.,31412245
Elective nodal irradiation mitigates local and systemic immunity generated by combination radiation and immunotherapy in head and neck tumors.,36385142
Rational construction of controllable autoimmune diabetes model depicting clinical features.,35061693
Host Genetics But Not Commensal Microbiota Determines the Initial Development of Systemic Autoimmune Disease in BXD2 Mice.,34725967
High-Oxygen Submersion Fetal Thymus Organ Cultures Enable FOXN1-Dependent and -Independent Support of T Lymphopoiesis.,33859647
Primary and memory immune responses against rough <i>Brucella canis</i> are less robust compared to smooth <i>B. abortus</i> and <i>B. melitensis</i> following intratracheal infection in mice.,36032120
Group 1 innate lymphoid-cell-derived interferon-γ maintains anti-viral vigilance in the mucosal epithelium.,33434494
Quantitative Difference in PLZF Protein Expression Determines iNKT Lineage Fate and Controls Innate CD8 T Cell Generation.,31141681
Immunization using ApoB-100 peptide-linked nanoparticles reduces atherosclerosis.,35536648
Modification of the Tumor Microenvironment Enhances Anti-PD-1 Immunotherapy in Metastatic Melanoma.,36365247
CD4 T cells mediate brain inflammation and neurodegeneration in a mouse model of Parkinson's disease.,33704423
C57BL/6 Mice Pretreated With Alpha-Tocopherol Show a Better Outcome of <i>Trypanosoma cruzi</i> Infection With Less Tissue Inflammation and Fibrosis.,35154155
Foxo3a tempers excessive glutaminolysis in activated T cells to prevent fatal gut inflammation in the murine IL-10<sup>-/-</sup> model of colitis.,34588632
Re-purposing the pro-senescence properties of doxorubicin to introduce immunotherapy in breast cancer brain metastasis.,36384097
Inflammation triggers ILC3 patrolling of the intestinal barrier.,35999393
The dietary sweetener sucralose is a negative modulator of T cell-mediated responses.,36922598
IFN-γ signature enables selection of neoadjuvant treatment in patients with stage III melanoma.,36920329
β2-adrenergic receptor signaling regulates metabolic pathways critical to myeloid-derived suppressor cell function within the TME.,34706232
ATF7ip Targets Transposable Elements for H3K9me3 Deposition to Modify CD8<sup>+</sup> T Cell Effector and Memory Responses.,35110421
"Effect of immunosuppressants on the parasite load developed in, and immune response to, visceral leishmaniasis: A comparative study in a mouse model.",33524030
Forced expression of the non-coding RNA miR-17∼92 restores activation and function in CD28-deficient CD4<sup>+</sup> T cells.,36388982
Plasmodium manipulates the expression of host long non-coding RNA during red blood cell intracellular infection.,35643541
"Indoleamine 2,3-dioxygenase 1 activation in mature cDC1 promotes tolerogenic education of inflammatory cDC2 via metabolic communication.",35704993
Pediococcus pentosaceus CECT 8330 protects DSS-induced colitis and regulates the intestinal microbiota and immune responses in mice.,35033121
"Thymidine rescues ATR kinase inhibitor-induced deoxyuridine contamination in genomic DNA, cell death, and interferon-α/β expression.",36130512
Spontaneous CD4+ T Cell Activation and Differentiation in Lupus-Prone B6.Nba2 Mice Is IFNAR-Independent.,35055071
ZEB1 promotes pathogenic Th1 and Th17 cell differentiation in multiple sclerosis.,34433042
Live Vaccination Generates Both Disease Tolerance and Host Resistance During Chronic Pulmonary Infection With Highly Virulent Francisella tularensis SchuS4.,29931113
Cancer cell-autonomous overactivation of PARP1 compromises immunosurveillance in non-small cell lung cancer.,35772809
Retinoic Acid Signaling Modulates Recipient Gut Barrier Integrity and Microbiota After Allogeneic Hematopoietic Stem Cell Transplantation in Mice.,34759928
Gastrointestinal Dopamine in Inflammatory Bowel Diseases: A Systematic Review. ,34884737
Repositioning liothyronine for cancer immunotherapy by blocking the interaction of immune checkpoint TIGIT/PVR.,32894141
Plaque-associated myeloid cells derive from resident microglia in an Alzheimer's disease model. ,31967645
Eosinophil-Mediated Immune Control of Adult Filarial Nematode Infection Can Proceed in the Absence of IL-4 Receptor Signaling.,32571840
Angioimmunoblastic T-cell lymphoma-like lymphadenopathy in mice transgenic for human <i>RHOA</i> with p.Gly17Val mutation.,32923110
The balance of interleukin-12 and interleukin-23 determines the bias of MAIT1 versus MAIT17 responses during bacterial infection.,35514192
Neoadjuvant Intratumoral Immunotherapy with TLR9 Activation and Anti-OX40 Antibody Eradicates Metastatic Cancer.,35135810
Protein arginine methyltransferase 1 is required for maintenance of normal adult hematopoiesis.,31853216
Impaired HA-specific T follicular helper cell and antibody responses to influenza vaccination are linked to inflammation in humans. ,34726156
The phosphatase PTEN links platelets with immune regulatory functions of mouse T follicular helper cells.,35589797
Spherical Nucleic Acid Vaccine Structure Markedly Influences Adaptive Immune Responses of Clinically Utilized Prostate Cancer Targets.,34494382
Targeting Glutamine Metabolism to Enhance Immunoprevention of EGFR-Driven Lung Cancer.,35861366
Role of distinct fibroblast lineages and immune cells in dermal repair following UV radiation-induced tissue damage. ,34939928
IL-4-Producing Vγ1<sup>+</sup>/Vδ6<sup>+</sup> γδ T Cells Sustain Germinal Center Reactions in Peyer's Patches of Mice.,34804014
Wnt-β-catenin activation epigenetically reprograms T<sub>reg</sub> cells in inflammatory bowel disease and dysplastic progression.,33664518
Proteolysis-targeting chimera against BCL-X<sub>L</sub> destroys tumor-infiltrating regulatory T cells.,33627663
Microglia Require CD4 T Cells to Complete the Fetal-to-Adult Transition.,32702313
Effector T cell responses unleashed by regulatory T cell ablation exacerbate oral squamous cell carcinoma.,34622236
Evaluating Antibody Pharmacokinetics as Prerequisite for Determining True Efficacy as Shown by Dual Targeting of PD-1 and CD96.,36140247
Immunotherapy Combined with Metronomic Dosing: An Effective Approach for the Treatment of NSCLC. ,33920884
Clonally expanded CD8 T cells characterize amyotrophic lateral sclerosis-4.,35732742
Activated B lymphocytes and tumor cell lysate as an effective cellular cancer vaccine.,33765210
mTOR-dependent translation drives tumor infiltrating CD8<sup>+</sup> effector and CD4<sup>+</sup> Treg cells expansion.,34787568
Coordinated Viral Control by Cytotoxic Lymphocytes Ensures Optimal Adaptive NK Cell Responses.,32966792
The Inhibitory Receptor GPR56 (Adgrg1) Is Specifically Expressed by Tissue-Resident Memory T Cells in Mice But Dispensable for Their Differentiation and Function In Vivo. ,34685654
Inducible T-Cell Costimulator Mediates Lymphocyte/Macrophage Interactions During Liver Repair.,34925367
The concerted change in the distribution of cell cycle phases and zone composition in germinal centers is regulated by IL-21.,34887406
Binary outcomes of enhancer activity underlie stable random monoallelic expression.,35617021
Circulating immunity protects the female reproductive tract from Chlamydia infection. ,34001624
CHBP induces stronger immunosuppressive CD127<sup>+</sup> M-MDSC via erythropoietin receptor.,33579907
Lung Regulatory T Cells Express Adiponectin Receptor 1: Modulation by Obesity and Airway Allergic Inflammation. ,33256137
Single-cell transcriptomics reveals immune dysregulation mediated by IL-17A in initiation of chronic lung injuries upon real-ambient particulate matter exposure.,35739565
Topical Application of Tetrandrine Nanoemulsion Promotes the Expansion of CD4<sup>+</sup>Foxp3<sup>+</sup> Regulatory T Cells and Alleviates Imiquimod-Induced Psoriasis in Mice.,35464441
CXCL10<sup>+</sup> peripheral activation niches couple preferred sites of Th1 entry with optimal APC encounter.,34380032
Whole-Exome Sequencing of Radiation-Induced Thymic Lymphoma in Mouse Models Identifies Notch1 Activation as a Driver of p53 Wild-Type Lymphoma.,34035082
Single cell transcriptomics of mouse kidney transplants reveals a myeloid cell pathway for transplant rejection. ,32970632
Lipid nanoparticles enhance the efficacy of mRNA and protein subunit vaccines by inducing robust T follicular helper cell and humoral responses.,34852217
Limited access to antigen drives generation of early B cell memory while restraining the plasmablast response.,34525339
TNF-α Contributes to Lymphoid Tissue Disorganization and Germinal Center B Cell Suppression during Intracellular Bacterial Infection.,31570507
IL-23 reshapes kidney resident cell metabolism and promotes local kidney inflammation. ,33956666
CXCL11 expressing C57BL/6 mice have intact adaptive immune responses to viral infection.,35233830
"Novel Oncolytic Herpes Simplex Virus 1 VC2 Promotes Long-Lasting, Systemic Anti-melanoma Tumor Immune Responses and Increased Survival in an Immunocompetent B16F10-Derived Mouse Melanoma Model.",33177208
GABAergic neuronal IL-4R mediates T cell effect on memory.,34793707
Tripartite-Motif 21 (TRIM21) Deficiency Results in a Modest Loss of Herpes Simplex Virus (HSV)-1 Surveillance in the Trigeminal Ganglia Following Cornea Infection.,35336995
Tumor membrane-based vaccine immunotherapy in combination with anti-CTLA-4 antibody confers protection against immune checkpoint resistant murine triple-negative breast cancer.,32530786
p53 Hinders CRISPR/Cas9-Mediated Targeted Gene Disruption in Memory CD8 T Cells In Vivo.,32887747
Valproic Acid Suppresses Autoimmune Recurrence and Allograft Rejection in Islet Transplantation through Induction of the Differentiation of Regulatory T Cells and Can Be Used in Cell Therapy for Type 1 Diabetes. ,34067829
Radiotherapy-exposed CD8+ and CD4+ neoantigens enhance tumor control. ,33476307
Decitabine priming increases anti-PD-1 antitumor efficacy by promoting CD8+ progenitor exhausted T cell expansion in tumor models.,36853831
Cold exposure protects from neuroinflammation through immunologic reprogramming.,34687652
Inducible de novo expression of neoantigens in tumor cells and mice.,32719479
The phytochemical bergenin as an adjunct immunotherapy for tuberculosis in mice.,30975902
CD80 Expression on Tumor Cells Alters Tumor Microenvironment and Efficacy of Cancer Immunotherapy by CTLA-4 Blockade. ,33923750
Transgenic Expression of a Mutant Ribonuclease Regnase-1 in T Cells Disturbs T Cell Development and Functions.,34305914
Testosterone Promotes the Intestinal Replication and Dissemination of Coxsackievirus B3 in an Oral Inoculation Mouse Model.,36037480
An epidemic Zika virus isolate suppresses antiviral immunity by disrupting antigen presentation pathways.,34193875
"IL-12 Blocks Tfh Cell Differentiation during Salmonella Infection, thereby Contributing to Germinal Center Suppression.",31775046
"An immune-competent, replication-permissive Syrian Hamster glioma model for evaluating Delta-24-RGD oncolytic adenovirus.",34059921
Niche derived netrin-1 regulates hematopoietic stem cell dormancy via its receptor neogenin-1.,33504783
PARP14 inhibition restores PD-1 immune checkpoint inhibitor response following IFNγ-driven adaptive resistance,10.21203/rs.3.rs-2277897/v1
"Eosinophil-derived chemokine (hCCL15/23, mCCL6) interacts with CCR1 to promote eosinophilic airway inflammation.",33640900
Antagonistic Inflammatory Phenotypes Dictate Tumor Fate and Response to Immune Checkpoint Blockade.,33220234
Autophagic protein ATG5 controls antiviral immunity via glycolytic reprogramming of dendritic cells against respiratory syncytial virus infection.,32816604
Single-cell sequencing reveals antitumor characteristics of intratumoral immune cells in old mice.,34642245
Live Vaccination with Blood-Stage <i>Plasmodium yoelii</i> 17XNL Prevents the Development of Experimental Cerebral Malaria.,35632518
The HDL particle composition determines its antitumor activity in pancreatic cancer.,35577388
SZB120 Exhibits Immunomodulatory Effects by Targeting eIF2α to Suppress Th17 Cell Differentiation.,33483349
Intestinal inflammation alters the antigen-specific immune response to a skin commensal.,35649365
Plasmodium yoelii 17XL infection modified maturation and function of dendritic cells by skewing Tregs and amplificating Th17.,32252652
A Multitrait Locus Regulates Sarbecovirus Pathogenesis.,35862771
Prevention of Tumor Growth and Dissemination by In Situ Vaccination with Mitochondria-Targeted Atovaquone.,35243806
T cell-specific constitutive active SHP2 enhances T cell memory formation and reduces T cell activation.,35983034
Thrombospondin-1 Silencing Improves Lymphocyte Infiltration in Tumors and Response to Anti-PD-1 in Triple-Negative Breast Cancer. ,34439212
Overexpression of Interleukin-33 in Recombinant Rabies Virus Enhances Innate and Humoral Immune Responses through Activation of Dendritic Cell-Germinal Center Reactions. ,35062695
NKG2D-Fc fusion protein promotes antitumor immunity through the depletion of immunosuppressive cells.,32468232
Dietary conjugated linoleic acid links reduced intestinal inflammation to amelioration of CNS autoimmunity.,33899089
TREM-2 is a sensor and activator of T cell response in SARS-CoV-2 infection.,34878838
The energy sensor AMPK orchestrates metabolic and translational adaptation in expanding T helper cells.,33715236
E3 Ubiquitin Ligase Von Hippel-Lindau Protein Promotes Th17 Differentiation.,32690659
Immunogenicity and Protective Efficacy of an Intranasal Live-attenuated Vaccine Against SARS-CoV-2 in Preclinical Animal Models,10.1101/2021.01.08.425974
Soluble CD137 Ameliorates Acute Type 1 Diabetes by Inducing T Cell Anergy.,31787971
Knockout of high-mobility group box 1 in B16F10 melanoma cells induced host immunity-mediated suppression of in vivo tumor growth.,35150340
Estrogen markedly reduces circulating low-density neutrophils and enhances pro-tumoral gene expression in neutrophil of tumour-bearing mice.,34511060
Blocking T-cell egress with FTY720 extends DNA vaccine expression but reduces immunogenicity.,34775601
Interferon-α-producing plasmacytoid dendritic cells drive the loss of adipose tissue regulatory T cells during obesity.,34256015
Immunogenicity and protective efficacy of an intranasal live-attenuated vaccine against SARS-CoV-2.,34368648
CCL28 Downregulation Attenuates Pancreatic Cancer Progression Through Tumor Cell-Intrinsic and -Extrinsic Mechanisms.,34939465
Loss of 15-lipoxygenase disrupts T<sub>reg</sub> differentiation altering their pro-resolving functions.,34040168
TNFR2/14-3-3ε signaling complex instructs macrophage plasticity in inflammation and autoimmunity. ,34185706
