Title,ID
Inactivated <i>Mycobacterium phlei</i> inhalation ameliorates allergic asthma through modulating the balance of CD4+CD25+ regulatory T and Th17 cells in mice.,27803782
Cell-Intrinsic Glycogen Metabolism Supports Early Glycolytic Reprogramming Required for Dendritic Cell Immune Responses.,28877459
Development and Evaluation of a Cryopreserved Whole-Parasite Vaccine in a Rodent Model of Blood-Stage Malaria.,34663097
Intravenous nanoparticle vaccination generates stem-like TCF1<sup>+</sup> neoantigen-specific CD8<sup>+</sup> T cells.,33139915
Systemic inhibition of PTPN22 augments anticancer immunity.,34283806
"Overexpression of Murine Rnaset2 in a Colon Syngeneic Mouse Carcinoma Model Leads to Rebalance of Intra-Tumor M1/M2 Macrophage Ratio, Activation of T Cells, Delayed Tumor Growth, and Rejection. ",32197460
T Cell-Derived IL-17A Induces Vascular Dysfunction via Perivascular Fibrosis Formation and Dysregulation of <sup>·</sup>NO/cGMP Signaling.,31396305
Genome-scale in vivo CRISPR screen identifies RNLS as a target for beta cell protection in type 1 diabetes.,32719542
A Requirement of Protein Geranylgeranylation for Chemokine Receptor Signaling and Th17 Cell Function in an Animal Model of Multiple Sclerosis.,33828552
Endogenous Galectin-1 in T Lymphocytes Regulates Anti-prostate Cancer Immunity.,30319642
Excessive neutrophil levels in the lung underlie the age-associated increase in influenza mortality.,30617300
ADAM10-Mediated ICOS Ligand Shedding on B Cells Is Necessary for Proper T Cell ICOS Regulation and T Follicular Helper Responses.,28814605
Oleate but not stearate induces the regulatory phenotype of myeloid suppressor cells.,28790345
γδ T cell IFNγ production is directly subverted by Yersinia pseudotuberculosis outer protein YopJ in mice and humans.,34871329
Targeted Delivery of Antigen to Activated CD169<sup>+</sup> Macrophages Induces Bias for Expansion of CD8<sup>+</sup> T Cells.,30393066
Polymicrobial Sepsis Impairs Antigen-Specific Memory CD4 T Cell-Mediated Immunity.,32903436
Protective Intranasal Immunization Against Influenza Virus in Infant Mice Is Dependent on IL-6.,33193346
Neurokinin-1 Receptor Signaling Is Required for Efficient Ca<sup>2+</sup> Flux in T-Cell-Receptor-Activated T Cells.,32160549
Enhancing immunotherapy of STING agonist for lymphoma in preclinical models.,30194137
Novel malaria antigen Plasmodium yoelii E140 induces antibody-mediated sterile protection in mice against malaria challenge.,32407410
Microglia Require CD4 T Cells to Complete the Fetal-to-Adult Transition.,32702313
"Liposomal Delivery of the RNA Genome of a Live-Attenuated Chikungunya Virus Vaccine Candidate Provides Local, but Not Systemic Protection After One Dose.",32194557
A transplantable tumor model allowing investigation of NY-BR-1-specific T cell responses in HLA-DRB1*0401 transgenic mice.,31519152
Rova-T enhances the anti-tumor activity of anti-PD1 in a murine model of small cell lung cancer with endogenous Dll3 expression.,33074129
Single cell transcriptomics of mouse kidney transplants reveals a myeloid cell pathway for transplant rejection. ,32970632
GCNT1-Mediated <i>O</i>-Glycosylation of the Sialomucin CD43 Is a Sensitive Indicator of Notch Signaling in Activated T Cells.,32060138
GM-CSF Programs Hematopoietic Stem and Progenitor Cells During <i>Candida albicans</i> Vaccination for Protection Against Reinfection.,34975887
Blood-stage malaria parasites manipulate host innate immune responses through the induction of sFGL2.,32133407
Broad cross protection by recombinant live attenuated influenza H3N2 seasonal virus expressing conserved M2 extracellular domain in a chimeric hemagglutinin.,33603072
MACHETE identifies interferon-encompassing chromosome 9p21.3 deletions as mediators of immune evasion and metastasis.,36344707
B7-H3×4-1BB bispecific antibody augments antitumor immunity by enhancing terminally differentiated CD8<sup>+</sup> tumor-infiltrating lymphocytes.,33523913
WSX1 act as a tumor suppressor in hepatocellular carcinoma by downregulating neoplastic PD-L1 expression.,34108491
"Inflammatory responses induce an identity crisis of alveolar macrophages, leading to pulmonary alveolar proteinosis.",28916727
Dynamic regulation of chromatin organizer SATB1 via TCR-induced alternative promoter switch during T-cell development.,32392347
The concerted change in the distribution of cell cycle phases and zone composition in germinal centers is regulated by IL-21.,34887406
Discovery of surrogate agonists for visceral fat Treg cells that modulate metabolic indices in vivo.,32773038
Cancer-associated fibroblasts induce antigen-specific deletion of CD8 <sup>+</sup> T Cells to protect tumour cells.,29507342
Resolving Cell Cycle Speed in One Snapshot with a Live-Cell Fluorescent Reporter.,32579930
Myxoma Virus-Loaded Mesenchymal Stem Cells in Experimental Oncolytic Therapy of Murine Pulmonary Melanoma.,32775618
The neutrophil antimicrobial peptide cathelicidin promotes Th17 differentiation.,33627652
Calcineurin inhibitors suppress acute graft-versus-host disease via NFAT-independent inhibition of T cell receptor signaling. ,33822776
let-7g counteracts endothelial dysfunction and ameliorating neurological functions in mouse ischemia/reperfusion stroke model.,32017988
Id1 and PD-1 Combined Blockade Impairs Tumor Growth and Survival of KRAS-mutant Lung Cancer by Stimulating PD-L1 Expression and Tumor Infiltrating CD8+ T Cells. ,33126649
A micropeptide encoded by lncRNA MIR155HG suppresses autoimmune inflammation via modulating antigen presentation.,32671205
Repositioning liothyronine for cancer immunotherapy by blocking the interaction of immune checkpoint TIGIT/PVR.,32894141
CTLA-4 expression by B-1a B cells is essential for immune tolerance.,33483505
Virotherapy-recruited PMN-MDSC infiltration of mesothelioma blocks antitumor CTL by IL-10-mediated dendritic cell suppression.,30546960
Increase of α-dicarbonyls in liver and receptor for advanced glycation end products on immune cells are linked to nonalcoholic fatty liver disease and liver cancer.,33628620
Tet2 Controls the Responses of β cells to Inflammation in Autoimmune Diabetes.,34417463
Toll-like receptor 7 deficiency suppresses type 1 diabetes development by modulating B-cell differentiation and function.,33432061
Low-dose oncolytic adenovirus therapy overcomes tumor-induced immune suppression and sensitizes intracranial gliomas to anti-PD-1 therapy.,32642679
Cricket paralysis virus internal ribosome entry site-derived RNA promotes conventional vaccine efficacy by enhancing a balanced Th1/Th2 response.,31371226
Toll-Like Receptor 4 Expression on Lymphoma Cells Is Critical for Therapeutic Activity of Intratumoral Therapy With Synthetic TLR4 Agonist Glucopyranosyl Lipid A.,32974162
LC3-Associated Phagocytosis in Myeloid Cells Promotes Tumor Immune Tolerance.,30245008
P2X7 receptor restrains pathogenic Tfh cell generation in systemic lupus erythematosus.,30655308
Upregulated ethanolamine phospholipid synthesis via selenoprotein I is required for effective metabolic reprogramming during T cell activation.,33484950
Molecular clamp stabilised Spike protein for protection against SARS-CoV-2,10.21203/rs.3.rs-68892/v1
Synergy between <i>Toxoplasma gondii</i> type I Δ<i>GRA17</i> immunotherapy and PD-L1 checkpoint inhibition triggers the regression of targeted and distal tumors.,34725213
Characterization of a murine mixed neuron-glia model and cellular responses to regulatory T cell-derived factors.,29720228
Selective inhibition of mTORC1 in tumor vessels increases antitumor immunity. ,32759497
Pyrin-only protein 2 limits inflammation but improves protection against bacteria.,28580947
Nlrp12 Mediates Adverse Neutrophil Recruitment during Influenza Virus Infection.,29282312
Oxazaphosphorines combined with immune checkpoint blockers: dose-dependent tuning between immune and cytotoxic effects. ,32784216
PEGylated PLGA Nanoparticle Delivery of Eggmanone for T Cell Modulation: Applications in Rheumatic Autoimmunity.,32110018
CD4<sup>+</sup> T-Cell Responses Mediate Progressive Neurodegeneration in Experimental Ischemic Retinopathy.,32389572
CD8+ T Cells Protect During Vein Graft Disease Development.,31263704
Mutant BRAF and MEK Inhibitors Regulate the Tumor Immune Microenvironment via Pyroptosis.,31796433
<i>In Vivo</i> Epigenetic CRISPR Screen Identifies <i>Asf1a</i> as an Immunotherapeutic Target in <i>Kras</i>-Mutant Lung Adenocarcinoma.,31744829
Vaccine delivery alerts innate immune systems for more immunogenic vaccination. ,33690222
PP2A enables IL-2 signaling by preserving IL-2Rβ chain expression during Treg development. ,30912768
The plant hormone zeatin riboside inhibits T lymphocyte activity via adenosine A2A receptor activation.,24813229
A peptide encoded by pri-miRNA-31 represses autoimmunity by promoting T<sub>reg</sub> differentiation.,35343645
An Important Role for CD4+ T Cells in Adaptive Immunity to Toxoplasma gondii in Mice Lacking the Transcription Factor Batf3. ,32669460
Toll-Like Receptor 7 Enhances Rabies Virus-Induced Humoral Immunity by Facilitating the Formation of Germinal Centers.,30906301
A Recombinant Rabies Virus Expressing Fms-like Tyrosine Kinase 3 Ligand (Flt3L) Induces Enhanced Immunogenicity in Mice.,31254272
BHLHE40 Regulates the T-Cell Effector Function Required for Tumor Microenvironment Remodeling and Immune Checkpoint Therapy Efficacy.,35181783
Dendritic cell NLRC4 regulates influenza A virus-specific CD4 T cell responses through FasL expression.,31038471
CD200 promotes immunosuppression in the pancreatic tumor microenvironment. ,32581043
Modulation of Oxidative Stress and Inflammation in the Aged Lacrimal Gland.,33159886
"The Significant Reduction or Complete Eradication of Subcutaneous and Metastatic Lesions in a Pheochromocytoma Mouse Model after Immunotherapy Using Mannan-BAM, TLR Ligands, and Anti-CD40. ",31083581
Rapid Application of the Molecular Clamp Platform for SARS-CoV-2,10.2139/ssrn.3736395
Enhancing and inhibitory motifs regulate CD4 activity.,35861317
Enhanced tumor immune surveillance through neutrophil reprogramming due to Tollip deficiency.,30674719
T cell response kinetics determines neuroinfection outcomes during murine HSV infection. ,32161194
Bempegaldesleukin selectively depletes intratumoral Tregs and potentiates T cell-mediated cancer therapy.,32005826
Stroma-derived Fibrinogen-like Protein 2 Activates Cancer-associated Fibroblasts to Promote Tumor Growth in Lung Cancer.,28656005
"Local Irradiation Sensitized Tumors to Adoptive T Cell Therapy via Enhancing the Cross-Priming, Homing, and Cytotoxicity of Antigen-Specific CD8 T Cells.",31921127
Re-education of Tumor-Associated Macrophages by CXCR2 Blockade Drives Senescence and Tumor Inhibition in Advanced Prostate Cancer.,31433989
The metabolic hormone leptin promotes the function of T<sub>FH</sub> cells and supports vaccine responses.,34031386
m<sup>6</sup>A mRNA demethylase FTO regulates melanoma tumorigenicity and response to anti-PD-1 blockade.,31239444
Resistance of melanoma to immune checkpoint inhibitors is overcome by targeting the sphingosine kinase-1.,31974367
Intratumoral SIRPα-deficient macrophages activate tumor antigen-specific cytotoxic T cells under radiotherapy.,34050181
Endogenous T cells prevent tumor immune escape following adoptive T cell therapy.,31682239
CSF1R-dependent myeloid cells are required for NK‑mediated control of metastasis. ,29769439
The Impact of Gut Microbiota on Gender-Specific Differences in Immunity.,28713378
Hypoxic pre-conditioning suppresses experimental autoimmune encephalomyelitis by modifying multiple properties of blood vessels.,30176931
Gut dysbiosis induced by cardiac pressure overload enhances adverse cardiac remodeling in a T cell-dependent manner.,33103561
Tumor necrosis factor is a therapeutic target for immunological unbalance and cardiac abnormalities in chronic experimental Chagas' heart disease.,25140115
In situ vaccination at a peripheral tumor site augments response against melanoma brain metastases. ,32690669
Xenogenization of tumor cells by fusogenic exosomes in tumor microenvironment ignites and propagates antitumor immunity. ,32937446
Hassall's corpuscles with cellular-senescence features maintain IFNα production through neutrophils and pDC activation in the thymus.,30534943
CD8+ T Cells Responding to the Middle East Respiratory Syndrome Coronavirus Nucleocapsid Protein Delivered by Vaccinia Virus MVA in Mice. ,30558354
Contrast-enhanced ultrasound with sub-micron sized contrast agents detects insulitis in mouse models of type1 diabetes.,32382089
PD-1<sup>+</sup> melanocortin receptor dependent-Treg cells prevent autoimmune disease.,31729418
Extrafollicular CD4 T cell-derived IL-10 functions rapidly and transiently to support anti-Plasmodium humoral immunity.,33529242
The same self-peptide selects conventional and regulatory CD4⁺ T cells with identical antigen receptors.,25270305
Mechanisms of the immunosuppressive effects of mouse adipose tissue-derived mesenchymal stromal cells on mouse alloreactively stimulated spleen cells.,24348757
Monocyte-derived dendritic cells link localized secretory IgA deficiency to adaptive immune activation in COPD.,32968197
Combined Blockade of T Cell Immunoglobulin and Mucin Domain 3 and Carcinoembryonic Antigen-Related Cell Adhesion Molecule 1 Results in Durable Therapeutic Efficacy in Mice with Intracranial Gliomas.,28736431
Lipocalin 2 modulates dendritic cell activity and shapes immunity to influenza in a microbiome dependent manner.,33905460
"Genetically Defined, Syngeneic Organoid Platform for Developing Combination Therapies for Ovarian Cancer.",33158842
Two nanoformulations induce reactive oxygen species and immunogenetic cell death for synergistic chemo-immunotherapy eradicating colorectal cancer and hepatocellular carcinoma.,33407548
"Egr2 and 3 control inflammation, but maintain homeostasis, of PD-1high memory phenotype CD4 T cells. ",32709717
Immunotherapeutic Blockade of CD47 Inhibitory Signaling Enhances Innate and Adaptive Immune Responses to Viral Infection.,32294445
Autophagic protein ATG5 controls antiviral immunity via glycolytic reprogramming of dendritic cells against respiratory syncytial virus infection.,32816604
Preclinical development of a molecular clamp-stabilised subunit vaccine for severe acute respiratory syndrome coronavirus 2.,33841880
Cowpea Mosaic Virus Immunotherapy Combined with Cyclophosphamide Reduces Breast Cancer Tumor Burden and Inhibits Lung Metastasis.,31453050
Memory CD8<sup>+</sup> T cells mediate early pathogen-specific protection via localized delivery of chemokines and IFNγ to clusters of monocytes.,34516896
A major role for ferroptosis in <i>Mycobacterium tuberculosis</i>-induced cell death and tissue necrosis.,30787033
I-a<sup>low</sup>CD11b<sup>high</sup> DC Regulates the Immune Response in the Eyes of Experimental Autoimmune Uveitis.,32256194
Celastrol nanoemulsion induces immunogenicity and downregulates PD-L1 to boost abscopal effect in melanoma therapy.,33383300
The energy sensor AMPK orchestrates metabolic and translational adaptation in expanding T helper cells.,33715236
β2 adrenergic receptor-mediated signaling regulates the immunosuppressive potential of myeloid-derived suppressor cells.,31566578
FcγR engagement reprograms neutrophils into antigen cross-presenting cells that elicit acquired anti-tumor immunity.,34373452
β2→1-Fructans Modulate the Immune System <i>In Vivo</i> in a Microbiota-Dependent and -Independent Fashion.,28261212
Antibody-suppressor CD8+ T Cells Require CXCR5.,30830040
CDK7 Inhibition Potentiates Genome Instability Triggering Anti-tumor Immunity in Small Cell Lung Cancer.,31883968
CD137 and PD-L1 targeting with immunovirotherapy induces a potent and durable antitumor immune response in glioblastoma models.,34281988
Clearance of Chikungunya Virus Infection in Lymphoid Tissues Is Promoted by Treatment with an Agonistic Anti-CD137 Antibody. ,31578287
Targeting the myeloid checkpoint receptor SIRPα potentiates innate and adaptive immune responses to promote anti-tumor activity.,33256806
T cell infiltration in both human multiple system atrophy and a novel mouse model of the disease.,31993745
A distal enhancer at risk locus 11q13.5 promotes suppression of colitis by T<sub>reg</sub> cells.,32499651
Combined Rho-kinase inhibition and immunogenic cell death triggers and propagates immunity against cancer.,29867097
Anti-CD47 treatment enhances anti-tumor T-cell immunity and improves immunosuppressive environment in head and neck squamous cell carcinoma.,29632717
Batf3 selectively determines acquisition of CD8<sup>+</sup> dendritic cell phenotype and function.,27897162
Type I Interferon Signaling Is Required for Dacryoadenitis in the Nonobese Diabetic Mouse Model of Sjögren Syndrome. ,30347820
Glioblastoma Myeloid-Derived Suppressor Cell Subsets Express Differential Macrophage Migration Inhibitory Factor Receptor Profiles That Can Be Targeted to Reduce Immune Suppression.,32625208
Erythropoietin inhibits SGK1-dependent TH17 induction and TH17-dependent kidney disease. ,31013255
Ecrg4 contributes to the anti-glioma immunosurveillance through type-I interferon signaling.,28123880
pVAXhsp65 Vaccination Primes for High IL-10 Production and Decreases Experimental Encephalomyelitis Severity.,28321419
Neutrophil derived CSF1 induces macrophage polarization and promotes transplantation tolerance.,29314558
"""Small"" Intestinal Immunopathology Plays a ""Big"" Role in Lethal Cytokine Release Syndrome, and Its Modulation by Interferon-γ, IL-17A, and a Janus Kinase Inhibitor.",32676080
CD8+ T cell-independent tumor regression induced by Fc-OX40L and therapeutic vaccination in a mouse model of glioma.,24293627
Age-related tumor growth in mice is related to integrin α 4 in CD8+ T cells. ,30385729
An Antigen-Presenting and Apoptosis-Inducing Polymer Microparticle Prolongs Alloskin Graft Survival by Selectively and Markedly Depleting Alloreactive CD8<sup>+</sup> T Cells.,28649247
TCF-1 and HEB cooperate to establish the epigenetic and transcription profiles of CD4<sup>+</sup>CD8<sup>+</sup> thymocytes.,30420627
Nanoparticle-encapsulated siRNAs for gene silencing in the haematopoietic stem-cell niche.,33020600
Regulatory T cells promote myelin regeneration in the central nervous system.,28288125
Aerobic Glycolysis Controls Myeloid-Derived Suppressor Cells and Tumor Immunity via a Specific CEBPB Isoform in Triple-Negative Breast Cancer.,29805099
Lambda phage-based vaccine induces antitumor immunity in hepatocellular carcinoma.,28971150
Diversity of the CD4 T Cell Alloresponse: The Short and the Long of It.,26804905
IL12 Abrogates Calcineurin-Dependent Immune Evasion during Leukemia Progression.,31142509
Diosgenin promotes antitumor immunity and PD-1 antibody efficacy against melanoma by regulating intestinal microbiota.,30305604
Tumor-released autophagosomes induces CD4<sup>+</sup> T cell-mediated immunosuppression via a TLR2-IL-6 cascade.,31300052
Sepsis induces long-lasting impairments in CD4+ T-cell responses despite rapid numerical recovery of T-lymphocyte populations.,30730978
Splicing factor SRSF1 controls T cell hyperactivity and systemic autoimmunity.,31487268
Unique roles of co-receptor-bound LCK in helper and cytotoxic T cells.,36564464
CD40L protects against mouse hepatitis virus-induced neuroinflammatory demyelination.,34898656
The induction of peripheral trained immunity in the pancreas incites anti-tumor activity to control pancreatic cancer progression.,35140221
Novel induction of CD40 expression by tumor cells with RAS/RAF/PI3K pathway inhibition augments response to checkpoint blockade.,34092233
Lipid-Mediated Insertion of Toll-Like Receptor (TLR) Ligands for Facile Immune Cell Engineering.,32425924
Non-canonicaly recruited TCRαβCD8αα IELs recognize microbial antigens.,30022086
Antigen-presenting ILC3 regulate T cell-dependent IgA responses to colonic mucosal bacteria.,30814299
Chemotherapeutic tumor microparticles combining low-dose irradiation reprogram tumor-promoting macrophages through a tumor-repopulating cell-curtailing pathway.,28680743
IFN-I response timing relative to virus replication determines MERS coronavirus infection outcomes.,31355779
Host Immunity Following Near-Infrared Photoimmunotherapy Is Enhanced with PD-1 Checkpoint Blockade to Eradicate Established Antigenic Tumors.,30683733
"TCR Transgenic Mice Reveal Stepwise, Multi-site Acquisition of the Distinctive Fat-Treg Phenotype.",29887374
A CD40 Agonist and PD-1 Antagonist Antibody Reprogram the Microenvironment of Nonimmunogenic Tumors to Allow T-cell-Mediated Anticancer Activity.,30642833
Oncolytic Herpes Simplex Virus Encoding IL12 Controls Triple-Negative Breast Cancer Growth and Metastasis.,32266155
Pharmacologic Screening Identifies Metabolic Vulnerabilities of CD8<sup>+</sup> T Cells.,33277233
Macrophage Migration Inhibitory Factor protects cancer cells from immunogenic cell death and impairs anti-tumor immune responses.,29864117
Nestin-Expressing Precursors Give Rise to Both Endothelial as well as Nonendothelial Lymph Node Stromal Cells.,27574301
Surveillance on the status of immune cells after Echinnococcus granulosus protoscoleces infection in Balb/c mice.,23555767
Flow cytometric analysis of inflammatory and resident myeloid populations in mouse ocular inflammatory models.,27544307
CD8+ T cells are preferentially activated during primary low dose leishmania major infection but are completely dispensable during secondary anti-Leishmania immunity.,25412267
"Unresolved endoplasmic reticulum stress engenders immune-resistant, latent pancreatic cancer metastases. ",29773669
The Heteromeric Complex Formed by Dopamine Receptor D<sub>5</sub> and CCR9 Leads the Gut Homing of CD4<sup>+</sup> T Cells Upon Inflammation.,33864900
Tbet Expression in Regulatory T Cells Is Required to Initiate Th1-Mediated Colitis.,31572375
Ionizing radiation sensitizes tumors to PD-L1 immune checkpoint blockade in orthotopic murine head and neck squamous cell carcinoma.,29123967
Age-associated and therapy-induced alterations in the cellular microenvironment of experimental gliomas.,29152068
JAK inhibitor has the amelioration effect in lupus-prone mice: the involvement of IFN signature gene downregulation.,28830352
Enforced Expression of CXCR5 Drives T Follicular Regulatory-Like Features in Foxp3<sup>+</sup> T Cells.,27737526
<i>Ubc9</i> Is Required for Positive Selection and Late-Stage Maturation of Thymocytes.,28314856
Combined Trabectedin and anti-PD1 antibody produces a synergistic antitumor effect in a murine model of ovarian cancer.,26219551
Prostaglandin E2 promotes intestinal inflammation via inhibiting microbiota-dependent regulatory T cells. ,33579710
T-cell autonomous death induced by regeneration of inert glucocorticoid metabolites.,28726773
Affinity-Restricted Memory B Cells Dominate Recall Responses to Heterologous Flaviviruses.,33010224
Lack of FcRn Impairs Natural Killer Cell Development and Functions in the Tumor Microenvironment.,30323819
Memory B cells form in aged mice despite impaired affinity maturation and germinal center kinetics.,24389058
Batf3 deficiency is not critical for the generation of CD8α⁺ dendritic cells.,25468565
IL22 Promotes <i>Kras</i>-Mutant Lung Cancer by Induction of a Protumor Immune Response and Protection of Stemness Properties.,29764837
Wiskott-Aldrich syndrome protein (WASP) is a tumor suppressor in T cell lymphoma.,30510251
Defining T Cell States Associated with Response to Checkpoint Immunotherapy in Melanoma.,30388456
Toll like receptor 7 expressed by malignant cells promotes tumor progression and metastasis through the recruitment of myeloid derived suppressor cells.,30546943
Low-dose interleukin-2 reverses behavioral sensitization in multiple mouse models of headache disorders.,32028334
Natural Killer Cells Degenerate Intact Sensory Afferents following Nerve Injury.,30712871
Targeting of the class II transactivator attenuates inflammation and neurodegeneration in an alpha-synuclein model of Parkinson's disease.,30165873
Precision DNA demethylation ameliorates disease in lupus-prone mice. ,30135300
A Chimeric Japanese Encephalitis Vaccine Protects against Lethal Yellow Fever Virus Infection without Inducing Neutralizing Antibodies. ,32265332
Alteration of Tumor Metabolism by CD4+ T Cells Leads to TNF-α-Dependent Intensification of Oxidative Stress and Tumor Cell Death.,29887396
Protection against H5N1 Influenza Virus Induced by Matrix-M Adjuvanted Seasonal Virosomal Vaccine in Mice Requires Both Antibodies and T Cells.,26696245
"Zeb1 represses TCR signaling, promotes the proliferation of T cell progenitors and is essential for NK1.1<sup>+</sup> T cell development.",32398809
Effector T cell responses unleashed by regulatory T cell ablation exacerbate oral squamous cell carcinoma.,34622236
Bone marrow laminins influence hematopoietic stem and progenitor cell cycling and homing to the bone marrow.,29360499
Systemic silencing of PHD2 causes reversible immune regulatory dysfunction.,31162141
Fibroblastic niches prime T cell alloimmunity through Delta-like Notch ligands.,28319044
Irreversible electroporation augments checkpoint immunotherapy in prostate cancer and promotes tumor antigen-specific tissue-resident memory CD8+ T cells.,34162858
Proliferating Helper T Cells Require Rictor/mTORC2 Complex to Integrate Signals from Limiting Environmental Amino Acids.,27799302
Alpha/Beta Interferon (IFN-α/β) Signaling in Astrocytes Mediates Protection against Viral Encephalomyelitis and Regulates IFN-γ-Dependent Responses. ,29491163
Immune activation caused by vascular oxidation promotes fibrosis and hypertension.,26595812
The Phytochemical Bergenin Enhances T Helper 1 Responses and Anti-Mycobacterial Immunity by Activating the MAP Kinase Pathway in Macrophages.,28507951
