Title,ID
Nanoparticle-based modulation of CD4<sup>+</sup> T cell effector and helper functions enhances adoptive immunotherapy.,36241639
Contribution of circulatory cells to asthma exacerbations and lung tissue-resident CD4 T cell memory.,35936001
Lentiviral vector transduction provides nonspecific immunogenicity for syngeneic tumor models.,36161729
The gut microbiota of people with asthma influences lung inflammation in gnotobiotic mice.,36824270
Experimental model of micronodular thymic neoplasm with lymphoid stroma.,36524622
"Cancer cell autophagy, reprogrammed macrophages, and remodeled vasculature in glioblastoma triggers tumor immunity.",36113478
"Obatoclax, the pan-Bcl-2 inhibitor sensitizes hepatocellular carcinoma cells to promote the anti-tumor efficacy in combination with immune checkpoint blockade.",33975180
Temporal dynamics of TNF-mediated changes in hematopoietic stem cell function and recovery.,36968066
A TLR7-nanoparticle adjuvant promotes a broad immune response against heterologous strains of influenza and SARS-CoV-2.,36717665
LAMP2 regulates autophagy in the thymic epithelium and thymic stroma-dependent CD4 T cell development.,35535798
IL-6/STAT3 signaling in tumor cells restricts the expression of frameshift-derived neoantigens by SMG1 induction.,36443756
Expression of tdTomato and luciferase in a murine lung cancer alters the growth and immune microenvironment of the tumor.,34411144
Evaluating the impact of hydroxychloroquine on mouse lymphocyte proliferation and cytokine production <i>in vivo</i> and <i>in vitro</i>.,34013212
High-yield enrichment of mouse small intestine intraepithelial lymphocytes by immunomagnetic depletion of EpCAM<sup>+</sup> cells.,35243383
The RNA-binding protein IMP2 drives a stromal-Th17 cell circuit in autoimmune neuroinflammation. ,34914635
Bcl-2 supports survival and metabolic fitness of quiescent tissue-resident ILC3,10.1101/2023.02.27.528945
Biometabolites of <i>Citrus unshiu</i> Peel Enhance Intestinal Permeability and Alter Gut Commensal Bacteria.,36678190
Incidence and severity of G6PI-induced arthritis are not increased in genetically distinct mouse strains upon aging.,34429153
Adjuvant effect of IRES-based single-stranded RNA on melanoma immunotherapy.,36199130
SZT2 maintains hematopoietic stem cell homeostasis via nutrient-mediated mTORC1 regulation.,36250465
Selective CD28 blockade impacts T cell differentiation during homeostatic reconstitution following lymphodepletion.,36761170
Specific immunosuppressive role of nanodrugs targeting calcineurin in innate myeloid cells.,36124235
"Intratumoral immunotherapy using a TLR2/3 agonist, L-pampo, induces robust antitumor immune responses and enhances immune checkpoint blockade.",35764365
BET inhibitor JQ1 enhances anti-tumor immunity and synergizes with PD-1 blockade in CRC.,35517410
"Targeting Ubiquitin-like Protein, ISG15, as a Novel Tumor Associated Antigen in Colorectal Cancer.",36831577
Development of follicular dendritic cells in lymph nodes depends on retinoic acid-mediated signaling.,34528674
Monocytes Contribute to IFN-β Production via the MyD88-Dependent Pathway and Cytotoxic T-Cell Responses against Mucosal Respiratory Syncytial Virus Infection.,34522440
FcγRIIB controls antibody-mediated target cell depletion by ITIM-independent mechanisms.,35858562
Apoptotic biliary epithelial cells and gut dysbiosis in the induction of murine primary biliary cholangitis.,36619656
Trem2 deficiency impairs recovery and phagocytosis by dysregulating myeloid gene expression during virus induced demyelination,10.21203/rs.3.rs-1769173/v1
Candida albicans oscillating UME6 expression during intestinal colonization primes systemic Th17 protective immunity.,35584674
OX40 agonism enhances PD-L1 checkpoint blockade by shifting the cytotoxic T cell differentiation spectrum.,36796366
Immunization of MERS-CoV-2-infected mice with a sublethal dose of MERS-CoV or VRP-MERS-S.,36920912
ATF7ip Targets Transposable Elements for H3K9me3 Deposition to Modify CD8<sup>+</sup> T Cell Effector and Memory Responses.,35110421
T cell self-reactivity during thymic development dictates the timing of positive selection. ,33884954
Trem2 deficiency impairs recovery and phagocytosis and dysregulates myeloid gene expression during virus-induced demyelination.,36333761
Effective inactivated influenza vaccine for the elderly using a single-stranded RNA-based adjuvant.,34099809
Intratumoral administration of pro-inflammatory allogeneic dendritic cells improved the anti-tumor response of systemic anti-CTLA-4 treatment via unleashing a T cell-dependent response.,35859733
STAT1 signaling protects self-reactive T cells from control by innate cells during neuroinflammation.,35587373
An Epidemic Zika Virus Isolate Drives Enhanced T Follicular Helper Cell and B Cell-Mediated Immunity.,35346966
FGF15 Protects Septic Mice by Inhibiting Inflammation and Modulating Treg Responses.,36386580
PKHB1 peptide induces antiviral effects through induction of immunogenic cell death in herpes simplex keratitis.,36532743
"Pseudocowpox virus, a novel vector to enhance the therapeutic efficacy of antitumor vaccination.",35573979
Natural killer cells suppress cancer metastasis by eliminating circulating cancer cells.,36733396
Mesenchymal Stromal Cells-Derived Extracellular Vesicles Regulate Dendritic Cell Functions in Dry Eye Disease.,36611828
Mice transgenic for human <i>CTLA4-CD28</i> fusion gene show proliferation and transformation of ATLL-like and AITL-like T cells.,35003894
Intestinal inflammation alters the antigen-specific immune response to a skin commensal.,35649365
A population of dermal Langerin<sup>+</sup> dendritic cells promote the inflammation in mouse model of atopic dermatitis.,36304463
Galectin-3 inhibition boosts the therapeutic efficacy of Semliki Forest virus in pediatric osteosarcoma.,35949950
The CXCL10/CXCR3 Pathway Contributes to the Synergy of Thermal Ablation and PD-1 Blockade Therapy against Tumors.,36900218
"Human CD22-Transgenic, Primary Murine Lymphoma Challenges Immunotherapies in Organ-Specific Tumor Microenvironments. ",34638774
Superantigens promote <i>Staphylococcus aureus</i> bloodstream infection by eliciting pathogenic interferon-gamma production.,35165181
CNS Pericytes Modulate Local T Cell Infiltration in EAE.,36361868
Intragranuloma Accumulation and Inflammatory Differentiation of Neutrophils Underlie Mycobacterial ESX-1-Dependent Immunopathology.,37017530
Choroid Plexus-Infiltrating T Cells as Drivers of Murine Neuropsychiatric Lupus.,35637551
Combination of apoptotic T cell induction and self-peptide administration for therapy of experimental autoimmune encephalomyelitis.,31097410
Fecal IgA Levels Are Determined by Strain-Level Differences in Bacteroides ovatus and Are Modifiable by Gut Microbiota Manipulation.,32075742
Synthetic Melanin Acts as Efficient Peptide Carrier in Cancer Vaccine Strategy.,36499300
SRA inhibition improves antitumor potency of antigen-targeted chaperone vaccine.,36793731
Erythropoietin Reduces Auto- and Alloantibodies by Inhibiting T Follicular Helper Cell Differentiation.,34261755
CDCP1 on Dendritic Cells Contributes to the Development of a Model of Kawasaki Disease.,34099547
"Thymidine rescues ATR kinase inhibitor-induced deoxyuridine contamination in genomic DNA, cell death, and interferon-α/β expression.",36130512
Loss of Bcl6 transcriptionally alters classical dendritic cells and diminishes T follicular helper cell and Th17-inducing cDC2 in mice,10.1101/2022.08.10.503322
TNF blockade enhances the efficacy of myxoma virus-based oncolytic virotherapy.,35577502
Distinct myeloid antigen-presenting cells dictate differential fates of tumor-specific CD8+ T cells in pancreatic cancer.,35393950
CaCO<sub>3</sub> powder-mediated biomineralization of antigen nanosponges synergize with PD-1 blockade to potentiate anti-tumor immunity.,37024939
cGAS deficiency enhances inflammasome activation in macrophages and inflammatory pathology in pristane-induced lupus.,36591278
Universal protection against influenza viruses by multi-subtype neuraminidase and M2 ectodomain virus-like particle.,36006890
Peptides Derived From S and N Proteins of Severe Acute Respiratory Syndrome Coronavirus 2 Induce T Cell Responses: A Proof of Concept for T Cell Vaccines.,34630356
Inducible nitric oxide synthase deficiency promotes murine-β-coronavirus induced demyelination.,36966345
Ifit2 regulates murine-coronavirus spread to the spinal cord white matter and its associated myelin pathology,10.1101/2022.06.06.494972
Niche derived netrin-1 regulates hematopoietic stem cell dormancy via its receptor neogenin-1.,33504783
Novel formulation of c-di-GMP with cytidinyl/cationic lipid reverses T cell exhaustion and activates stronger anti-tumor immunity.,36185614
Adaptive immune determinants of viral clearance and protection in mouse models of SARS-CoV-2.,34623900
LAG3 blockade coordinates with microwave ablation to promote CD8<sup>+</sup> T cell-mediated anti-tumor immunity.,36180876
A microarray patch SARS-CoV-2 vaccine induces sustained antibody responses and polyfunctional cellular immunity.,36062075
Linking erythropoietin to Treg-dependent allograft survival through myeloid cells.,35389892
Immunization using ApoB-100 peptide-linked nanoparticles reduces atherosclerosis.,35536648
"Effect of immunosuppressants on the parasite load developed in, and immune response to, visceral leishmaniasis: A comparative study in a mouse model.",33524030
Early innate and adaptive immune perturbations determine long-term severity of chronic virus and Mycobacterium tuberculosis coinfection.,33515487
Non-replicative antibiotic resistance-free DNA vaccine encoding S and N proteins induces full protection in mice against SARS-CoV-2.,36439169
Epigenetic state determines the in vivo efficacy of STING agonist therapy.,36949064
Th17/1-Biased Inflammatory Environment Involved in the Response of Epithelial Cells to Antigen Stimuli in Nasal Polyps.,34222494
Substance P Release by Sensory Neurons Triggers Dendritic Cell Migration and Initiates the Type-2 Immune Response to Allergens.,33098765
Position-Scanning Peptide Libraries as Particle Immunogens for Improving CD8<sup>+</sup> T-Cell Responses.,34716694
Imaging Kv1.3 Expressing Memory T Cells as a Marker of Immunotherapy Response. ,35267526
TNFR2/14-3-3ε signaling complex instructs macrophage plasticity in inflammation and autoimmunity. ,34185706
Lcn2 mediates adipocyte-muscle-tumor communication and hypothermia in pancreatic cancer cachexia.,36243318
Topical Application of Tetrandrine Nanoemulsion Promotes the Expansion of CD4<sup>+</sup>Foxp3<sup>+</sup> Regulatory T Cells and Alleviates Imiquimod-Induced Psoriasis in Mice.,35464441
Listeria-based immunotherapy directed against CD105 exerts anti-angiogenic and anti-tumor efficacy in renal cell carcinoma.,36439126
C57BL/6 Mice Pretreated With Alpha-Tocopherol Show a Better Outcome of <i>Trypanosoma cruzi</i> Infection With Less Tissue Inflammation and Fibrosis.,35154155
Keratin 17 Promotes T Cell Response in Allergic Contact Dermatitis by Upregulating C-C Motif Chemokine Ligand 20.,35178048
Reduced CD5 on CD8<sup>+</sup> T Cells in Tumors but Not Lymphoid Organs Is Associated With Increased Activation and Effector Function.,33584650
Spherical Nucleic Acid Vaccine Structure Markedly Influences Adaptive Immune Responses of Clinically Utilized Prostate Cancer Targets.,34494382
Forced expression of the non-coding RNA miR-17∼92 restores activation and function in CD28-deficient CD4<sup>+</sup> T cells.,36388982
Inflammatory Immune Responses Trigger Rejection of Allogeneic Fibroblasts Transplanted into Mouse Skin.,35912954
Neutrophils drive pulmonary vascular leakage in MHV-1 infection of susceptible A/J mice.,36685578
Radiotherapy-exposed CD8+ and CD4+ neoantigens enhance tumor control. ,33476307
Subunit microparticulate vaccine delivery using microneedles trigger significant SARS-spike-specific humoral and cellular responses in a preclinical murine model.,36610521
Tumor Cell-Surface Binding of Immune Stimulating Polymeric Glyco-Adjuvant via Cysteine-Reactive Pyridyl Disulfide Promotes Antitumor Immunity.,36313164
Loss of LRRC33-Dependent TGFβ1 Activation Enhances Antitumor Immunity and Checkpoint Blockade Therapy.,35181792
Modulation of the liver immune microenvironment by the adeno-associated virus serotype 8 gene therapy vector.,33376758
IL-18BP mediates the balance between protective and pathological immune responses to Toxoplasma gondii.,36827187
Identification of a class of non-conventional ER-stress-response-derived immunogenic peptides.,34233181
Altered distribution and function of NK-cell subsets lead to impaired tumor surveillance in JAK2V617F myeloproliferative neoplasms.,36211444
Extended SARS-CoV-2 RBD booster vaccination induces humoral and cellular immune tolerance in mice.,36338436
"The subunits of IL-12, originating from two distinct cells, can functionally synergize to protect against pathogen dissemination in vivo.",34644571
Combination TIGIT/PD-1 blockade enhances the efficacy of neoantigen vaccines in a model of pancreatic cancer.,36569934
Genetic dissection of TLR9 reveals complex regulatory and cryptic proinflammatory roles in mouse lupus.,36151396
Limited access to antigen drives generation of early B cell memory while restraining the plasmablast response.,34525339
Immunological conversion of solid tumours using a bispecific nanobioconjugate for cancer immunotherapy.,36357792
Cellular Senescence Is Immunogenic and Promotes Antitumor Immunity.,36302218
Granzyme B PET Imaging in Response to In Situ Vaccine Therapy Combined with αPD1 in a Murine Colon Cancer Model. ,35057046
Physiological and Functional Effects of Dominant Active TCRα Expression in Transgenic Mice.,37047500
Adjuvant Effects of a New Saponin Analog VSA-1 on Enhancing Homologous and Heterosubtypic Protection by Influenza Virus Vaccination.,36146461
Respiratory mucosal delivery of next-generation COVID-19 vaccine provides robust protection against both ancestral and variant strains of SARS-CoV-2.,35180381
IFNAR1 Deficiency Impairs Immunostimulatory Properties of Neutrophils in Tumor-Draining Lymph Nodes.,35833131
Sialomucin CD43 Plays a Deleterious Role in the Development of Experimental Heart Failure Induced by Pressure Overload by Modulating Cardiac Inflammation and Fibrosis.,34925069
Long wavelength single photon like driven photolysis via triplet triplet annihilation.,33402702
"Osteopontin contributes to virus resistance associated with type I IFN expression, activation of downstream ifn-inducible effector genes, and CCR2<sup>+</sup>CD115<sup>+</sup>CD206<sup>+</sup> macrophage infiltration following ocular HSV-1 infection of mice.",36685562
Fully murine CD105-targeted CAR-T cells provide an immunocompetent model for CAR-T cell biology.,36275862
Differential impact of a dyskeratosis congenita mutation in TPP1 on mouse hematopoiesis and germline.,34645668
Cancer cell-autonomous overactivation of PARP1 compromises immunosurveillance in non-small cell lung cancer.,35772809
FLT3L Release by Natural Killer Cells Enhances Response to Radioimmunotherapy in Preclinical Models of HNSCC.,34518311
The efficacy of chemotherapy is limited by intratumoural senescent cells that persist through the upregulation of PD-L2,10.1101/2022.11.04.501681
Epigenetic therapy to enhance therapeutic effects of PD-1 inhibition in therapy-resistant melanoma.,34753889
"Local, multimodal intralesional therapy renders distant brain metastases susceptible to PD-L1 blockade in a preclinical model of triple-negative breast cancer.",34754037
The phosphatase PTEN links platelets with immune regulatory functions of mouse T follicular helper cells.,35589797
Context-Dependent Role for T-bet in T Follicular Helper Differentiation and Germinal Center Function following Viral Infection.,31412245
Antagonistic Inflammatory Phenotypes Dictate Tumor Fate and Response to Immune Checkpoint Blockade.,33220234
Heme-stress activated NRF2 skews fate trajectories of bone marrow cells from dendritic cells towards red pulp-like macrophages in hemolytic anemia.,35031770
Tripartite-Motif 21 (TRIM21) Deficiency Results in a Modest Loss of Herpes Simplex Virus (HSV)-1 Surveillance in the Trigeminal Ganglia Following Cornea Infection.,35336995
"An immune-competent, replication-permissive Syrian Hamster glioma model for evaluating Delta-24-RGD oncolytic adenovirus.",34059921
Involvement of autophagy in exacerbation of eosinophilic airway inflammation in a murine model of obese asthma.,35098856
Androgen conspires with the CD8<sup>+</sup> T cell exhaustion program and contributes to sex bias in cancer.,35420889
The dietary sweetener sucralose is a negative modulator of T cell-mediated responses.,36922598
The neuropeptide PACAP alleviates T. gondii infection-induced neuroinflammation and neuronal impairment.,36403002
Adenosine deaminase augments SARS-CoV-2 specific cellular and humoral responses in aged mouse models of immunization and challenge.,36999023
Combination immunotherapy of chlorogenic acid liposomes modified with sialic acid and PD-1 blockers effectively enhances the anti-tumor immune response and therapeutic effects.,34515617
Angioimmunoblastic T-cell lymphoma-like lymphadenopathy in mice transgenic for human <i>RHOA</i> with p.Gly17Val mutation.,32923110
Elective nodal irradiation mitigates local and systemic immunity generated by combination radiation and immunotherapy in head and neck tumors.,36385142
"Indoleamine 2,3-dioxygenase 1 activation in mature cDC1 promotes tolerogenic education of inflammatory cDC2 via metabolic communication.",35704993
MYC-driven synthesis of Siglec ligands is a glycoimmune checkpoint.,36897988
MCL-1 is essential for survival but dispensable for metabolic fitness of FOXP3<sup>+</sup> regulatory T cells.,32612106
Combining bempegaldesleukin (CD122-preferential IL-2 pathway agonist) and NKTR-262 (TLR7/8 agonist) improves systemic antitumor CD8<sup>+</sup> T cell cytotoxicity over BEMPEG+RT.,35444059
CHBP induces stronger immunosuppressive CD127<sup>+</sup> M-MDSC via erythropoietin receptor.,33579907
Engineered Lactococcus lactis secreting Flt3L and OX40 ligand for in situ vaccination-based cancer immunotherapy.,36463242
Hepcidin-Mediated Hypoferremia Disrupts Immune Responses to Vaccination and Infection.,33665641
Acute pharmacological degradation of Helios destabilizes regulatory T cells.,34035522
"IL-12 Blocks Tfh Cell Differentiation during Salmonella Infection, thereby Contributing to Germinal Center Suppression.",31775046
Thrombospondin-1 Silencing Improves Lymphocyte Infiltration in Tumors and Response to Anti-PD-1 in Triple-Negative Breast Cancer. ,34439212
A human mutation in STAT3 promotes type 1 diabetes through a defect in CD8+ T cell tolerance.,34115115
IL36 Cooperates With Anti-CTLA-4 mAbs to Facilitate Antitumor Immune Responses.,32351508
The long non-coding RNA Meg3 is dispensable for hematopoietic stem cells.,30765776
Improved intratumoral penetration of IL12 immunocytokine enhances the antitumor efficacy.,36405748
Interferon regulatory factor 1(IRF-1) activates anti-tumor immunity via CXCL10/CXCR3 axis in hepatocellular carcinoma (HCC).,33689775
Staphylococcus aureus-induced immunosuppression mediated by IL-10 and IL-27 facilitates nasal colonisation.,35776778
Immunosuppression of Syrian golden hamsters accelerates relapse but not the emergence of resistance in Leishmania infantum following recurrent miltefosine pressure.,30562667
Secreted osteopontin from CD4<sup>+</sup> T cells limits acute graft-versus-host disease.,34965439
Inducible de novo expression of neoantigens in tumor cells and mice.,32719479
"Discovery and characterization of high-affinity, potent SARS-CoV-2 neutralizing antibodies via single B cell screening.",34671080
Nicotinamide combined with gemcitabine is an immunomodulatory therapy that restrains pancreatic cancer in mice.,33154149
Antigen-specific memory and naïve CD4+ T cells following secondary Chlamydia trachomatis infection.,33091023
Oral Limonite Supplement Ameliorates Glucose Intolerance in Diabetic and Obese Mice.,34276223
A Genome-Wide Screen Identifies PDPK1 as a Target to Enhance the Efficacy of MEK1/2 Inhibitors in NRAS Mutant Melanoma.,35657206
Synergistic effect of non-neutralizing antibodies and interferon-γ for cross-protection against influenza.,34622175
P2X7 purinergic receptor plays a critical role in maintaining T-cell homeostasis and preventing lupus pathogenesis.,36248812
Targeting Glutamine Metabolism to Enhance Immunoprevention of EGFR-Driven Lung Cancer.,35861366
Gastrointestinal Dopamine in Inflammatory Bowel Diseases: A Systematic Review. ,34884737
Engagement of TREM2 by a novel monoclonal antibody induces activation of microglia and improves cognitive function in Alzheimer's disease models.,33422057
Interferon-α-producing plasmacytoid dendritic cells drive the loss of adipose tissue regulatory T cells during obesity.,34256015
Potential Tamoxifen Repurposing to Combat Infections by Multidrug-Resistant Gram-Negative Bacilli. ,34073235
Ruxolitinib Cream Has Dual Efficacy on Pruritus and Inflammation in Experimental Dermatitis.,33658996
Candida tropicalis Systemic Infection Redirects Leukocyte Infiltration to the Kidneys Attenuating Encephalomyelitis. ,34575795
Smad7 suppresses melanoma lung metastasis by impairing Tregs migration to the tumor microenvironment.,33594321
Potent antitumor effects of cell-penetrating peptides targeting STAT3 axis. ,33491667
"The epigenetic regulator ATF7ip inhibits <i>Il2</i> expression, regulating Th17 responses.",31217192
Monoclonal antibody-mediated immunosuppression enables long-term survival of transplanted human neural stem cells in mouse brain.,36101963
Androgens show sex-dependent differences in myelination in immune and non-immune murine models of CNS demyelination.,36949062
Arthritis flares mediated by tissue-resident memory T cells in the joint.,34706228
Dual targeting of lymphocyte homing and retention through α4β7 and αEβ7 inhibition in inflammatory bowel disease.,34467254
Epicutaneous Staphylococcus aureus induces IL-36 to enhance IgE production and ensuing allergic disease. ,33645549
GPR182 limits antitumor immunity via chemokine scavenging in mouse melanoma models.,35013216
Establishment of fetomaternal tolerance through glycan-mediated B cell suppression.,35236989
CYBB/NOX2 in conventional DCs controls T cell encephalitogenicity during neuroinflammation.,32401602
Fluvastatin enhances IL-33-mediated mast cell IL-6 and TNF production.,34883342
Engineering the lymph node environment promotes antigen-specific efficacy in type 1 diabetes and islet transplantation.,36755035
PTBP1 is necessary for dendritic cells to regulate T-cell homeostasis and antitumour immunity.,33421118
"Eosinophil-derived chemokine (hCCL15/23, mCCL6) interacts with CCR1 to promote eosinophilic airway inflammation.",33640900
Fate mapping of hematopoietic stem cells reveals two pathways of native thrombopoiesis.,35922411
Identification of polo-like kinase 1 as a therapeutic target in murine lupus.,35024139
Combination checkpoint therapy with anti-PD-1 and anti-BTLA results in a synergistic therapeutic effect against murine glioblastoma.,34484870
Immunization with CSP and a RIG-I Agonist is Effective in Inducing a Functional and Protective Humoral Response Against <i>Plasmodium</i>.,35669785
Single-cell multiomics defines tolerogenic extrathymic Aire-expressing populations with unique homology to thymic epithelium.,34767455
Failure of thymic deletion and instability of autoreactive Tregs drive autoimmunity in immune-privileged liver. ,33600378
Psychological stress creates an immune suppressive environment in the lung that increases susceptibility of aged mice to <i>Mycobacterium tuberculosis</i> infection.,36189368
Monoallelic IRF5 deficiency in B cells prevents murine lupus. ,34197340
Improved hematopoietic differentiation of mouse embryonic stem cells through manipulation of the RNA binding protein ARS2.,31986485
OXPHOS promotes apoptotic resistance and cellular persistence in T<sub>H</sub>17 cells in the periphery and tumor microenvironment.,36399539
Development of a Live Recombinant BCG Expressing Human Immunodeficiency Virus Type 1 (HIV-1) Gag Using a pMyong2 Vector System: Potential Use As a Novel HIV-1 Vaccine.,29636755
Group 1 innate lymphoid-cell-derived interferon-γ maintains anti-viral vigilance in the mucosal epithelium.,33434494
TGFβ Signaling in Myeloid Cells Promotes Lung and Liver Metastasis Through Different Mechanisms.,34868988
CD4<sup>+</sup>c-Met<sup>+</sup>Itgα4<sup>+</sup> T cell subset promotes murine neuroinflammation.,35488271
An injectable hydrogel-formulated inhibitor of prolyl-4-hydroxylase promotes T regulatory cell recruitment and enhances alveolar bone regeneration during resolution of experimental periodontitis.,32812255
TIGIT Blockade Exerts Synergistic Effects on Microwave Ablation Against Cancer.,35320940
Low-dose self-amplifying mRNA COVID-19 vaccine drives strong protective immunity in non-human primates against SARS-CoV-2 infection.,35672369
CXCL10<sup>+</sup> peripheral activation niches couple preferred sites of Th1 entry with optimal APC encounter.,34380032
Loss of IL-27Rα Results in Enhanced Tubulointerstitial Fibrosis Associated with Elevated Th17 Responses.,32522836
Remodeling the tumor microenvironment via blockade of LAIR-1 and TGF-β signaling enables PD-L1-mediated tumor eradication.,35230974
Statins mediate anti- and pro-tumourigenic functions by remodelling the tumour microenvironment. ,34779486
Whole-Exome Sequencing of Radiation-Induced Thymic Lymphoma in Mouse Models Identifies Notch1 Activation as a Driver of p53 Wild-Type Lymphoma.,34035082
Alphavirus Replicon Particle Vaccine Breaks B Cell Tolerance and Rapidly Induces IgG to Murine Hematolymphoid Tumor Associated Antigens.,35686131
