Title,URL,Found,IS_PMC,IS_NOT_PREPRINT
ERK differentially regulates Th17- and Treg-cell development and contributes to the pathogenesis of colitis.,https://onlinelibrary.wiley.com/doi/pdfdirect/10.1002/eji.201242889,0,False,True
Interleukin-4-induced loss of CD8 expression and cytolytic function in effector CD8 T cells persists long term in vivo.,,0,False,True
Memory CD8⁺ T cells can outsource IFN-γ production but not cytolytic killing for antiviral protection.,https://europepmc.org/articles/PMC3662238?pdf=render,1,True,True
High viral burden restricts short-lived effector cell number at late times postinfection through increased natural regulatory T cell expansion.,https://europepmc.org/articles/PMC3711656?pdf=render,1,True,True
Cell penetrating recombinant Foxp3 protein enhances Treg function and ameliorates arthritis.,http://europepmc.org/articles/PMC3652316?pdf=render,0,True,True
"Norovirus P particle efficiently elicits innate, humoral and cellular immunity.",http://www.ncbi.nlm.nih.gov/pmc/articles/PMC3639243/pdf/,1,False,True
Vav1 regulates MHCII expression in murine resting and activated B cells.,,1,False,True
Plasticity of Th17 cells in Peyer's patches is responsible for the induction of T cell-dependent IgA responses.,http://europepmc.org/articles/PMC3672955?pdf=render,1,True,True
Cutting edge: tumor-targeting antibodies enhance NKG2D-mediated NK cell cytotoxicity by stabilizing NK cell-tumor cell interactions.,http://www.jimmunol.org/content/189/12/5493.full.pdf,0,False,True
Leptin exacerbates collagen-induced arthritis via enhancement of Th17 cell response.,,1,False,True
Induction of histiocytic sarcoma in mouse skeletal muscle.,https://journals.plos.org/plosone/article/file?id=10.1371/journal.pone.0044044&type=printable,0,False,True
Aminoimidazole carboxamide ribonucleotide ameliorates experimental autoimmune uveitis.,http://europepmc.org/articles/PMC3392008?pdf=render,1,True,True
Antigen delivery to macrophages using liposomal nanoparticles targeting sialoadhesin/CD169.,http://www.ncbi.nlm.nih.gov/pmc/articles/PMC3378521/pdf/,1,False,True
B cell depletion therapy ameliorates autoimmune disease through ablation of IL-6-producing B cells.,http://jem.rupress.org/content/209/5/1001.full.pdf,1,False,True
The E3 ubiquitin ligase adaptor Ndfip1 regulates Th17 differentiation by limiting the production of proinflammatory cytokines.,https://europepmc.org/articles/PMC3713491?pdf=render,1,True,True
Regenerative capacity of adult cortical thymic epithelial cells.,https://europepmc.org/articles/PMC3295321?pdf=render,1,True,True
Difference in Th1 and Th17 lymphocyte adhesion to endothelium.,http://europepmc.org/articles/PMC3262911?pdf=render,1,True,True
Critical role for perforin and Fas-dependent killing of dendritic cells in the control of inflammation.,,1,False,True
Airway epithelial cells suppress T cell proliferation by an IFNγ/STAT1/TGFβ-dependent mechanism.,,1,False,True
TGF-β induces the expression of the adaptor Ndfip1 to silence IL-4 production during iTreg cell differentiation.,http://europepmc.org/articles/PMC3542978?pdf=render,1,True,True
Contribution of IL-13 to early exocrinopathy in Id3-/- mice.,http://europepmc.org/articles/PMC3205188?pdf=render,1,True,True
Serotonin-mediated tuning of human helper T cell responsiveness to the chemokine CXCL12.,http://www.ncbi.nlm.nih.gov/pmc/articles/PMC3154189/pdf/,1,False,True
CCL17-expressing dendritic cells drive atherosclerosis by restraining regulatory T cell homeostasis in mice.,http://europepmc.org/articles/PMC3223829?pdf=render,1,True,True
Specific microtubule-depolymerizing agents augment efficacy of dendritic cell-based cancer vaccines.,http://www.jbiomedsci.com/content/pdf/1423-0127-18-44.pdf,1,False,True
Ebf1 or Pax5 haploinsufficiency synergizes with STAT5 activation to initiate acute lymphoblastic leukemia.,http://jem.rupress.org/content/208/6/1135.full.pdf,1,False,True
Generation and evaluation of an IPTG-regulated version of Vav-gene promoter for mouse transgenesis.,https://journals.plos.org/plosone/article/file?id=10.1371/journal.pone.0018051&type=printable,1,False,True
Plasma cells negatively regulate the follicular helper T cell program.,http://www.ncbi.nlm.nih.gov/pmc/articles/PMC3058870/pdf/,1,False,True
T-bet-independent effects of IL-12 family cytokines on regulation of Th17 responses to experimental T. cruzi infection.,,0,False,True
Capture of influenza by medullary dendritic cells via SIGN-R1 is essential for humoral immunity in draining lymph nodes.,http://europepmc.org/articles/PMC3424101?pdf=render,1,True,True
A simple method to detect Toxoplasma gondii-specific cytotoxic T cells in vivo.,https://europepmc.org/articles/PMC2855898?pdf=render,1,True,True
Self-organized criticality theory of autoimmunity.,http://www.ncbi.nlm.nih.gov/pmc/articles/PMC2795160/pdf/,0,False,True
Inhibition of phosphoinositide 3-kinase ameliorates dextran sodium sulfate-induced colitis in mice.,,0,False,True
Transgenic expression of human gp100 and RANTES at specific time points for suppression of melanoma.,http://www.nature.com/gt/journal/v16/n11/pdf/gt200990a.pdf,0,False,True
Regulation of pathogenic IL-17 responses in collagen-induced arthritis: roles of endogenous interferon-gamma and IL-4.,http://arthritis-research.com/content/pdf/ar2838.pdf,1,False,True
Deciphering developmental stages of adult myelopoiesis.,,0,False,True
